15:41:09.705328 IP Planetlab1.CS.UCLA.EDU.43309 > 198.188.2.10.44444: UDP, length 1024
15:41:09.705413 IP Planetlab1.CS.UCLA.EDU.43309 > 198.188.2.10.44444: UDP, length 1024
15:41:09.705499 IP Planetlab1.CS.UCLA.EDU.43309 > 198.188.2.10.44444: UDP, length 1024
15:41:09.705586 IP Planetlab1.CS.UCLA.EDU.43309 > 198.188.2.10.44444: UDP, length 1024
15:41:09.707491 IP Planetlab1.CS.UCLA.EDU.43309 > 198.188.2.10.44444: UDP, length 1024
15:41:09.707578 IP Planetlab1.CS.UCLA.EDU.43309 > 198.188.2.10.44444: UDP, length 1024
15:41:09.709245 IP Planetlab1.CS.UCLA.EDU.43309 > 198.188.2.10.44444: UDP, length 1024
15:41:09.709334 IP Planetlab1.CS.UCLA.EDU.43309 > 198.188.2.10.44444: UDP, length 1024
15:41:09.710959 IP Planetlab1.CS.UCLA.EDU.43309 > 198.188.2.10.44444: UDP, length 1024
15:41:09.711047 IP Planetlab1.CS.UCLA.EDU.43309 > 198.188.2.10.44444: UDP, length 1024
15:41:09.712899 IP Planetlab1.CS.UCLA.EDU.43309 > 198.188.2.10.44444: UDP, length 1024
15:41:09.714182 IP Planetlab1.CS.UCLA.EDU.43309 > 198.188.2.10.44444: UDP, length 1024
15:41:09.714277 IP Planetlab1.CS.UCLA.EDU.43309 > 198.188.2.10.44444: UDP, length 1024
15:41:09.715911 IP Planetlab1.CS.UCLA.EDU.43309 > 198.188.2.10.44444: UDP, length 1024
15:41:09.715999 IP Planetlab1.CS.UCLA.EDU.43309 > 198.188.2.10.44444: UDP, length 1024
15:41:09.717724 IP Planetlab1.CS.UCLA.EDU.43309 > 198.188.2.10.44444: UDP, length 1024
15:41:09.717811 IP Planetlab1.CS.UCLA.EDU.43309 > 198.188.2.10.44444: UDP, length 1024
15:41:09.719605 IP Planetlab1.CS.UCLA.EDU.43309 > 198.188.2.10.44444: UDP, length 1024
15:41:09.719692 IP Planetlab1.CS.UCLA.EDU.43309 > 198.188.2.10.44444: UDP, length 1024
15:41:09.721431 IP Planetlab1.CS.UCLA.EDU.43309 > 198.188.2.10.44444: UDP, length 1024
15:41:09.721519 IP Planetlab1.CS.UCLA.EDU.43309 > 198.188.2.10.44444: UDP, length 1024
15:41:09.723255 IP Planetlab1.CS.UCLA.EDU.43309 > 198.188.2.10.44444: UDP, length 1024
15:41:09.723342 IP Planetlab1.CS.UCLA.EDU.43309 > 198.188.2.10.44444: UDP, length 1024
15:41:09.724962 IP Planetlab1.CS.UCLA.EDU.43309 > 198.188.2.10.44444: UDP, length 1024
15:41:09.725050 IP Planetlab1.CS.UCLA.EDU.43309 > 198.188.2.10.44444: UDP, length 1024
15:41:09.726852 IP Planetlab1.CS.UCLA.EDU.43309 > 198.188.2.10.44444: UDP, length 1024
15:41:09.726937 IP Planetlab1.CS.UCLA.EDU.43309 > 198.188.2.10.44444: UDP, length 1024
15:41:09.728706 IP Planetlab1.CS.UCLA.EDU.43309 > 198.188.2.10.44444: UDP, length 1024
15:41:09.728796 IP Planetlab1.CS.UCLA.EDU.43309 > 198.188.2.10.44444: UDP, length 1024
15:41:09.730524 IP Planetlab1.CS.UCLA.EDU.43309 > 198.188.2.10.44444: UDP, length 1024
15:41:09.730613 IP Planetlab1.CS.UCLA.EDU.43309 > 198.188.2.10.44444: UDP, length 1024
15:41:09.732394 IP Planetlab1.CS.UCLA.EDU.43309 > 198.188.2.10.44444: UDP, length 1024
15:41:09.732479 IP Planetlab1.CS.UCLA.EDU.43309 > 198.188.2.10.44444: UDP, length 1024
15:41:09.734256 IP Planetlab1.CS.UCLA.EDU.43309 > 198.188.2.10.44444: UDP, length 1024
15:41:09.734344 IP Planetlab1.CS.UCLA.EDU.43309 > 198.188.2.10.44444: UDP, length 1024
15:41:09.736026 IP Planetlab1.CS.UCLA.EDU.43309 > 198.188.2.10.44444: UDP, length 1024
15:41:09.736114 IP Planetlab1.CS.UCLA.EDU.43309 > 198.188.2.10.44444: UDP, length 1024
15:41:09.737849 IP Planetlab1.CS.UCLA.EDU.43309 > 198.188.2.10.44444: UDP, length 1024
15:41:09.737936 IP Planetlab1.CS.UCLA.EDU.43309 > 198.188.2.10.44444: UDP, length 1024
15:41:09.739846 IP Planetlab1.CS.UCLA.EDU.43309 > 198.188.2.10.44444: UDP, length 1024
15:41:09.739934 IP Planetlab1.CS.UCLA.EDU.43309 > 198.188.2.10.44444: UDP, length 1024
15:41:09.741542 IP Planetlab1.CS.UCLA.EDU.43309 > 198.188.2.10.44444: UDP, length 1024
15:41:09.741629 IP Planetlab1.CS.UCLA.EDU.43309 > 198.188.2.10.44444: UDP, length 1024
15:41:09.743404 IP Planetlab1.CS.UCLA.EDU.43309 > 198.188.2.10.44444: UDP, length 1024
15:41:09.743491 IP Planetlab1.CS.UCLA.EDU.43309 > 198.188.2.10.44444: UDP, length 1024
15:41:09.745341 IP Planetlab1.CS.UCLA.EDU.43309 > 198.188.2.10.44444: UDP, length 1024
15:41:09.745428 IP Planetlab1.CS.UCLA.EDU.43309 > 198.188.2.10.44444: UDP, length 1024
15:41:09.747123 IP Planetlab1.CS.UCLA.EDU.43309 > 198.188.2.10.44444: UDP, length 1024
15:41:09.747212 IP Planetlab1.CS.UCLA.EDU.43309 > 198.188.2.10.44444: UDP, length 1024
15:41:09.749058 IP Planetlab1.CS.UCLA.EDU.43309 > 198.188.2.10.44444: UDP, length 1024
15:41:09.749145 IP Planetlab1.CS.UCLA.EDU.43309 > 198.188.2.10.44444: UDP, length 1024
15:41:09.750929 IP Planetlab1.CS.UCLA.EDU.43309 > 198.188.2.10.44444: UDP, length 1024
15:41:09.751017 IP Planetlab1.CS.UCLA.EDU.43309 > 198.188.2.10.44444: UDP, length 1024
15:41:09.753010 IP Planetlab1.CS.UCLA.EDU.43309 > 198.188.2.10.44444: UDP, length 1024
15:41:09.753097 IP Planetlab1.CS.UCLA.EDU.43309 > 198.188.2.10.44444: UDP, length 1024
15:41:09.754629 IP Planetlab1.CS.UCLA.EDU.43309 > 198.188.2.10.44444: UDP, length 1024
15:41:09.754715 IP Planetlab1.CS.UCLA.EDU.43309 > 198.188.2.10.44444: UDP, length 1024
15:41:09.756548 IP Planetlab1.CS.UCLA.EDU.43309 > 198.188.2.10.44444: UDP, length 1024
15:41:09.756637 IP Planetlab1.CS.UCLA.EDU.43309 > 198.188.2.10.44444: UDP, length 1024
15:41:09.758268 IP Planetlab1.CS.UCLA.EDU.43309 > 198.188.2.10.44444: UDP, length 1024
15:41:09.758354 IP Planetlab1.CS.UCLA.EDU.43309 > 198.188.2.10.44444: UDP, length 1024
15:41:09.760083 IP Planetlab1.CS.UCLA.EDU.43309 > 198.188.2.10.44444: UDP, length 1024
15:41:09.760171 IP Planetlab1.CS.UCLA.EDU.43309 > 198.188.2.10.44444: UDP, length 1024
15:41:09.761859 IP Planetlab1.CS.UCLA.EDU.43309 > 198.188.2.10.44444: UDP, length 1024
15:41:09.761947 IP Planetlab1.CS.UCLA.EDU.43309 > 198.188.2.10.44444: UDP, length 1024
15:41:09.763574 IP Planetlab1.CS.UCLA.EDU.43309 > 198.188.2.10.44444: UDP, length 1024
15:41:09.763662 IP Planetlab1.CS.UCLA.EDU.43309 > 198.188.2.10.44444: UDP, length 1024
15:41:09.765283 IP Planetlab1.CS.UCLA.EDU.43309 > 198.188.2.10.44444: UDP, length 1024
15:41:09.765372 IP Planetlab1.CS.UCLA.EDU.43309 > 198.188.2.10.44444: UDP, length 1024
15:41:09.767000 IP Planetlab1.CS.UCLA.EDU.43309 > 198.188.2.10.44444: UDP, length 1024
15:41:09.767086 IP Planetlab1.CS.UCLA.EDU.43309 > 198.188.2.10.44444: UDP, length 1024
15:41:09.768714 IP Planetlab1.CS.UCLA.EDU.43309 > 198.188.2.10.44444: UDP, length 1024
15:41:09.768801 IP Planetlab1.CS.UCLA.EDU.43309 > 198.188.2.10.44444: UDP, length 1024
15:41:09.770475 IP Planetlab1.CS.UCLA.EDU.43309 > 198.188.2.10.44444: UDP, length 1024
15:41:09.770564 IP Planetlab1.CS.UCLA.EDU.43309 > 198.188.2.10.44444: UDP, length 1024
15:41:09.772373 IP Planetlab1.CS.UCLA.EDU.43309 > 198.188.2.10.44444: UDP, length 1024
15:41:09.772462 IP Planetlab1.CS.UCLA.EDU.43309 > 198.188.2.10.44444: UDP, length 1024
15:41:09.773961 IP Planetlab1.CS.UCLA.EDU.43309 > 198.188.2.10.44444: UDP, length 1024
15:41:09.774046 IP Planetlab1.CS.UCLA.EDU.43309 > 198.188.2.10.44444: UDP, length 1024
15:41:09.776061 IP Planetlab1.CS.UCLA.EDU.43309 > 198.188.2.10.44444: UDP, length 1024
15:41:09.777503 IP Planetlab1.CS.UCLA.EDU.43309 > 198.188.2.10.44444: UDP, length 1024
15:41:09.778939 IP Planetlab1.CS.UCLA.EDU.43309 > 198.188.2.10.44444: UDP, length 1024
15:41:09.780378 IP Planetlab1.CS.UCLA.EDU.43309 > 198.188.2.10.44444: UDP, length 1024
15:41:09.780465 IP Planetlab1.CS.UCLA.EDU.43309 > 198.188.2.10.44444: UDP, length 1024
15:41:09.782470 IP Planetlab1.CS.UCLA.EDU.43309 > 198.188.2.10.44444: UDP, length 1024
15:41:09.782557 IP Planetlab1.CS.UCLA.EDU.43309 > 198.188.2.10.44444: UDP, length 1024
15:41:09.784273 IP Planetlab1.CS.UCLA.EDU.43309 > 198.188.2.10.44444: UDP, length 1024
15:41:09.784361 IP Planetlab1.CS.UCLA.EDU.43309 > 198.188.2.10.44444: UDP, length 1024
15:41:09.785997 IP Planetlab1.CS.UCLA.EDU.43309 > 198.188.2.10.44444: UDP, length 1024
15:41:09.786085 IP Planetlab1.CS.UCLA.EDU.43309 > 198.188.2.10.44444: UDP, length 1024
15:41:09.787818 IP Planetlab1.CS.UCLA.EDU.43309 > 198.188.2.10.44444: UDP, length 1024
15:41:09.787904 IP Planetlab1.CS.UCLA.EDU.43309 > 198.188.2.10.44444: UDP, length 1024
15:41:09.789696 IP Planetlab1.CS.UCLA.EDU.43309 > 198.188.2.10.44444: UDP, length 1024
15:41:09.789874 IP Planetlab1.CS.UCLA.EDU.43309 > 198.188.2.10.44444: UDP, length 1024
15:41:09.791521 IP Planetlab1.CS.UCLA.EDU.43309 > 198.188.2.10.44444: UDP, length 1024
15:41:09.791608 IP Planetlab1.CS.UCLA.EDU.43309 > 198.188.2.10.44444: UDP, length 1024
15:41:09.793401 IP Planetlab1.CS.UCLA.EDU.43309 > 198.188.2.10.44444: UDP, length 1024
15:41:09.793488 IP Planetlab1.CS.UCLA.EDU.43309 > 198.188.2.10.44444: UDP, length 1024
15:41:09.795231 IP Planetlab1.CS.UCLA.EDU.43309 > 198.188.2.10.44444: UDP, length 1024
15:41:09.795317 IP Planetlab1.CS.UCLA.EDU.43309 > 198.188.2.10.44444: UDP, length 1024
15:41:09.797065 IP Planetlab1.CS.UCLA.EDU.43309 > 198.188.2.10.44444: UDP, length 1024
15:41:09.797152 IP Planetlab1.CS.UCLA.EDU.43309 > 198.188.2.10.44444: UDP, length 1024
15:41:09.798829 IP Planetlab1.CS.UCLA.EDU.43309 > 198.188.2.10.44444: UDP, length 1024
15:41:09.798917 IP Planetlab1.CS.UCLA.EDU.43309 > 198.188.2.10.44444: UDP, length 1024
15:41:09.800532 IP Planetlab1.CS.UCLA.EDU.43309 > 198.188.2.10.44444: UDP, length 1024
15:41:09.800619 IP Planetlab1.CS.UCLA.EDU.43309 > 198.188.2.10.44444: UDP, length 1024
15:41:09.802256 IP Planetlab1.CS.UCLA.EDU.43309 > 198.188.2.10.44444: UDP, length 1024
15:41:09.802343 IP Planetlab1.CS.UCLA.EDU.43309 > 198.188.2.10.44444: UDP, length 1024
15:41:09.804019 IP Planetlab1.CS.UCLA.EDU.43309 > 198.188.2.10.44444: UDP, length 1024
15:41:09.804106 IP Planetlab1.CS.UCLA.EDU.43309 > 198.188.2.10.44444: UDP, length 1024
15:41:09.805832 IP Planetlab1.CS.UCLA.EDU.43309 > 198.188.2.10.44444: UDP, length 1024
15:41:09.805918 IP Planetlab1.CS.UCLA.EDU.43309 > 198.188.2.10.44444: UDP, length 1024
15:41:09.807427 IP Planetlab1.CS.UCLA.EDU.43309 > 198.188.2.10.44444: UDP, length 1024
15:41:09.807514 IP Planetlab1.CS.UCLA.EDU.43309 > 198.188.2.10.44444: UDP, length 1024
15:41:09.809429 IP Planetlab1.CS.UCLA.EDU.43309 > 198.188.2.10.44444: UDP, length 1024
15:41:09.809518 IP Planetlab1.CS.UCLA.EDU.43309 > 198.188.2.10.44444: UDP, length 1024
15:41:09.811498 IP Planetlab1.CS.UCLA.EDU.43309 > 198.188.2.10.44444: UDP, length 1024
15:41:09.811585 IP Planetlab1.CS.UCLA.EDU.43309 > 198.188.2.10.44444: UDP, length 1024
15:41:09.813478 IP Planetlab1.CS.UCLA.EDU.43309 > 198.188.2.10.44444: UDP, length 1024
15:41:09.813565 IP Planetlab1.CS.UCLA.EDU.43309 > 198.188.2.10.44444: UDP, length 1024
15:41:09.815195 IP Planetlab1.CS.UCLA.EDU.43309 > 198.188.2.10.44444: UDP, length 1024
15:41:09.815284 IP Planetlab1.CS.UCLA.EDU.43309 > 198.188.2.10.44444: UDP, length 1024
15:41:09.817272 IP Planetlab1.CS.UCLA.EDU.43309 > 198.188.2.10.44444: UDP, length 1024
15:41:09.817358 IP Planetlab1.CS.UCLA.EDU.43309 > 198.188.2.10.44444: UDP, length 1024
15:41:09.819127 IP Planetlab1.CS.UCLA.EDU.43309 > 198.188.2.10.44444: UDP, length 1024
15:41:09.819212 IP Planetlab1.CS.UCLA.EDU.43309 > 198.188.2.10.44444: UDP, length 1024
15:41:09.820823 IP Planetlab1.CS.UCLA.EDU.43309 > 198.188.2.10.44444: UDP, length 1024
15:41:09.820911 IP Planetlab1.CS.UCLA.EDU.43309 > 198.188.2.10.44444: UDP, length 1024
15:41:09.822833 IP Planetlab1.CS.UCLA.EDU.43309 > 198.188.2.10.44444: UDP, length 1024
15:41:09.822919 IP Planetlab1.CS.UCLA.EDU.43309 > 198.188.2.10.44444: UDP, length 1024
15:41:09.824689 IP Planetlab1.CS.UCLA.EDU.43309 > 198.188.2.10.44444: UDP, length 1024
15:41:09.824776 IP Planetlab1.CS.UCLA.EDU.43309 > 198.188.2.10.44444: UDP, length 1024
15:41:09.826419 IP Planetlab1.CS.UCLA.EDU.43309 > 198.188.2.10.44444: UDP, length 1024
15:41:09.826505 IP Planetlab1.CS.UCLA.EDU.43309 > 198.188.2.10.44444: UDP, length 1024
15:41:09.828256 IP Planetlab1.CS.UCLA.EDU.43309 > 198.188.2.10.44444: UDP, length 1024
15:41:09.828343 IP Planetlab1.CS.UCLA.EDU.43309 > 198.188.2.10.44444: UDP, length 1024
15:41:09.830136 IP Planetlab1.CS.UCLA.EDU.43309 > 198.188.2.10.44444: UDP, length 1024
15:41:09.830222 IP Planetlab1.CS.UCLA.EDU.43309 > 198.188.2.10.44444: UDP, length 1024
15:41:09.832141 IP Planetlab1.CS.UCLA.EDU.43309 > 198.188.2.10.44444: UDP, length 1024
15:41:09.832229 IP Planetlab1.CS.UCLA.EDU.43309 > 198.188.2.10.44444: UDP, length 1024
15:41:09.834240 IP Planetlab1.CS.UCLA.EDU.43309 > 198.188.2.10.44444: UDP, length 1024
15:41:09.834327 IP Planetlab1.CS.UCLA.EDU.43309 > 198.188.2.10.44444: UDP, length 1024
15:41:09.835965 IP Planetlab1.CS.UCLA.EDU.43309 > 198.188.2.10.44444: UDP, length 1024
15:41:09.836053 IP Planetlab1.CS.UCLA.EDU.43309 > 198.188.2.10.44444: UDP, length 1024
15:41:09.837899 IP Planetlab1.CS.UCLA.EDU.43309 > 198.188.2.10.44444: UDP, length 1024
15:41:09.837988 IP Planetlab1.CS.UCLA.EDU.43309 > 198.188.2.10.44444: UDP, length 1024
15:41:09.839661 IP Planetlab1.CS.UCLA.EDU.43309 > 198.188.2.10.44444: UDP, length 1024
15:41:09.839747 IP Planetlab1.CS.UCLA.EDU.43309 > 198.188.2.10.44444: UDP, length 1024
15:41:09.841498 IP Planetlab1.CS.UCLA.EDU.43309 > 198.188.2.10.44444: UDP, length 1024
15:41:09.841584 IP Planetlab1.CS.UCLA.EDU.43309 > 198.188.2.10.44444: UDP, length 1024
15:41:09.843376 IP Planetlab1.CS.UCLA.EDU.43309 > 198.188.2.10.44444: UDP, length 1024
15:41:09.843464 IP Planetlab1.CS.UCLA.EDU.43309 > 198.188.2.10.44444: UDP, length 1024
15:41:09.845389 IP Planetlab1.CS.UCLA.EDU.43309 > 198.188.2.10.44444: UDP, length 1024
15:41:09.845476 IP Planetlab1.CS.UCLA.EDU.43309 > 198.188.2.10.44444: UDP, length 1024
15:41:09.847069 IP Planetlab1.CS.UCLA.EDU.43309 > 198.188.2.10.44444: UDP, length 1024
15:41:09.847156 IP Planetlab1.CS.UCLA.EDU.43309 > 198.188.2.10.44444: UDP, length 1024
15:41:09.849144 IP Planetlab1.CS.UCLA.EDU.43309 > 198.188.2.10.44444: UDP, length 1024
15:41:09.850557 IP Planetlab1.CS.UCLA.EDU.43309 > 198.188.2.10.44444: UDP, length 1024
15:41:09.850644 IP Planetlab1.CS.UCLA.EDU.43309 > 198.188.2.10.44444: UDP, length 1024
15:41:09.852255 IP Planetlab1.CS.UCLA.EDU.43309 > 198.188.2.10.44444: UDP, length 1024
15:41:09.852343 IP Planetlab1.CS.UCLA.EDU.43309 > 198.188.2.10.44444: UDP, length 1024
15:41:09.854463 IP Planetlab1.CS.UCLA.EDU.43309 > 198.188.2.10.44444: UDP, length 1024
15:41:09.854550 IP Planetlab1.CS.UCLA.EDU.43309 > 198.188.2.10.44444: UDP, length 1024
15:41:09.856239 IP Planetlab1.CS.UCLA.EDU.43309 > 198.188.2.10.44444: UDP, length 1024
15:41:09.856328 IP Planetlab1.CS.UCLA.EDU.43309 > 198.188.2.10.44444: UDP, length 1024
15:41:09.858060 IP Planetlab1.CS.UCLA.EDU.43309 > 198.188.2.10.44444: UDP, length 1024
15:41:09.858148 IP Planetlab1.CS.UCLA.EDU.43309 > 198.188.2.10.44444: UDP, length 1024
15:41:09.859946 IP Planetlab1.CS.UCLA.EDU.43309 > 198.188.2.10.44444: UDP, length 1024
15:41:09.860033 IP Planetlab1.CS.UCLA.EDU.43309 > 198.188.2.10.44444: UDP, length 1024
15:41:09.861748 IP Planetlab1.CS.UCLA.EDU.43309 > 198.188.2.10.44444: UDP, length 1024
15:41:09.861835 IP Planetlab1.CS.UCLA.EDU.43309 > 198.188.2.10.44444: UDP, length 1024
15:41:09.863648 IP Planetlab1.CS.UCLA.EDU.43309 > 198.188.2.10.44444: UDP, length 1024
15:41:09.863735 IP Planetlab1.CS.UCLA.EDU.43309 > 198.188.2.10.44444: UDP, length 1024
15:41:09.865438 IP Planetlab1.CS.UCLA.EDU.43309 > 198.188.2.10.44444: UDP, length 1024
15:41:09.865526 IP Planetlab1.CS.UCLA.EDU.43309 > 198.188.2.10.44444: UDP, length 1024
15:41:09.867229 IP Planetlab1.CS.UCLA.EDU.43309 > 198.188.2.10.44444: UDP, length 1024
15:41:09.867315 IP Planetlab1.CS.UCLA.EDU.43309 > 198.188.2.10.44444: UDP, length 1024
15:41:09.869179 IP Planetlab1.CS.UCLA.EDU.43309 > 198.188.2.10.44444: UDP, length 1024
15:41:09.869268 IP Planetlab1.CS.UCLA.EDU.43309 > 198.188.2.10.44444: UDP, length 1024
15:41:09.871115 IP Planetlab1.CS.UCLA.EDU.43309 > 198.188.2.10.44444: UDP, length 1024
15:41:09.871202 IP Planetlab1.CS.UCLA.EDU.43309 > 198.188.2.10.44444: UDP, length 1024
15:41:09.872999 IP Planetlab1.CS.UCLA.EDU.43309 > 198.188.2.10.44444: UDP, length 1024
15:41:09.873086 IP Planetlab1.CS.UCLA.EDU.43309 > 198.188.2.10.44444: UDP, length 1024
15:41:09.874823 IP Planetlab1.CS.UCLA.EDU.43309 > 198.188.2.10.44444: UDP, length 1024
15:41:09.874911 IP Planetlab1.CS.UCLA.EDU.43309 > 198.188.2.10.44444: UDP, length 1024
15:41:09.876655 IP Planetlab1.CS.UCLA.EDU.43309 > 198.188.2.10.44444: UDP, length 1024
15:41:09.876742 IP Planetlab1.CS.UCLA.EDU.43309 > 198.188.2.10.44444: UDP, length 1024
15:41:09.878487 IP Planetlab1.CS.UCLA.EDU.43309 > 198.188.2.10.44444: UDP, length 1024
15:41:09.878574 IP Planetlab1.CS.UCLA.EDU.43309 > 198.188.2.10.44444: UDP, length 1024
15:41:09.880257 IP Planetlab1.CS.UCLA.EDU.43309 > 198.188.2.10.44444: UDP, length 1024
15:41:09.880345 IP Planetlab1.CS.UCLA.EDU.43309 > 198.188.2.10.44444: UDP, length 1024
15:41:09.882191 IP Planetlab1.CS.UCLA.EDU.43309 > 198.188.2.10.44444: UDP, length 1024
15:41:09.882279 IP Planetlab1.CS.UCLA.EDU.43309 > 198.188.2.10.44444: UDP, length 1024
15:41:09.884133 IP Planetlab1.CS.UCLA.EDU.43309 > 198.188.2.10.44444: UDP, length 1024
15:41:09.884220 IP Planetlab1.CS.UCLA.EDU.43309 > 198.188.2.10.44444: UDP, length 1024
15:41:09.885904 IP Planetlab1.CS.UCLA.EDU.43309 > 198.188.2.10.44444: UDP, length 1024
15:41:09.885992 IP Planetlab1.CS.UCLA.EDU.43309 > 198.188.2.10.44444: UDP, length 1024
15:41:09.887659 IP Planetlab1.CS.UCLA.EDU.43309 > 198.188.2.10.44444: UDP, length 1024
15:41:09.887747 IP Planetlab1.CS.UCLA.EDU.43309 > 198.188.2.10.44444: UDP, length 1024
15:41:09.889618 IP Planetlab1.CS.UCLA.EDU.43309 > 198.188.2.10.44444: UDP, length 1024
15:41:09.889705 IP Planetlab1.CS.UCLA.EDU.43309 > 198.188.2.10.44444: UDP, length 1024
15:41:09.891330 IP Planetlab1.CS.UCLA.EDU.43309 > 198.188.2.10.44444: UDP, length 1024
15:41:09.891418 IP Planetlab1.CS.UCLA.EDU.43309 > 198.188.2.10.44444: UDP, length 1024
15:41:09.893123 IP Planetlab1.CS.UCLA.EDU.43309 > 198.188.2.10.44444: UDP, length 1024
15:41:09.893211 IP Planetlab1.CS.UCLA.EDU.43309 > 198.188.2.10.44444: UDP, length 1024
15:41:09.894960 IP Planetlab1.CS.UCLA.EDU.43309 > 198.188.2.10.44444: UDP, length 1024
15:41:09.895045 IP Planetlab1.CS.UCLA.EDU.43309 > 198.188.2.10.44444: UDP, length 1024
15:41:09.896599 IP Planetlab1.CS.UCLA.EDU.43309 > 198.188.2.10.44444: UDP, length 1024
15:41:09.896686 IP Planetlab1.CS.UCLA.EDU.43309 > 198.188.2.10.44444: UDP, length 1024
15:41:09.898280 IP Planetlab1.CS.UCLA.EDU.43309 > 198.188.2.10.44444: UDP, length 1024
15:41:09.899569 IP Planetlab1.CS.UCLA.EDU.43309 > 198.188.2.10.44444: UDP, length 1024
15:41:09.899656 IP Planetlab1.CS.UCLA.EDU.43309 > 198.188.2.10.44444: UDP, length 1024
15:41:09.901399 IP Planetlab1.CS.UCLA.EDU.43309 > 198.188.2.10.44444: UDP, length 1024
15:41:09.901485 IP Planetlab1.CS.UCLA.EDU.43309 > 198.188.2.10.44444: UDP, length 1024
15:41:09.903238 IP Planetlab1.CS.UCLA.EDU.43309 > 198.188.2.10.44444: UDP, length 1024
15:41:09.903321 IP Planetlab1.CS.UCLA.EDU.43309 > 198.188.2.10.44444: UDP, length 1024
15:41:09.905162 IP Planetlab1.CS.UCLA.EDU.43309 > 198.188.2.10.44444: UDP, length 1024
15:41:09.905249 IP Planetlab1.CS.UCLA.EDU.43309 > 198.188.2.10.44444: UDP, length 1024
15:41:09.907279 IP Planetlab1.CS.UCLA.EDU.43309 > 198.188.2.10.44444: UDP, length 1024
15:41:09.907366 IP Planetlab1.CS.UCLA.EDU.43309 > 198.188.2.10.44444: UDP, length 1024
15:41:09.908916 IP Planetlab1.CS.UCLA.EDU.43309 > 198.188.2.10.44444: UDP, length 1024
15:41:09.909006 IP Planetlab1.CS.UCLA.EDU.43309 > 198.188.2.10.44444: UDP, length 1024
15:41:09.910846 IP Planetlab1.CS.UCLA.EDU.43309 > 198.188.2.10.44444: UDP, length 1024
15:41:09.910934 IP Planetlab1.CS.UCLA.EDU.43309 > 198.188.2.10.44444: UDP, length 1024
15:41:09.912984 IP Planetlab1.CS.UCLA.EDU.43309 > 198.188.2.10.44444: UDP, length 1024
15:41:09.913071 IP Planetlab1.CS.UCLA.EDU.43309 > 198.188.2.10.44444: UDP, length 1024
15:41:09.914506 IP Planetlab1.CS.UCLA.EDU.43309 > 198.188.2.10.44444: UDP, length 1024
15:41:09.914595 IP Planetlab1.CS.UCLA.EDU.43309 > 198.188.2.10.44444: UDP, length 1024
15:41:09.916440 IP Planetlab1.CS.UCLA.EDU.43309 > 198.188.2.10.44444: UDP, length 1024
15:41:09.916528 IP Planetlab1.CS.UCLA.EDU.43309 > 198.188.2.10.44444: UDP, length 1024
15:41:09.918298 IP Planetlab1.CS.UCLA.EDU.43309 > 198.188.2.10.44444: UDP, length 1024
15:41:09.918346 IP Planetlab1.CS.UCLA.EDU.43309 > 198.188.2.10.44444: UDP, length 1024
15:41:09.919939 IP Planetlab1.CS.UCLA.EDU.43309 > 198.188.2.10.44444: UDP, length 1024
15:41:09.920026 IP Planetlab1.CS.UCLA.EDU.43309 > 198.188.2.10.44444: UDP, length 1024
15:41:09.921860 IP Planetlab1.CS.UCLA.EDU.43309 > 198.188.2.10.44444: UDP, length 1024
15:41:09.921946 IP Planetlab1.CS.UCLA.EDU.43309 > 198.188.2.10.44444: UDP, length 1024
15:41:09.923692 IP Planetlab1.CS.UCLA.EDU.43309 > 198.188.2.10.44444: UDP, length 1024
15:41:09.923780 IP Planetlab1.CS.UCLA.EDU.43309 > 198.188.2.10.44444: UDP, length 1024
15:41:09.925579 IP Planetlab1.CS.UCLA.EDU.43309 > 198.188.2.10.44444: UDP, length 1024
15:41:09.925666 IP Planetlab1.CS.UCLA.EDU.43309 > 198.188.2.10.44444: UDP, length 1024
15:41:09.927525 IP Planetlab1.CS.UCLA.EDU.43309 > 198.188.2.10.44444: UDP, length 1024
15:41:09.927611 IP Planetlab1.CS.UCLA.EDU.43309 > 198.188.2.10.44444: UDP, length 1024
15:41:09.929517 IP Planetlab1.CS.UCLA.EDU.43309 > 198.188.2.10.44444: UDP, length 1024
15:41:09.929604 IP Planetlab1.CS.UCLA.EDU.43309 > 198.188.2.10.44444: UDP, length 1024
15:41:09.931426 IP Planetlab1.CS.UCLA.EDU.43309 > 198.188.2.10.44444: UDP, length 1024
15:41:09.931513 IP Planetlab1.CS.UCLA.EDU.43309 > 198.188.2.10.44444: UDP, length 1024
15:41:09.933229 IP Planetlab1.CS.UCLA.EDU.43309 > 198.188.2.10.44444: UDP, length 1024
15:41:09.933318 IP Planetlab1.CS.UCLA.EDU.43309 > 198.188.2.10.44444: UDP, length 1024
15:41:09.934945 IP Planetlab1.CS.UCLA.EDU.43309 > 198.188.2.10.44444: UDP, length 1024
15:41:09.935033 IP Planetlab1.CS.UCLA.EDU.43309 > 198.188.2.10.44444: UDP, length 1024
15:41:09.936992 IP Planetlab1.CS.UCLA.EDU.43309 > 198.188.2.10.44444: UDP, length 1024
15:41:09.937079 IP Planetlab1.CS.UCLA.EDU.43309 > 198.188.2.10.44444: UDP, length 1024
15:41:09.938872 IP Planetlab1.CS.UCLA.EDU.43309 > 198.188.2.10.44444: UDP, length 1024
15:41:09.938961 IP Planetlab1.CS.UCLA.EDU.43309 > 198.188.2.10.44444: UDP, length 1024
15:41:09.940658 IP Planetlab1.CS.UCLA.EDU.43309 > 198.188.2.10.44444: UDP, length 1024
15:41:09.940745 IP Planetlab1.CS.UCLA.EDU.43309 > 198.188.2.10.44444: UDP, length 1024
15:41:09.942639 IP Planetlab1.CS.UCLA.EDU.43309 > 198.188.2.10.44444: UDP, length 1024
15:41:09.942727 IP Planetlab1.CS.UCLA.EDU.43309 > 198.188.2.10.44444: UDP, length 1024
15:41:09.944505 IP Planetlab1.CS.UCLA.EDU.43309 > 198.188.2.10.44444: UDP, length 1024
15:41:09.944595 IP Planetlab1.CS.UCLA.EDU.43309 > 198.188.2.10.44444: UDP, length 1024
15:41:09.946214 IP Planetlab1.CS.UCLA.EDU.43309 > 198.188.2.10.44444: UDP, length 1024
15:41:09.946299 IP Planetlab1.CS.UCLA.EDU.43309 > 198.188.2.10.44444: UDP, length 1024
15:41:09.948122 IP Planetlab1.CS.UCLA.EDU.43309 > 198.188.2.10.44444: UDP, length 1024
15:41:09.948209 IP Planetlab1.CS.UCLA.EDU.43309 > 198.188.2.10.44444: UDP, length 1024
15:41:09.949872 IP Planetlab1.CS.UCLA.EDU.43309 > 198.188.2.10.44444: UDP, length 1024
15:41:09.949960 IP Planetlab1.CS.UCLA.EDU.43309 > 198.188.2.10.44444: UDP, length 1024
15:41:09.951744 IP Planetlab1.CS.UCLA.EDU.43309 > 198.188.2.10.44444: UDP, length 1024
15:41:09.951831 IP Planetlab1.CS.UCLA.EDU.43309 > 198.188.2.10.44444: UDP, length 1024
15:41:09.953673 IP Planetlab1.CS.UCLA.EDU.43309 > 198.188.2.10.44444: UDP, length 1024
15:41:09.953760 IP Planetlab1.CS.UCLA.EDU.43309 > 198.188.2.10.44444: UDP, length 1024
15:41:09.955620 IP Planetlab1.CS.UCLA.EDU.43309 > 198.188.2.10.44444: UDP, length 1024
15:41:09.955708 IP Planetlab1.CS.UCLA.EDU.43309 > 198.188.2.10.44444: UDP, length 1024
15:41:09.957320 IP Planetlab1.CS.UCLA.EDU.43309 > 198.188.2.10.44444: UDP, length 1024
15:41:09.957405 IP Planetlab1.CS.UCLA.EDU.43309 > 198.188.2.10.44444: UDP, length 1024
15:41:09.958986 IP Planetlab1.CS.UCLA.EDU.43309 > 198.188.2.10.44444: UDP, length 1024
15:41:09.959073 IP Planetlab1.CS.UCLA.EDU.43309 > 198.188.2.10.44444: UDP, length 1024
15:41:09.960819 IP Planetlab1.CS.UCLA.EDU.43309 > 198.188.2.10.44444: UDP, length 1024
15:41:09.960905 IP Planetlab1.CS.UCLA.EDU.43309 > 198.188.2.10.44444: UDP, length 1024
15:41:09.962921 IP Planetlab1.CS.UCLA.EDU.43309 > 198.188.2.10.44444: UDP, length 1024
15:41:09.963008 IP Planetlab1.CS.UCLA.EDU.43309 > 198.188.2.10.44444: UDP, length 1024
15:41:09.964521 IP Planetlab1.CS.UCLA.EDU.43309 > 198.188.2.10.44444: UDP, length 1024
15:41:09.964609 IP Planetlab1.CS.UCLA.EDU.43309 > 198.188.2.10.44444: UDP, length 1024
15:41:09.966469 IP Planetlab1.CS.UCLA.EDU.43309 > 198.188.2.10.44444: UDP, length 1024
15:41:09.966555 IP Planetlab1.CS.UCLA.EDU.43309 > 198.188.2.10.44444: UDP, length 1024
15:41:09.968398 IP Planetlab1.CS.UCLA.EDU.43309 > 198.188.2.10.44444: UDP, length 1024
15:41:09.968486 IP Planetlab1.CS.UCLA.EDU.43309 > 198.188.2.10.44444: UDP, length 1024
15:41:09.970594 IP Planetlab1.CS.UCLA.EDU.43309 > 198.188.2.10.44444: UDP, length 1024
15:41:09.970682 IP Planetlab1.CS.UCLA.EDU.43309 > 198.188.2.10.44444: UDP, length 1024
15:41:09.972446 IP Planetlab1.CS.UCLA.EDU.43309 > 198.188.2.10.44444: UDP, length 1024
15:41:09.972533 IP Planetlab1.CS.UCLA.EDU.43309 > 198.188.2.10.44444: UDP, length 1024
15:41:09.974521 IP Planetlab1.CS.UCLA.EDU.43309 > 198.188.2.10.44444: UDP, length 1024
15:41:09.976194 IP Planetlab1.CS.UCLA.EDU.43309 > 198.188.2.10.44444: UDP, length 1024
15:41:09.977545 IP Planetlab1.CS.UCLA.EDU.43309 > 198.188.2.10.44444: UDP, length 1024
15:41:09.979025 IP Planetlab1.CS.UCLA.EDU.43309 > 198.188.2.10.44444: UDP, length 1024
15:41:09.979113 IP Planetlab1.CS.UCLA.EDU.43309 > 198.188.2.10.44444: UDP, length 1024
15:41:09.980828 IP Planetlab1.CS.UCLA.EDU.43309 > 198.188.2.10.44444: UDP, length 1024
15:41:09.980916 IP Planetlab1.CS.UCLA.EDU.43309 > 198.188.2.10.44444: UDP, length 1024
15:41:09.982636 IP Planetlab1.CS.UCLA.EDU.43309 > 198.188.2.10.44444: UDP, length 1024
15:41:09.982725 IP Planetlab1.CS.UCLA.EDU.43309 > 198.188.2.10.44444: UDP, length 1024
15:41:09.984357 IP Planetlab1.CS.UCLA.EDU.43309 > 198.188.2.10.44444: UDP, length 1024
15:41:09.984445 IP Planetlab1.CS.UCLA.EDU.43309 > 198.188.2.10.44444: UDP, length 1024
15:41:09.986144 IP Planetlab1.CS.UCLA.EDU.43309 > 198.188.2.10.44444: UDP, length 1024
15:41:09.986236 IP Planetlab1.CS.UCLA.EDU.43309 > 198.188.2.10.44444: UDP, length 1024
15:41:09.988084 IP Planetlab1.CS.UCLA.EDU.43309 > 198.188.2.10.44444: UDP, length 1024
15:41:09.988171 IP Planetlab1.CS.UCLA.EDU.43309 > 198.188.2.10.44444: UDP, length 1024
15:41:09.989911 IP Planetlab1.CS.UCLA.EDU.43309 > 198.188.2.10.44444: UDP, length 1024
15:41:09.989999 IP Planetlab1.CS.UCLA.EDU.43309 > 198.188.2.10.44444: UDP, length 1024
15:41:09.991783 IP Planetlab1.CS.UCLA.EDU.43309 > 198.188.2.10.44444: UDP, length 1024
15:41:09.991870 IP Planetlab1.CS.UCLA.EDU.43309 > 198.188.2.10.44444: UDP, length 1024
15:41:09.993426 IP Planetlab1.CS.UCLA.EDU.43309 > 198.188.2.10.44444: UDP, length 1024
15:41:09.993510 IP Planetlab1.CS.UCLA.EDU.43309 > 198.188.2.10.44444: UDP, length 1024
15:41:09.995157 IP Planetlab1.CS.UCLA.EDU.43309 > 198.188.2.10.44444: UDP, length 1024
15:41:09.995243 IP Planetlab1.CS.UCLA.EDU.43309 > 198.188.2.10.44444: UDP, length 1024
15:41:09.996880 IP Planetlab1.CS.UCLA.EDU.43309 > 198.188.2.10.44444: UDP, length 1024
15:41:09.996968 IP Planetlab1.CS.UCLA.EDU.43309 > 198.188.2.10.44444: UDP, length 1024
15:41:09.998566 IP Planetlab1.CS.UCLA.EDU.43309 > 198.188.2.10.44444: UDP, length 1024
15:41:09.998654 IP Planetlab1.CS.UCLA.EDU.43309 > 198.188.2.10.44444: UDP, length 1024
15:41:10.000284 IP Planetlab1.CS.UCLA.EDU.43309 > 198.188.2.10.44444: UDP, length 1024
15:41:10.000372 IP Planetlab1.CS.UCLA.EDU.43309 > 198.188.2.10.44444: UDP, length 1024
15:41:10.002023 IP Planetlab1.CS.UCLA.EDU.43309 > 198.188.2.10.44444: UDP, length 1024
15:41:10.002112 IP Planetlab1.CS.UCLA.EDU.43309 > 198.188.2.10.44444: UDP, length 1024
15:41:10.003903 IP Planetlab1.CS.UCLA.EDU.43309 > 198.188.2.10.44444: UDP, length 1024
15:41:10.003990 IP Planetlab1.CS.UCLA.EDU.43309 > 198.188.2.10.44444: UDP, length 1024
15:41:10.005521 IP Planetlab1.CS.UCLA.EDU.43309 > 198.188.2.10.44444: UDP, length 1024
15:41:10.005609 IP Planetlab1.CS.UCLA.EDU.43309 > 198.188.2.10.44444: UDP, length 1024
15:41:10.007521 IP Planetlab1.CS.UCLA.EDU.43309 > 198.188.2.10.44444: UDP, length 1024
15:41:10.007609 IP Planetlab1.CS.UCLA.EDU.43309 > 198.188.2.10.44444: UDP, length 1024
15:41:10.009346 IP Planetlab1.CS.UCLA.EDU.43309 > 198.188.2.10.44444: UDP, length 1024
15:41:10.009436 IP Planetlab1.CS.UCLA.EDU.43309 > 198.188.2.10.44444: UDP, length 1024
15:41:10.011044 IP Planetlab1.CS.UCLA.EDU.43309 > 198.188.2.10.44444: UDP, length 1024
15:41:10.011133 IP Planetlab1.CS.UCLA.EDU.43309 > 198.188.2.10.44444: UDP, length 1024
15:41:10.012956 IP Planetlab1.CS.UCLA.EDU.43309 > 198.188.2.10.44444: UDP, length 1024
15:41:10.014672 IP Planetlab1.CS.UCLA.EDU.43309 > 198.188.2.10.44444: UDP, length 1024
15:41:10.014760 IP Planetlab1.CS.UCLA.EDU.43309 > 198.188.2.10.44444: UDP, length 1024
15:41:10.016239 IP Planetlab1.CS.UCLA.EDU.43309 > 198.188.2.10.44444: UDP, length 1024
15:41:10.016326 IP Planetlab1.CS.UCLA.EDU.43309 > 198.188.2.10.44444: UDP, length 1024
15:41:10.018275 IP Planetlab1.CS.UCLA.EDU.43309 > 198.188.2.10.44444: UDP, length 1024
15:41:10.018361 IP Planetlab1.CS.UCLA.EDU.43309 > 198.188.2.10.44444: UDP, length 1024
15:41:10.020104 IP Planetlab1.CS.UCLA.EDU.43309 > 198.188.2.10.44444: UDP, length 1024
15:41:10.020195 IP Planetlab1.CS.UCLA.EDU.43309 > 198.188.2.10.44444: UDP, length 1024
15:41:10.021922 IP Planetlab1.CS.UCLA.EDU.43309 > 198.188.2.10.44444: UDP, length 1024
15:41:10.022008 IP Planetlab1.CS.UCLA.EDU.43309 > 198.188.2.10.44444: UDP, length 1024
15:41:10.023816 IP Planetlab1.CS.UCLA.EDU.43309 > 198.188.2.10.44444: UDP, length 1024
15:41:10.023902 IP Planetlab1.CS.UCLA.EDU.43309 > 198.188.2.10.44444: UDP, length 1024
15:41:10.025730 IP Planetlab1.CS.UCLA.EDU.43309 > 198.188.2.10.44444: UDP, length 1024
15:41:10.025817 IP Planetlab1.CS.UCLA.EDU.43309 > 198.188.2.10.44444: UDP, length 1024
15:41:10.027352 IP Planetlab1.CS.UCLA.EDU.43309 > 198.188.2.10.44444: UDP, length 1024
15:41:10.027438 IP Planetlab1.CS.UCLA.EDU.43309 > 198.188.2.10.44444: UDP, length 1024
15:41:10.029009 IP Planetlab1.CS.UCLA.EDU.43309 > 198.188.2.10.44444: UDP, length 1024
15:41:10.029098 IP Planetlab1.CS.UCLA.EDU.43309 > 198.188.2.10.44444: UDP, length 1024
15:41:10.031076 IP Planetlab1.CS.UCLA.EDU.43309 > 198.188.2.10.44444: UDP, length 1024
15:41:10.031164 IP Planetlab1.CS.UCLA.EDU.43309 > 198.188.2.10.44444: UDP, length 1024
15:41:10.032775 IP Planetlab1.CS.UCLA.EDU.43309 > 198.188.2.10.44444: UDP, length 1024
15:41:10.032862 IP Planetlab1.CS.UCLA.EDU.43309 > 198.188.2.10.44444: UDP, length 1024
15:41:10.034511 IP Planetlab1.CS.UCLA.EDU.43309 > 198.188.2.10.44444: UDP, length 1024
15:41:10.034595 IP Planetlab1.CS.UCLA.EDU.43309 > 198.188.2.10.44444: UDP, length 1024
15:41:10.036374 IP Planetlab1.CS.UCLA.EDU.43309 > 198.188.2.10.44444: UDP, length 1024
15:41:10.036460 IP Planetlab1.CS.UCLA.EDU.43309 > 198.188.2.10.44444: UDP, length 1024
15:41:10.038146 IP Planetlab1.CS.UCLA.EDU.43309 > 198.188.2.10.44444: UDP, length 1024
15:41:10.038233 IP Planetlab1.CS.UCLA.EDU.43309 > 198.188.2.10.44444: UDP, length 1024
15:41:10.040193 IP Planetlab1.CS.UCLA.EDU.43309 > 198.188.2.10.44444: UDP, length 1024
15:41:10.040279 IP Planetlab1.CS.UCLA.EDU.43309 > 198.188.2.10.44444: UDP, length 1024
15:41:10.041866 IP Planetlab1.CS.UCLA.EDU.43309 > 198.188.2.10.44444: UDP, length 1024
15:41:10.041972 IP Planetlab1.CS.UCLA.EDU.43309 > 198.188.2.10.44444: UDP, length 1024
15:41:10.044004 IP Planetlab1.CS.UCLA.EDU.43309 > 198.188.2.10.44444: UDP, length 1024
15:41:10.044091 IP Planetlab1.CS.UCLA.EDU.43309 > 198.188.2.10.44444: UDP, length 1024
15:41:10.045804 IP Planetlab1.CS.UCLA.EDU.43309 > 198.188.2.10.44444: UDP, length 1024
15:41:10.045892 IP Planetlab1.CS.UCLA.EDU.43309 > 198.188.2.10.44444: UDP, length 1024
15:41:10.047784 IP Planetlab1.CS.UCLA.EDU.43309 > 198.188.2.10.44444: UDP, length 1024
15:41:10.047909 IP Planetlab1.CS.UCLA.EDU.43309 > 198.188.2.10.44444: UDP, length 1024
15:41:10.049369 IP Planetlab1.CS.UCLA.EDU.43309 > 198.188.2.10.44444: UDP, length 1024
15:41:10.049455 IP Planetlab1.CS.UCLA.EDU.43309 > 198.188.2.10.44444: UDP, length 1024
15:41:10.051362 IP Planetlab1.CS.UCLA.EDU.43309 > 198.188.2.10.44444: UDP, length 1024
15:41:10.051448 IP Planetlab1.CS.UCLA.EDU.43309 > 198.188.2.10.44444: UDP, length 1024
15:41:10.053142 IP Planetlab1.CS.UCLA.EDU.43309 > 198.188.2.10.44444: UDP, length 1024
15:41:10.054502 IP Planetlab1.CS.UCLA.EDU.43309 > 198.188.2.10.44444: UDP, length 1024
15:41:10.054591 IP Planetlab1.CS.UCLA.EDU.43309 > 198.188.2.10.44444: UDP, length 1024
15:41:10.056578 IP Planetlab1.CS.UCLA.EDU.43309 > 198.188.2.10.44444: UDP, length 1024
15:41:10.056666 IP Planetlab1.CS.UCLA.EDU.43309 > 198.188.2.10.44444: UDP, length 1024
15:41:10.058432 IP Planetlab1.CS.UCLA.EDU.43309 > 198.188.2.10.44444: UDP, length 1024
15:41:10.058520 IP Planetlab1.CS.UCLA.EDU.43309 > 198.188.2.10.44444: UDP, length 1024
15:41:10.060230 IP Planetlab1.CS.UCLA.EDU.43309 > 198.188.2.10.44444: UDP, length 1024
15:41:10.060317 IP Planetlab1.CS.UCLA.EDU.43309 > 198.188.2.10.44444: UDP, length 1024
15:41:10.062162 IP Planetlab1.CS.UCLA.EDU.43309 > 198.188.2.10.44444: UDP, length 1024
15:41:10.062251 IP Planetlab1.CS.UCLA.EDU.43309 > 198.188.2.10.44444: UDP, length 1024
15:41:10.063937 IP Planetlab1.CS.UCLA.EDU.43309 > 198.188.2.10.44444: UDP, length 1024
15:41:10.064026 IP Planetlab1.CS.UCLA.EDU.43309 > 198.188.2.10.44444: UDP, length 1024
15:41:10.065809 IP Planetlab1.CS.UCLA.EDU.43309 > 198.188.2.10.44444: UDP, length 1024
15:41:10.065897 IP Planetlab1.CS.UCLA.EDU.43309 > 198.188.2.10.44444: UDP, length 1024
15:41:10.067531 IP Planetlab1.CS.UCLA.EDU.43309 > 198.188.2.10.44444: UDP, length 1024
15:41:10.067618 IP Planetlab1.CS.UCLA.EDU.43309 > 198.188.2.10.44444: UDP, length 1024
15:41:10.069379 IP Planetlab1.CS.UCLA.EDU.43309 > 198.188.2.10.44444: UDP, length 1024
15:41:10.069468 IP Planetlab1.CS.UCLA.EDU.43309 > 198.188.2.10.44444: UDP, length 1024
15:41:10.071274 IP Planetlab1.CS.UCLA.EDU.43309 > 198.188.2.10.44444: UDP, length 1024
15:41:10.071361 IP Planetlab1.CS.UCLA.EDU.43309 > 198.188.2.10.44444: UDP, length 1024
15:41:10.073088 IP Planetlab1.CS.UCLA.EDU.43309 > 198.188.2.10.44444: UDP, length 1024
15:41:10.073175 IP Planetlab1.CS.UCLA.EDU.43309 > 198.188.2.10.44444: UDP, length 1024
15:41:10.074885 IP Planetlab1.CS.UCLA.EDU.43309 > 198.188.2.10.44444: UDP, length 1024
15:41:10.074973 IP Planetlab1.CS.UCLA.EDU.43309 > 198.188.2.10.44444: UDP, length 1024
15:41:10.076774 IP Planetlab1.CS.UCLA.EDU.43309 > 198.188.2.10.44444: UDP, length 1024
15:41:10.076861 IP Planetlab1.CS.UCLA.EDU.43309 > 198.188.2.10.44444: UDP, length 1024
15:41:10.078486 IP Planetlab1.CS.UCLA.EDU.43309 > 198.188.2.10.44444: UDP, length 1024
15:41:10.078572 IP Planetlab1.CS.UCLA.EDU.43309 > 198.188.2.10.44444: UDP, length 1024
15:41:10.080316 IP Planetlab1.CS.UCLA.EDU.43309 > 198.188.2.10.44444: UDP, length 1024
15:41:10.080405 IP Planetlab1.CS.UCLA.EDU.43309 > 198.188.2.10.44444: UDP, length 1024
15:41:10.082255 IP Planetlab1.CS.UCLA.EDU.43309 > 198.188.2.10.44444: UDP, length 1024
15:41:10.082343 IP Planetlab1.CS.UCLA.EDU.43309 > 198.188.2.10.44444: UDP, length 1024
15:41:10.084043 IP Planetlab1.CS.UCLA.EDU.43309 > 198.188.2.10.44444: UDP, length 1024
15:41:10.084129 IP Planetlab1.CS.UCLA.EDU.43309 > 198.188.2.10.44444: UDP, length 1024
15:41:10.085855 IP Planetlab1.CS.UCLA.EDU.43309 > 198.188.2.10.44444: UDP, length 1024
15:41:10.085943 IP Planetlab1.CS.UCLA.EDU.43309 > 198.188.2.10.44444: UDP, length 1024
15:41:10.087566 IP Planetlab1.CS.UCLA.EDU.43309 > 198.188.2.10.44444: UDP, length 1024
15:41:10.087653 IP Planetlab1.CS.UCLA.EDU.43309 > 198.188.2.10.44444: UDP, length 1024
15:41:10.089452 IP Planetlab1.CS.UCLA.EDU.43309 > 198.188.2.10.44444: UDP, length 1024
15:41:10.089539 IP Planetlab1.CS.UCLA.EDU.43309 > 198.188.2.10.44444: UDP, length 1024
15:41:10.091225 IP Planetlab1.CS.UCLA.EDU.43309 > 198.188.2.10.44444: UDP, length 1024
15:41:10.091312 IP Planetlab1.CS.UCLA.EDU.43309 > 198.188.2.10.44444: UDP, length 1024
15:41:10.093053 IP Planetlab1.CS.UCLA.EDU.43309 > 198.188.2.10.44444: UDP, length 1024
15:41:10.093139 IP Planetlab1.CS.UCLA.EDU.43309 > 198.188.2.10.44444: UDP, length 1024
15:41:10.094926 IP Planetlab1.CS.UCLA.EDU.43309 > 198.188.2.10.44444: UDP, length 1024
15:41:10.095014 IP Planetlab1.CS.UCLA.EDU.43309 > 198.188.2.10.44444: UDP, length 1024
15:41:10.096659 IP Planetlab1.CS.UCLA.EDU.43309 > 198.188.2.10.44444: UDP, length 1024
15:41:10.096746 IP Planetlab1.CS.UCLA.EDU.43309 > 198.188.2.10.44444: UDP, length 1024
15:41:10.098403 IP Planetlab1.CS.UCLA.EDU.43309 > 198.188.2.10.44444: UDP, length 1024
15:41:10.098490 IP Planetlab1.CS.UCLA.EDU.43309 > 198.188.2.10.44444: UDP, length 1024
15:41:10.100131 IP Planetlab1.CS.UCLA.EDU.43309 > 198.188.2.10.44444: UDP, length 1024
15:41:10.100221 IP Planetlab1.CS.UCLA.EDU.43309 > 198.188.2.10.44444: UDP, length 1024
15:41:10.102202 IP Planetlab1.CS.UCLA.EDU.43309 > 198.188.2.10.44444: UDP, length 1024
15:41:10.102289 IP Planetlab1.CS.UCLA.EDU.43309 > 198.188.2.10.44444: UDP, length 1024
15:41:10.103808 IP Planetlab1.CS.UCLA.EDU.43309 > 198.188.2.10.44444: UDP, length 1024
15:41:10.103896 IP Planetlab1.CS.UCLA.EDU.43309 > 198.188.2.10.44444: UDP, length 1024
15:41:10.105762 IP Planetlab1.CS.UCLA.EDU.43309 > 198.188.2.10.44444: UDP, length 1024
15:41:10.105850 IP Planetlab1.CS.UCLA.EDU.43309 > 198.188.2.10.44444: UDP, length 1024
15:41:10.107682 IP Planetlab1.CS.UCLA.EDU.43309 > 198.188.2.10.44444: UDP, length 1024
15:41:10.107768 IP Planetlab1.CS.UCLA.EDU.43309 > 198.188.2.10.44444: UDP, length 1024
15:41:10.109588 IP Planetlab1.CS.UCLA.EDU.43309 > 198.188.2.10.44444: UDP, length 1024
15:41:10.109678 IP Planetlab1.CS.UCLA.EDU.43309 > 198.188.2.10.44444: UDP, length 1024
15:41:10.111453 IP Planetlab1.CS.UCLA.EDU.43309 > 198.188.2.10.44444: UDP, length 1024
15:41:10.111540 IP Planetlab1.CS.UCLA.EDU.43309 > 198.188.2.10.44444: UDP, length 1024
15:41:10.113182 IP Planetlab1.CS.UCLA.EDU.43309 > 198.188.2.10.44444: UDP, length 1024
15:41:10.113270 IP Planetlab1.CS.UCLA.EDU.43309 > 198.188.2.10.44444: UDP, length 1024
15:41:10.114880 IP Planetlab1.CS.UCLA.EDU.43309 > 198.188.2.10.44444: UDP, length 1024
15:41:10.114966 IP Planetlab1.CS.UCLA.EDU.43309 > 198.188.2.10.44444: UDP, length 1024
15:41:10.116760 IP Planetlab1.CS.UCLA.EDU.43309 > 198.188.2.10.44444: UDP, length 1024
15:41:10.116849 IP Planetlab1.CS.UCLA.EDU.43309 > 198.188.2.10.44444: UDP, length 1024
15:41:10.118644 IP Planetlab1.CS.UCLA.EDU.43309 > 198.188.2.10.44444: UDP, length 1024
15:41:10.118733 IP Planetlab1.CS.UCLA.EDU.43309 > 198.188.2.10.44444: UDP, length 1024
15:41:10.120646 IP Planetlab1.CS.UCLA.EDU.43309 > 198.188.2.10.44444: UDP, length 1024
15:41:10.120735 IP Planetlab1.CS.UCLA.EDU.43309 > 198.188.2.10.44444: UDP, length 1024
15:41:10.122539 IP Planetlab1.CS.UCLA.EDU.43309 > 198.188.2.10.44444: UDP, length 1024
15:41:10.123966 IP Planetlab1.CS.UCLA.EDU.43309 > 198.188.2.10.44444: UDP, length 1024
15:41:10.124053 IP Planetlab1.CS.UCLA.EDU.43309 > 198.188.2.10.44444: UDP, length 1024
15:41:10.125654 IP Planetlab1.CS.UCLA.EDU.43309 > 198.188.2.10.44444: UDP, length 1024
15:41:10.125739 IP Planetlab1.CS.UCLA.EDU.43309 > 198.188.2.10.44444: UDP, length 1024
15:41:10.127481 IP Planetlab1.CS.UCLA.EDU.43309 > 198.188.2.10.44444: UDP, length 1024
15:41:10.127569 IP Planetlab1.CS.UCLA.EDU.43309 > 198.188.2.10.44444: UDP, length 1024
15:41:10.129437 IP Planetlab1.CS.UCLA.EDU.43309 > 198.188.2.10.44444: UDP, length 1024
15:41:10.129486 IP Planetlab1.CS.UCLA.EDU.43309 > 198.188.2.10.44444: UDP, length 1024
15:41:10.131414 IP Planetlab1.CS.UCLA.EDU.43309 > 198.188.2.10.44444: UDP, length 1024
