02:16:12.651121 IP planetlab1.ecs.vuw.ac.nz.57196 > 198.188.2.10.33333: UDP, length 1024
02:16:12.651985 IP planetlab1.ecs.vuw.ac.nz.57196 > 198.188.2.10.33333: UDP, length 1024
02:16:12.652856 IP planetlab1.ecs.vuw.ac.nz.57196 > 198.188.2.10.33333: UDP, length 1024
02:16:12.653728 IP planetlab1.ecs.vuw.ac.nz.57196 > 198.188.2.10.33333: UDP, length 1024
02:16:12.654600 IP planetlab1.ecs.vuw.ac.nz.57196 > 198.188.2.10.33333: UDP, length 1024
02:16:12.655472 IP planetlab1.ecs.vuw.ac.nz.57196 > 198.188.2.10.33333: UDP, length 1024
02:16:12.656343 IP planetlab1.ecs.vuw.ac.nz.57196 > 198.188.2.10.33333: UDP, length 1024
02:16:12.657217 IP planetlab1.ecs.vuw.ac.nz.57196 > 198.188.2.10.33333: UDP, length 1024
02:16:12.658087 IP planetlab1.ecs.vuw.ac.nz.57196 > 198.188.2.10.33333: UDP, length 1024
02:16:12.658959 IP planetlab1.ecs.vuw.ac.nz.57196 > 198.188.2.10.33333: UDP, length 1024
02:16:12.659830 IP planetlab1.ecs.vuw.ac.nz.57196 > 198.188.2.10.33333: UDP, length 1024
02:16:12.660703 IP planetlab1.ecs.vuw.ac.nz.57196 > 198.188.2.10.33333: UDP, length 1024
02:16:12.661575 IP planetlab1.ecs.vuw.ac.nz.57196 > 198.188.2.10.33333: UDP, length 1024
02:16:12.662452 IP planetlab1.ecs.vuw.ac.nz.57196 > 198.188.2.10.33333: UDP, length 1024
02:16:12.663323 IP planetlab1.ecs.vuw.ac.nz.57196 > 198.188.2.10.33333: UDP, length 1024
02:16:12.664191 IP planetlab1.ecs.vuw.ac.nz.57196 > 198.188.2.10.33333: UDP, length 1024
02:16:12.665067 IP planetlab1.ecs.vuw.ac.nz.57196 > 198.188.2.10.33333: UDP, length 1024
02:16:12.665940 IP planetlab1.ecs.vuw.ac.nz.57196 > 198.188.2.10.33333: UDP, length 1024
02:16:12.666811 IP planetlab1.ecs.vuw.ac.nz.57196 > 198.188.2.10.33333: UDP, length 1024
02:16:12.667683 IP planetlab1.ecs.vuw.ac.nz.57196 > 198.188.2.10.33333: UDP, length 1024
02:16:12.668554 IP planetlab1.ecs.vuw.ac.nz.57196 > 198.188.2.10.33333: UDP, length 1024
02:16:12.669427 IP planetlab1.ecs.vuw.ac.nz.57196 > 198.188.2.10.33333: UDP, length 1024
02:16:12.670299 IP planetlab1.ecs.vuw.ac.nz.57196 > 198.188.2.10.33333: UDP, length 1024
02:16:12.671172 IP planetlab1.ecs.vuw.ac.nz.57196 > 198.188.2.10.33333: UDP, length 1024
02:16:12.672043 IP planetlab1.ecs.vuw.ac.nz.57196 > 198.188.2.10.33333: UDP, length 1024
02:16:12.672916 IP planetlab1.ecs.vuw.ac.nz.57196 > 198.188.2.10.33333: UDP, length 1024
02:16:12.673782 IP planetlab1.ecs.vuw.ac.nz.57196 > 198.188.2.10.33333: UDP, length 1024
02:16:12.674659 IP planetlab1.ecs.vuw.ac.nz.57196 > 198.188.2.10.33333: UDP, length 1024
02:16:12.675531 IP planetlab1.ecs.vuw.ac.nz.57196 > 198.188.2.10.33333: UDP, length 1024
02:16:12.676404 IP planetlab1.ecs.vuw.ac.nz.57196 > 198.188.2.10.33333: UDP, length 1024
02:16:12.677275 IP planetlab1.ecs.vuw.ac.nz.57196 > 198.188.2.10.33333: UDP, length 1024
02:16:12.678147 IP planetlab1.ecs.vuw.ac.nz.57196 > 198.188.2.10.33333: UDP, length 1024
02:16:12.679022 IP planetlab1.ecs.vuw.ac.nz.57196 > 198.188.2.10.33333: UDP, length 1024
02:16:12.679879 IP planetlab1.ecs.vuw.ac.nz.57196 > 198.188.2.10.33333: UDP, length 1024
02:16:12.680764 IP planetlab1.ecs.vuw.ac.nz.57196 > 198.188.2.10.33333: UDP, length 1024
02:16:12.681621 IP planetlab1.ecs.vuw.ac.nz.57196 > 198.188.2.10.33333: UDP, length 1024
02:16:12.682509 IP planetlab1.ecs.vuw.ac.nz.57196 > 198.188.2.10.33333: UDP, length 1024
02:16:12.683364 IP planetlab1.ecs.vuw.ac.nz.57196 > 198.188.2.10.33333: UDP, length 1024
02:16:12.684240 IP planetlab1.ecs.vuw.ac.nz.57196 > 198.188.2.10.33333: UDP, length 1024
02:16:12.685108 IP planetlab1.ecs.vuw.ac.nz.57196 > 198.188.2.10.33333: UDP, length 1024
02:16:12.685982 IP planetlab1.ecs.vuw.ac.nz.57196 > 198.188.2.10.33333: UDP, length 1024
02:16:12.686858 IP planetlab1.ecs.vuw.ac.nz.57196 > 198.188.2.10.33333: UDP, length 1024
02:16:12.687724 IP planetlab1.ecs.vuw.ac.nz.57196 > 198.188.2.10.33333: UDP, length 1024
02:16:12.688595 IP planetlab1.ecs.vuw.ac.nz.57196 > 198.188.2.10.33333: UDP, length 1024
02:16:12.689487 IP planetlab1.ecs.vuw.ac.nz.57196 > 198.188.2.10.33333: UDP, length 1024
02:16:12.690340 IP planetlab1.ecs.vuw.ac.nz.57196 > 198.188.2.10.33333: UDP, length 1024
02:16:12.691211 IP planetlab1.ecs.vuw.ac.nz.57196 > 198.188.2.10.33333: UDP, length 1024
02:16:12.692097 IP planetlab1.ecs.vuw.ac.nz.57196 > 198.188.2.10.33333: UDP, length 1024
02:16:12.692956 IP planetlab1.ecs.vuw.ac.nz.57196 > 198.188.2.10.33333: UDP, length 1024
02:16:12.693841 IP planetlab1.ecs.vuw.ac.nz.57196 > 198.188.2.10.33333: UDP, length 1024
02:16:12.694712 IP planetlab1.ecs.vuw.ac.nz.57196 > 198.188.2.10.33333: UDP, length 1024
02:16:12.695584 IP planetlab1.ecs.vuw.ac.nz.57196 > 198.188.2.10.33333: UDP, length 1024
02:16:12.696452 IP planetlab1.ecs.vuw.ac.nz.57196 > 198.188.2.10.33333: UDP, length 1024
02:16:12.697324 IP planetlab1.ecs.vuw.ac.nz.57196 > 198.188.2.10.33333: UDP, length 1024
02:16:12.698198 IP planetlab1.ecs.vuw.ac.nz.57196 > 198.188.2.10.33333: UDP, length 1024
02:16:12.699071 IP planetlab1.ecs.vuw.ac.nz.57196 > 198.188.2.10.33333: UDP, length 1024
02:16:12.699943 IP planetlab1.ecs.vuw.ac.nz.57196 > 198.188.2.10.33333: UDP, length 1024
02:16:12.700815 IP planetlab1.ecs.vuw.ac.nz.57196 > 198.188.2.10.33333: UDP, length 1024
02:16:12.701686 IP planetlab1.ecs.vuw.ac.nz.57196 > 198.188.2.10.33333: UDP, length 1024
02:16:12.702558 IP planetlab1.ecs.vuw.ac.nz.57196 > 198.188.2.10.33333: UDP, length 1024
02:16:12.703431 IP planetlab1.ecs.vuw.ac.nz.57196 > 198.188.2.10.33333: UDP, length 1024
02:16:12.704303 IP planetlab1.ecs.vuw.ac.nz.57196 > 198.188.2.10.33333: UDP, length 1024
02:16:12.705196 IP planetlab1.ecs.vuw.ac.nz.57196 > 198.188.2.10.33333: UDP, length 1024
02:16:12.706046 IP planetlab1.ecs.vuw.ac.nz.57196 > 198.188.2.10.33333: UDP, length 1024
02:16:12.706922 IP planetlab1.ecs.vuw.ac.nz.57196 > 198.188.2.10.33333: UDP, length 1024
02:16:12.707791 IP planetlab1.ecs.vuw.ac.nz.57196 > 198.188.2.10.33333: UDP, length 1024
02:16:12.708662 IP planetlab1.ecs.vuw.ac.nz.57196 > 198.188.2.10.33333: UDP, length 1024
02:16:12.709534 IP planetlab1.ecs.vuw.ac.nz.57196 > 198.188.2.10.33333: UDP, length 1024
02:16:12.710407 IP planetlab1.ecs.vuw.ac.nz.57196 > 198.188.2.10.33333: UDP, length 1024
02:16:12.711279 IP planetlab1.ecs.vuw.ac.nz.57196 > 198.188.2.10.33333: UDP, length 1024
02:16:12.712150 IP planetlab1.ecs.vuw.ac.nz.57196 > 198.188.2.10.33333: UDP, length 1024
02:16:12.713023 IP planetlab1.ecs.vuw.ac.nz.57196 > 198.188.2.10.33333: UDP, length 1024
02:16:12.713895 IP planetlab1.ecs.vuw.ac.nz.57196 > 198.188.2.10.33333: UDP, length 1024
02:16:12.714767 IP planetlab1.ecs.vuw.ac.nz.57196 > 198.188.2.10.33333: UDP, length 1024
02:16:12.715638 IP planetlab1.ecs.vuw.ac.nz.57196 > 198.188.2.10.33333: UDP, length 1024
02:16:12.716510 IP planetlab1.ecs.vuw.ac.nz.57196 > 198.188.2.10.33333: UDP, length 1024
02:16:12.717388 IP planetlab1.ecs.vuw.ac.nz.57196 > 198.188.2.10.33333: UDP, length 1024
02:16:12.718251 IP planetlab1.ecs.vuw.ac.nz.57196 > 198.188.2.10.33333: UDP, length 1024
