18:24:05.969599 IP 192.91.235.230.41264 > 198.188.2.10.22222: UDP, length 1024
18:24:05.973701 IP 192.91.235.230.41264 > 198.188.2.10.22222: UDP, length 1024
18:24:05.977809 IP 192.91.235.230.41264 > 198.188.2.10.22222: UDP, length 1024
18:24:05.982315 IP 192.91.235.230.41264 > 198.188.2.10.22222: UDP, length 1024
18:24:05.986421 IP 192.91.235.230.41264 > 198.188.2.10.22222: UDP, length 1024
18:24:05.990932 IP 192.91.235.230.41264 > 198.188.2.10.22222: UDP, length 1024
18:24:05.995037 IP 192.91.235.230.41264 > 198.188.2.10.22222: UDP, length 1024
18:24:05.999549 IP 192.91.235.230.41264 > 198.188.2.10.22222: UDP, length 1024
18:24:06.003654 IP 192.91.235.230.41264 > 198.188.2.10.22222: UDP, length 1024
18:24:06.008165 IP 192.91.235.230.41264 > 198.188.2.10.22222: UDP, length 1024
18:24:06.012269 IP 192.91.235.230.41264 > 198.188.2.10.22222: UDP, length 1024
18:24:06.016780 IP 192.91.235.230.41264 > 198.188.2.10.22222: UDP, length 1024
18:24:06.020885 IP 192.91.235.230.41264 > 198.188.2.10.22222: UDP, length 1024
18:24:06.025399 IP 192.91.235.230.41264 > 198.188.2.10.22222: UDP, length 1024
18:24:06.029501 IP 192.91.235.230.41264 > 198.188.2.10.22222: UDP, length 1024
18:24:06.034014 IP 192.91.235.230.41264 > 198.188.2.10.22222: UDP, length 1024
18:24:06.038117 IP 192.91.235.230.41264 > 198.188.2.10.22222: UDP, length 1024
18:24:06.042220 IP 192.91.235.230.41264 > 198.188.2.10.22222: UDP, length 1024
18:24:06.046732 IP 192.91.235.230.41264 > 198.188.2.10.22222: UDP, length 1024
18:24:06.050837 IP 192.91.235.230.41264 > 198.188.2.10.22222: UDP, length 1024
18:24:06.055350 IP 192.91.235.230.41264 > 198.188.2.10.22222: UDP, length 1024
18:24:06.059454 IP 192.91.235.230.41264 > 198.188.2.10.22222: UDP, length 1024
18:24:06.063967 IP 192.91.235.230.41264 > 198.188.2.10.22222: UDP, length 1024
18:24:06.068070 IP 192.91.235.230.41264 > 198.188.2.10.22222: UDP, length 1024
18:24:06.072581 IP 192.91.235.230.41264 > 198.188.2.10.22222: UDP, length 1024
18:24:06.076685 IP 192.91.235.230.41264 > 198.188.2.10.22222: UDP, length 1024
18:24:06.081198 IP 192.91.235.230.41264 > 198.188.2.10.22222: UDP, length 1024
18:24:06.085301 IP 192.91.235.230.41264 > 198.188.2.10.22222: UDP, length 1024
18:24:06.089813 IP 192.91.235.230.41264 > 198.188.2.10.22222: UDP, length 1024
18:24:06.093918 IP 192.91.235.230.41264 > 198.188.2.10.22222: UDP, length 1024
18:24:06.098430 IP 192.91.235.230.41264 > 198.188.2.10.22222: UDP, length 1024
18:24:06.102534 IP 192.91.235.230.41264 > 198.188.2.10.22222: UDP, length 1024
18:24:06.106639 IP 192.91.235.230.41264 > 198.188.2.10.22222: UDP, length 1024
18:24:06.111150 IP 192.91.235.230.41264 > 198.188.2.10.22222: UDP, length 1024
18:24:06.115255 IP 192.91.235.230.41264 > 198.188.2.10.22222: UDP, length 1024
18:24:06.119767 IP 192.91.235.230.41264 > 198.188.2.10.22222: UDP, length 1024
18:24:06.123869 IP 192.91.235.230.41264 > 198.188.2.10.22222: UDP, length 1024
18:24:06.128383 IP 192.91.235.230.41264 > 198.188.2.10.22222: UDP, length 1024
18:24:06.132486 IP 192.91.235.230.41264 > 198.188.2.10.22222: UDP, length 1024
18:24:06.136999 IP 192.91.235.230.41264 > 198.188.2.10.22222: UDP, length 1024
18:24:06.141103 IP 192.91.235.230.41264 > 198.188.2.10.22222: UDP, length 1024
18:24:06.145614 IP 192.91.235.230.41264 > 198.188.2.10.22222: UDP, length 1024
18:24:06.149718 IP 192.91.235.230.41264 > 198.188.2.10.22222: UDP, length 1024
18:24:06.154232 IP 192.91.235.230.41264 > 198.188.2.10.22222: UDP, length 1024
18:24:06.158335 IP 192.91.235.230.41264 > 198.188.2.10.22222: UDP, length 1024
18:24:06.162847 IP 192.91.235.230.41264 > 198.188.2.10.22222: UDP, length 1024
18:24:06.166953 IP 192.91.235.230.41264 > 198.188.2.10.22222: UDP, length 1024
18:24:06.171055 IP 192.91.235.230.41264 > 198.188.2.10.22222: UDP, length 1024
18:24:06.175567 IP 192.91.235.230.41264 > 198.188.2.10.22222: UDP, length 1024
18:24:06.179670 IP 192.91.235.230.41264 > 198.188.2.10.22222: UDP, length 1024
18:24:06.184182 IP 192.91.235.230.41264 > 198.188.2.10.22222: UDP, length 1024
18:24:06.188289 IP 192.91.235.230.41264 > 198.188.2.10.22222: UDP, length 1024
18:24:06.192799 IP 192.91.235.230.41264 > 198.188.2.10.22222: UDP, length 1024
18:24:06.196904 IP 192.91.235.230.41264 > 198.188.2.10.22222: UDP, length 1024
18:24:06.201420 IP 192.91.235.230.41264 > 198.188.2.10.22222: UDP, length 1024
18:24:06.205519 IP 192.91.235.230.41264 > 198.188.2.10.22222: UDP, length 1024
18:24:06.210031 IP 192.91.235.230.41264 > 198.188.2.10.22222: UDP, length 1024
18:24:06.214134 IP 192.91.235.230.41264 > 198.188.2.10.22222: UDP, length 1024
18:24:06.218646 IP 192.91.235.230.41264 > 198.188.2.10.22222: UDP, length 1024
18:24:06.222752 IP 192.91.235.230.41264 > 198.188.2.10.22222: UDP, length 1024
18:24:06.227795 IP 192.91.235.230.41264 > 198.188.2.10.22222: UDP, length 1024
18:24:06.231901 IP 192.91.235.230.41264 > 198.188.2.10.22222: UDP, length 1024
18:24:06.236414 IP 192.91.235.230.41264 > 198.188.2.10.22222: UDP, length 1024
18:24:06.240515 IP 192.91.235.230.41264 > 198.188.2.10.22222: UDP, length 1024
18:24:06.245029 IP 192.91.235.230.41264 > 198.188.2.10.22222: UDP, length 1024
18:24:06.249133 IP 192.91.235.230.41264 > 198.188.2.10.22222: UDP, length 1024
18:24:06.253645 IP 192.91.235.230.41264 > 198.188.2.10.22222: UDP, length 1024
18:24:06.257749 IP 192.91.235.230.41264 > 198.188.2.10.22222: UDP, length 1024
18:24:06.262261 IP 192.91.235.230.41264 > 198.188.2.10.22222: UDP, length 1024
18:24:06.267834 IP 192.91.235.230.41264 > 198.188.2.10.22222: UDP, length 1024
18:24:06.271938 IP 192.91.235.230.41264 > 198.188.2.10.22222: UDP, length 1024
18:24:06.276041 IP 192.91.235.230.41264 > 198.188.2.10.22222: UDP, length 1024
18:24:06.280557 IP 192.91.235.230.41264 > 198.188.2.10.22222: UDP, length 1024
18:24:06.284659 IP 192.91.235.230.41264 > 198.188.2.10.22222: UDP, length 1024
18:24:06.289169 IP 192.91.235.230.41264 > 198.188.2.10.22222: UDP, length 1024
18:24:06.293273 IP 192.91.235.230.41264 > 198.188.2.10.22222: UDP, length 1024
18:24:06.297785 IP 192.91.235.230.41264 > 198.188.2.10.22222: UDP, length 1024
18:24:06.301891 IP 192.91.235.230.41264 > 198.188.2.10.22222: UDP, length 1024
18:24:06.306403 IP 192.91.235.230.41264 > 198.188.2.10.22222: UDP, length 1024
18:24:06.310506 IP 192.91.235.230.41264 > 198.188.2.10.22222: UDP, length 1024
18:24:06.315017 IP 192.91.235.230.41264 > 198.188.2.10.22222: UDP, length 1024
18:24:06.319123 IP 192.91.235.230.41264 > 198.188.2.10.22222: UDP, length 1024
18:24:06.323636 IP 192.91.235.230.41264 > 198.188.2.10.22222: UDP, length 1024
18:24:06.327738 IP 192.91.235.230.41264 > 198.188.2.10.22222: UDP, length 1024
18:24:06.332250 IP 192.91.235.230.41264 > 198.188.2.10.22222: UDP, length 1024
18:24:06.336354 IP 192.91.235.230.41264 > 198.188.2.10.22222: UDP, length 1024
18:24:06.340460 IP 192.91.235.230.41264 > 198.188.2.10.22222: UDP, length 1024
18:24:06.344971 IP 192.91.235.230.41264 > 198.188.2.10.22222: UDP, length 1024
18:24:06.349075 IP 192.91.235.230.41264 > 198.188.2.10.22222: UDP, length 1024
18:24:06.353586 IP 192.91.235.230.41264 > 198.188.2.10.22222: UDP, length 1024
18:24:06.357695 IP 192.91.235.230.41264 > 198.188.2.10.22222: UDP, length 1024
18:24:06.362202 IP 192.91.235.230.41264 > 198.188.2.10.22222: UDP, length 1024
18:24:06.366306 IP 192.91.235.230.41264 > 198.188.2.10.22222: UDP, length 1024
18:24:06.370821 IP 192.91.235.230.41264 > 198.188.2.10.22222: UDP, length 1024
18:24:06.374923 IP 192.91.235.230.41264 > 198.188.2.10.22222: UDP, length 1024
18:24:06.379435 IP 192.91.235.230.41264 > 198.188.2.10.22222: UDP, length 1024
18:24:06.383516 IP 192.91.235.230.41264 > 198.188.2.10.22222: UDP, length 1024
18:24:06.388028 IP 192.91.235.230.41264 > 198.188.2.10.22222: UDP, length 1024
18:24:06.392128 IP 192.91.235.230.41264 > 198.188.2.10.22222: UDP, length 1024
18:24:06.396639 IP 192.91.235.230.41264 > 198.188.2.10.22222: UDP, length 1024
18:24:06.400744 IP 192.91.235.230.41264 > 198.188.2.10.22222: UDP, length 1024
18:24:06.404848 IP 192.91.235.230.41264 > 198.188.2.10.22222: UDP, length 1024
18:24:06.409361 IP 192.91.235.230.41264 > 198.188.2.10.22222: UDP, length 1024
18:24:06.413463 IP 192.91.235.230.41264 > 198.188.2.10.22222: UDP, length 1024
18:24:06.417975 IP 192.91.235.230.41264 > 198.188.2.10.22222: UDP, length 1024
18:24:06.422079 IP 192.91.235.230.41264 > 198.188.2.10.22222: UDP, length 1024
18:24:06.426594 IP 192.91.235.230.41264 > 198.188.2.10.22222: UDP, length 1024
18:24:06.430703 IP 192.91.235.230.41264 > 198.188.2.10.22222: UDP, length 1024
18:24:06.435215 IP 192.91.235.230.41264 > 198.188.2.10.22222: UDP, length 1024
18:24:06.439323 IP 192.91.235.230.41264 > 198.188.2.10.22222: UDP, length 1024
18:24:06.443835 IP 192.91.235.230.41264 > 198.188.2.10.22222: UDP, length 1024
18:24:06.447939 IP 192.91.235.230.41264 > 198.188.2.10.22222: UDP, length 1024
18:24:06.452449 IP 192.91.235.230.41264 > 198.188.2.10.22222: UDP, length 1024
18:24:06.456554 IP 192.91.235.230.41264 > 198.188.2.10.22222: UDP, length 1024
18:24:06.461067 IP 192.91.235.230.41264 > 198.188.2.10.22222: UDP, length 1024
18:24:06.465173 IP 192.91.235.230.41264 > 198.188.2.10.22222: UDP, length 1024
18:24:06.469275 IP 192.91.235.230.41264 > 198.188.2.10.22222: UDP, length 1024
18:24:06.473790 IP 192.91.235.230.41264 > 198.188.2.10.22222: UDP, length 1024
18:24:06.477894 IP 192.91.235.230.41264 > 198.188.2.10.22222: UDP, length 1024
18:24:06.482403 IP 192.91.235.230.41264 > 198.188.2.10.22222: UDP, length 1024
18:24:06.486510 IP 192.91.235.230.41264 > 198.188.2.10.22222: UDP, length 1024
18:24:06.491006 IP 192.91.235.230.41264 > 198.188.2.10.22222: UDP, length 1024
18:24:06.495126 IP 192.91.235.230.41264 > 198.188.2.10.22222: UDP, length 1024
18:24:06.499626 IP 192.91.235.230.41264 > 198.188.2.10.22222: UDP, length 1024
18:24:06.503740 IP 192.91.235.230.41264 > 198.188.2.10.22222: UDP, length 1024
18:24:06.508249 IP 192.91.235.230.41264 > 198.188.2.10.22222: UDP, length 1024
18:24:06.512356 IP 192.91.235.230.41264 > 198.188.2.10.22222: UDP, length 1024
18:24:06.516869 IP 192.91.235.230.41264 > 198.188.2.10.22222: UDP, length 1024
18:24:06.520972 IP 192.91.235.230.41264 > 198.188.2.10.22222: UDP, length 1024
18:24:06.525487 IP 192.91.235.230.41264 > 198.188.2.10.22222: UDP, length 1024
18:24:06.529589 IP 192.91.235.230.41264 > 198.188.2.10.22222: UDP, length 1024
18:24:06.533696 IP 192.91.235.230.41264 > 198.188.2.10.22222: UDP, length 1024
18:24:06.538207 IP 192.91.235.230.41264 > 198.188.2.10.22222: UDP, length 1024
18:24:06.542318 IP 192.91.235.230.41264 > 198.188.2.10.22222: UDP, length 1024
18:24:06.546804 IP 192.91.235.230.41264 > 198.188.2.10.22222: UDP, length 1024
18:24:06.550923 IP 192.91.235.230.41264 > 198.188.2.10.22222: UDP, length 1024
18:24:06.555509 IP 192.91.235.230.41264 > 198.188.2.10.22222: UDP, length 1024
18:24:06.559594 IP 192.91.235.230.41264 > 198.188.2.10.22222: UDP, length 1024
18:24:06.564035 IP 192.91.235.230.41264 > 198.188.2.10.22222: UDP, length 1024
18:24:06.568150 IP 192.91.235.230.41264 > 198.188.2.10.22222: UDP, length 1024
18:24:06.572662 IP 192.91.235.230.41264 > 198.188.2.10.22222: UDP, length 1024
18:24:06.576767 IP 192.91.235.230.41264 > 198.188.2.10.22222: UDP, length 1024
18:24:06.581278 IP 192.91.235.230.41264 > 198.188.2.10.22222: UDP, length 1024
18:24:06.585382 IP 192.91.235.230.41264 > 198.188.2.10.22222: UDP, length 1024
18:24:06.589895 IP 192.91.235.230.41264 > 198.188.2.10.22222: UDP, length 1024
18:24:06.593999 IP 192.91.235.230.41264 > 198.188.2.10.22222: UDP, length 1024
18:24:06.598498 IP 192.91.235.230.41264 > 198.188.2.10.22222: UDP, length 1024
18:24:06.602601 IP 192.91.235.230.41264 > 198.188.2.10.22222: UDP, length 1024
18:24:06.606707 IP 192.91.235.230.41264 > 198.188.2.10.22222: UDP, length 1024
18:24:06.611217 IP 192.91.235.230.41264 > 198.188.2.10.22222: UDP, length 1024
18:24:06.615335 IP 192.91.235.230.41264 > 198.188.2.10.22222: UDP, length 1024
18:24:06.619844 IP 192.91.235.230.41264 > 198.188.2.10.22222: UDP, length 1024
18:24:06.623948 IP 192.91.235.230.41264 > 198.188.2.10.22222: UDP, length 1024
18:24:06.628450 IP 192.91.235.230.41264 > 198.188.2.10.22222: UDP, length 1024
18:24:06.632554 IP 192.91.235.230.41264 > 198.188.2.10.22222: UDP, length 1024
18:24:06.637074 IP 192.91.235.230.41264 > 198.188.2.10.22222: UDP, length 1024
18:24:06.641169 IP 192.91.235.230.41264 > 198.188.2.10.22222: UDP, length 1024
18:24:06.645716 IP 192.91.235.230.41264 > 198.188.2.10.22222: UDP, length 1024
18:24:06.649819 IP 192.91.235.230.41264 > 198.188.2.10.22222: UDP, length 1024
18:24:06.654330 IP 192.91.235.230.41264 > 198.188.2.10.22222: UDP, length 1024
18:24:06.658436 IP 192.91.235.230.41264 > 198.188.2.10.22222: UDP, length 1024
18:24:06.662947 IP 192.91.235.230.41264 > 198.188.2.10.22222: UDP, length 1024
18:24:06.667051 IP 192.91.235.230.41264 > 198.188.2.10.22222: UDP, length 1024
18:24:06.671155 IP 192.91.235.230.41264 > 198.188.2.10.22222: UDP, length 1024
18:24:06.675668 IP 192.91.235.230.41264 > 198.188.2.10.22222: UDP, length 1024
18:24:06.679771 IP 192.91.235.230.41264 > 198.188.2.10.22222: UDP, length 1024
18:24:06.684284 IP 192.91.235.230.41264 > 198.188.2.10.22222: UDP, length 1024
18:24:06.688388 IP 192.91.235.230.41264 > 198.188.2.10.22222: UDP, length 1024
18:24:06.692900 IP 192.91.235.230.41264 > 198.188.2.10.22222: UDP, length 1024
18:24:06.697003 IP 192.91.235.230.41264 > 198.188.2.10.22222: UDP, length 1024
18:24:06.701520 IP 192.91.235.230.41264 > 198.188.2.10.22222: UDP, length 1024
18:24:06.705620 IP 192.91.235.230.41264 > 198.188.2.10.22222: UDP, length 1024
18:24:06.710133 IP 192.91.235.230.41264 > 198.188.2.10.22222: UDP, length 1024
18:24:06.714235 IP 192.91.235.230.41264 > 198.188.2.10.22222: UDP, length 1024
18:24:06.718747 IP 192.91.235.230.41264 > 198.188.2.10.22222: UDP, length 1024
18:24:06.722852 IP 192.91.235.230.41264 > 198.188.2.10.22222: UDP, length 1024
18:24:06.727364 IP 192.91.235.230.41264 > 198.188.2.10.22222: UDP, length 1024
18:24:06.731468 IP 192.91.235.230.41264 > 198.188.2.10.22222: UDP, length 1024
18:24:06.735572 IP 192.91.235.230.41264 > 198.188.2.10.22222: UDP, length 1024
18:24:06.740083 IP 192.91.235.230.41264 > 198.188.2.10.22222: UDP, length 1024
18:24:06.744187 IP 192.91.235.230.41264 > 198.188.2.10.22222: UDP, length 1024
18:24:06.748699 IP 192.91.235.230.41264 > 198.188.2.10.22222: UDP, length 1024
18:24:06.752804 IP 192.91.235.230.41264 > 198.188.2.10.22222: UDP, length 1024
18:24:06.757316 IP 192.91.235.230.41264 > 198.188.2.10.22222: UDP, length 1024
18:24:06.761420 IP 192.91.235.230.41264 > 198.188.2.10.22222: UDP, length 1024
18:24:06.765932 IP 192.91.235.230.41264 > 198.188.2.10.22222: UDP, length 1024
18:24:06.770036 IP 192.91.235.230.41264 > 198.188.2.10.22222: UDP, length 1024
18:24:06.774548 IP 192.91.235.230.41264 > 198.188.2.10.22222: UDP, length 1024
18:24:06.778658 IP 192.91.235.230.41264 > 198.188.2.10.22222: UDP, length 1024
18:24:06.783164 IP 192.91.235.230.41264 > 198.188.2.10.22222: UDP, length 1024
18:24:06.787269 IP 192.91.235.230.41264 > 198.188.2.10.22222: UDP, length 1024
18:24:06.791781 IP 192.91.235.230.41264 > 198.188.2.10.22222: UDP, length 1024
18:24:06.795884 IP 192.91.235.230.41264 > 198.188.2.10.22222: UDP, length 1024
18:24:06.799988 IP 192.91.235.230.41264 > 198.188.2.10.22222: UDP, length 1024
18:24:06.804501 IP 192.91.235.230.41264 > 198.188.2.10.22222: UDP, length 1024
18:24:06.808604 IP 192.91.235.230.41264 > 198.188.2.10.22222: UDP, length 1024
18:24:06.813116 IP 192.91.235.230.41264 > 198.188.2.10.22222: UDP, length 1024
18:24:06.817221 IP 192.91.235.230.41264 > 198.188.2.10.22222: UDP, length 1024
18:24:06.821737 IP 192.91.235.230.41264 > 198.188.2.10.22222: UDP, length 1024
18:24:06.825839 IP 192.91.235.230.41264 > 198.188.2.10.22222: UDP, length 1024
18:24:06.830349 IP 192.91.235.230.41264 > 198.188.2.10.22222: UDP, length 1024
18:24:06.834452 IP 192.91.235.230.41264 > 198.188.2.10.22222: UDP, length 1024
18:24:06.838965 IP 192.91.235.230.41264 > 198.188.2.10.22222: UDP, length 1024
18:24:06.843068 IP 192.91.235.230.41264 > 198.188.2.10.22222: UDP, length 1024
18:24:06.847581 IP 192.91.235.230.41264 > 198.188.2.10.22222: UDP, length 1024
18:24:06.851685 IP 192.91.235.230.41264 > 198.188.2.10.22222: UDP, length 1024
18:24:06.856197 IP 192.91.235.230.41264 > 198.188.2.10.22222: UDP, length 1024
18:24:06.860302 IP 192.91.235.230.41264 > 198.188.2.10.22222: UDP, length 1024
18:24:06.864813 IP 192.91.235.230.41264 > 198.188.2.10.22222: UDP, length 1024
18:24:06.868922 IP 192.91.235.230.41264 > 198.188.2.10.22222: UDP, length 1024
18:24:06.873021 IP 192.91.235.230.41264 > 198.188.2.10.22222: UDP, length 1024
18:24:06.877532 IP 192.91.235.230.41264 > 198.188.2.10.22222: UDP, length 1024
18:24:06.881638 IP 192.91.235.230.41264 > 198.188.2.10.22222: UDP, length 1024
18:24:06.886149 IP 192.91.235.230.41264 > 198.188.2.10.22222: UDP, length 1024
18:24:06.890254 IP 192.91.235.230.41264 > 198.188.2.10.22222: UDP, length 1024
18:24:06.894766 IP 192.91.235.230.41264 > 198.188.2.10.22222: UDP, length 1024
18:24:06.898869 IP 192.91.235.230.41264 > 198.188.2.10.22222: UDP, length 1024
18:24:06.903381 IP 192.91.235.230.41264 > 198.188.2.10.22222: UDP, length 1024
18:24:06.907484 IP 192.91.235.230.41264 > 198.188.2.10.22222: UDP, length 1024
18:24:06.912001 IP 192.91.235.230.41264 > 198.188.2.10.22222: UDP, length 1024
18:24:06.916102 IP 192.91.235.230.41264 > 198.188.2.10.22222: UDP, length 1024
18:24:06.920614 IP 192.91.235.230.41264 > 198.188.2.10.22222: UDP, length 1024
18:24:06.924719 IP 192.91.235.230.41264 > 198.188.2.10.22222: UDP, length 1024
18:24:06.929229 IP 192.91.235.230.41264 > 198.188.2.10.22222: UDP, length 1024
18:24:06.933334 IP 192.91.235.230.41264 > 198.188.2.10.22222: UDP, length 1024
18:24:06.937438 IP 192.91.235.230.41264 > 198.188.2.10.22222: UDP, length 1024
18:24:06.941950 IP 192.91.235.230.41264 > 198.188.2.10.22222: UDP, length 1024
18:24:06.946057 IP 192.91.235.230.41264 > 198.188.2.10.22222: UDP, length 1024
18:24:06.950565 IP 192.91.235.230.41264 > 198.188.2.10.22222: UDP, length 1024
18:24:06.954671 IP 192.91.235.230.41264 > 198.188.2.10.22222: UDP, length 1024
18:24:06.959181 IP 192.91.235.230.41264 > 198.188.2.10.22222: UDP, length 1024
18:24:06.963286 IP 192.91.235.230.41264 > 198.188.2.10.22222: UDP, length 1024
18:24:06.967799 IP 192.91.235.230.41264 > 198.188.2.10.22222: UDP, length 1024
18:24:06.971903 IP 192.91.235.230.41264 > 198.188.2.10.22222: UDP, length 1024
18:24:06.976415 IP 192.91.235.230.41264 > 198.188.2.10.22222: UDP, length 1024
18:24:06.980517 IP 192.91.235.230.41264 > 198.188.2.10.22222: UDP, length 1024
18:24:06.985031 IP 192.91.235.230.41264 > 198.188.2.10.22222: UDP, length 1024
18:24:06.989141 IP 192.91.235.230.41264 > 198.188.2.10.22222: UDP, length 1024
18:24:06.993646 IP 192.91.235.230.41264 > 198.188.2.10.22222: UDP, length 1024
18:24:06.997751 IP 192.91.235.230.41264 > 198.188.2.10.22222: UDP, length 1024
18:24:07.001854 IP 192.91.235.230.41264 > 198.188.2.10.22222: UDP, length 1024
18:24:07.006367 IP 192.91.235.230.41264 > 198.188.2.10.22222: UDP, length 1024
18:24:07.010471 IP 192.91.235.230.41264 > 198.188.2.10.22222: UDP, length 1024
18:24:07.014982 IP 192.91.235.230.41264 > 198.188.2.10.22222: UDP, length 1024
18:24:07.019087 IP 192.91.235.230.41264 > 198.188.2.10.22222: UDP, length 1024
18:24:07.023598 IP 192.91.235.230.41264 > 198.188.2.10.22222: UDP, length 1024
18:24:07.027704 IP 192.91.235.230.41264 > 198.188.2.10.22222: UDP, length 1024
18:24:07.032217 IP 192.91.235.230.41264 > 198.188.2.10.22222: UDP, length 1024
18:24:07.036318 IP 192.91.235.230.41264 > 198.188.2.10.22222: UDP, length 1024
18:24:07.040831 IP 192.91.235.230.41264 > 198.188.2.10.22222: UDP, length 1024
18:24:07.044934 IP 192.91.235.230.41264 > 198.188.2.10.22222: UDP, length 1024
18:24:07.049446 IP 192.91.235.230.41264 > 198.188.2.10.22222: UDP, length 1024
18:24:07.053552 IP 192.91.235.230.41264 > 198.188.2.10.22222: UDP, length 1024
18:24:07.058064 IP 192.91.235.230.41264 > 198.188.2.10.22222: UDP, length 1024
18:24:07.062166 IP 192.91.235.230.41264 > 198.188.2.10.22222: UDP, length 1024
18:24:07.066272 IP 192.91.235.230.41264 > 198.188.2.10.22222: UDP, length 1024
18:24:07.070784 IP 192.91.235.230.41264 > 198.188.2.10.22222: UDP, length 1024
18:24:07.074885 IP 192.91.235.230.41264 > 198.188.2.10.22222: UDP, length 1024
18:24:07.079398 IP 192.91.235.230.41264 > 198.188.2.10.22222: UDP, length 1024
18:24:07.083503 IP 192.91.235.230.41264 > 198.188.2.10.22222: UDP, length 1024
18:24:07.088015 IP 192.91.235.230.41264 > 198.188.2.10.22222: UDP, length 1024
18:24:07.092120 IP 192.91.235.230.20000 > 198.188.2.10.22222: UDP, length 1024
18:24:07.096631 IP 192.91.235.230.20000 > 198.188.2.10.22222: UDP, length 1024
18:24:07.100736 IP 192.91.235.230.20000 > 198.188.2.10.22222: UDP, length 1024
18:24:07.105248 IP 192.91.235.230.20000 > 198.188.2.10.22222: UDP, length 1024
18:24:07.109352 IP 192.91.235.230.20000 > 198.188.2.10.22222: UDP, length 1024
18:24:07.113864 IP 192.91.235.230.20000 > 198.188.2.10.22222: UDP, length 1024
18:24:07.117968 IP 192.91.235.230.20000 > 198.188.2.10.22222: UDP, length 1024
18:24:07.122484 IP 192.91.235.230.20000 > 198.188.2.10.22222: UDP, length 1024
18:24:07.126584 IP 192.91.235.230.20000 > 198.188.2.10.22222: UDP, length 1024
18:24:07.131096 IP 192.91.235.230.20000 > 198.188.2.10.22222: UDP, length 1024
18:24:07.135200 IP 192.91.235.230.20000 > 198.188.2.10.22222: UDP, length 1024
18:24:07.139305 IP 192.91.235.230.20000 > 198.188.2.10.22222: UDP, length 1024
18:24:07.143816 IP 192.91.235.230.20000 > 198.188.2.10.22222: UDP, length 1024
18:24:07.147920 IP 192.91.235.230.20000 > 198.188.2.10.22222: UDP, length 1024
18:24:07.152432 IP 192.91.235.230.20000 > 198.188.2.10.22222: UDP, length 1024
18:24:07.156540 IP 192.91.235.230.20000 > 198.188.2.10.22222: UDP, length 1024
18:24:07.161047 IP 192.91.235.230.20000 > 198.188.2.10.22222: UDP, length 1024
18:24:07.165153 IP 192.91.235.230.20000 > 198.188.2.10.22222: UDP, length 1024
18:24:07.169667 IP 192.91.235.230.20000 > 198.188.2.10.22222: UDP, length 1024
18:24:07.173769 IP 192.91.235.230.20000 > 198.188.2.10.22222: UDP, length 1024
18:24:07.178281 IP 192.91.235.230.20000 > 198.188.2.10.22222: UDP, length 1024
18:24:07.182385 IP 192.91.235.230.20000 > 198.188.2.10.22222: UDP, length 1024
18:24:07.186896 IP 192.91.235.230.20000 > 198.188.2.10.22222: UDP, length 1024
18:24:07.191000 IP 192.91.235.230.20000 > 198.188.2.10.22222: UDP, length 1024
18:24:07.195512 IP 192.91.235.230.20000 > 198.188.2.10.22222: UDP, length 1024
18:24:07.199622 IP 192.91.235.230.20000 > 198.188.2.10.22222: UDP, length 1024
18:24:07.203722 IP 192.91.235.230.20000 > 198.188.2.10.22222: UDP, length 1024
18:24:07.208233 IP 192.91.235.230.20000 > 198.188.2.10.22222: UDP, length 1024
18:24:07.212336 IP 192.91.235.230.20000 > 198.188.2.10.22222: UDP, length 1024
18:24:07.216848 IP 192.91.235.230.20000 > 198.188.2.10.22222: UDP, length 1024
18:24:07.220952 IP 192.91.235.230.20000 > 198.188.2.10.22222: UDP, length 1024
18:24:07.225465 IP 192.91.235.230.20000 > 198.188.2.10.22222: UDP, length 1024
18:24:07.229570 IP 192.91.235.230.20000 > 198.188.2.10.22222: UDP, length 1024
18:24:07.234081 IP 192.91.235.230.20000 > 198.188.2.10.22222: UDP, length 1024
18:24:07.238185 IP 192.91.235.230.20000 > 198.188.2.10.22222: UDP, length 1024
18:24:07.242697 IP 192.91.235.230.20000 > 198.188.2.10.22222: UDP, length 1024
18:24:07.246800 IP 192.91.235.230.20000 > 198.188.2.10.22222: UDP, length 1024
18:24:07.251312 IP 192.91.235.230.20000 > 198.188.2.10.22222: UDP, length 1024
18:24:07.255418 IP 192.91.235.230.20000 > 198.188.2.10.22222: UDP, length 1024
18:24:07.259929 IP 192.91.235.230.20000 > 198.188.2.10.22222: UDP, length 1024
18:24:07.264033 IP 192.91.235.230.20000 > 198.188.2.10.22222: UDP, length 1024
18:24:07.268137 IP 192.91.235.230.20000 > 198.188.2.10.22222: UDP, length 1024
18:24:07.272649 IP 192.91.235.230.20000 > 198.188.2.10.22222: UDP, length 1024
18:24:07.276752 IP 192.91.235.230.20000 > 198.188.2.10.22222: UDP, length 1024
18:24:07.281264 IP 192.91.235.230.20000 > 198.188.2.10.22222: UDP, length 1024
18:24:07.285369 IP 192.91.235.230.20000 > 198.188.2.10.22222: UDP, length 1024
18:24:07.289885 IP 192.91.235.230.20000 > 198.188.2.10.22222: UDP, length 1024
18:24:07.293986 IP 192.91.235.230.20000 > 198.188.2.10.22222: UDP, length 1024
18:24:07.298497 IP 192.91.235.230.20000 > 198.188.2.10.22222: UDP, length 1024
18:24:07.302602 IP 192.91.235.230.20000 > 198.188.2.10.22222: UDP, length 1024
18:24:07.307113 IP 192.91.235.230.20000 > 198.188.2.10.22222: UDP, length 1024
18:24:07.311218 IP 192.91.235.230.20000 > 198.188.2.10.22222: UDP, length 1024
18:24:07.315730 IP 192.91.235.230.20000 > 198.188.2.10.22222: UDP, length 1024
18:24:07.319833 IP 192.91.235.230.20000 > 198.188.2.10.22222: UDP, length 1024
18:24:07.324346 IP 192.91.235.230.20000 > 198.188.2.10.22222: UDP, length 1024
18:24:07.328450 IP 192.91.235.230.20000 > 198.188.2.10.22222: UDP, length 1024
18:24:07.332554 IP 192.91.235.230.20000 > 198.188.2.10.22222: UDP, length 1024
18:24:07.337065 IP 192.91.235.230.20000 > 198.188.2.10.22222: UDP, length 1024
18:24:07.341171 IP 192.91.235.230.20000 > 198.188.2.10.22222: UDP, length 1024
18:24:07.345683 IP 192.91.235.230.20000 > 198.188.2.10.22222: UDP, length 1024
18:24:07.349785 IP 192.91.235.230.20000 > 198.188.2.10.22222: UDP, length 1024
18:24:07.354297 IP 192.91.235.230.20000 > 198.188.2.10.22222: UDP, length 1024
18:24:07.358402 IP 192.91.235.230.20000 > 198.188.2.10.22222: UDP, length 1024
18:24:07.362913 IP 192.91.235.230.20000 > 198.188.2.10.22222: UDP, length 1024
18:24:07.367019 IP 192.91.235.230.20000 > 198.188.2.10.22222: UDP, length 1024
18:24:07.371530 IP 192.91.235.230.20000 > 198.188.2.10.22222: UDP, length 1024
18:24:07.375635 IP 192.91.235.230.20000 > 198.188.2.10.22222: UDP, length 1024
18:24:07.380146 IP 192.91.235.230.20000 > 198.188.2.10.22222: UDP, length 1024
18:24:07.384213 IP 192.91.235.230.20000 > 198.188.2.10.22222: UDP, length 1024
18:24:07.388724 IP 192.91.235.230.20000 > 198.188.2.10.22222: UDP, length 1024
18:24:07.392829 IP 192.91.235.230.20000 > 198.188.2.10.22222: UDP, length 1024
18:24:07.397340 IP 192.91.235.230.20000 > 198.188.2.10.22222: UDP, length 1024
18:24:07.401446 IP 192.91.235.230.20000 > 198.188.2.10.22222: UDP, length 1024
18:24:07.405549 IP 192.91.235.230.20000 > 198.188.2.10.22222: UDP, length 1024
18:24:07.410061 IP 192.91.235.230.20000 > 198.188.2.10.22222: UDP, length 1024
18:24:07.414164 IP 192.91.235.230.20000 > 198.188.2.10.22222: UDP, length 1024
18:24:07.418676 IP 192.91.235.230.20000 > 198.188.2.10.22222: UDP, length 1024
18:24:07.422781 IP 192.91.235.230.20000 > 198.188.2.10.22222: UDP, length 1024
18:24:07.427295 IP 192.91.235.230.20000 > 198.188.2.10.22222: UDP, length 1024
18:24:07.431494 IP 192.91.235.230.20000 > 198.188.2.10.22222: UDP, length 1024
18:24:07.435915 IP 192.91.235.230.20000 > 198.188.2.10.22222: UDP, length 1024
18:24:07.440015 IP 192.91.235.230.20000 > 198.188.2.10.22222: UDP, length 1024
18:24:07.444528 IP 192.91.235.230.20000 > 198.188.2.10.22222: UDP, length 1024
18:24:07.448632 IP 192.91.235.230.20000 > 198.188.2.10.22222: UDP, length 1024
18:24:07.453142 IP 192.91.235.230.20000 > 198.188.2.10.22222: UDP, length 1024
18:24:07.457247 IP 192.91.235.230.20000 > 198.188.2.10.22222: UDP, length 1024
18:24:07.461759 IP 192.91.235.230.20000 > 198.188.2.10.22222: UDP, length 1024
18:24:07.465864 IP 192.91.235.230.20000 > 198.188.2.10.22222: UDP, length 1024
18:24:07.469968 IP 192.91.235.230.20000 > 198.188.2.10.22222: UDP, length 1024
18:24:07.474481 IP 192.91.235.230.20000 > 198.188.2.10.22222: UDP, length 1024
18:24:07.478586 IP 192.91.235.230.20000 > 198.188.2.10.22222: UDP, length 1024
18:24:07.483098 IP 192.91.235.230.20000 > 198.188.2.10.22222: UDP, length 1024
18:24:07.487203 IP 192.91.235.230.20000 > 198.188.2.10.22222: UDP, length 1024
18:24:07.491712 IP 192.91.235.230.20000 > 198.188.2.10.22222: UDP, length 1024
18:24:07.495818 IP 192.91.235.230.20000 > 198.188.2.10.22222: UDP, length 1024
18:24:07.500328 IP 192.91.235.230.20000 > 198.188.2.10.22222: UDP, length 1024
18:24:07.504432 IP 192.91.235.230.20000 > 198.188.2.10.22222: UDP, length 1024
18:24:07.508945 IP 192.91.235.230.20000 > 198.188.2.10.22222: UDP, length 1024
18:24:07.513555 IP 192.91.235.230.20000 > 198.188.2.10.22222: UDP, length 1024
18:24:07.518069 IP 192.91.235.230.20000 > 198.188.2.10.22222: UDP, length 1024
18:24:07.522174 IP 192.91.235.230.20000 > 198.188.2.10.22222: UDP, length 1024
18:24:07.526685 IP 192.91.235.230.20000 > 198.188.2.10.22222: UDP, length 1024
18:24:07.530790 IP 192.91.235.230.20000 > 198.188.2.10.22222: UDP, length 1024
18:24:07.534895 IP 192.91.235.230.20000 > 198.188.2.10.22222: UDP, length 1024
18:24:07.539484 IP 192.91.235.230.20000 > 198.188.2.10.22222: UDP, length 1024
18:24:07.543603 IP 192.91.235.230.20000 > 198.188.2.10.22222: UDP, length 1024
18:24:07.548035 IP 192.91.235.230.20000 > 198.188.2.10.22222: UDP, length 1024
18:24:07.552146 IP 192.91.235.230.20000 > 198.188.2.10.22222: UDP, length 1024
18:24:07.556659 IP 192.91.235.230.20000 > 198.188.2.10.22222: UDP, length 1024
18:24:07.560760 IP 192.91.235.230.20000 > 198.188.2.10.22222: UDP, length 1024
18:24:07.565267 IP 192.91.235.230.20000 > 198.188.2.10.22222: UDP, length 1024
18:24:07.569370 IP 192.91.235.230.20000 > 198.188.2.10.22222: UDP, length 1024
18:24:07.573884 IP 192.91.235.230.20000 > 198.188.2.10.22222: UDP, length 1024
18:24:07.577987 IP 192.91.235.230.20000 > 198.188.2.10.22222: UDP, length 1024
18:24:07.582501 IP 192.91.235.230.20000 > 198.188.2.10.22222: UDP, length 1024
18:24:07.586606 IP 192.91.235.230.20000 > 198.188.2.10.22222: UDP, length 1024
18:24:07.591120 IP 192.91.235.230.20000 > 198.188.2.10.22222: UDP, length 1024
18:24:07.595223 IP 192.91.235.230.20000 > 198.188.2.10.22222: UDP, length 1024
18:24:07.599733 IP 192.91.235.230.20000 > 198.188.2.10.22222: UDP, length 1024
18:24:07.603835 IP 192.91.235.230.20000 > 198.188.2.10.22222: UDP, length 1024
18:24:07.607928 IP 192.91.235.230.20000 > 198.188.2.10.22222: UDP, length 1024
18:24:07.612439 IP 192.91.235.230.20000 > 198.188.2.10.22222: UDP, length 1024
18:24:07.616542 IP 192.91.235.230.20000 > 198.188.2.10.22222: UDP, length 1024
18:24:07.621070 IP 192.91.235.230.20000 > 198.188.2.10.22222: UDP, length 1024
18:24:07.625172 IP 192.91.235.230.20000 > 198.188.2.10.22222: UDP, length 1024
18:24:07.629681 IP 192.91.235.230.20000 > 198.188.2.10.22222: UDP, length 1024
18:24:07.633794 IP 192.91.235.230.20000 > 198.188.2.10.22222: UDP, length 1024
18:24:07.638311 IP 192.91.235.230.20000 > 198.188.2.10.22222: UDP, length 1024
18:24:07.642407 IP 192.91.235.230.20000 > 198.188.2.10.22222: UDP, length 1024
18:24:07.646916 IP 192.91.235.230.20000 > 198.188.2.10.22222: UDP, length 1024
18:24:07.651020 IP 192.91.235.230.20000 > 198.188.2.10.22222: UDP, length 1024
18:24:07.655529 IP 192.91.235.230.20000 > 198.188.2.10.22222: UDP, length 1024
18:24:07.659660 IP 192.91.235.230.20000 > 198.188.2.10.22222: UDP, length 1024
18:24:07.664173 IP 192.91.235.230.20000 > 198.188.2.10.22222: UDP, length 1024
18:24:07.668278 IP 192.91.235.230.20000 > 198.188.2.10.22222: UDP, length 1024
18:24:07.672382 IP 192.91.235.230.20000 > 198.188.2.10.22222: UDP, length 1024
18:24:07.676896 IP 192.91.235.230.20000 > 198.188.2.10.22222: UDP, length 1024
18:24:07.680999 IP 192.91.235.230.20000 > 198.188.2.10.22222: UDP, length 1024
18:24:07.685511 IP 192.91.235.230.20000 > 198.188.2.10.22222: UDP, length 1024
18:24:07.689613 IP 192.91.235.230.20000 > 198.188.2.10.22222: UDP, length 1024
18:24:07.694126 IP 192.91.235.230.20000 > 198.188.2.10.22222: UDP, length 1024
18:24:07.698231 IP 192.91.235.230.20000 > 198.188.2.10.22222: UDP, length 1024
18:24:07.702743 IP 192.91.235.230.20000 > 198.188.2.10.22222: UDP, length 1024
18:24:07.706851 IP 192.91.235.230.20000 > 198.188.2.10.22222: UDP, length 1024
18:24:07.711360 IP 192.91.235.230.20000 > 198.188.2.10.22222: UDP, length 1024
18:24:07.715463 IP 192.91.235.230.20000 > 198.188.2.10.22222: UDP, length 1024
18:24:07.719976 IP 192.91.235.230.20000 > 198.188.2.10.22222: UDP, length 1024
18:24:07.724081 IP 192.91.235.230.20000 > 198.188.2.10.22222: UDP, length 1024
18:24:07.728592 IP 192.91.235.230.20000 > 198.188.2.10.22222: UDP, length 1024
18:24:07.732695 IP 192.91.235.230.20000 > 198.188.2.10.22222: UDP, length 1024
18:24:07.736798 IP 192.91.235.230.20000 > 198.188.2.10.22222: UDP, length 1024
18:24:07.741312 IP 192.91.235.230.20000 > 198.188.2.10.22222: UDP, length 1024
18:24:07.745415 IP 192.91.235.230.20000 > 198.188.2.10.22222: UDP, length 1024
18:24:07.749931 IP 192.91.235.230.20000 > 198.188.2.10.22222: UDP, length 1024
18:24:07.754033 IP 192.91.235.230.20000 > 198.188.2.10.22222: UDP, length 1024
18:24:07.758543 IP 192.91.235.230.20000 > 198.188.2.10.22222: UDP, length 1024
18:24:07.762646 IP 192.91.235.230.20000 > 198.188.2.10.22222: UDP, length 1024
18:24:07.767153 IP 192.91.235.230.20000 > 198.188.2.10.22222: UDP, length 1024
18:24:07.771263 IP 192.91.235.230.20000 > 198.188.2.10.22222: UDP, length 1024
18:24:07.775776 IP 192.91.235.230.20000 > 198.188.2.10.22222: UDP, length 1024
18:24:07.779880 IP 192.91.235.230.20000 > 198.188.2.10.22222: UDP, length 1024
18:24:07.784393 IP 192.91.235.230.20000 > 198.188.2.10.22222: UDP, length 1024
18:24:07.788496 IP 192.91.235.230.20000 > 198.188.2.10.22222: UDP, length 1024
18:24:07.793011 IP 192.91.235.230.20000 > 198.188.2.10.22222: UDP, length 1024
18:24:07.797112 IP 192.91.235.230.20000 > 198.188.2.10.22222: UDP, length 1024
18:24:07.801217 IP 192.91.235.230.20000 > 198.188.2.10.22222: UDP, length 1024
18:24:07.805728 IP 192.91.235.230.20000 > 198.188.2.10.22222: UDP, length 1024
18:24:07.809832 IP 192.91.235.230.20000 > 198.188.2.10.22222: UDP, length 1024
18:24:07.814345 IP 192.91.235.230.20000 > 198.188.2.10.22222: UDP, length 1024
18:24:07.818448 IP 192.91.235.230.20000 > 198.188.2.10.22222: UDP, length 1024
18:24:07.822960 IP 192.91.235.230.20000 > 198.188.2.10.22222: UDP, length 1024
18:24:07.827068 IP 192.91.235.230.20000 > 198.188.2.10.22222: UDP, length 1024
18:24:07.831576 IP 192.91.235.230.20000 > 198.188.2.10.22222: UDP, length 1024
18:24:07.835681 IP 192.91.235.230.20000 > 198.188.2.10.22222: UDP, length 1024
18:24:07.840192 IP 192.91.235.230.20000 > 198.188.2.10.22222: UDP, length 1024
18:24:07.844297 IP 192.91.235.230.20000 > 198.188.2.10.22222: UDP, length 1024
18:24:07.848809 IP 192.91.235.230.20000 > 198.188.2.10.22222: UDP, length 1024
18:24:07.852914 IP 192.91.235.230.20000 > 198.188.2.10.22222: UDP, length 1024
18:24:07.857424 IP 192.91.235.230.20000 > 198.188.2.10.22222: UDP, length 1024
18:24:07.861527 IP 192.91.235.230.20000 > 198.188.2.10.22222: UDP, length 1024
18:24:07.866040 IP 192.91.235.230.20000 > 198.188.2.10.22222: UDP, length 1024
18:24:07.870145 IP 192.91.235.230.20000 > 198.188.2.10.22222: UDP, length 1024
18:24:07.874252 IP 192.91.235.230.20000 > 198.188.2.10.22222: UDP, length 1024
18:24:07.878760 IP 192.91.235.230.20000 > 198.188.2.10.22222: UDP, length 1024
18:24:07.882865 IP 192.91.235.230.20000 > 198.188.2.10.22222: UDP, length 1024
18:24:07.887378 IP 192.91.235.230.20000 > 198.188.2.10.22222: UDP, length 1024
18:24:07.891481 IP 192.91.235.230.20000 > 198.188.2.10.22222: UDP, length 1024
18:24:07.895995 IP 192.91.235.230.20000 > 198.188.2.10.22222: UDP, length 1024
18:24:07.900096 IP 192.91.235.230.20000 > 198.188.2.10.22222: UDP, length 1024
18:24:07.904608 IP 192.91.235.230.20000 > 198.188.2.10.22222: UDP, length 1024
18:24:07.908713 IP 192.91.235.230.20000 > 198.188.2.10.22222: UDP, length 1024
18:24:07.913224 IP 192.91.235.230.20000 > 198.188.2.10.22222: UDP, length 1024
18:24:07.917329 IP 192.91.235.230.20000 > 198.188.2.10.22222: UDP, length 1024
18:24:07.921841 IP 192.91.235.230.20000 > 198.188.2.10.22222: UDP, length 1024
18:24:07.925946 IP 192.91.235.230.20000 > 198.188.2.10.22222: UDP, length 1024
18:24:07.930458 IP 192.91.235.230.20000 > 198.188.2.10.22222: UDP, length 1024
18:24:07.934561 IP 192.91.235.230.20000 > 198.188.2.10.22222: UDP, length 1024
18:24:07.938665 IP 192.91.235.230.20000 > 198.188.2.10.22222: UDP, length 1024
18:24:07.943171 IP 192.91.235.230.20000 > 198.188.2.10.22222: UDP, length 1024
18:24:07.947281 IP 192.91.235.230.20000 > 198.188.2.10.22222: UDP, length 1024
18:24:07.951794 IP 192.91.235.230.20000 > 198.188.2.10.22222: UDP, length 1024
18:24:07.955898 IP 192.91.235.230.20000 > 198.188.2.10.22222: UDP, length 1024
18:24:07.960410 IP 192.91.235.230.20000 > 198.188.2.10.22222: UDP, length 1024
18:24:07.964513 IP 192.91.235.230.20000 > 198.188.2.10.22222: UDP, length 1024
18:24:07.969026 IP 192.91.235.230.20000 > 198.188.2.10.22222: UDP, length 1024
18:24:07.973131 IP 192.91.235.230.20000 > 198.188.2.10.22222: UDP, length 1024
18:24:07.977642 IP 192.91.235.230.20000 > 198.188.2.10.22222: UDP, length 1024
18:24:07.981745 IP 192.91.235.230.20000 > 198.188.2.10.22222: UDP, length 1024
18:24:07.986258 IP 192.91.235.230.20000 > 198.188.2.10.22222: UDP, length 1024
18:24:07.990362 IP 192.91.235.230.20000 > 198.188.2.10.22222: UDP, length 1024
18:24:07.994874 IP 192.91.235.230.20000 > 198.188.2.10.22222: UDP, length 1024
18:24:07.998977 IP 192.91.235.230.20000 > 198.188.2.10.22222: UDP, length 1024
18:24:08.003081 IP 192.91.235.230.20000 > 198.188.2.10.22222: UDP, length 1024
18:24:08.007594 IP 192.91.235.230.20000 > 198.188.2.10.22222: UDP, length 1024
18:24:08.011699 IP 192.91.235.230.20000 > 198.188.2.10.22222: UDP, length 1024
18:24:08.016209 IP 192.91.235.230.20000 > 198.188.2.10.22222: UDP, length 1024
18:24:08.020315 IP 192.91.235.230.20000 > 198.188.2.10.22222: UDP, length 1024
18:24:08.024826 IP 192.91.235.230.20000 > 198.188.2.10.22222: UDP, length 1024
18:24:08.028929 IP 192.91.235.230.20000 > 198.188.2.10.22222: UDP, length 1024
18:24:08.033441 IP 192.91.235.230.20000 > 198.188.2.10.22222: UDP, length 1024
18:24:08.037546 IP 192.91.235.230.20000 > 198.188.2.10.22222: UDP, length 1024
18:24:08.042058 IP 192.91.235.230.20000 > 198.188.2.10.22222: UDP, length 1024
18:24:08.046162 IP 192.91.235.230.20000 > 198.188.2.10.22222: UDP, length 1024
18:24:08.050675 IP 192.91.235.230.20000 > 198.188.2.10.22222: UDP, length 1024
18:24:08.054779 IP 192.91.235.230.20000 > 198.188.2.10.22222: UDP, length 1024
18:24:08.059291 IP 192.91.235.230.20000 > 198.188.2.10.22222: UDP, length 1024
18:24:08.063394 IP 192.91.235.230.20000 > 198.188.2.10.22222: UDP, length 1024
18:24:08.067498 IP 192.91.235.230.20000 > 198.188.2.10.22222: UDP, length 1024
18:24:08.072010 IP 192.91.235.230.20000 > 198.188.2.10.22222: UDP, length 1024
18:24:08.076115 IP 192.91.235.230.20000 > 198.188.2.10.22222: UDP, length 1024
18:24:08.080627 IP 192.91.235.230.20000 > 198.188.2.10.22222: UDP, length 1024
18:24:08.084730 IP 192.91.235.230.20000 > 198.188.2.10.22222: UDP, length 1024
18:24:08.089244 IP 192.91.235.230.20000 > 198.188.2.10.22222: UDP, length 1024
18:24:08.093348 IP 192.91.235.230.20000 > 198.188.2.10.22222: UDP, length 1024
18:24:08.097860 IP 192.91.235.230.20000 > 198.188.2.10.22222: UDP, length 1024
18:24:08.101963 IP 192.91.235.230.20000 > 198.188.2.10.22222: UDP, length 1024
18:24:08.106474 IP 192.91.235.230.20000 > 198.188.2.10.22222: UDP, length 1024
18:24:08.110578 IP 192.91.235.230.20000 > 198.188.2.10.22222: UDP, length 1024
18:24:08.115092 IP 192.91.235.230.20000 > 198.188.2.10.22222: UDP, length 1024
18:24:08.119189 IP 192.91.235.230.20000 > 198.188.2.10.22222: UDP, length 1024
18:24:08.123706 IP 192.91.235.230.20000 > 198.188.2.10.22222: UDP, length 1024
18:24:08.127811 IP 192.91.235.230.20000 > 198.188.2.10.22222: UDP, length 1024
18:24:08.132324 IP 192.91.235.230.20000 > 198.188.2.10.22222: UDP, length 1024
18:24:08.136426 IP 192.91.235.230.20000 > 198.188.2.10.22222: UDP, length 1024
18:24:08.140531 IP 192.91.235.230.20000 > 198.188.2.10.22222: UDP, length 1024
