19:00:03.118005 IP 198.188.2.10.53852 > skimmer.csun.edu.domain: 41453+ PTR? 218.21.186.222.in-addr.arpa. (45)
19:00:03.119112 IP skimmer.csun.edu.domain > 198.188.2.10.53852: 41453 NXDomain 0/1/0 (101)
19:00:03.377145 IP Planetlab1.CS.UCLA.EDU.50327 > 198.188.2.10.22222: UDP, length 1024
19:00:03.381248 IP Planetlab1.CS.UCLA.EDU.50327 > 198.188.2.10.22222: UDP, length 1024
19:00:03.385761 IP Planetlab1.CS.UCLA.EDU.50327 > 198.188.2.10.22222: UDP, length 1024
19:00:03.389860 IP Planetlab1.CS.UCLA.EDU.50327 > 198.188.2.10.22222: UDP, length 1024
19:00:03.394383 IP Planetlab1.CS.UCLA.EDU.50327 > 198.188.2.10.22222: UDP, length 1024
19:00:03.398488 IP Planetlab1.CS.UCLA.EDU.50327 > 198.188.2.10.22222: UDP, length 1024
19:00:03.402999 IP Planetlab1.CS.UCLA.EDU.50327 > 198.188.2.10.22222: UDP, length 1024
19:00:03.407101 IP Planetlab1.CS.UCLA.EDU.50327 > 198.188.2.10.22222: UDP, length 1024
19:00:03.411607 IP Planetlab1.CS.UCLA.EDU.50327 > 198.188.2.10.22222: UDP, length 1024
19:00:03.415711 IP Planetlab1.CS.UCLA.EDU.50327 > 198.188.2.10.22222: UDP, length 1024
19:00:03.419816 IP Planetlab1.CS.UCLA.EDU.50327 > 198.188.2.10.22222: UDP, length 1024
19:00:03.424335 IP Planetlab1.CS.UCLA.EDU.50327 > 198.188.2.10.22222: UDP, length 1024
19:00:03.428428 IP Planetlab1.CS.UCLA.EDU.50327 > 198.188.2.10.22222: UDP, length 1024
19:00:03.432964 IP Planetlab1.CS.UCLA.EDU.50327 > 198.188.2.10.22222: UDP, length 1024
19:00:03.437081 IP Planetlab1.CS.UCLA.EDU.50327 > 198.188.2.10.22222: UDP, length 1024
19:00:03.441593 IP Planetlab1.CS.UCLA.EDU.50327 > 198.188.2.10.22222: UDP, length 1024
19:00:03.445698 IP Planetlab1.CS.UCLA.EDU.50327 > 198.188.2.10.22222: UDP, length 1024
19:00:03.450209 IP Planetlab1.CS.UCLA.EDU.50327 > 198.188.2.10.22222: UDP, length 1024
19:00:03.454312 IP Planetlab1.CS.UCLA.EDU.50327 > 198.188.2.10.22222: UDP, length 1024
19:00:03.458824 IP Planetlab1.CS.UCLA.EDU.50327 > 198.188.2.10.22222: UDP, length 1024
19:00:03.462929 IP Planetlab1.CS.UCLA.EDU.50327 > 198.188.2.10.22222: UDP, length 1024
19:00:03.467441 IP Planetlab1.CS.UCLA.EDU.50327 > 198.188.2.10.22222: UDP, length 1024
19:00:03.471545 IP Planetlab1.CS.UCLA.EDU.50327 > 198.188.2.10.22222: UDP, length 1024
19:00:03.476065 IP Planetlab1.CS.UCLA.EDU.50327 > 198.188.2.10.22222: UDP, length 1024
19:00:03.480161 IP Planetlab1.CS.UCLA.EDU.50327 > 198.188.2.10.22222: UDP, length 1024
19:00:03.484264 IP Planetlab1.CS.UCLA.EDU.50327 > 198.188.2.10.22222: UDP, length 1024
19:00:03.488776 IP Planetlab1.CS.UCLA.EDU.50327 > 198.188.2.10.22222: UDP, length 1024
19:00:03.492881 IP Planetlab1.CS.UCLA.EDU.50327 > 198.188.2.10.22222: UDP, length 1024
19:00:03.497393 IP Planetlab1.CS.UCLA.EDU.50327 > 198.188.2.10.22222: UDP, length 1024
19:00:03.501497 IP Planetlab1.CS.UCLA.EDU.50327 > 198.188.2.10.22222: UDP, length 1024
19:00:03.506010 IP Planetlab1.CS.UCLA.EDU.50327 > 198.188.2.10.22222: UDP, length 1024
19:00:03.510120 IP Planetlab1.CS.UCLA.EDU.50327 > 198.188.2.10.22222: UDP, length 1024
19:00:03.514626 IP Planetlab1.CS.UCLA.EDU.50327 > 198.188.2.10.22222: UDP, length 1024
19:00:03.518730 IP Planetlab1.CS.UCLA.EDU.50327 > 198.188.2.10.22222: UDP, length 1024
19:00:03.523244 IP Planetlab1.CS.UCLA.EDU.50327 > 198.188.2.10.22222: UDP, length 1024
19:00:03.527346 IP Planetlab1.CS.UCLA.EDU.50327 > 198.188.2.10.22222: UDP, length 1024
19:00:03.531858 IP Planetlab1.CS.UCLA.EDU.50327 > 198.188.2.10.22222: UDP, length 1024
19:00:03.535962 IP Planetlab1.CS.UCLA.EDU.50327 > 198.188.2.10.22222: UDP, length 1024
19:00:03.540474 IP Planetlab1.CS.UCLA.EDU.50327 > 198.188.2.10.22222: UDP, length 1024
19:00:03.544578 IP Planetlab1.CS.UCLA.EDU.50327 > 198.188.2.10.22222: UDP, length 1024
19:00:03.548682 IP Planetlab1.CS.UCLA.EDU.50327 > 198.188.2.10.22222: UDP, length 1024
19:00:03.553195 IP Planetlab1.CS.UCLA.EDU.50327 > 198.188.2.10.22222: UDP, length 1024
19:00:03.557298 IP Planetlab1.CS.UCLA.EDU.50327 > 198.188.2.10.22222: UDP, length 1024
19:00:03.561809 IP Planetlab1.CS.UCLA.EDU.50327 > 198.188.2.10.22222: UDP, length 1024
19:00:03.565914 IP Planetlab1.CS.UCLA.EDU.50327 > 198.188.2.10.22222: UDP, length 1024
19:00:03.570426 IP Planetlab1.CS.UCLA.EDU.50327 > 198.188.2.10.22222: UDP, length 1024
19:00:03.574531 IP Planetlab1.CS.UCLA.EDU.50327 > 198.188.2.10.22222: UDP, length 1024
19:00:03.579043 IP Planetlab1.CS.UCLA.EDU.50327 > 198.188.2.10.22222: UDP, length 1024
19:00:03.583147 IP Planetlab1.CS.UCLA.EDU.50327 > 198.188.2.10.22222: UDP, length 1024
19:00:03.587658 IP Planetlab1.CS.UCLA.EDU.50327 > 198.188.2.10.22222: UDP, length 1024
19:00:03.591762 IP Planetlab1.CS.UCLA.EDU.50327 > 198.188.2.10.22222: UDP, length 1024
19:00:03.596278 IP Planetlab1.CS.UCLA.EDU.50327 > 198.188.2.10.22222: UDP, length 1024
19:00:03.600378 IP Planetlab1.CS.UCLA.EDU.50327 > 198.188.2.10.22222: UDP, length 1024
19:00:03.604890 IP Planetlab1.CS.UCLA.EDU.50327 > 198.188.2.10.22222: UDP, length 1024
19:00:03.608995 IP Planetlab1.CS.UCLA.EDU.50327 > 198.188.2.10.22222: UDP, length 1024
19:00:03.613100 IP Planetlab1.CS.UCLA.EDU.50327 > 198.188.2.10.22222: UDP, length 1024
19:00:03.617611 IP Planetlab1.CS.UCLA.EDU.50327 > 198.188.2.10.22222: UDP, length 1024
19:00:03.621714 IP Planetlab1.CS.UCLA.EDU.50327 > 198.188.2.10.22222: UDP, length 1024
19:00:03.626227 IP Planetlab1.CS.UCLA.EDU.50327 > 198.188.2.10.22222: UDP, length 1024
19:00:03.630330 IP Planetlab1.CS.UCLA.EDU.50327 > 198.188.2.10.22222: UDP, length 1024
19:00:03.634843 IP Planetlab1.CS.UCLA.EDU.50327 > 198.188.2.10.22222: UDP, length 1024
19:00:03.638947 IP Planetlab1.CS.UCLA.EDU.50327 > 198.188.2.10.22222: UDP, length 1024
19:00:03.643460 IP Planetlab1.CS.UCLA.EDU.50327 > 198.188.2.10.22222: UDP, length 1024
19:00:03.647563 IP Planetlab1.CS.UCLA.EDU.50327 > 198.188.2.10.22222: UDP, length 1024
19:00:03.652075 IP Planetlab1.CS.UCLA.EDU.50327 > 198.188.2.10.22222: UDP, length 1024
19:00:03.656177 IP Planetlab1.CS.UCLA.EDU.50327 > 198.188.2.10.22222: UDP, length 1024
19:00:03.660691 IP Planetlab1.CS.UCLA.EDU.50327 > 198.188.2.10.22222: UDP, length 1024
19:00:03.664794 IP Planetlab1.CS.UCLA.EDU.50327 > 198.188.2.10.22222: UDP, length 1024
19:00:03.669307 IP Planetlab1.CS.UCLA.EDU.50327 > 198.188.2.10.22222: UDP, length 1024
19:00:03.673411 IP Planetlab1.CS.UCLA.EDU.50327 > 198.188.2.10.22222: UDP, length 1024
19:00:03.677924 IP Planetlab1.CS.UCLA.EDU.50327 > 198.188.2.10.22222: UDP, length 1024
19:00:03.682027 IP Planetlab1.CS.UCLA.EDU.50327 > 198.188.2.10.22222: UDP, length 1024
19:00:03.686130 IP Planetlab1.CS.UCLA.EDU.50327 > 198.188.2.10.22222: UDP, length 1024
19:00:03.690643 IP Planetlab1.CS.UCLA.EDU.50327 > 198.188.2.10.22222: UDP, length 1024
19:00:03.694747 IP Planetlab1.CS.UCLA.EDU.50327 > 198.188.2.10.22222: UDP, length 1024
19:00:03.699259 IP Planetlab1.CS.UCLA.EDU.50327 > 198.188.2.10.22222: UDP, length 1024
19:00:03.703363 IP Planetlab1.CS.UCLA.EDU.50327 > 198.188.2.10.22222: UDP, length 1024
19:00:03.707875 IP Planetlab1.CS.UCLA.EDU.50327 > 198.188.2.10.22222: UDP, length 1024
19:00:03.711980 IP Planetlab1.CS.UCLA.EDU.50327 > 198.188.2.10.22222: UDP, length 1024
19:00:03.716491 IP Planetlab1.CS.UCLA.EDU.50327 > 198.188.2.10.22222: UDP, length 1024
19:00:03.720596 IP Planetlab1.CS.UCLA.EDU.50327 > 198.188.2.10.22222: UDP, length 1024
19:00:03.725109 IP Planetlab1.CS.UCLA.EDU.50327 > 198.188.2.10.22222: UDP, length 1024
19:00:03.729211 IP Planetlab1.CS.UCLA.EDU.50327 > 198.188.2.10.22222: UDP, length 1024
19:00:03.733723 IP Planetlab1.CS.UCLA.EDU.50327 > 198.188.2.10.22222: UDP, length 1024
19:00:03.737828 IP Planetlab1.CS.UCLA.EDU.50327 > 198.188.2.10.22222: UDP, length 1024
19:00:03.742339 IP Planetlab1.CS.UCLA.EDU.50327 > 198.188.2.10.22222: UDP, length 1024
19:00:03.746443 IP Planetlab1.CS.UCLA.EDU.50327 > 198.188.2.10.22222: UDP, length 1024
19:00:03.750549 IP Planetlab1.CS.UCLA.EDU.50327 > 198.188.2.10.22222: UDP, length 1024
19:00:03.755060 IP Planetlab1.CS.UCLA.EDU.50327 > 198.188.2.10.22222: UDP, length 1024
19:00:03.759163 IP Planetlab1.CS.UCLA.EDU.50327 > 198.188.2.10.22222: UDP, length 1024
19:00:03.763675 IP Planetlab1.CS.UCLA.EDU.50327 > 198.188.2.10.22222: UDP, length 1024
19:00:03.767783 IP Planetlab1.CS.UCLA.EDU.50327 > 198.188.2.10.22222: UDP, length 1024
19:00:03.772292 IP Planetlab1.CS.UCLA.EDU.50327 > 198.188.2.10.22222: UDP, length 1024
19:00:03.776397 IP Planetlab1.CS.UCLA.EDU.50327 > 198.188.2.10.22222: UDP, length 1024
19:00:03.780910 IP Planetlab1.CS.UCLA.EDU.50327 > 198.188.2.10.22222: UDP, length 1024
19:00:03.785012 IP Planetlab1.CS.UCLA.EDU.50327 > 198.188.2.10.22222: UDP, length 1024
19:00:03.789525 IP Planetlab1.CS.UCLA.EDU.50327 > 198.188.2.10.22222: UDP, length 1024
19:00:03.793628 IP Planetlab1.CS.UCLA.EDU.50327 > 198.188.2.10.22222: UDP, length 1024
19:00:03.798140 IP Planetlab1.CS.UCLA.EDU.50327 > 198.188.2.10.22222: UDP, length 1024
19:00:03.802244 IP Planetlab1.CS.UCLA.EDU.50327 > 198.188.2.10.22222: UDP, length 1024
19:00:03.806756 IP Planetlab1.CS.UCLA.EDU.50327 > 198.188.2.10.22222: UDP, length 1024
19:00:03.810864 IP Planetlab1.CS.UCLA.EDU.50327 > 198.188.2.10.22222: UDP, length 1024
19:00:03.814965 IP Planetlab1.CS.UCLA.EDU.50327 > 198.188.2.10.22222: UDP, length 1024
19:00:03.819469 IP Planetlab1.CS.UCLA.EDU.50327 > 198.188.2.10.22222: UDP, length 1024
19:00:03.823580 IP Planetlab1.CS.UCLA.EDU.50327 > 198.188.2.10.22222: UDP, length 1024
19:00:03.828092 IP Planetlab1.CS.UCLA.EDU.50327 > 198.188.2.10.22222: UDP, length 1024
19:00:03.832197 IP Planetlab1.CS.UCLA.EDU.50327 > 198.188.2.10.22222: UDP, length 1024
19:00:03.836708 IP Planetlab1.CS.UCLA.EDU.50327 > 198.188.2.10.22222: UDP, length 1024
19:00:03.840813 IP Planetlab1.CS.UCLA.EDU.50327 > 198.188.2.10.22222: UDP, length 1024
19:00:03.845325 IP Planetlab1.CS.UCLA.EDU.50327 > 198.188.2.10.22222: UDP, length 1024
19:00:03.849429 IP Planetlab1.CS.UCLA.EDU.50327 > 198.188.2.10.22222: UDP, length 1024
19:00:03.853942 IP Planetlab1.CS.UCLA.EDU.50327 > 198.188.2.10.22222: UDP, length 1024
19:00:03.858044 IP Planetlab1.CS.UCLA.EDU.50327 > 198.188.2.10.22222: UDP, length 1024
19:00:03.862556 IP Planetlab1.CS.UCLA.EDU.50327 > 198.188.2.10.22222: UDP, length 1024
19:00:03.866661 IP Planetlab1.CS.UCLA.EDU.50327 > 198.188.2.10.22222: UDP, length 1024
19:00:03.871173 IP Planetlab1.CS.UCLA.EDU.50327 > 198.188.2.10.22222: UDP, length 1024
19:00:03.875277 IP Planetlab1.CS.UCLA.EDU.50327 > 198.188.2.10.22222: UDP, length 1024
19:00:03.879382 IP Planetlab1.CS.UCLA.EDU.50327 > 198.188.2.10.22222: UDP, length 1024
19:00:03.883893 IP Planetlab1.CS.UCLA.EDU.50327 > 198.188.2.10.22222: UDP, length 1024
19:00:03.888002 IP Planetlab1.CS.UCLA.EDU.50327 > 198.188.2.10.22222: UDP, length 1024
19:00:03.892511 IP Planetlab1.CS.UCLA.EDU.50327 > 198.188.2.10.22222: UDP, length 1024
19:00:03.896613 IP Planetlab1.CS.UCLA.EDU.50327 > 198.188.2.10.22222: UDP, length 1024
19:00:03.901125 IP Planetlab1.CS.UCLA.EDU.50327 > 198.188.2.10.22222: UDP, length 1024
19:00:03.905229 IP Planetlab1.CS.UCLA.EDU.50327 > 198.188.2.10.22222: UDP, length 1024
19:00:03.909741 IP Planetlab1.CS.UCLA.EDU.50327 > 198.188.2.10.22222: UDP, length 1024
19:00:03.913847 IP Planetlab1.CS.UCLA.EDU.50327 > 198.188.2.10.22222: UDP, length 1024
19:00:03.918359 IP Planetlab1.CS.UCLA.EDU.50327 > 198.188.2.10.22222: UDP, length 1024
19:00:03.922463 IP Planetlab1.CS.UCLA.EDU.50327 > 198.188.2.10.22222: UDP, length 1024
19:00:03.926973 IP Planetlab1.CS.UCLA.EDU.50327 > 198.188.2.10.22222: UDP, length 1024
19:00:03.931077 IP Planetlab1.CS.UCLA.EDU.50327 > 198.188.2.10.22222: UDP, length 1024
19:00:03.935589 IP Planetlab1.CS.UCLA.EDU.50327 > 198.188.2.10.22222: UDP, length 1024
19:00:03.939693 IP Planetlab1.CS.UCLA.EDU.50327 > 198.188.2.10.22222: UDP, length 1024
19:00:03.944206 IP Planetlab1.CS.UCLA.EDU.50327 > 198.188.2.10.22222: UDP, length 1024
19:00:03.948310 IP Planetlab1.CS.UCLA.EDU.50327 > 198.188.2.10.22222: UDP, length 1024
19:00:03.952413 IP Planetlab1.CS.UCLA.EDU.50327 > 198.188.2.10.22222: UDP, length 1024
19:00:03.956926 IP Planetlab1.CS.UCLA.EDU.50327 > 198.188.2.10.22222: UDP, length 1024
19:00:03.961029 IP Planetlab1.CS.UCLA.EDU.50327 > 198.188.2.10.22222: UDP, length 1024
19:00:03.965541 IP Planetlab1.CS.UCLA.EDU.50327 > 198.188.2.10.22222: UDP, length 1024
19:00:03.969646 IP Planetlab1.CS.UCLA.EDU.50327 > 198.188.2.10.22222: UDP, length 1024
19:00:03.974159 IP Planetlab1.CS.UCLA.EDU.50327 > 198.188.2.10.22222: UDP, length 1024
19:00:03.978262 IP Planetlab1.CS.UCLA.EDU.50327 > 198.188.2.10.22222: UDP, length 1024
19:00:03.982775 IP Planetlab1.CS.UCLA.EDU.50327 > 198.188.2.10.22222: UDP, length 1024
19:00:03.986879 IP Planetlab1.CS.UCLA.EDU.50327 > 198.188.2.10.22222: UDP, length 1024
19:00:03.991390 IP Planetlab1.CS.UCLA.EDU.50327 > 198.188.2.10.22222: UDP, length 1024
19:00:03.995494 IP Planetlab1.CS.UCLA.EDU.50327 > 198.188.2.10.22222: UDP, length 1024
19:00:04.000008 IP Planetlab1.CS.UCLA.EDU.50327 > 198.188.2.10.22222: UDP, length 1024
19:00:04.004110 IP Planetlab1.CS.UCLA.EDU.50327 > 198.188.2.10.22222: UDP, length 1024
19:00:04.008622 IP Planetlab1.CS.UCLA.EDU.50327 > 198.188.2.10.22222: UDP, length 1024
19:00:04.012727 IP Planetlab1.CS.UCLA.EDU.50327 > 198.188.2.10.22222: UDP, length 1024
19:00:04.016831 IP Planetlab1.CS.UCLA.EDU.50327 > 198.188.2.10.22222: UDP, length 1024
19:00:04.021345 IP Planetlab1.CS.UCLA.EDU.50327 > 198.188.2.10.22222: UDP, length 1024
19:00:04.025445 IP Planetlab1.CS.UCLA.EDU.50327 > 198.188.2.10.22222: UDP, length 1024
19:00:04.029957 IP Planetlab1.CS.UCLA.EDU.50327 > 198.188.2.10.22222: UDP, length 1024
19:00:04.034063 IP Planetlab1.CS.UCLA.EDU.50327 > 198.188.2.10.22222: UDP, length 1024
19:00:04.038575 IP Planetlab1.CS.UCLA.EDU.50327 > 198.188.2.10.22222: UDP, length 1024
19:00:04.042680 IP Planetlab1.CS.UCLA.EDU.50327 > 198.188.2.10.22222: UDP, length 1024
19:00:04.047192 IP Planetlab1.CS.UCLA.EDU.50327 > 198.188.2.10.22222: UDP, length 1024
19:00:04.051294 IP Planetlab1.CS.UCLA.EDU.50327 > 198.188.2.10.22222: UDP, length 1024
19:00:04.055807 IP Planetlab1.CS.UCLA.EDU.50327 > 198.188.2.10.22222: UDP, length 1024
19:00:04.059912 IP Planetlab1.CS.UCLA.EDU.50327 > 198.188.2.10.22222: UDP, length 1024
19:00:04.064426 IP Planetlab1.CS.UCLA.EDU.50327 > 198.188.2.10.22222: UDP, length 1024
19:00:04.068527 IP Planetlab1.CS.UCLA.EDU.50327 > 198.188.2.10.22222: UDP, length 1024
19:00:04.073038 IP Planetlab1.CS.UCLA.EDU.50327 > 198.188.2.10.22222: UDP, length 1024
19:00:04.077143 IP Planetlab1.CS.UCLA.EDU.50327 > 198.188.2.10.22222: UDP, length 1024
19:00:04.081247 IP Planetlab1.CS.UCLA.EDU.50327 > 198.188.2.10.22222: UDP, length 1024
19:00:04.085759 IP Planetlab1.CS.UCLA.EDU.50327 > 198.188.2.10.22222: UDP, length 1024
19:00:04.089865 IP Planetlab1.CS.UCLA.EDU.50327 > 198.188.2.10.22222: UDP, length 1024
19:00:04.094377 IP Planetlab1.CS.UCLA.EDU.50327 > 198.188.2.10.22222: UDP, length 1024
19:00:04.098482 IP Planetlab1.CS.UCLA.EDU.50327 > 198.188.2.10.22222: UDP, length 1024
19:00:04.102990 IP Planetlab1.CS.UCLA.EDU.50327 > 198.188.2.10.22222: UDP, length 1024
19:00:04.107096 IP Planetlab1.CS.UCLA.EDU.50327 > 198.188.2.10.22222: UDP, length 1024
19:00:04.111607 IP Planetlab1.CS.UCLA.EDU.50327 > 198.188.2.10.22222: UDP, length 1024
19:00:04.115711 IP Planetlab1.CS.UCLA.EDU.50327 > 198.188.2.10.22222: UDP, length 1024
19:00:04.120224 IP Planetlab1.CS.UCLA.EDU.50327 > 198.188.2.10.22222: UDP, length 1024
19:00:04.124329 IP Planetlab1.CS.UCLA.EDU.50327 > 198.188.2.10.22222: UDP, length 1024
19:00:04.128841 IP Planetlab1.CS.UCLA.EDU.50327 > 198.188.2.10.22222: UDP, length 1024
19:00:04.132943 IP Planetlab1.CS.UCLA.EDU.50327 > 198.188.2.10.22222: UDP, length 1024
19:00:04.137455 IP Planetlab1.CS.UCLA.EDU.50327 > 198.188.2.10.22222: UDP, length 1024
19:00:04.141560 IP Planetlab1.CS.UCLA.EDU.50327 > 198.188.2.10.22222: UDP, length 1024
19:00:04.145664 IP Planetlab1.CS.UCLA.EDU.50327 > 198.188.2.10.22222: UDP, length 1024
19:00:04.150177 IP Planetlab1.CS.UCLA.EDU.50327 > 198.188.2.10.22222: UDP, length 1024
19:00:04.154282 IP Planetlab1.CS.UCLA.EDU.50327 > 198.188.2.10.22222: UDP, length 1024
19:00:04.158793 IP Planetlab1.CS.UCLA.EDU.50327 > 198.188.2.10.22222: UDP, length 1024
19:00:04.162894 IP Planetlab1.CS.UCLA.EDU.50327 > 198.188.2.10.22222: UDP, length 1024
19:00:04.167409 IP Planetlab1.CS.UCLA.EDU.50327 > 198.188.2.10.22222: UDP, length 1024
19:00:04.171511 IP Planetlab1.CS.UCLA.EDU.50327 > 198.188.2.10.22222: UDP, length 1024
19:00:04.176024 IP Planetlab1.CS.UCLA.EDU.50327 > 198.188.2.10.22222: UDP, length 1024
19:00:04.180128 IP Planetlab1.CS.UCLA.EDU.50327 > 198.188.2.10.22222: UDP, length 1024
19:00:04.184640 IP Planetlab1.CS.UCLA.EDU.50327 > 198.188.2.10.22222: UDP, length 1024
19:00:04.188748 IP Planetlab1.CS.UCLA.EDU.50327 > 198.188.2.10.22222: UDP, length 1024
19:00:04.193257 IP Planetlab1.CS.UCLA.EDU.50327 > 198.188.2.10.22222: UDP, length 1024
19:00:04.197359 IP Planetlab1.CS.UCLA.EDU.50327 > 198.188.2.10.22222: UDP, length 1024
19:00:04.201871 IP Planetlab1.CS.UCLA.EDU.50327 > 198.188.2.10.22222: UDP, length 1024
19:00:04.205977 IP Planetlab1.CS.UCLA.EDU.50327 > 198.188.2.10.22222: UDP, length 1024
19:00:04.210490 IP Planetlab1.CS.UCLA.EDU.50327 > 198.188.2.10.22222: UDP, length 1024
19:00:04.214592 IP Planetlab1.CS.UCLA.EDU.50327 > 198.188.2.10.22222: UDP, length 1024
19:00:04.218697 IP Planetlab1.CS.UCLA.EDU.50327 > 198.188.2.10.22222: UDP, length 1024
19:00:04.223209 IP Planetlab1.CS.UCLA.EDU.50327 > 198.188.2.10.22222: UDP, length 1024
19:00:04.227311 IP Planetlab1.CS.UCLA.EDU.50327 > 198.188.2.10.22222: UDP, length 1024
19:00:04.231829 IP Planetlab1.CS.UCLA.EDU.50327 > 198.188.2.10.22222: UDP, length 1024
19:00:04.235931 IP Planetlab1.CS.UCLA.EDU.50327 > 198.188.2.10.22222: UDP, length 1024
19:00:04.240444 IP Planetlab1.CS.UCLA.EDU.50327 > 198.188.2.10.22222: UDP, length 1024
19:00:04.244548 IP Planetlab1.CS.UCLA.EDU.50327 > 198.188.2.10.22222: UDP, length 1024
19:00:04.249059 IP Planetlab1.CS.UCLA.EDU.50327 > 198.188.2.10.22222: UDP, length 1024
19:00:04.253163 IP Planetlab1.CS.UCLA.EDU.50327 > 198.188.2.10.22222: UDP, length 1024
19:00:04.257675 IP Planetlab1.CS.UCLA.EDU.50327 > 198.188.2.10.22222: UDP, length 1024
19:00:04.261782 IP Planetlab1.CS.UCLA.EDU.50327 > 198.188.2.10.22222: UDP, length 1024
19:00:04.266291 IP Planetlab1.CS.UCLA.EDU.50327 > 198.188.2.10.22222: UDP, length 1024
19:00:04.270395 IP Planetlab1.CS.UCLA.EDU.20000 > 198.188.2.10.22222: UDP, length 1024
19:00:04.274912 IP Planetlab1.CS.UCLA.EDU.20000 > 198.188.2.10.22222: UDP, length 1024
19:00:04.279010 IP Planetlab1.CS.UCLA.EDU.20000 > 198.188.2.10.22222: UDP, length 1024
19:00:04.283115 IP Planetlab1.CS.UCLA.EDU.20000 > 198.188.2.10.22222: UDP, length 1024
19:00:04.287627 IP Planetlab1.CS.UCLA.EDU.20000 > 198.188.2.10.22222: UDP, length 1024
19:00:04.291732 IP Planetlab1.CS.UCLA.EDU.20000 > 198.188.2.10.22222: UDP, length 1024
19:00:04.296244 IP Planetlab1.CS.UCLA.EDU.20000 > 198.188.2.10.22222: UDP, length 1024
19:00:04.300347 IP Planetlab1.CS.UCLA.EDU.20000 > 198.188.2.10.22222: UDP, length 1024
19:00:04.304860 IP Planetlab1.CS.UCLA.EDU.20000 > 198.188.2.10.22222: UDP, length 1024
19:00:04.308963 IP Planetlab1.CS.UCLA.EDU.20000 > 198.188.2.10.22222: UDP, length 1024
19:00:04.313474 IP Planetlab1.CS.UCLA.EDU.20000 > 198.188.2.10.22222: UDP, length 1024
19:00:04.317579 IP Planetlab1.CS.UCLA.EDU.20000 > 198.188.2.10.22222: UDP, length 1024
19:00:04.322093 IP Planetlab1.CS.UCLA.EDU.20000 > 198.188.2.10.22222: UDP, length 1024
19:00:04.326198 IP Planetlab1.CS.UCLA.EDU.20000 > 198.188.2.10.22222: UDP, length 1024
19:00:04.330710 IP Planetlab1.CS.UCLA.EDU.20000 > 198.188.2.10.22222: UDP, length 1024
19:00:04.334813 IP Planetlab1.CS.UCLA.EDU.20000 > 198.188.2.10.22222: UDP, length 1024
19:00:04.339324 IP Planetlab1.CS.UCLA.EDU.20000 > 198.188.2.10.22222: UDP, length 1024
19:00:04.343427 IP Planetlab1.CS.UCLA.EDU.20000 > 198.188.2.10.22222: UDP, length 1024
19:00:04.347532 IP Planetlab1.CS.UCLA.EDU.20000 > 198.188.2.10.22222: UDP, length 1024
19:00:04.352044 IP Planetlab1.CS.UCLA.EDU.20000 > 198.188.2.10.22222: UDP, length 1024
19:00:04.356154 IP Planetlab1.CS.UCLA.EDU.20000 > 198.188.2.10.22222: UDP, length 1024
19:00:04.360661 IP Planetlab1.CS.UCLA.EDU.20000 > 198.188.2.10.22222: UDP, length 1024
19:00:04.364763 IP Planetlab1.CS.UCLA.EDU.20000 > 198.188.2.10.22222: UDP, length 1024
19:00:04.369276 IP Planetlab1.CS.UCLA.EDU.20000 > 198.188.2.10.22222: UDP, length 1024
19:00:04.373380 IP Planetlab1.CS.UCLA.EDU.20000 > 198.188.2.10.22222: UDP, length 1024
19:00:04.377893 IP Planetlab1.CS.UCLA.EDU.20000 > 198.188.2.10.22222: UDP, length 1024
19:00:04.381996 IP Planetlab1.CS.UCLA.EDU.20000 > 198.188.2.10.22222: UDP, length 1024
19:00:04.386509 IP Planetlab1.CS.UCLA.EDU.20000 > 198.188.2.10.22222: UDP, length 1024
19:00:04.390612 IP Planetlab1.CS.UCLA.EDU.20000 > 198.188.2.10.22222: UDP, length 1024
19:00:04.395124 IP Planetlab1.CS.UCLA.EDU.20000 > 198.188.2.10.22222: UDP, length 1024
19:00:04.399229 IP Planetlab1.CS.UCLA.EDU.20000 > 198.188.2.10.22222: UDP, length 1024
19:00:04.403741 IP Planetlab1.CS.UCLA.EDU.20000 > 198.188.2.10.22222: UDP, length 1024
19:00:04.407846 IP Planetlab1.CS.UCLA.EDU.20000 > 198.188.2.10.22222: UDP, length 1024
19:00:04.411948 IP Planetlab1.CS.UCLA.EDU.20000 > 198.188.2.10.22222: UDP, length 1024
19:00:04.416459 IP Planetlab1.CS.UCLA.EDU.20000 > 198.188.2.10.22222: UDP, length 1024
19:00:04.420565 IP Planetlab1.CS.UCLA.EDU.20000 > 198.188.2.10.22222: UDP, length 1024
19:00:04.425078 IP Planetlab1.CS.UCLA.EDU.20000 > 198.188.2.10.22222: UDP, length 1024
19:00:04.429181 IP Planetlab1.CS.UCLA.EDU.20000 > 198.188.2.10.22222: UDP, length 1024
19:00:04.433694 IP Planetlab1.CS.UCLA.EDU.20000 > 198.188.2.10.22222: UDP, length 1024
19:00:04.437797 IP Planetlab1.CS.UCLA.EDU.20000 > 198.188.2.10.22222: UDP, length 1024
19:00:04.442308 IP Planetlab1.CS.UCLA.EDU.20000 > 198.188.2.10.22222: UDP, length 1024
19:00:04.446412 IP Planetlab1.CS.UCLA.EDU.20000 > 198.188.2.10.22222: UDP, length 1024
19:00:04.450924 IP Planetlab1.CS.UCLA.EDU.20000 > 198.188.2.10.22222: UDP, length 1024
19:00:04.455029 IP Planetlab1.CS.UCLA.EDU.20000 > 198.188.2.10.22222: UDP, length 1024
19:00:04.459541 IP Planetlab1.CS.UCLA.EDU.20000 > 198.188.2.10.22222: UDP, length 1024
19:00:04.463645 IP Planetlab1.CS.UCLA.EDU.20000 > 198.188.2.10.22222: UDP, length 1024
19:00:04.468160 IP Planetlab1.CS.UCLA.EDU.20000 > 198.188.2.10.22222: UDP, length 1024
19:00:04.472260 IP Planetlab1.CS.UCLA.EDU.20000 > 198.188.2.10.22222: UDP, length 1024
19:00:04.476773 IP Planetlab1.CS.UCLA.EDU.20000 > 198.188.2.10.22222: UDP, length 1024
19:00:04.480876 IP Planetlab1.CS.UCLA.EDU.20000 > 198.188.2.10.22222: UDP, length 1024
19:00:04.484982 IP Planetlab1.CS.UCLA.EDU.20000 > 198.188.2.10.22222: UDP, length 1024
19:00:04.489499 IP Planetlab1.CS.UCLA.EDU.20000 > 198.188.2.10.22222: UDP, length 1024
19:00:04.493599 IP Planetlab1.CS.UCLA.EDU.20000 > 198.188.2.10.22222: UDP, length 1024
19:00:04.498110 IP Planetlab1.CS.UCLA.EDU.20000 > 198.188.2.10.22222: UDP, length 1024
19:00:04.502213 IP Planetlab1.CS.UCLA.EDU.20000 > 198.188.2.10.22222: UDP, length 1024
19:00:04.506726 IP Planetlab1.CS.UCLA.EDU.20000 > 198.188.2.10.22222: UDP, length 1024
19:00:04.510829 IP Planetlab1.CS.UCLA.EDU.20000 > 198.188.2.10.22222: UDP, length 1024
19:00:04.515342 IP Planetlab1.CS.UCLA.EDU.20000 > 198.188.2.10.22222: UDP, length 1024
19:00:04.519445 IP Planetlab1.CS.UCLA.EDU.20000 > 198.188.2.10.22222: UDP, length 1024
19:00:04.523957 IP Planetlab1.CS.UCLA.EDU.20000 > 198.188.2.10.22222: UDP, length 1024
19:00:04.528063 IP Planetlab1.CS.UCLA.EDU.20000 > 198.188.2.10.22222: UDP, length 1024
19:00:04.532575 IP Planetlab1.CS.UCLA.EDU.20000 > 198.188.2.10.22222: UDP, length 1024
19:00:04.536679 IP Planetlab1.CS.UCLA.EDU.20000 > 198.188.2.10.22222: UDP, length 1024
19:00:04.541190 IP Planetlab1.CS.UCLA.EDU.20000 > 198.188.2.10.22222: UDP, length 1024
19:00:04.545295 IP Planetlab1.CS.UCLA.EDU.20000 > 198.188.2.10.22222: UDP, length 1024
19:00:04.549398 IP Planetlab1.CS.UCLA.EDU.20000 > 198.188.2.10.22222: UDP, length 1024
19:00:04.553910 IP Planetlab1.CS.UCLA.EDU.20000 > 198.188.2.10.22222: UDP, length 1024
19:00:04.558014 IP Planetlab1.CS.UCLA.EDU.20000 > 198.188.2.10.22222: UDP, length 1024
19:00:04.562531 IP Planetlab1.CS.UCLA.EDU.20000 > 198.188.2.10.22222: UDP, length 1024
19:00:04.566632 IP Planetlab1.CS.UCLA.EDU.20000 > 198.188.2.10.22222: UDP, length 1024
19:00:04.571141 IP Planetlab1.CS.UCLA.EDU.20000 > 198.188.2.10.22222: UDP, length 1024
19:00:04.575246 IP Planetlab1.CS.UCLA.EDU.20000 > 198.188.2.10.22222: UDP, length 1024
19:00:04.579759 IP Planetlab1.CS.UCLA.EDU.20000 > 198.188.2.10.22222: UDP, length 1024
19:00:04.583863 IP Planetlab1.CS.UCLA.EDU.20000 > 198.188.2.10.22222: UDP, length 1024
19:00:04.588376 IP Planetlab1.CS.UCLA.EDU.20000 > 198.188.2.10.22222: UDP, length 1024
19:00:04.592479 IP Planetlab1.CS.UCLA.EDU.20000 > 198.188.2.10.22222: UDP, length 1024
19:00:04.596991 IP Planetlab1.CS.UCLA.EDU.20000 > 198.188.2.10.22222: UDP, length 1024
19:00:04.601094 IP Planetlab1.CS.UCLA.EDU.20000 > 198.188.2.10.22222: UDP, length 1024
19:00:04.605609 IP Planetlab1.CS.UCLA.EDU.20000 > 198.188.2.10.22222: UDP, length 1024
19:00:04.609714 IP Planetlab1.CS.UCLA.EDU.20000 > 198.188.2.10.22222: UDP, length 1024
19:00:04.613814 IP Planetlab1.CS.UCLA.EDU.20000 > 198.188.2.10.22222: UDP, length 1024
19:00:04.618327 IP Planetlab1.CS.UCLA.EDU.20000 > 198.188.2.10.22222: UDP, length 1024
19:00:04.622431 IP Planetlab1.CS.UCLA.EDU.20000 > 198.188.2.10.22222: UDP, length 1024
19:00:04.626943 IP Planetlab1.CS.UCLA.EDU.20000 > 198.188.2.10.22222: UDP, length 1024
19:00:04.631048 IP Planetlab1.CS.UCLA.EDU.20000 > 198.188.2.10.22222: UDP, length 1024
19:00:04.635560 IP Planetlab1.CS.UCLA.EDU.20000 > 198.188.2.10.22222: UDP, length 1024
19:00:04.639663 IP Planetlab1.CS.UCLA.EDU.20000 > 198.188.2.10.22222: UDP, length 1024
19:00:04.644175 IP Planetlab1.CS.UCLA.EDU.20000 > 198.188.2.10.22222: UDP, length 1024
19:00:04.648279 IP Planetlab1.CS.UCLA.EDU.20000 > 198.188.2.10.22222: UDP, length 1024
19:00:04.652795 IP Planetlab1.CS.UCLA.EDU.20000 > 198.188.2.10.22222: UDP, length 1024
19:00:04.656895 IP Planetlab1.CS.UCLA.EDU.20000 > 198.188.2.10.22222: UDP, length 1024
19:00:04.661407 IP Planetlab1.CS.UCLA.EDU.20000 > 198.188.2.10.22222: UDP, length 1024
19:00:04.665512 IP Planetlab1.CS.UCLA.EDU.20000 > 198.188.2.10.22222: UDP, length 1024
19:00:04.670025 IP Planetlab1.CS.UCLA.EDU.20000 > 198.188.2.10.22222: UDP, length 1024
19:00:04.674128 IP Planetlab1.CS.UCLA.EDU.20000 > 198.188.2.10.22222: UDP, length 1024
19:00:04.678231 IP Planetlab1.CS.UCLA.EDU.20000 > 198.188.2.10.22222: UDP, length 1024
19:00:04.682742 IP Planetlab1.CS.UCLA.EDU.20000 > 198.188.2.10.22222: UDP, length 1024
19:00:04.686842 IP Planetlab1.CS.UCLA.EDU.20000 > 198.188.2.10.22222: UDP, length 1024
19:00:04.691359 IP Planetlab1.CS.UCLA.EDU.20000 > 198.188.2.10.22222: UDP, length 1024
19:00:04.695465 IP Planetlab1.CS.UCLA.EDU.20000 > 198.188.2.10.22222: UDP, length 1024
19:00:04.699976 IP Planetlab1.CS.UCLA.EDU.20000 > 198.188.2.10.22222: UDP, length 1024
19:00:04.704079 IP Planetlab1.CS.UCLA.EDU.20000 > 198.188.2.10.22222: UDP, length 1024
19:00:04.708591 IP Planetlab1.CS.UCLA.EDU.20000 > 198.188.2.10.22222: UDP, length 1024
19:00:04.712689 IP Planetlab1.CS.UCLA.EDU.20000 > 198.188.2.10.22222: UDP, length 1024
19:00:04.717207 IP Planetlab1.CS.UCLA.EDU.20000 > 198.188.2.10.22222: UDP, length 1024
19:00:04.721312 IP Planetlab1.CS.UCLA.EDU.20000 > 198.188.2.10.22222: UDP, length 1024
19:00:04.725824 IP Planetlab1.CS.UCLA.EDU.20000 > 198.188.2.10.22222: UDP, length 1024
19:00:04.729932 IP Planetlab1.CS.UCLA.EDU.20000 > 198.188.2.10.22222: UDP, length 1024
19:00:04.734440 IP Planetlab1.CS.UCLA.EDU.20000 > 198.188.2.10.22222: UDP, length 1024
19:00:04.738545 IP Planetlab1.CS.UCLA.EDU.20000 > 198.188.2.10.22222: UDP, length 1024
19:00:04.743059 IP Planetlab1.CS.UCLA.EDU.20000 > 198.188.2.10.22222: UDP, length 1024
19:00:04.747162 IP Planetlab1.CS.UCLA.EDU.20000 > 198.188.2.10.22222: UDP, length 1024
19:00:04.751267 IP Planetlab1.CS.UCLA.EDU.20000 > 198.188.2.10.22222: UDP, length 1024
19:00:04.755779 IP Planetlab1.CS.UCLA.EDU.20000 > 198.188.2.10.22222: UDP, length 1024
19:00:04.759883 IP Planetlab1.CS.UCLA.EDU.20000 > 198.188.2.10.22222: UDP, length 1024
19:00:04.764395 IP Planetlab1.CS.UCLA.EDU.20000 > 198.188.2.10.22222: UDP, length 1024
19:00:04.768498 IP Planetlab1.CS.UCLA.EDU.20000 > 198.188.2.10.22222: UDP, length 1024
19:00:04.773010 IP Planetlab1.CS.UCLA.EDU.20000 > 198.188.2.10.22222: UDP, length 1024
19:00:04.777116 IP Planetlab1.CS.UCLA.EDU.20000 > 198.188.2.10.22222: UDP, length 1024
19:00:04.781627 IP Planetlab1.CS.UCLA.EDU.20000 > 198.188.2.10.22222: UDP, length 1024
19:00:04.785733 IP Planetlab1.CS.UCLA.EDU.20000 > 198.188.2.10.22222: UDP, length 1024
19:00:04.790244 IP Planetlab1.CS.UCLA.EDU.20000 > 198.188.2.10.22222: UDP, length 1024
19:00:04.794347 IP Planetlab1.CS.UCLA.EDU.20000 > 198.188.2.10.22222: UDP, length 1024
19:00:04.798858 IP Planetlab1.CS.UCLA.EDU.20000 > 198.188.2.10.22222: UDP, length 1024
19:00:04.802962 IP Planetlab1.CS.UCLA.EDU.20000 > 198.188.2.10.22222: UDP, length 1024
19:00:04.807476 IP Planetlab1.CS.UCLA.EDU.20000 > 198.188.2.10.22222: UDP, length 1024
19:00:04.811580 IP Planetlab1.CS.UCLA.EDU.20000 > 198.188.2.10.22222: UDP, length 1024
19:00:04.815683 IP Planetlab1.CS.UCLA.EDU.20000 > 198.188.2.10.22222: UDP, length 1024
19:00:04.820199 IP Planetlab1.CS.UCLA.EDU.20000 > 198.188.2.10.22222: UDP, length 1024
19:00:04.824299 IP Planetlab1.CS.UCLA.EDU.20000 > 198.188.2.10.22222: UDP, length 1024
19:00:04.828812 IP Planetlab1.CS.UCLA.EDU.20000 > 198.188.2.10.22222: UDP, length 1024
19:00:04.832914 IP Planetlab1.CS.UCLA.EDU.20000 > 198.188.2.10.22222: UDP, length 1024
19:00:04.837426 IP Planetlab1.CS.UCLA.EDU.20000 > 198.188.2.10.22222: UDP, length 1024
19:00:04.841530 IP Planetlab1.CS.UCLA.EDU.20000 > 198.188.2.10.22222: UDP, length 1024
19:00:04.846043 IP Planetlab1.CS.UCLA.EDU.20000 > 198.188.2.10.22222: UDP, length 1024
19:00:04.850148 IP Planetlab1.CS.UCLA.EDU.20000 > 198.188.2.10.22222: UDP, length 1024
19:00:04.854659 IP Planetlab1.CS.UCLA.EDU.20000 > 198.188.2.10.22222: UDP, length 1024
19:00:04.858764 IP Planetlab1.CS.UCLA.EDU.20000 > 198.188.2.10.22222: UDP, length 1024
19:00:04.863281 IP Planetlab1.CS.UCLA.EDU.20000 > 198.188.2.10.22222: UDP, length 1024
19:00:04.867379 IP Planetlab1.CS.UCLA.EDU.20000 > 198.188.2.10.22222: UDP, length 1024
19:00:04.871892 IP Planetlab1.CS.UCLA.EDU.20000 > 198.188.2.10.22222: UDP, length 1024
19:00:04.875996 IP Planetlab1.CS.UCLA.EDU.20000 > 198.188.2.10.22222: UDP, length 1024
19:00:04.880100 IP Planetlab1.CS.UCLA.EDU.20000 > 198.188.2.10.22222: UDP, length 1024
19:00:04.884611 IP Planetlab1.CS.UCLA.EDU.20000 > 198.188.2.10.22222: UDP, length 1024
19:00:04.888709 IP Planetlab1.CS.UCLA.EDU.20000 > 198.188.2.10.22222: UDP, length 1024
19:00:04.893229 IP Planetlab1.CS.UCLA.EDU.20000 > 198.188.2.10.22222: UDP, length 1024
19:00:04.897337 IP Planetlab1.CS.UCLA.EDU.20000 > 198.188.2.10.22222: UDP, length 1024
19:00:04.901844 IP Planetlab1.CS.UCLA.EDU.20000 > 198.188.2.10.22222: UDP, length 1024
19:00:04.905947 IP Planetlab1.CS.UCLA.EDU.20000 > 198.188.2.10.22222: UDP, length 1024
19:00:04.910437 IP Planetlab1.CS.UCLA.EDU.20000 > 198.188.2.10.22222: UDP, length 1024
19:00:04.914565 IP Planetlab1.CS.UCLA.EDU.20000 > 198.188.2.10.22222: UDP, length 1024
19:00:04.919077 IP Planetlab1.CS.UCLA.EDU.20000 > 198.188.2.10.22222: UDP, length 1024
19:00:04.923180 IP Planetlab1.CS.UCLA.EDU.20000 > 198.188.2.10.22222: UDP, length 1024
19:00:04.927692 IP Planetlab1.CS.UCLA.EDU.20000 > 198.188.2.10.22222: UDP, length 1024
19:00:04.931796 IP Planetlab1.CS.UCLA.EDU.20000 > 198.188.2.10.22222: UDP, length 1024
19:00:04.936307 IP Planetlab1.CS.UCLA.EDU.20000 > 198.188.2.10.22222: UDP, length 1024
19:00:04.940418 IP Planetlab1.CS.UCLA.EDU.20000 > 198.188.2.10.22222: UDP, length 1024
19:00:04.944517 IP Planetlab1.CS.UCLA.EDU.20000 > 198.188.2.10.22222: UDP, length 1024
19:00:04.949030 IP Planetlab1.CS.UCLA.EDU.20000 > 198.188.2.10.22222: UDP, length 1024
19:00:04.953133 IP Planetlab1.CS.UCLA.EDU.20000 > 198.188.2.10.22222: UDP, length 1024
19:00:04.957645 IP Planetlab1.CS.UCLA.EDU.20000 > 198.188.2.10.22222: UDP, length 1024
19:00:04.961747 IP Planetlab1.CS.UCLA.EDU.20000 > 198.188.2.10.22222: UDP, length 1024
19:00:04.966259 IP Planetlab1.CS.UCLA.EDU.20000 > 198.188.2.10.22222: UDP, length 1024
19:00:04.970364 IP Planetlab1.CS.UCLA.EDU.20000 > 198.188.2.10.22222: UDP, length 1024
19:00:04.974877 IP Planetlab1.CS.UCLA.EDU.20000 > 198.188.2.10.22222: UDP, length 1024
19:00:04.978981 IP Planetlab1.CS.UCLA.EDU.20000 > 198.188.2.10.22222: UDP, length 1024
19:00:04.983493 IP Planetlab1.CS.UCLA.EDU.20000 > 198.188.2.10.22222: UDP, length 1024
19:00:04.987603 IP Planetlab1.CS.UCLA.EDU.20000 > 198.188.2.10.22222: UDP, length 1024
19:00:04.992108 IP Planetlab1.CS.UCLA.EDU.20000 > 198.188.2.10.22222: UDP, length 1024
19:00:04.996212 IP Planetlab1.CS.UCLA.EDU.20000 > 198.188.2.10.22222: UDP, length 1024
19:00:05.000717 IP Planetlab1.CS.UCLA.EDU.20000 > 198.188.2.10.22222: UDP, length 1024
19:00:05.004829 IP Planetlab1.CS.UCLA.EDU.20000 > 198.188.2.10.22222: UDP, length 1024
19:00:05.009340 IP Planetlab1.CS.UCLA.EDU.20000 > 198.188.2.10.22222: UDP, length 1024
19:00:05.013445 IP Planetlab1.CS.UCLA.EDU.20000 > 198.188.2.10.22222: UDP, length 1024
19:00:05.017552 IP Planetlab1.CS.UCLA.EDU.20000 > 198.188.2.10.22222: UDP, length 1024
19:00:05.022059 IP Planetlab1.CS.UCLA.EDU.20000 > 198.188.2.10.22222: UDP, length 1024
19:00:05.026165 IP Planetlab1.CS.UCLA.EDU.20000 > 198.188.2.10.22222: UDP, length 1024
19:00:05.030683 IP Planetlab1.CS.UCLA.EDU.20000 > 198.188.2.10.22222: UDP, length 1024
19:00:05.034781 IP Planetlab1.CS.UCLA.EDU.20000 > 198.188.2.10.22222: UDP, length 1024
19:00:05.039293 IP Planetlab1.CS.UCLA.EDU.20000 > 198.188.2.10.22222: UDP, length 1024
19:00:05.043397 IP Planetlab1.CS.UCLA.EDU.20000 > 198.188.2.10.22222: UDP, length 1024
19:00:05.047910 IP Planetlab1.CS.UCLA.EDU.20000 > 198.188.2.10.22222: UDP, length 1024
19:00:05.052013 IP Planetlab1.CS.UCLA.EDU.20000 > 198.188.2.10.22222: UDP, length 1024
19:00:05.056526 IP Planetlab1.CS.UCLA.EDU.20000 > 198.188.2.10.22222: UDP, length 1024
19:00:05.060630 IP Planetlab1.CS.UCLA.EDU.20000 > 198.188.2.10.22222: UDP, length 1024
19:00:05.065142 IP Planetlab1.CS.UCLA.EDU.20000 > 198.188.2.10.22222: UDP, length 1024
19:00:05.069245 IP Planetlab1.CS.UCLA.EDU.20000 > 198.188.2.10.22222: UDP, length 1024
19:00:05.073759 IP Planetlab1.CS.UCLA.EDU.20000 > 198.188.2.10.22222: UDP, length 1024
19:00:05.077861 IP Planetlab1.CS.UCLA.EDU.20000 > 198.188.2.10.22222: UDP, length 1024
19:00:05.081966 IP Planetlab1.CS.UCLA.EDU.20000 > 198.188.2.10.22222: UDP, length 1024
19:00:05.086479 IP Planetlab1.CS.UCLA.EDU.20000 > 198.188.2.10.22222: UDP, length 1024
19:00:05.090581 IP Planetlab1.CS.UCLA.EDU.20000 > 198.188.2.10.22222: UDP, length 1024
19:00:05.095093 IP Planetlab1.CS.UCLA.EDU.20000 > 198.188.2.10.22222: UDP, length 1024
19:00:05.099197 IP Planetlab1.CS.UCLA.EDU.20000 > 198.188.2.10.22222: UDP, length 1024
19:00:05.103709 IP Planetlab1.CS.UCLA.EDU.20000 > 198.188.2.10.22222: UDP, length 1024
19:00:05.107815 IP Planetlab1.CS.UCLA.EDU.20000 > 198.188.2.10.22222: UDP, length 1024
19:00:05.112327 IP Planetlab1.CS.UCLA.EDU.20000 > 198.188.2.10.22222: UDP, length 1024
19:00:05.116431 IP Planetlab1.CS.UCLA.EDU.20000 > 198.188.2.10.22222: UDP, length 1024
19:00:05.120946 IP Planetlab1.CS.UCLA.EDU.20000 > 198.188.2.10.22222: UDP, length 1024
19:00:05.125046 IP Planetlab1.CS.UCLA.EDU.20000 > 198.188.2.10.22222: UDP, length 1024
19:00:05.129558 IP Planetlab1.CS.UCLA.EDU.20000 > 198.188.2.10.22222: UDP, length 1024
19:00:05.133661 IP Planetlab1.CS.UCLA.EDU.20000 > 198.188.2.10.22222: UDP, length 1024
19:00:05.138173 IP Planetlab1.CS.UCLA.EDU.20000 > 198.188.2.10.22222: UDP, length 1024
19:00:05.142277 IP Planetlab1.CS.UCLA.EDU.20000 > 198.188.2.10.22222: UDP, length 1024
19:00:05.146382 IP Planetlab1.CS.UCLA.EDU.20000 > 198.188.2.10.22222: UDP, length 1024
19:00:05.150895 IP Planetlab1.CS.UCLA.EDU.20000 > 198.188.2.10.22222: UDP, length 1024
19:00:05.154999 IP Planetlab1.CS.UCLA.EDU.20000 > 198.188.2.10.22222: UDP, length 1024
19:00:05.159510 IP Planetlab1.CS.UCLA.EDU.20000 > 198.188.2.10.22222: UDP, length 1024
19:00:05.163614 IP Planetlab1.CS.UCLA.EDU.20000 > 198.188.2.10.22222: UDP, length 1024
19:00:05.168125 IP Planetlab1.CS.UCLA.EDU.20000 > 198.188.2.10.22222: UDP, length 1024
19:00:05.172230 IP Planetlab1.CS.UCLA.EDU.20000 > 198.188.2.10.22222: UDP, length 1024
19:00:05.176736 IP Planetlab1.CS.UCLA.EDU.20000 > 198.188.2.10.22222: UDP, length 1024
19:00:05.180847 IP Planetlab1.CS.UCLA.EDU.20000 > 198.188.2.10.22222: UDP, length 1024
19:00:05.185358 IP Planetlab1.CS.UCLA.EDU.20000 > 198.188.2.10.22222: UDP, length 1024
19:00:05.189462 IP Planetlab1.CS.UCLA.EDU.20000 > 198.188.2.10.22222: UDP, length 1024
19:00:05.193974 IP Planetlab1.CS.UCLA.EDU.20000 > 198.188.2.10.22222: UDP, length 1024
19:00:05.198082 IP Planetlab1.CS.UCLA.EDU.20000 > 198.188.2.10.22222: UDP, length 1024
19:00:05.202588 IP Planetlab1.CS.UCLA.EDU.20000 > 198.188.2.10.22222: UDP, length 1024
19:00:05.206694 IP Planetlab1.CS.UCLA.EDU.20000 > 198.188.2.10.22222: UDP, length 1024
19:00:05.210799 IP Planetlab1.CS.UCLA.EDU.20000 > 198.188.2.10.22222: UDP, length 1024
19:00:05.215311 IP Planetlab1.CS.UCLA.EDU.20000 > 198.188.2.10.22222: UDP, length 1024
19:00:05.219398 IP Planetlab1.CS.UCLA.EDU.20000 > 198.188.2.10.22222: UDP, length 1024
19:00:05.223928 IP Planetlab1.CS.UCLA.EDU.20000 > 198.188.2.10.22222: UDP, length 1024
19:00:05.228031 IP Planetlab1.CS.UCLA.EDU.20000 > 198.188.2.10.22222: UDP, length 1024
19:00:05.232544 IP Planetlab1.CS.UCLA.EDU.20000 > 198.188.2.10.22222: UDP, length 1024
19:00:05.236646 IP Planetlab1.CS.UCLA.EDU.20000 > 198.188.2.10.22222: UDP, length 1024
19:00:05.241158 IP Planetlab1.CS.UCLA.EDU.20000 > 198.188.2.10.22222: UDP, length 1024
19:00:05.245264 IP Planetlab1.CS.UCLA.EDU.20000 > 198.188.2.10.22222: UDP, length 1024
19:00:05.249774 IP Planetlab1.CS.UCLA.EDU.20000 > 198.188.2.10.22222: UDP, length 1024
19:00:05.253878 IP Planetlab1.CS.UCLA.EDU.20000 > 198.188.2.10.22222: UDP, length 1024
19:00:05.258391 IP Planetlab1.CS.UCLA.EDU.20000 > 198.188.2.10.22222: UDP, length 1024
19:00:05.262495 IP Planetlab1.CS.UCLA.EDU.20000 > 198.188.2.10.22222: UDP, length 1024
19:00:05.267008 IP Planetlab1.CS.UCLA.EDU.20000 > 198.188.2.10.22222: UDP, length 1024
19:00:05.271110 IP Planetlab1.CS.UCLA.EDU.20000 > 198.188.2.10.22222: UDP, length 1024
19:00:05.275623 IP Planetlab1.CS.UCLA.EDU.20000 > 198.188.2.10.22222: UDP, length 1024
19:00:05.279728 IP Planetlab1.CS.UCLA.EDU.20000 > 198.188.2.10.22222: UDP, length 1024
19:00:05.283832 IP Planetlab1.CS.UCLA.EDU.20000 > 198.188.2.10.22222: UDP, length 1024
19:00:05.288344 IP Planetlab1.CS.UCLA.EDU.20000 > 198.188.2.10.22222: UDP, length 1024
19:00:05.292449 IP Planetlab1.CS.UCLA.EDU.20000 > 198.188.2.10.22222: UDP, length 1024
19:00:05.296959 IP Planetlab1.CS.UCLA.EDU.20000 > 198.188.2.10.22222: UDP, length 1024
19:00:05.301065 IP Planetlab1.CS.UCLA.EDU.20000 > 198.188.2.10.22222: UDP, length 1024
19:00:05.305574 IP Planetlab1.CS.UCLA.EDU.20000 > 198.188.2.10.22222: UDP, length 1024
19:00:05.309680 IP Planetlab1.CS.UCLA.EDU.20000 > 198.188.2.10.22222: UDP, length 1024
19:00:05.314190 IP Planetlab1.CS.UCLA.EDU.20000 > 198.188.2.10.22222: UDP, length 1024
19:00:05.318299 IP Planetlab1.CS.UCLA.EDU.20000 > 198.188.2.10.22222: UDP, length 1024
19:00:05.322810 IP Planetlab1.CS.UCLA.EDU.20000 > 198.188.2.10.22222: UDP, length 1024
19:00:05.326913 IP Planetlab1.CS.UCLA.EDU.20000 > 198.188.2.10.22222: UDP, length 1024
19:00:05.331424 IP Planetlab1.CS.UCLA.EDU.20000 > 198.188.2.10.22222: UDP, length 1024
19:00:05.335527 IP Planetlab1.CS.UCLA.EDU.20000 > 198.188.2.10.22222: UDP, length 1024
