19:28:32.345347 IP Planetlab1.CS.UCLA.EDU.50713 > 198.188.2.10.22222: UDP, length 1024
19:28:32.349452 IP Planetlab1.CS.UCLA.EDU.50713 > 198.188.2.10.22222: UDP, length 1024
19:28:32.353556 IP Planetlab1.CS.UCLA.EDU.50713 > 198.188.2.10.22222: UDP, length 1024
19:28:32.358067 IP Planetlab1.CS.UCLA.EDU.50713 > 198.188.2.10.22222: UDP, length 1024
19:28:32.362173 IP Planetlab1.CS.UCLA.EDU.50713 > 198.188.2.10.22222: UDP, length 1024
19:28:32.366686 IP Planetlab1.CS.UCLA.EDU.50713 > 198.188.2.10.22222: UDP, length 1024
19:28:32.370788 IP Planetlab1.CS.UCLA.EDU.50713 > 198.188.2.10.22222: UDP, length 1024
19:28:32.375301 IP Planetlab1.CS.UCLA.EDU.50713 > 198.188.2.10.22222: UDP, length 1024
19:28:32.379404 IP Planetlab1.CS.UCLA.EDU.50713 > 198.188.2.10.22222: UDP, length 1024
19:28:32.383916 IP Planetlab1.CS.UCLA.EDU.50713 > 198.188.2.10.22222: UDP, length 1024
19:28:32.388019 IP Planetlab1.CS.UCLA.EDU.50713 > 198.188.2.10.22222: UDP, length 1024
19:28:32.392533 IP Planetlab1.CS.UCLA.EDU.50713 > 198.188.2.10.22222: UDP, length 1024
19:28:32.396637 IP Planetlab1.CS.UCLA.EDU.50713 > 198.188.2.10.22222: UDP, length 1024
19:28:32.401149 IP Planetlab1.CS.UCLA.EDU.50713 > 198.188.2.10.22222: UDP, length 1024
19:28:32.405252 IP Planetlab1.CS.UCLA.EDU.50713 > 198.188.2.10.22222: UDP, length 1024
19:28:32.409765 IP Planetlab1.CS.UCLA.EDU.50713 > 198.188.2.10.22222: UDP, length 1024
19:28:32.413870 IP Planetlab1.CS.UCLA.EDU.50713 > 198.188.2.10.22222: UDP, length 1024
19:28:32.417973 IP Planetlab1.CS.UCLA.EDU.50713 > 198.188.2.10.22222: UDP, length 1024
19:28:32.422487 IP Planetlab1.CS.UCLA.EDU.50713 > 198.188.2.10.22222: UDP, length 1024
19:28:32.426589 IP Planetlab1.CS.UCLA.EDU.50713 > 198.188.2.10.22222: UDP, length 1024
19:28:32.431100 IP Planetlab1.CS.UCLA.EDU.50713 > 198.188.2.10.22222: UDP, length 1024
19:28:32.435206 IP Planetlab1.CS.UCLA.EDU.50713 > 198.188.2.10.22222: UDP, length 1024
19:28:32.439716 IP Planetlab1.CS.UCLA.EDU.50713 > 198.188.2.10.22222: UDP, length 1024
19:28:32.443822 IP Planetlab1.CS.UCLA.EDU.50713 > 198.188.2.10.22222: UDP, length 1024
19:28:32.448333 IP Planetlab1.CS.UCLA.EDU.50713 > 198.188.2.10.22222: UDP, length 1024
19:28:32.452437 IP Planetlab1.CS.UCLA.EDU.50713 > 198.188.2.10.22222: UDP, length 1024
19:28:32.456951 IP Planetlab1.CS.UCLA.EDU.50713 > 198.188.2.10.22222: UDP, length 1024
19:28:32.461054 IP Planetlab1.CS.UCLA.EDU.50713 > 198.188.2.10.22222: UDP, length 1024
19:28:32.465564 IP Planetlab1.CS.UCLA.EDU.50713 > 198.188.2.10.22222: UDP, length 1024
19:28:32.469668 IP Planetlab1.CS.UCLA.EDU.50713 > 198.188.2.10.22222: UDP, length 1024
19:28:32.474180 IP Planetlab1.CS.UCLA.EDU.50713 > 198.188.2.10.22222: UDP, length 1024
19:28:32.478288 IP Planetlab1.CS.UCLA.EDU.50713 > 198.188.2.10.22222: UDP, length 1024
19:28:32.482390 IP Planetlab1.CS.UCLA.EDU.50713 > 198.188.2.10.22222: UDP, length 1024
19:28:32.486900 IP Planetlab1.CS.UCLA.EDU.50713 > 198.188.2.10.22222: UDP, length 1024
19:28:32.490999 IP Planetlab1.CS.UCLA.EDU.50713 > 198.188.2.10.22222: UDP, length 1024
19:28:32.495517 IP Planetlab1.CS.UCLA.EDU.50713 > 198.188.2.10.22222: UDP, length 1024
19:28:32.499620 IP Planetlab1.CS.UCLA.EDU.50713 > 198.188.2.10.22222: UDP, length 1024
19:28:32.504135 IP Planetlab1.CS.UCLA.EDU.50713 > 198.188.2.10.22222: UDP, length 1024
19:28:32.508237 IP Planetlab1.CS.UCLA.EDU.50713 > 198.188.2.10.22222: UDP, length 1024
19:28:32.512751 IP Planetlab1.CS.UCLA.EDU.50713 > 198.188.2.10.22222: UDP, length 1024
19:28:32.516854 IP Planetlab1.CS.UCLA.EDU.50713 > 198.188.2.10.22222: UDP, length 1024
19:28:32.521369 IP Planetlab1.CS.UCLA.EDU.50713 > 198.188.2.10.22222: UDP, length 1024
19:28:32.525469 IP Planetlab1.CS.UCLA.EDU.50713 > 198.188.2.10.22222: UDP, length 1024
19:28:32.529980 IP Planetlab1.CS.UCLA.EDU.50713 > 198.188.2.10.22222: UDP, length 1024
19:28:32.534087 IP Planetlab1.CS.UCLA.EDU.50713 > 198.188.2.10.22222: UDP, length 1024
19:28:32.538598 IP Planetlab1.CS.UCLA.EDU.50713 > 198.188.2.10.22222: UDP, length 1024
19:28:32.542702 IP Planetlab1.CS.UCLA.EDU.50713 > 198.188.2.10.22222: UDP, length 1024
19:28:32.546806 IP Planetlab1.CS.UCLA.EDU.50713 > 198.188.2.10.22222: UDP, length 1024
19:28:32.551318 IP Planetlab1.CS.UCLA.EDU.50713 > 198.188.2.10.22222: UDP, length 1024
19:28:32.555422 IP Planetlab1.CS.UCLA.EDU.50713 > 198.188.2.10.22222: UDP, length 1024
19:28:32.559934 IP Planetlab1.CS.UCLA.EDU.50713 > 198.188.2.10.22222: UDP, length 1024
19:28:32.564040 IP Planetlab1.CS.UCLA.EDU.50713 > 198.188.2.10.22222: UDP, length 1024
19:28:32.568551 IP Planetlab1.CS.UCLA.EDU.50713 > 198.188.2.10.22222: UDP, length 1024
19:28:32.572653 IP Planetlab1.CS.UCLA.EDU.50713 > 198.188.2.10.22222: UDP, length 1024
19:28:32.577165 IP Planetlab1.CS.UCLA.EDU.50713 > 198.188.2.10.22222: UDP, length 1024
19:28:32.581271 IP Planetlab1.CS.UCLA.EDU.50713 > 198.188.2.10.22222: UDP, length 1024
19:28:32.585782 IP Planetlab1.CS.UCLA.EDU.50713 > 198.188.2.10.22222: UDP, length 1024
19:28:32.589886 IP Planetlab1.CS.UCLA.EDU.50713 > 198.188.2.10.22222: UDP, length 1024
19:28:32.594399 IP Planetlab1.CS.UCLA.EDU.50713 > 198.188.2.10.22222: UDP, length 1024
19:28:32.598504 IP Planetlab1.CS.UCLA.EDU.50713 > 198.188.2.10.22222: UDP, length 1024
19:28:32.603008 IP Planetlab1.CS.UCLA.EDU.50713 > 198.188.2.10.22222: UDP, length 1024
19:28:32.607118 IP Planetlab1.CS.UCLA.EDU.50713 > 198.188.2.10.22222: UDP, length 1024
19:28:32.611222 IP Planetlab1.CS.UCLA.EDU.50713 > 198.188.2.10.22222: UDP, length 1024
19:28:32.615735 IP Planetlab1.CS.UCLA.EDU.50713 > 198.188.2.10.22222: UDP, length 1024
19:28:32.619840 IP Planetlab1.CS.UCLA.EDU.50713 > 198.188.2.10.22222: UDP, length 1024
19:28:32.624351 IP Planetlab1.CS.UCLA.EDU.50713 > 198.188.2.10.22222: UDP, length 1024
19:28:32.628454 IP Planetlab1.CS.UCLA.EDU.50713 > 198.188.2.10.22222: UDP, length 1024
19:28:32.632968 IP Planetlab1.CS.UCLA.EDU.50713 > 198.188.2.10.22222: UDP, length 1024
19:28:32.637069 IP Planetlab1.CS.UCLA.EDU.50713 > 198.188.2.10.22222: UDP, length 1024
19:28:32.641582 IP Planetlab1.CS.UCLA.EDU.50713 > 198.188.2.10.22222: UDP, length 1024
19:28:32.645694 IP Planetlab1.CS.UCLA.EDU.50713 > 198.188.2.10.22222: UDP, length 1024
19:28:32.650200 IP Planetlab1.CS.UCLA.EDU.50713 > 198.188.2.10.22222: UDP, length 1024
19:28:32.654303 IP Planetlab1.CS.UCLA.EDU.50713 > 198.188.2.10.22222: UDP, length 1024
19:28:32.658814 IP Planetlab1.CS.UCLA.EDU.50713 > 198.188.2.10.22222: UDP, length 1024
19:28:32.662920 IP Planetlab1.CS.UCLA.EDU.50713 > 198.188.2.10.22222: UDP, length 1024
19:28:32.667431 IP Planetlab1.CS.UCLA.EDU.50713 > 198.188.2.10.22222: UDP, length 1024
19:28:32.671534 IP Planetlab1.CS.UCLA.EDU.50713 > 198.188.2.10.22222: UDP, length 1024
19:28:32.676047 IP Planetlab1.CS.UCLA.EDU.50713 > 198.188.2.10.22222: UDP, length 1024
19:28:32.680152 IP Planetlab1.CS.UCLA.EDU.50713 > 198.188.2.10.22222: UDP, length 1024
19:28:32.684256 IP Planetlab1.CS.UCLA.EDU.50713 > 198.188.2.10.22222: UDP, length 1024
19:28:32.688773 IP Planetlab1.CS.UCLA.EDU.50713 > 198.188.2.10.22222: UDP, length 1024
19:28:32.692873 IP Planetlab1.CS.UCLA.EDU.50713 > 198.188.2.10.22222: UDP, length 1024
19:28:32.697384 IP Planetlab1.CS.UCLA.EDU.50713 > 198.188.2.10.22222: UDP, length 1024
19:28:32.701486 IP Planetlab1.CS.UCLA.EDU.50713 > 198.188.2.10.22222: UDP, length 1024
19:28:32.706001 IP Planetlab1.CS.UCLA.EDU.50713 > 198.188.2.10.22222: UDP, length 1024
19:28:32.710103 IP Planetlab1.CS.UCLA.EDU.50713 > 198.188.2.10.22222: UDP, length 1024
19:28:32.714616 IP Planetlab1.CS.UCLA.EDU.50713 > 198.188.2.10.22222: UDP, length 1024
19:28:32.718721 IP Planetlab1.CS.UCLA.EDU.50713 > 198.188.2.10.22222: UDP, length 1024
19:28:32.723233 IP Planetlab1.CS.UCLA.EDU.50713 > 198.188.2.10.22222: UDP, length 1024
19:28:32.727334 IP Planetlab1.CS.UCLA.EDU.50713 > 198.188.2.10.22222: UDP, length 1024
19:28:32.731850 IP Planetlab1.CS.UCLA.EDU.50713 > 198.188.2.10.22222: UDP, length 1024
19:28:32.735952 IP Planetlab1.CS.UCLA.EDU.50713 > 198.188.2.10.22222: UDP, length 1024
19:28:32.740465 IP Planetlab1.CS.UCLA.EDU.50713 > 198.188.2.10.22222: UDP, length 1024
19:28:32.744568 IP Planetlab1.CS.UCLA.EDU.50713 > 198.188.2.10.22222: UDP, length 1024
19:28:32.748673 IP Planetlab1.CS.UCLA.EDU.50713 > 198.188.2.10.22222: UDP, length 1024
19:28:32.753183 IP Planetlab1.CS.UCLA.EDU.50713 > 198.188.2.10.22222: UDP, length 1024
19:28:32.757288 IP Planetlab1.CS.UCLA.EDU.50713 > 198.188.2.10.22222: UDP, length 1024
19:28:32.761799 IP Planetlab1.CS.UCLA.EDU.50713 > 198.188.2.10.22222: UDP, length 1024
19:28:32.765911 IP Planetlab1.CS.UCLA.EDU.50713 > 198.188.2.10.22222: UDP, length 1024
19:28:32.770417 IP Planetlab1.CS.UCLA.EDU.50713 > 198.188.2.10.22222: UDP, length 1024
19:28:32.774520 IP Planetlab1.CS.UCLA.EDU.50713 > 198.188.2.10.22222: UDP, length 1024
19:28:32.779025 IP Planetlab1.CS.UCLA.EDU.50713 > 198.188.2.10.22222: UDP, length 1024
19:28:32.783136 IP Planetlab1.CS.UCLA.EDU.50713 > 198.188.2.10.22222: UDP, length 1024
19:28:32.787650 IP Planetlab1.CS.UCLA.EDU.50713 > 198.188.2.10.22222: UDP, length 1024
19:28:32.791753 IP Planetlab1.CS.UCLA.EDU.50713 > 198.188.2.10.22222: UDP, length 1024
19:28:32.796266 IP Planetlab1.CS.UCLA.EDU.50713 > 198.188.2.10.22222: UDP, length 1024
19:28:32.800370 IP Planetlab1.CS.UCLA.EDU.50713 > 198.188.2.10.22222: UDP, length 1024
19:28:32.804881 IP Planetlab1.CS.UCLA.EDU.50713 > 198.188.2.10.22222: UDP, length 1024
19:28:32.808984 IP Planetlab1.CS.UCLA.EDU.50713 > 198.188.2.10.22222: UDP, length 1024
19:28:32.813090 IP Planetlab1.CS.UCLA.EDU.50713 > 198.188.2.10.22222: UDP, length 1024
19:28:32.817600 IP Planetlab1.CS.UCLA.EDU.50713 > 198.188.2.10.22222: UDP, length 1024
19:28:32.821706 IP Planetlab1.CS.UCLA.EDU.50713 > 198.188.2.10.22222: UDP, length 1024
19:28:32.826217 IP Planetlab1.CS.UCLA.EDU.50713 > 198.188.2.10.22222: UDP, length 1024
19:28:32.830322 IP Planetlab1.CS.UCLA.EDU.50713 > 198.188.2.10.22222: UDP, length 1024
19:28:32.834835 IP Planetlab1.CS.UCLA.EDU.50713 > 198.188.2.10.22222: UDP, length 1024
19:28:32.838935 IP Planetlab1.CS.UCLA.EDU.50713 > 198.188.2.10.22222: UDP, length 1024
19:28:32.843448 IP Planetlab1.CS.UCLA.EDU.50713 > 198.188.2.10.22222: UDP, length 1024
19:28:32.847553 IP Planetlab1.CS.UCLA.EDU.50713 > 198.188.2.10.22222: UDP, length 1024
19:28:32.852065 IP Planetlab1.CS.UCLA.EDU.50713 > 198.188.2.10.22222: UDP, length 1024
19:28:32.856176 IP Planetlab1.CS.UCLA.EDU.50713 > 198.188.2.10.22222: UDP, length 1024
19:28:32.860680 IP Planetlab1.CS.UCLA.EDU.50713 > 198.188.2.10.22222: UDP, length 1024
19:28:32.864785 IP Planetlab1.CS.UCLA.EDU.50713 > 198.188.2.10.22222: UDP, length 1024
19:28:32.869298 IP Planetlab1.CS.UCLA.EDU.50713 > 198.188.2.10.22222: UDP, length 1024
19:28:32.873400 IP Planetlab1.CS.UCLA.EDU.50713 > 198.188.2.10.22222: UDP, length 1024
19:28:32.877505 IP Planetlab1.CS.UCLA.EDU.50713 > 198.188.2.10.22222: UDP, length 1024
19:28:32.882018 IP Planetlab1.CS.UCLA.EDU.50713 > 198.188.2.10.22222: UDP, length 1024
19:28:32.886121 IP Planetlab1.CS.UCLA.EDU.50713 > 198.188.2.10.22222: UDP, length 1024
19:28:32.890633 IP Planetlab1.CS.UCLA.EDU.50713 > 198.188.2.10.22222: UDP, length 1024
19:28:32.894738 IP Planetlab1.CS.UCLA.EDU.50713 > 198.188.2.10.22222: UDP, length 1024
19:28:32.899251 IP Planetlab1.CS.UCLA.EDU.50713 > 198.188.2.10.22222: UDP, length 1024
19:28:32.903332 IP Planetlab1.CS.UCLA.EDU.50713 > 198.188.2.10.22222: UDP, length 1024
19:28:32.907845 IP Planetlab1.CS.UCLA.EDU.50713 > 198.188.2.10.22222: UDP, length 1024
19:28:32.911943 IP Planetlab1.CS.UCLA.EDU.50713 > 198.188.2.10.22222: UDP, length 1024
19:28:32.916456 IP Planetlab1.CS.UCLA.EDU.50713 > 198.188.2.10.22222: UDP, length 1024
19:28:32.920560 IP Planetlab1.CS.UCLA.EDU.50713 > 198.188.2.10.22222: UDP, length 1024
19:28:32.925073 IP Planetlab1.CS.UCLA.EDU.50713 > 198.188.2.10.22222: UDP, length 1024
19:28:32.929178 IP Planetlab1.CS.UCLA.EDU.50713 > 198.188.2.10.22222: UDP, length 1024
19:28:32.933690 IP Planetlab1.CS.UCLA.EDU.50713 > 198.188.2.10.22222: UDP, length 1024
19:28:32.937795 IP Planetlab1.CS.UCLA.EDU.50713 > 198.188.2.10.22222: UDP, length 1024
19:28:32.942319 IP Planetlab1.CS.UCLA.EDU.50713 > 198.188.2.10.22222: UDP, length 1024
19:28:32.946402 IP Planetlab1.CS.UCLA.EDU.50713 > 198.188.2.10.22222: UDP, length 1024
19:28:32.950503 IP Planetlab1.CS.UCLA.EDU.50713 > 198.188.2.10.22222: UDP, length 1024
19:28:32.955015 IP Planetlab1.CS.UCLA.EDU.50713 > 198.188.2.10.22222: UDP, length 1024
19:28:32.959119 IP Planetlab1.CS.UCLA.EDU.50713 > 198.188.2.10.22222: UDP, length 1024
19:28:32.963630 IP Planetlab1.CS.UCLA.EDU.50713 > 198.188.2.10.22222: UDP, length 1024
19:28:32.967735 IP Planetlab1.CS.UCLA.EDU.50713 > 198.188.2.10.22222: UDP, length 1024
19:28:32.972248 IP Planetlab1.CS.UCLA.EDU.50713 > 198.188.2.10.22222: UDP, length 1024
19:28:32.976352 IP Planetlab1.CS.UCLA.EDU.50713 > 198.188.2.10.22222: UDP, length 1024
19:28:32.980864 IP Planetlab1.CS.UCLA.EDU.50713 > 198.188.2.10.22222: UDP, length 1024
19:28:32.984979 IP Planetlab1.CS.UCLA.EDU.50713 > 198.188.2.10.22222: UDP, length 1024
19:28:32.989478 IP Planetlab1.CS.UCLA.EDU.50713 > 198.188.2.10.22222: UDP, length 1024
19:28:32.993584 IP Planetlab1.CS.UCLA.EDU.50713 > 198.188.2.10.22222: UDP, length 1024
19:28:32.998093 IP Planetlab1.CS.UCLA.EDU.50713 > 198.188.2.10.22222: UDP, length 1024
19:28:33.002197 IP Planetlab1.CS.UCLA.EDU.50713 > 198.188.2.10.22222: UDP, length 1024
19:28:33.006708 IP Planetlab1.CS.UCLA.EDU.50713 > 198.188.2.10.22222: UDP, length 1024
19:28:33.010812 IP Planetlab1.CS.UCLA.EDU.50713 > 198.188.2.10.22222: UDP, length 1024
19:28:33.014917 IP Planetlab1.CS.UCLA.EDU.50713 > 198.188.2.10.22222: UDP, length 1024
19:28:33.019495 IP Planetlab1.CS.UCLA.EDU.50713 > 198.188.2.10.22222: UDP, length 1024
19:28:33.023534 IP Planetlab1.CS.UCLA.EDU.50713 > 198.188.2.10.22222: UDP, length 1024
19:28:33.028049 IP Planetlab1.CS.UCLA.EDU.50713 > 198.188.2.10.22222: UDP, length 1024
19:28:33.032162 IP Planetlab1.CS.UCLA.EDU.50713 > 198.188.2.10.22222: UDP, length 1024
19:28:33.036664 IP Planetlab1.CS.UCLA.EDU.50713 > 198.188.2.10.22222: UDP, length 1024
19:28:33.040782 IP Planetlab1.CS.UCLA.EDU.50713 > 198.188.2.10.22222: UDP, length 1024
19:28:33.045296 IP Planetlab1.CS.UCLA.EDU.50713 > 198.188.2.10.22222: UDP, length 1024
19:28:33.049398 IP Planetlab1.CS.UCLA.EDU.50713 > 198.188.2.10.22222: UDP, length 1024
19:28:33.053912 IP Planetlab1.CS.UCLA.EDU.50713 > 198.188.2.10.22222: UDP, length 1024
19:28:33.058015 IP Planetlab1.CS.UCLA.EDU.50713 > 198.188.2.10.22222: UDP, length 1024
19:28:33.062529 IP Planetlab1.CS.UCLA.EDU.50713 > 198.188.2.10.22222: UDP, length 1024
19:28:33.066635 IP Planetlab1.CS.UCLA.EDU.50713 > 198.188.2.10.22222: UDP, length 1024
19:28:33.071148 IP Planetlab1.CS.UCLA.EDU.50713 > 198.188.2.10.22222: UDP, length 1024
19:28:33.075250 IP Planetlab1.CS.UCLA.EDU.50713 > 198.188.2.10.22222: UDP, length 1024
19:28:33.079593 IP Planetlab1.CS.UCLA.EDU.50713 > 198.188.2.10.22222: UDP, length 1024
19:28:33.083848 IP Planetlab1.CS.UCLA.EDU.50713 > 198.188.2.10.22222: UDP, length 1024
19:28:33.087952 IP Planetlab1.CS.UCLA.EDU.50713 > 198.188.2.10.22222: UDP, length 1024
19:28:33.092466 IP Planetlab1.CS.UCLA.EDU.50713 > 198.188.2.10.22222: UDP, length 1024
19:28:33.096571 IP Planetlab1.CS.UCLA.EDU.50713 > 198.188.2.10.22222: UDP, length 1024
19:28:33.101083 IP Planetlab1.CS.UCLA.EDU.50713 > 198.188.2.10.22222: UDP, length 1024
19:28:33.105187 IP Planetlab1.CS.UCLA.EDU.50713 > 198.188.2.10.22222: UDP, length 1024
19:28:33.109697 IP Planetlab1.CS.UCLA.EDU.50713 > 198.188.2.10.22222: UDP, length 1024
19:28:33.113815 IP Planetlab1.CS.UCLA.EDU.50713 > 198.188.2.10.22222: UDP, length 1024
19:28:33.118323 IP Planetlab1.CS.UCLA.EDU.50713 > 198.188.2.10.22222: UDP, length 1024
19:28:33.122430 IP Planetlab1.CS.UCLA.EDU.50713 > 198.188.2.10.22222: UDP, length 1024
19:28:33.126944 IP Planetlab1.CS.UCLA.EDU.50713 > 198.188.2.10.22222: UDP, length 1024
19:28:33.131048 IP Planetlab1.CS.UCLA.EDU.50713 > 198.188.2.10.22222: UDP, length 1024
19:28:33.135557 IP Planetlab1.CS.UCLA.EDU.50713 > 198.188.2.10.22222: UDP, length 1024
19:28:33.139686 IP Planetlab1.CS.UCLA.EDU.50713 > 198.188.2.10.22222: UDP, length 1024
19:28:33.143768 IP Planetlab1.CS.UCLA.EDU.50713 > 198.188.2.10.22222: UDP, length 1024
19:28:33.148282 IP Planetlab1.CS.UCLA.EDU.50713 > 198.188.2.10.22222: UDP, length 1024
19:28:33.152385 IP Planetlab1.CS.UCLA.EDU.50713 > 198.188.2.10.22222: UDP, length 1024
19:28:33.156897 IP Planetlab1.CS.UCLA.EDU.50713 > 198.188.2.10.22222: UDP, length 1024
19:28:33.161003 IP Planetlab1.CS.UCLA.EDU.50713 > 198.188.2.10.22222: UDP, length 1024
19:28:33.165513 IP Planetlab1.CS.UCLA.EDU.50713 > 198.188.2.10.22222: UDP, length 1024
19:28:33.169610 IP Planetlab1.CS.UCLA.EDU.50713 > 198.188.2.10.22222: UDP, length 1024
19:28:33.174126 IP Planetlab1.CS.UCLA.EDU.50713 > 198.188.2.10.22222: UDP, length 1024
19:28:33.178226 IP Planetlab1.CS.UCLA.EDU.50713 > 198.188.2.10.22222: UDP, length 1024
19:28:33.182738 IP Planetlab1.CS.UCLA.EDU.50713 > 198.188.2.10.22222: UDP, length 1024
19:28:33.186845 IP Planetlab1.CS.UCLA.EDU.50713 > 198.188.2.10.22222: UDP, length 1024
19:28:33.191375 IP Planetlab1.CS.UCLA.EDU.50713 > 198.188.2.10.22222: UDP, length 1024
19:28:33.195513 IP Planetlab1.CS.UCLA.EDU.50713 > 198.188.2.10.22222: UDP, length 1024
19:28:33.199973 IP Planetlab1.CS.UCLA.EDU.50713 > 198.188.2.10.22222: UDP, length 1024
19:28:33.204075 IP Planetlab1.CS.UCLA.EDU.50713 > 198.188.2.10.22222: UDP, length 1024
19:28:33.208588 IP Planetlab1.CS.UCLA.EDU.50713 > 198.188.2.10.22222: UDP, length 1024
19:28:33.212690 IP Planetlab1.CS.UCLA.EDU.50713 > 198.188.2.10.22222: UDP, length 1024
19:28:33.216795 IP Planetlab1.CS.UCLA.EDU.50713 > 198.188.2.10.22222: UDP, length 1024
19:28:33.221309 IP Planetlab1.CS.UCLA.EDU.50713 > 198.188.2.10.22222: UDP, length 1024
19:28:33.225412 IP Planetlab1.CS.UCLA.EDU.50713 > 198.188.2.10.22222: UDP, length 1024
19:28:33.229925 IP Planetlab1.CS.UCLA.EDU.50713 > 198.188.2.10.22222: UDP, length 1024
19:28:33.234039 IP Planetlab1.CS.UCLA.EDU.50713 > 198.188.2.10.22222: UDP, length 1024
19:28:33.238536 IP Planetlab1.CS.UCLA.EDU.50713 > 198.188.2.10.22222: UDP, length 1024
19:28:33.242644 IP Planetlab1.CS.UCLA.EDU.50713 > 198.188.2.10.22222: UDP, length 1024
19:28:33.247160 IP Planetlab1.CS.UCLA.EDU.50713 > 198.188.2.10.22222: UDP, length 1024
19:28:33.251253 IP Planetlab1.CS.UCLA.EDU.50713 > 198.188.2.10.22222: UDP, length 1024
19:28:33.255762 IP Planetlab1.CS.UCLA.EDU.50713 > 198.188.2.10.22222: UDP, length 1024
19:28:33.259864 IP Planetlab1.CS.UCLA.EDU.50713 > 198.188.2.10.22222: UDP, length 1024
19:28:33.264376 IP Planetlab1.CS.UCLA.EDU.50713 > 198.188.2.10.22222: UDP, length 1024
19:28:33.268482 IP Planetlab1.CS.UCLA.EDU.50713 > 198.188.2.10.22222: UDP, length 1024
19:28:33.272993 IP Planetlab1.CS.UCLA.EDU.50713 > 198.188.2.10.22222: UDP, length 1024
19:28:33.277099 IP Planetlab1.CS.UCLA.EDU.50713 > 198.188.2.10.22222: UDP, length 1024
19:28:33.281213 IP Planetlab1.CS.UCLA.EDU.50713 > 198.188.2.10.22222: UDP, length 1024
19:28:33.285723 IP Planetlab1.CS.UCLA.EDU.50713 > 198.188.2.10.22222: UDP, length 1024
19:28:33.289824 IP Planetlab1.CS.UCLA.EDU.50713 > 198.188.2.10.22222: UDP, length 1024
19:28:33.294338 IP Planetlab1.CS.UCLA.EDU.50713 > 198.188.2.10.22222: UDP, length 1024
19:28:33.298432 IP Planetlab1.CS.UCLA.EDU.50713 > 198.188.2.10.22222: UDP, length 1024
19:28:33.302948 IP Planetlab1.CS.UCLA.EDU.50713 > 198.188.2.10.22222: UDP, length 1024
19:28:33.307049 IP Planetlab1.CS.UCLA.EDU.50713 > 198.188.2.10.22222: UDP, length 1024
19:28:33.311595 IP Planetlab1.CS.UCLA.EDU.50713 > 198.188.2.10.22222: UDP, length 1024
19:28:33.315674 IP Planetlab1.CS.UCLA.EDU.50713 > 198.188.2.10.22222: UDP, length 1024
19:28:33.320175 IP Planetlab1.CS.UCLA.EDU.50713 > 198.188.2.10.22222: UDP, length 1024
19:28:33.324289 IP Planetlab1.CS.UCLA.EDU.50713 > 198.188.2.10.22222: UDP, length 1024
19:28:33.328825 IP Planetlab1.CS.UCLA.EDU.50713 > 198.188.2.10.22222: UDP, length 1024
19:28:33.332929 IP Planetlab1.CS.UCLA.EDU.50713 > 198.188.2.10.22222: UDP, length 1024
19:28:33.337443 IP Planetlab1.CS.UCLA.EDU.50713 > 198.188.2.10.22222: UDP, length 1024
19:28:33.341546 IP Planetlab1.CS.UCLA.EDU.50713 > 198.188.2.10.22222: UDP, length 1024
19:28:33.345650 IP Planetlab1.CS.UCLA.EDU.50713 > 198.188.2.10.22222: UDP, length 1024
19:28:33.350161 IP Planetlab1.CS.UCLA.EDU.50713 > 198.188.2.10.22222: UDP, length 1024
19:28:33.354266 IP Planetlab1.CS.UCLA.EDU.50713 > 198.188.2.10.22222: UDP, length 1024
19:28:33.358777 IP Planetlab1.CS.UCLA.EDU.50713 > 198.188.2.10.22222: UDP, length 1024
19:28:33.362881 IP Planetlab1.CS.UCLA.EDU.50713 > 198.188.2.10.22222: UDP, length 1024
19:28:33.367394 IP Planetlab1.CS.UCLA.EDU.50713 > 198.188.2.10.22222: UDP, length 1024
19:28:33.371498 IP Planetlab1.CS.UCLA.EDU.50713 > 198.188.2.10.22222: UDP, length 1024
19:28:33.376010 IP Planetlab1.CS.UCLA.EDU.50713 > 198.188.2.10.22222: UDP, length 1024
19:28:33.380116 IP Planetlab1.CS.UCLA.EDU.50713 > 198.188.2.10.22222: UDP, length 1024
19:28:33.384625 IP Planetlab1.CS.UCLA.EDU.50713 > 198.188.2.10.22222: UDP, length 1024
19:28:33.388730 IP Planetlab1.CS.UCLA.EDU.50713 > 198.188.2.10.22222: UDP, length 1024
19:28:33.393242 IP Planetlab1.CS.UCLA.EDU.50713 > 198.188.2.10.22222: UDP, length 1024
19:28:33.397349 IP Planetlab1.CS.UCLA.EDU.50713 > 198.188.2.10.22222: UDP, length 1024
19:28:33.401858 IP Planetlab1.CS.UCLA.EDU.50713 > 198.188.2.10.22222: UDP, length 1024
19:28:33.405963 IP Planetlab1.CS.UCLA.EDU.50713 > 198.188.2.10.22222: UDP, length 1024
19:28:33.410066 IP Planetlab1.CS.UCLA.EDU.50713 > 198.188.2.10.22222: UDP, length 1024
19:28:33.414578 IP Planetlab1.CS.UCLA.EDU.50713 > 198.188.2.10.22222: UDP, length 1024
19:28:33.418682 IP Planetlab1.CS.UCLA.EDU.50713 > 198.188.2.10.22222: UDP, length 1024
19:28:33.423195 IP Planetlab1.CS.UCLA.EDU.50713 > 198.188.2.10.22222: UDP, length 1024
19:28:33.427298 IP Planetlab1.CS.UCLA.EDU.50713 > 198.188.2.10.22222: UDP, length 1024
19:28:33.431811 IP Planetlab1.CS.UCLA.EDU.50713 > 198.188.2.10.22222: UDP, length 1024
19:28:33.435914 IP Planetlab1.CS.UCLA.EDU.50713 > 198.188.2.10.22222: UDP, length 1024
19:28:33.440426 IP Planetlab1.CS.UCLA.EDU.50713 > 198.188.2.10.22222: UDP, length 1024
19:28:33.444534 IP Planetlab1.CS.UCLA.EDU.50713 > 198.188.2.10.22222: UDP, length 1024
19:28:33.449042 IP Planetlab1.CS.UCLA.EDU.50713 > 198.188.2.10.22222: UDP, length 1024
19:28:33.453146 IP Planetlab1.CS.UCLA.EDU.50713 > 198.188.2.10.22222: UDP, length 1024
19:28:33.457659 IP Planetlab1.CS.UCLA.EDU.50713 > 198.188.2.10.22222: UDP, length 1024
19:28:33.461763 IP Planetlab1.CS.UCLA.EDU.50713 > 198.188.2.10.22222: UDP, length 1024
19:28:33.466274 IP Planetlab1.CS.UCLA.EDU.50713 > 198.188.2.10.22222: UDP, length 1024
19:28:33.470379 IP Planetlab1.CS.UCLA.EDU.50713 > 198.188.2.10.22222: UDP, length 1024
19:28:33.474891 IP Planetlab1.CS.UCLA.EDU.50713 > 198.188.2.10.22222: UDP, length 1024
19:28:33.478995 IP Planetlab1.CS.UCLA.EDU.50713 > 198.188.2.10.22222: UDP, length 1024
19:28:33.483092 IP Planetlab1.CS.UCLA.EDU.50713 > 198.188.2.10.22222: UDP, length 1024
19:28:33.487616 IP Planetlab1.CS.UCLA.EDU.50713 > 198.188.2.10.22222: UDP, length 1024
19:28:33.491716 IP Planetlab1.CS.UCLA.EDU.50713 > 198.188.2.10.22222: UDP, length 1024
19:28:33.496227 IP Planetlab1.CS.UCLA.EDU.50713 > 198.188.2.10.22222: UDP, length 1024
19:28:33.500332 IP Planetlab1.CS.UCLA.EDU.50713 > 198.188.2.10.22222: UDP, length 1024
19:28:33.504844 IP Planetlab1.CS.UCLA.EDU.50713 > 198.188.2.10.22222: UDP, length 1024
19:28:33.508946 IP Planetlab1.CS.UCLA.EDU.50713 > 198.188.2.10.22222: UDP, length 1024
19:28:33.513459 IP Planetlab1.CS.UCLA.EDU.50713 > 198.188.2.10.22222: UDP, length 1024
19:28:33.517564 IP Planetlab1.CS.UCLA.EDU.50713 > 198.188.2.10.22222: UDP, length 1024
19:28:33.522075 IP Planetlab1.CS.UCLA.EDU.50713 > 198.188.2.10.22222: UDP, length 1024
19:28:33.526178 IP Planetlab1.CS.UCLA.EDU.50713 > 198.188.2.10.22222: UDP, length 1024
19:28:33.530697 IP Planetlab1.CS.UCLA.EDU.50713 > 198.188.2.10.22222: UDP, length 1024
19:28:33.534795 IP Planetlab1.CS.UCLA.EDU.50713 > 198.188.2.10.22222: UDP, length 1024
19:28:33.539308 IP Planetlab1.CS.UCLA.EDU.50713 > 198.188.2.10.22222: UDP, length 1024
19:28:33.543411 IP Planetlab1.CS.UCLA.EDU.50713 > 198.188.2.10.22222: UDP, length 1024
19:28:33.547516 IP Planetlab1.CS.UCLA.EDU.50713 > 198.188.2.10.22222: UDP, length 1024
19:28:33.552027 IP Planetlab1.CS.UCLA.EDU.50713 > 198.188.2.10.22222: UDP, length 1024
19:28:33.556132 IP Planetlab1.CS.UCLA.EDU.50713 > 198.188.2.10.22222: UDP, length 1024
19:28:33.560644 IP Planetlab1.CS.UCLA.EDU.50713 > 198.188.2.10.22222: UDP, length 1024
19:28:33.564748 IP Planetlab1.CS.UCLA.EDU.50713 > 198.188.2.10.22222: UDP, length 1024
19:28:33.569260 IP Planetlab1.CS.UCLA.EDU.50713 > 198.188.2.10.22222: UDP, length 1024
19:28:33.573363 IP Planetlab1.CS.UCLA.EDU.50713 > 198.188.2.10.22222: UDP, length 1024
19:28:33.577875 IP Planetlab1.CS.UCLA.EDU.50713 > 198.188.2.10.22222: UDP, length 1024
19:28:33.581979 IP Planetlab1.CS.UCLA.EDU.50713 > 198.188.2.10.22222: UDP, length 1024
19:28:33.586491 IP Planetlab1.CS.UCLA.EDU.50713 > 198.188.2.10.22222: UDP, length 1024
19:28:33.590597 IP Planetlab1.CS.UCLA.EDU.50713 > 198.188.2.10.22222: UDP, length 1024
19:28:33.595102 IP Planetlab1.CS.UCLA.EDU.50713 > 198.188.2.10.22222: UDP, length 1024
19:28:33.599213 IP Planetlab1.CS.UCLA.EDU.50713 > 198.188.2.10.22222: UDP, length 1024
19:28:33.603723 IP Planetlab1.CS.UCLA.EDU.50713 > 198.188.2.10.22222: UDP, length 1024
19:28:33.607827 IP Planetlab1.CS.UCLA.EDU.50713 > 198.188.2.10.22222: UDP, length 1024
19:28:33.611932 IP Planetlab1.CS.UCLA.EDU.50713 > 198.188.2.10.22222: UDP, length 1024
19:28:33.616444 IP Planetlab1.CS.UCLA.EDU.50713 > 198.188.2.10.22222: UDP, length 1024
19:28:33.620549 IP Planetlab1.CS.UCLA.EDU.50713 > 198.188.2.10.22222: UDP, length 1024
19:28:33.625060 IP Planetlab1.CS.UCLA.EDU.50713 > 198.188.2.10.22222: UDP, length 1024
19:28:33.629164 IP Planetlab1.CS.UCLA.EDU.50713 > 198.188.2.10.22222: UDP, length 1024
19:28:33.633676 IP Planetlab1.CS.UCLA.EDU.50713 > 198.188.2.10.22222: UDP, length 1024
19:28:33.637779 IP Planetlab1.CS.UCLA.EDU.50713 > 198.188.2.10.22222: UDP, length 1024
19:28:33.642290 IP Planetlab1.CS.UCLA.EDU.50713 > 198.188.2.10.22222: UDP, length 1024
19:28:33.646397 IP Planetlab1.CS.UCLA.EDU.50713 > 198.188.2.10.22222: UDP, length 1024
19:28:33.650908 IP Planetlab1.CS.UCLA.EDU.50713 > 198.188.2.10.22222: UDP, length 1024
19:28:33.655015 IP Planetlab1.CS.UCLA.EDU.50713 > 198.188.2.10.22222: UDP, length 1024
19:28:33.659526 IP Planetlab1.CS.UCLA.EDU.50713 > 198.188.2.10.22222: UDP, length 1024
19:28:33.663628 IP Planetlab1.CS.UCLA.EDU.50713 > 198.188.2.10.22222: UDP, length 1024
19:28:33.668140 IP Planetlab1.CS.UCLA.EDU.50713 > 198.188.2.10.22222: UDP, length 1024
19:28:33.672245 IP Planetlab1.CS.UCLA.EDU.50713 > 198.188.2.10.22222: UDP, length 1024
19:28:33.676348 IP Planetlab1.CS.UCLA.EDU.50713 > 198.188.2.10.22222: UDP, length 1024
19:28:33.680861 IP Planetlab1.CS.UCLA.EDU.50713 > 198.188.2.10.22222: UDP, length 1024
19:28:33.684965 IP Planetlab1.CS.UCLA.EDU.50713 > 198.188.2.10.22222: UDP, length 1024
19:28:33.689477 IP Planetlab1.CS.UCLA.EDU.50713 > 198.188.2.10.22222: UDP, length 1024
19:28:33.693581 IP Planetlab1.CS.UCLA.EDU.50713 > 198.188.2.10.22222: UDP, length 1024
19:28:33.698097 IP Planetlab1.CS.UCLA.EDU.50713 > 198.188.2.10.22222: UDP, length 1024
19:28:33.702198 IP Planetlab1.CS.UCLA.EDU.50713 > 198.188.2.10.22222: UDP, length 1024
19:28:33.706710 IP Planetlab1.CS.UCLA.EDU.50713 > 198.188.2.10.22222: UDP, length 1024
19:28:33.710812 IP Planetlab1.CS.UCLA.EDU.50713 > 198.188.2.10.22222: UDP, length 1024
19:28:33.715325 IP Planetlab1.CS.UCLA.EDU.50713 > 198.188.2.10.22222: UDP, length 1024
19:28:33.719429 IP Planetlab1.CS.UCLA.EDU.50713 > 198.188.2.10.22222: UDP, length 1024
19:28:33.723942 IP Planetlab1.CS.UCLA.EDU.50713 > 198.188.2.10.22222: UDP, length 1024
19:28:33.728046 IP Planetlab1.CS.UCLA.EDU.20000 > 198.188.2.10.22222: UDP, length 1024
19:28:33.732558 IP Planetlab1.CS.UCLA.EDU.20000 > 198.188.2.10.22222: UDP, length 1024
19:28:33.736661 IP Planetlab1.CS.UCLA.EDU.20000 > 198.188.2.10.22222: UDP, length 1024
19:28:33.741173 IP Planetlab1.CS.UCLA.EDU.20000 > 198.188.2.10.22222: UDP, length 1024
19:28:33.745276 IP Planetlab1.CS.UCLA.EDU.20000 > 198.188.2.10.22222: UDP, length 1024
19:28:33.749381 IP Planetlab1.CS.UCLA.EDU.20000 > 198.188.2.10.22222: UDP, length 1024
19:28:33.753892 IP Planetlab1.CS.UCLA.EDU.20000 > 198.188.2.10.22222: UDP, length 1024
19:28:33.757998 IP Planetlab1.CS.UCLA.EDU.20000 > 198.188.2.10.22222: UDP, length 1024
19:28:33.762509 IP Planetlab1.CS.UCLA.EDU.20000 > 198.188.2.10.22222: UDP, length 1024
19:28:33.766614 IP Planetlab1.CS.UCLA.EDU.20000 > 198.188.2.10.22222: UDP, length 1024
19:28:33.771120 IP Planetlab1.CS.UCLA.EDU.20000 > 198.188.2.10.22222: UDP, length 1024
19:28:33.775229 IP Planetlab1.CS.UCLA.EDU.20000 > 198.188.2.10.22222: UDP, length 1024
19:28:33.779741 IP Planetlab1.CS.UCLA.EDU.20000 > 198.188.2.10.22222: UDP, length 1024
19:28:33.783846 IP Planetlab1.CS.UCLA.EDU.20000 > 198.188.2.10.22222: UDP, length 1024
19:28:33.788358 IP Planetlab1.CS.UCLA.EDU.20000 > 198.188.2.10.22222: UDP, length 1024
19:28:33.792462 IP Planetlab1.CS.UCLA.EDU.20000 > 198.188.2.10.22222: UDP, length 1024
19:28:33.796975 IP Planetlab1.CS.UCLA.EDU.20000 > 198.188.2.10.22222: UDP, length 1024
19:28:33.801078 IP Planetlab1.CS.UCLA.EDU.20000 > 198.188.2.10.22222: UDP, length 1024
19:28:33.805589 IP Planetlab1.CS.UCLA.EDU.20000 > 198.188.2.10.22222: UDP, length 1024
19:28:33.809693 IP Planetlab1.CS.UCLA.EDU.20000 > 198.188.2.10.22222: UDP, length 1024
19:28:33.813798 IP Planetlab1.CS.UCLA.EDU.20000 > 198.188.2.10.22222: UDP, length 1024
19:28:33.818310 IP Planetlab1.CS.UCLA.EDU.20000 > 198.188.2.10.22222: UDP, length 1024
19:28:33.822414 IP Planetlab1.CS.UCLA.EDU.20000 > 198.188.2.10.22222: UDP, length 1024
19:28:33.826926 IP Planetlab1.CS.UCLA.EDU.20000 > 198.188.2.10.22222: UDP, length 1024
19:28:33.831031 IP Planetlab1.CS.UCLA.EDU.20000 > 198.188.2.10.22222: UDP, length 1024
19:28:33.835542 IP Planetlab1.CS.UCLA.EDU.20000 > 198.188.2.10.22222: UDP, length 1024
19:28:33.839647 IP Planetlab1.CS.UCLA.EDU.20000 > 198.188.2.10.22222: UDP, length 1024
19:28:33.844159 IP Planetlab1.CS.UCLA.EDU.20000 > 198.188.2.10.22222: UDP, length 1024
19:28:33.848263 IP Planetlab1.CS.UCLA.EDU.20000 > 198.188.2.10.22222: UDP, length 1024
19:28:33.852774 IP Planetlab1.CS.UCLA.EDU.20000 > 198.188.2.10.22222: UDP, length 1024
19:28:33.856879 IP Planetlab1.CS.UCLA.EDU.20000 > 198.188.2.10.22222: UDP, length 1024
19:28:33.861391 IP Planetlab1.CS.UCLA.EDU.20000 > 198.188.2.10.22222: UDP, length 1024
19:28:33.865496 IP Planetlab1.CS.UCLA.EDU.20000 > 198.188.2.10.22222: UDP, length 1024
19:28:33.870006 IP Planetlab1.CS.UCLA.EDU.20000 > 198.188.2.10.22222: UDP, length 1024
19:28:33.874112 IP Planetlab1.CS.UCLA.EDU.20000 > 198.188.2.10.22222: UDP, length 1024
19:28:33.878214 IP Planetlab1.CS.UCLA.EDU.20000 > 198.188.2.10.22222: UDP, length 1024
19:28:33.882727 IP Planetlab1.CS.UCLA.EDU.20000 > 198.188.2.10.22222: UDP, length 1024
19:28:33.886832 IP Planetlab1.CS.UCLA.EDU.20000 > 198.188.2.10.22222: UDP, length 1024
19:28:33.891343 IP Planetlab1.CS.UCLA.EDU.20000 > 198.188.2.10.22222: UDP, length 1024
19:28:33.895446 IP Planetlab1.CS.UCLA.EDU.20000 > 198.188.2.10.22222: UDP, length 1024
19:28:33.899959 IP Planetlab1.CS.UCLA.EDU.20000 > 198.188.2.10.22222: UDP, length 1024
19:28:33.904064 IP Planetlab1.CS.UCLA.EDU.20000 > 198.188.2.10.22222: UDP, length 1024
19:28:33.908581 IP Planetlab1.CS.UCLA.EDU.20000 > 198.188.2.10.22222: UDP, length 1024
19:28:33.912678 IP Planetlab1.CS.UCLA.EDU.20000 > 198.188.2.10.22222: UDP, length 1024
19:28:33.917191 IP Planetlab1.CS.UCLA.EDU.20000 > 198.188.2.10.22222: UDP, length 1024
19:28:33.921294 IP Planetlab1.CS.UCLA.EDU.20000 > 198.188.2.10.22222: UDP, length 1024
19:28:33.925807 IP Planetlab1.CS.UCLA.EDU.20000 > 198.188.2.10.22222: UDP, length 1024
19:28:33.929911 IP Planetlab1.CS.UCLA.EDU.20000 > 198.188.2.10.22222: UDP, length 1024
19:28:33.934423 IP Planetlab1.CS.UCLA.EDU.20000 > 198.188.2.10.22222: UDP, length 1024
19:28:33.938528 IP Planetlab1.CS.UCLA.EDU.20000 > 198.188.2.10.22222: UDP, length 1024
19:28:33.942634 IP Planetlab1.CS.UCLA.EDU.20000 > 198.188.2.10.22222: UDP, length 1024
19:28:33.947136 IP Planetlab1.CS.UCLA.EDU.20000 > 198.188.2.10.22222: UDP, length 1024
19:28:33.951247 IP Planetlab1.CS.UCLA.EDU.20000 > 198.188.2.10.22222: UDP, length 1024
19:28:33.955759 IP Planetlab1.CS.UCLA.EDU.20000 > 198.188.2.10.22222: UDP, length 1024
19:28:33.959864 IP Planetlab1.CS.UCLA.EDU.20000 > 198.188.2.10.22222: UDP, length 1024
19:28:33.964377 IP Planetlab1.CS.UCLA.EDU.20000 > 198.188.2.10.22222: UDP, length 1024
19:28:33.968482 IP Planetlab1.CS.UCLA.EDU.20000 > 198.188.2.10.22222: UDP, length 1024
19:28:33.972992 IP Planetlab1.CS.UCLA.EDU.20000 > 198.188.2.10.22222: UDP, length 1024
19:28:33.977095 IP Planetlab1.CS.UCLA.EDU.20000 > 198.188.2.10.22222: UDP, length 1024
19:28:33.981608 IP Planetlab1.CS.UCLA.EDU.20000 > 198.188.2.10.22222: UDP, length 1024
19:28:33.985711 IP Planetlab1.CS.UCLA.EDU.20000 > 198.188.2.10.22222: UDP, length 1024
19:28:33.990223 IP Planetlab1.CS.UCLA.EDU.20000 > 198.188.2.10.22222: UDP, length 1024
19:28:33.994328 IP Planetlab1.CS.UCLA.EDU.20000 > 198.188.2.10.22222: UDP, length 1024
19:28:33.998841 IP Planetlab1.CS.UCLA.EDU.20000 > 198.188.2.10.22222: UDP, length 1024
19:28:34.002945 IP Planetlab1.CS.UCLA.EDU.20000 > 198.188.2.10.22222: UDP, length 1024
19:28:34.007456 IP Planetlab1.CS.UCLA.EDU.20000 > 198.188.2.10.22222: UDP, length 1024
19:28:34.011559 IP Planetlab1.CS.UCLA.EDU.20000 > 198.188.2.10.22222: UDP, length 1024
19:28:34.015664 IP Planetlab1.CS.UCLA.EDU.20000 > 198.188.2.10.22222: UDP, length 1024
19:28:34.020176 IP Planetlab1.CS.UCLA.EDU.20000 > 198.188.2.10.22222: UDP, length 1024
19:28:34.024282 IP Planetlab1.CS.UCLA.EDU.20000 > 198.188.2.10.22222: UDP, length 1024
19:28:34.028793 IP Planetlab1.CS.UCLA.EDU.20000 > 198.188.2.10.22222: UDP, length 1024
19:28:34.032897 IP Planetlab1.CS.UCLA.EDU.20000 > 198.188.2.10.22222: UDP, length 1024
19:28:34.037407 IP Planetlab1.CS.UCLA.EDU.20000 > 198.188.2.10.22222: UDP, length 1024
19:28:34.041513 IP Planetlab1.CS.UCLA.EDU.20000 > 198.188.2.10.22222: UDP, length 1024
19:28:34.046025 IP Planetlab1.CS.UCLA.EDU.20000 > 198.188.2.10.22222: UDP, length 1024
19:28:34.050128 IP Planetlab1.CS.UCLA.EDU.20000 > 198.188.2.10.22222: UDP, length 1024
19:28:34.054641 IP Planetlab1.CS.UCLA.EDU.20000 > 198.188.2.10.22222: UDP, length 1024
19:28:34.058745 IP Planetlab1.CS.UCLA.EDU.20000 > 198.188.2.10.22222: UDP, length 1024
19:28:34.063256 IP Planetlab1.CS.UCLA.EDU.20000 > 198.188.2.10.22222: UDP, length 1024
19:28:34.067360 IP Planetlab1.CS.UCLA.EDU.20000 > 198.188.2.10.22222: UDP, length 1024
19:28:34.071872 IP Planetlab1.CS.UCLA.EDU.20000 > 198.188.2.10.22222: UDP, length 1024
19:28:34.075980 IP Planetlab1.CS.UCLA.EDU.20000 > 198.188.2.10.22222: UDP, length 1024
19:28:34.080080 IP Planetlab1.CS.UCLA.EDU.20000 > 198.188.2.10.22222: UDP, length 1024
19:28:34.084593 IP Planetlab1.CS.UCLA.EDU.20000 > 198.188.2.10.22222: UDP, length 1024
19:28:34.088697 IP Planetlab1.CS.UCLA.EDU.20000 > 198.188.2.10.22222: UDP, length 1024
19:28:34.093209 IP Planetlab1.CS.UCLA.EDU.20000 > 198.188.2.10.22222: UDP, length 1024
19:28:34.097312 IP Planetlab1.CS.UCLA.EDU.20000 > 198.188.2.10.22222: UDP, length 1024
19:28:34.101826 IP Planetlab1.CS.UCLA.EDU.20000 > 198.188.2.10.22222: UDP, length 1024
19:28:34.105929 IP Planetlab1.CS.UCLA.EDU.20000 > 198.188.2.10.22222: UDP, length 1024
19:28:34.110441 IP Planetlab1.CS.UCLA.EDU.20000 > 198.188.2.10.22222: UDP, length 1024
19:28:34.114545 IP Planetlab1.CS.UCLA.EDU.20000 > 198.188.2.10.22222: UDP, length 1024
19:28:34.119055 IP Planetlab1.CS.UCLA.EDU.20000 > 198.188.2.10.22222: UDP, length 1024
19:28:34.123162 IP Planetlab1.CS.UCLA.EDU.20000 > 198.188.2.10.22222: UDP, length 1024
19:28:34.127673 IP Planetlab1.CS.UCLA.EDU.20000 > 198.188.2.10.22222: UDP, length 1024
19:28:34.131779 IP Planetlab1.CS.UCLA.EDU.20000 > 198.188.2.10.22222: UDP, length 1024
19:28:34.136289 IP Planetlab1.CS.UCLA.EDU.20000 > 198.188.2.10.22222: UDP, length 1024
19:28:34.140394 IP Planetlab1.CS.UCLA.EDU.20000 > 198.188.2.10.22222: UDP, length 1024
19:28:34.144496 IP Planetlab1.CS.UCLA.EDU.20000 > 198.188.2.10.22222: UDP, length 1024
19:28:34.149008 IP Planetlab1.CS.UCLA.EDU.20000 > 198.188.2.10.22222: UDP, length 1024
19:28:34.153108 IP Planetlab1.CS.UCLA.EDU.20000 > 198.188.2.10.22222: UDP, length 1024
19:28:34.157626 IP Planetlab1.CS.UCLA.EDU.20000 > 198.188.2.10.22222: UDP, length 1024
19:28:34.161730 IP Planetlab1.CS.UCLA.EDU.20000 > 198.188.2.10.22222: UDP, length 1024
19:28:34.166242 IP Planetlab1.CS.UCLA.EDU.20000 > 198.188.2.10.22222: UDP, length 1024
19:28:34.170346 IP Planetlab1.CS.UCLA.EDU.20000 > 198.188.2.10.22222: UDP, length 1024
19:28:34.174858 IP Planetlab1.CS.UCLA.EDU.20000 > 198.188.2.10.22222: UDP, length 1024
19:28:34.178961 IP Planetlab1.CS.UCLA.EDU.20000 > 198.188.2.10.22222: UDP, length 1024
19:28:34.183473 IP Planetlab1.CS.UCLA.EDU.20000 > 198.188.2.10.22222: UDP, length 1024
19:28:34.187577 IP Planetlab1.CS.UCLA.EDU.20000 > 198.188.2.10.22222: UDP, length 1024
19:28:34.192091 IP Planetlab1.CS.UCLA.EDU.20000 > 198.188.2.10.22222: UDP, length 1024
19:28:34.196194 IP Planetlab1.CS.UCLA.EDU.20000 > 198.188.2.10.22222: UDP, length 1024
19:28:34.200706 IP Planetlab1.CS.UCLA.EDU.20000 > 198.188.2.10.22222: UDP, length 1024
19:28:34.204810 IP Planetlab1.CS.UCLA.EDU.20000 > 198.188.2.10.22222: UDP, length 1024
19:28:34.208915 IP Planetlab1.CS.UCLA.EDU.20000 > 198.188.2.10.22222: UDP, length 1024
19:28:34.213427 IP Planetlab1.CS.UCLA.EDU.20000 > 198.188.2.10.22222: UDP, length 1024
19:28:34.217529 IP Planetlab1.CS.UCLA.EDU.20000 > 198.188.2.10.22222: UDP, length 1024
19:28:34.222041 IP Planetlab1.CS.UCLA.EDU.20000 > 198.188.2.10.22222: UDP, length 1024
19:28:34.226145 IP Planetlab1.CS.UCLA.EDU.20000 > 198.188.2.10.22222: UDP, length 1024
19:28:34.230659 IP Planetlab1.CS.UCLA.EDU.20000 > 198.188.2.10.22222: UDP, length 1024
19:28:34.234763 IP Planetlab1.CS.UCLA.EDU.20000 > 198.188.2.10.22222: UDP, length 1024
19:28:34.239274 IP Planetlab1.CS.UCLA.EDU.20000 > 198.188.2.10.22222: UDP, length 1024
19:28:34.243383 IP Planetlab1.CS.UCLA.EDU.20000 > 198.188.2.10.22222: UDP, length 1024
19:28:34.247891 IP Planetlab1.CS.UCLA.EDU.20000 > 198.188.2.10.22222: UDP, length 1024
19:28:34.251993 IP Planetlab1.CS.UCLA.EDU.20000 > 198.188.2.10.22222: UDP, length 1024
19:28:34.256505 IP Planetlab1.CS.UCLA.EDU.20000 > 198.188.2.10.22222: UDP, length 1024
19:28:34.260611 IP Planetlab1.CS.UCLA.EDU.20000 > 198.188.2.10.22222: UDP, length 1024
19:28:34.265122 IP Planetlab1.CS.UCLA.EDU.20000 > 198.188.2.10.22222: UDP, length 1024
19:28:34.269228 IP Planetlab1.CS.UCLA.EDU.20000 > 198.188.2.10.22222: UDP, length 1024
19:28:34.273739 IP Planetlab1.CS.UCLA.EDU.20000 > 198.188.2.10.22222: UDP, length 1024
19:28:34.277843 IP Planetlab1.CS.UCLA.EDU.20000 > 198.188.2.10.22222: UDP, length 1024
19:28:34.281946 IP Planetlab1.CS.UCLA.EDU.20000 > 198.188.2.10.22222: UDP, length 1024
19:28:34.286457 IP Planetlab1.CS.UCLA.EDU.20000 > 198.188.2.10.22222: UDP, length 1024
19:28:34.290562 IP Planetlab1.CS.UCLA.EDU.20000 > 198.188.2.10.22222: UDP, length 1024
19:28:34.295074 IP Planetlab1.CS.UCLA.EDU.20000 > 198.188.2.10.22222: UDP, length 1024
19:28:34.299179 IP Planetlab1.CS.UCLA.EDU.20000 > 198.188.2.10.22222: UDP, length 1024
19:28:34.303691 IP Planetlab1.CS.UCLA.EDU.20000 > 198.188.2.10.22222: UDP, length 1024
19:28:34.307796 IP Planetlab1.CS.UCLA.EDU.20000 > 198.188.2.10.22222: UDP, length 1024
19:28:34.312308 IP Planetlab1.CS.UCLA.EDU.20000 > 198.188.2.10.22222: UDP, length 1024
