18:24:22.227591 IP 192.91.235.230.57784 > 198.188.2.10.22222: UDP, length 1024
18:24:22.231696 IP 192.91.235.230.57784 > 198.188.2.10.22222: UDP, length 1024
18:24:22.236207 IP 192.91.235.230.57784 > 198.188.2.10.22222: UDP, length 1024
18:24:22.240310 IP 192.91.235.230.57784 > 198.188.2.10.22222: UDP, length 1024
18:24:22.244824 IP 192.91.235.230.57784 > 198.188.2.10.22222: UDP, length 1024
18:24:22.248926 IP 192.91.235.230.57784 > 198.188.2.10.22222: UDP, length 1024
18:24:22.253437 IP 192.91.235.230.57784 > 198.188.2.10.22222: UDP, length 1024
18:24:22.257544 IP 192.91.235.230.57784 > 198.188.2.10.22222: UDP, length 1024
18:24:22.262054 IP 192.91.235.230.57784 > 198.188.2.10.22222: UDP, length 1024
18:24:22.266160 IP 192.91.235.230.57784 > 198.188.2.10.22222: UDP, length 1024
18:24:22.270672 IP 192.91.235.230.57784 > 198.188.2.10.22222: UDP, length 1024
18:24:22.274776 IP 192.91.235.230.57784 > 198.188.2.10.22222: UDP, length 1024
18:24:22.279281 IP 192.91.235.230.57784 > 198.188.2.10.22222: UDP, length 1024
18:24:22.283390 IP 192.91.235.230.57784 > 198.188.2.10.22222: UDP, length 1024
18:24:22.287903 IP 192.91.235.230.57784 > 198.188.2.10.22222: UDP, length 1024
18:24:22.292007 IP 192.91.235.230.57784 > 198.188.2.10.22222: UDP, length 1024
18:24:22.296112 IP 192.91.235.230.57784 > 198.188.2.10.22222: UDP, length 1024
18:24:22.300626 IP 192.91.235.230.57784 > 198.188.2.10.22222: UDP, length 1024
18:24:22.304728 IP 192.91.235.230.57784 > 198.188.2.10.22222: UDP, length 1024
18:24:22.309239 IP 192.91.235.230.57784 > 198.188.2.10.22222: UDP, length 1024
18:24:22.313342 IP 192.91.235.230.57784 > 198.188.2.10.22222: UDP, length 1024
18:24:22.317857 IP 192.91.235.230.57784 > 198.188.2.10.22222: UDP, length 1024
18:24:22.321960 IP 192.91.235.230.57784 > 198.188.2.10.22222: UDP, length 1024
18:24:22.326471 IP 192.91.235.230.57784 > 198.188.2.10.22222: UDP, length 1024
18:24:22.330581 IP 192.91.235.230.57784 > 198.188.2.10.22222: UDP, length 1024
18:24:22.335087 IP 192.91.235.230.57784 > 198.188.2.10.22222: UDP, length 1024
18:24:22.339192 IP 192.91.235.230.57784 > 198.188.2.10.22222: UDP, length 1024
18:24:22.343703 IP 192.91.235.230.57784 > 198.188.2.10.22222: UDP, length 1024
18:24:22.347810 IP 192.91.235.230.57784 > 198.188.2.10.22222: UDP, length 1024
18:24:22.352321 IP 192.91.235.230.57784 > 198.188.2.10.22222: UDP, length 1024
18:24:22.356424 IP 192.91.235.230.57784 > 198.188.2.10.22222: UDP, length 1024
18:24:22.360528 IP 192.91.235.230.57784 > 198.188.2.10.22222: UDP, length 1024
18:24:22.365041 IP 192.91.235.230.57784 > 198.188.2.10.22222: UDP, length 1024
18:24:22.369143 IP 192.91.235.230.57784 > 198.188.2.10.22222: UDP, length 1024
18:24:22.373657 IP 192.91.235.230.57784 > 198.188.2.10.22222: UDP, length 1024
18:24:22.377765 IP 192.91.235.230.57784 > 198.188.2.10.22222: UDP, length 1024
18:24:22.382273 IP 192.91.235.230.57784 > 198.188.2.10.22222: UDP, length 1024
18:24:22.386376 IP 192.91.235.230.57784 > 198.188.2.10.22222: UDP, length 1024
18:24:22.390888 IP 192.91.235.230.57784 > 198.188.2.10.22222: UDP, length 1024
18:24:22.394992 IP 192.91.235.230.57784 > 198.188.2.10.22222: UDP, length 1024
18:24:22.399505 IP 192.91.235.230.57784 > 198.188.2.10.22222: UDP, length 1024
18:24:22.403584 IP 192.91.235.230.57784 > 198.188.2.10.22222: UDP, length 1024
18:24:22.408096 IP 192.91.235.230.57784 > 198.188.2.10.22222: UDP, length 1024
18:24:22.412200 IP 192.91.235.230.57784 > 198.188.2.10.22222: UDP, length 1024
18:24:22.416714 IP 192.91.235.230.57784 > 198.188.2.10.22222: UDP, length 1024
18:24:22.420815 IP 192.91.235.230.57784 > 198.188.2.10.22222: UDP, length 1024
18:24:22.424920 IP 192.91.235.230.57784 > 198.188.2.10.22222: UDP, length 1024
18:24:22.429431 IP 192.91.235.230.57784 > 198.188.2.10.22222: UDP, length 1024
18:24:22.433536 IP 192.91.235.230.57784 > 198.188.2.10.22222: UDP, length 1024
18:24:22.438049 IP 192.91.235.230.57784 > 198.188.2.10.22222: UDP, length 1024
18:24:22.442156 IP 192.91.235.230.57784 > 198.188.2.10.22222: UDP, length 1024
18:24:22.446672 IP 192.91.235.230.57784 > 198.188.2.10.22222: UDP, length 1024
18:24:22.450775 IP 192.91.235.230.57784 > 198.188.2.10.22222: UDP, length 1024
18:24:22.455290 IP 192.91.235.230.57784 > 198.188.2.10.22222: UDP, length 1024
18:24:22.459496 IP 192.91.235.230.57784 > 198.188.2.10.22222: UDP, length 1024
18:24:22.463903 IP 192.91.235.230.57784 > 198.188.2.10.22222: UDP, length 1024
18:24:22.468010 IP 192.91.235.230.57784 > 198.188.2.10.22222: UDP, length 1024
18:24:22.472522 IP 192.91.235.230.57784 > 198.188.2.10.22222: UDP, length 1024
18:24:22.476626 IP 192.91.235.230.57784 > 198.188.2.10.22222: UDP, length 1024
18:24:22.481142 IP 192.91.235.230.57784 > 198.188.2.10.22222: UDP, length 1024
18:24:22.485242 IP 192.91.235.230.57784 > 198.188.2.10.22222: UDP, length 1024
18:24:22.489350 IP 192.91.235.230.57784 > 198.188.2.10.22222: UDP, length 1024
18:24:22.493864 IP 192.91.235.230.57784 > 198.188.2.10.22222: UDP, length 1024
18:24:22.497966 IP 192.91.235.230.57784 > 198.188.2.10.22222: UDP, length 1024
18:24:22.502471 IP 192.91.235.230.57784 > 198.188.2.10.22222: UDP, length 1024
18:24:22.506565 IP 192.91.235.230.57784 > 198.188.2.10.22222: UDP, length 1024
18:24:22.511087 IP 192.91.235.230.57784 > 198.188.2.10.22222: UDP, length 1024
18:24:22.515189 IP 192.91.235.230.57784 > 198.188.2.10.22222: UDP, length 1024
18:24:22.519701 IP 192.91.235.230.57784 > 198.188.2.10.22222: UDP, length 1024
18:24:22.523804 IP 192.91.235.230.57784 > 198.188.2.10.22222: UDP, length 1024
18:24:22.528316 IP 192.91.235.230.57784 > 198.188.2.10.22222: UDP, length 1024
18:24:22.532420 IP 192.91.235.230.57784 > 198.188.2.10.22222: UDP, length 1024
18:24:22.536931 IP 192.91.235.230.57784 > 198.188.2.10.22222: UDP, length 1024
18:24:22.541036 IP 192.91.235.230.57784 > 198.188.2.10.22222: UDP, length 1024
18:24:22.545549 IP 192.91.235.230.57784 > 198.188.2.10.22222: UDP, length 1024
18:24:22.549653 IP 192.91.235.230.57784 > 198.188.2.10.22222: UDP, length 1024
18:24:22.554166 IP 192.91.235.230.57784 > 198.188.2.10.22222: UDP, length 1024
18:24:22.558270 IP 192.91.235.230.57784 > 198.188.2.10.22222: UDP, length 1024
18:24:22.562375 IP 192.91.235.230.57784 > 198.188.2.10.22222: UDP, length 1024
18:24:22.566887 IP 192.91.235.230.57784 > 198.188.2.10.22222: UDP, length 1024
18:24:22.570992 IP 192.91.235.230.57784 > 198.188.2.10.22222: UDP, length 1024
18:24:22.575503 IP 192.91.235.230.57784 > 198.188.2.10.22222: UDP, length 1024
18:24:22.579608 IP 192.91.235.230.57784 > 198.188.2.10.22222: UDP, length 1024
18:24:22.584113 IP 192.91.235.230.57784 > 198.188.2.10.22222: UDP, length 1024
18:24:22.588212 IP 192.91.235.230.57784 > 198.188.2.10.22222: UDP, length 1024
18:24:22.592723 IP 192.91.235.230.57784 > 198.188.2.10.22222: UDP, length 1024
18:24:22.596845 IP 192.91.235.230.57784 > 198.188.2.10.22222: UDP, length 1024
18:24:22.601353 IP 192.91.235.230.57784 > 198.188.2.10.22222: UDP, length 1024
18:24:22.605453 IP 192.91.235.230.57784 > 198.188.2.10.22222: UDP, length 1024
18:24:22.609964 IP 192.91.235.230.57784 > 198.188.2.10.22222: UDP, length 1024
18:24:22.614070 IP 192.91.235.230.57784 > 198.188.2.10.22222: UDP, length 1024
18:24:22.618583 IP 192.91.235.230.57784 > 198.188.2.10.22222: UDP, length 1024
18:24:22.622687 IP 192.91.235.230.57784 > 198.188.2.10.22222: UDP, length 1024
18:24:22.626793 IP 192.91.235.230.57784 > 198.188.2.10.22222: UDP, length 1024
18:24:22.631306 IP 192.91.235.230.57784 > 198.188.2.10.22222: UDP, length 1024
18:24:22.635421 IP 192.91.235.230.57784 > 198.188.2.10.22222: UDP, length 1024
18:24:22.639919 IP 192.91.235.230.57784 > 198.188.2.10.22222: UDP, length 1024
18:24:22.644021 IP 192.91.235.230.57784 > 198.188.2.10.22222: UDP, length 1024
18:24:22.648521 IP 192.91.235.230.57784 > 198.188.2.10.22222: UDP, length 1024
18:24:22.652624 IP 192.91.235.230.57784 > 198.188.2.10.22222: UDP, length 1024
18:24:22.657136 IP 192.91.235.230.57784 > 198.188.2.10.22222: UDP, length 1024
18:24:22.661255 IP 192.91.235.230.57784 > 198.188.2.10.22222: UDP, length 1024
18:24:22.665765 IP 192.91.235.230.57784 > 198.188.2.10.22222: UDP, length 1024
18:24:22.669856 IP 192.91.235.230.57784 > 198.188.2.10.22222: UDP, length 1024
18:24:22.674381 IP 192.91.235.230.57784 > 198.188.2.10.22222: UDP, length 1024
18:24:22.678473 IP 192.91.235.230.57784 > 198.188.2.10.22222: UDP, length 1024
18:24:22.682997 IP 192.91.235.230.57784 > 198.188.2.10.22222: UDP, length 1024
18:24:22.687101 IP 192.91.235.230.57784 > 198.188.2.10.22222: UDP, length 1024
18:24:22.691228 IP 192.91.235.230.57784 > 198.188.2.10.22222: UDP, length 1024
18:24:22.695740 IP 192.91.235.230.57784 > 198.188.2.10.22222: UDP, length 1024
18:24:22.699843 IP 192.91.235.230.57784 > 198.188.2.10.22222: UDP, length 1024
18:24:22.704355 IP 192.91.235.230.57784 > 198.188.2.10.22222: UDP, length 1024
18:24:22.708463 IP 192.91.235.230.57784 > 198.188.2.10.22222: UDP, length 1024
18:24:22.712972 IP 192.91.235.230.57784 > 198.188.2.10.22222: UDP, length 1024
18:24:22.717077 IP 192.91.235.230.57784 > 198.188.2.10.22222: UDP, length 1024
18:24:22.721589 IP 192.91.235.230.57784 > 198.188.2.10.22222: UDP, length 1024
18:24:22.725691 IP 192.91.235.230.57784 > 198.188.2.10.22222: UDP, length 1024
18:24:22.730204 IP 192.91.235.230.57784 > 198.188.2.10.22222: UDP, length 1024
18:24:22.734307 IP 192.91.235.230.57784 > 198.188.2.10.22222: UDP, length 1024
18:24:22.738820 IP 192.91.235.230.57784 > 198.188.2.10.22222: UDP, length 1024
18:24:22.742925 IP 192.91.235.230.57784 > 198.188.2.10.22222: UDP, length 1024
18:24:22.747437 IP 192.91.235.230.57784 > 198.188.2.10.22222: UDP, length 1024
18:24:22.751542 IP 192.91.235.230.57784 > 198.188.2.10.22222: UDP, length 1024
18:24:22.755645 IP 192.91.235.230.57784 > 198.188.2.10.22222: UDP, length 1024
18:24:22.760156 IP 192.91.235.230.57784 > 198.188.2.10.22222: UDP, length 1024
18:24:22.764260 IP 192.91.235.230.57784 > 198.188.2.10.22222: UDP, length 1024
18:24:22.768772 IP 192.91.235.230.57784 > 198.188.2.10.22222: UDP, length 1024
18:24:22.772878 IP 192.91.235.230.57784 > 198.188.2.10.22222: UDP, length 1024
18:24:22.777389 IP 192.91.235.230.57784 > 198.188.2.10.22222: UDP, length 1024
18:24:22.781493 IP 192.91.235.230.57784 > 198.188.2.10.22222: UDP, length 1024
18:24:22.786006 IP 192.91.235.230.57784 > 198.188.2.10.22222: UDP, length 1024
18:24:22.790109 IP 192.91.235.230.57784 > 198.188.2.10.22222: UDP, length 1024
18:24:22.794620 IP 192.91.235.230.57784 > 198.188.2.10.22222: UDP, length 1024
18:24:22.798725 IP 192.91.235.230.57784 > 198.188.2.10.22222: UDP, length 1024
18:24:22.803237 IP 192.91.235.230.57784 > 198.188.2.10.22222: UDP, length 1024
18:24:22.807341 IP 192.91.235.230.57784 > 198.188.2.10.22222: UDP, length 1024
18:24:22.811853 IP 192.91.235.230.57784 > 198.188.2.10.22222: UDP, length 1024
18:24:22.815956 IP 192.91.235.230.57784 > 198.188.2.10.22222: UDP, length 1024
18:24:22.820470 IP 192.91.235.230.57784 > 198.188.2.10.22222: UDP, length 1024
18:24:22.824573 IP 192.91.235.230.57784 > 198.188.2.10.22222: UDP, length 1024
18:24:22.828677 IP 192.91.235.230.57784 > 198.188.2.10.22222: UDP, length 1024
18:24:22.833190 IP 192.91.235.230.57784 > 198.188.2.10.22222: UDP, length 1024
18:24:22.837293 IP 192.91.235.230.57784 > 198.188.2.10.22222: UDP, length 1024
18:24:22.841805 IP 192.91.235.230.57784 > 198.188.2.10.22222: UDP, length 1024
18:24:22.845910 IP 192.91.235.230.57784 > 198.188.2.10.22222: UDP, length 1024
18:24:22.850422 IP 192.91.235.230.57784 > 198.188.2.10.22222: UDP, length 1024
18:24:22.854526 IP 192.91.235.230.57784 > 198.188.2.10.22222: UDP, length 1024
18:24:22.859038 IP 192.91.235.230.57784 > 198.188.2.10.22222: UDP, length 1024
18:24:22.863141 IP 192.91.235.230.57784 > 198.188.2.10.22222: UDP, length 1024
18:24:22.867655 IP 192.91.235.230.57784 > 198.188.2.10.22222: UDP, length 1024
18:24:22.871756 IP 192.91.235.230.57784 > 198.188.2.10.22222: UDP, length 1024
18:24:22.876269 IP 192.91.235.230.57784 > 198.188.2.10.22222: UDP, length 1024
18:24:22.880373 IP 192.91.235.230.57784 > 198.188.2.10.22222: UDP, length 1024
18:24:22.884887 IP 192.91.235.230.57784 > 198.188.2.10.22222: UDP, length 1024
18:24:22.888990 IP 192.91.235.230.57784 > 198.188.2.10.22222: UDP, length 1024
18:24:22.893094 IP 192.91.235.230.57784 > 198.188.2.10.22222: UDP, length 1024
18:24:22.897605 IP 192.91.235.230.57784 > 198.188.2.10.22222: UDP, length 1024
18:24:22.901709 IP 192.91.235.230.57784 > 198.188.2.10.22222: UDP, length 1024
18:24:22.906222 IP 192.91.235.230.57784 > 198.188.2.10.22222: UDP, length 1024
18:24:22.910326 IP 192.91.235.230.57784 > 198.188.2.10.22222: UDP, length 1024
18:24:22.914837 IP 192.91.235.230.57784 > 198.188.2.10.22222: UDP, length 1024
18:24:22.918942 IP 192.91.235.230.57784 > 198.188.2.10.22222: UDP, length 1024
18:24:22.923431 IP 192.91.235.230.57784 > 198.188.2.10.22222: UDP, length 1024
18:24:22.927558 IP 192.91.235.230.57784 > 198.188.2.10.22222: UDP, length 1024
18:24:22.932071 IP 192.91.235.230.57784 > 198.188.2.10.22222: UDP, length 1024
18:24:22.936173 IP 192.91.235.230.57784 > 198.188.2.10.22222: UDP, length 1024
18:24:22.940684 IP 192.91.235.230.57784 > 198.188.2.10.22222: UDP, length 1024
18:24:22.944791 IP 192.91.235.230.57784 > 198.188.2.10.22222: UDP, length 1024
18:24:22.949302 IP 192.91.235.230.57784 > 198.188.2.10.22222: UDP, length 1024
18:24:22.953407 IP 192.91.235.230.57784 > 198.188.2.10.22222: UDP, length 1024
18:24:22.957509 IP 192.91.235.230.57784 > 198.188.2.10.22222: UDP, length 1024
18:24:22.962024 IP 192.91.235.230.57784 > 198.188.2.10.22222: UDP, length 1024
18:24:22.966125 IP 192.91.235.230.57784 > 198.188.2.10.22222: UDP, length 1024
18:24:22.970637 IP 192.91.235.230.57784 > 198.188.2.10.22222: UDP, length 1024
18:24:22.974743 IP 192.91.235.230.57784 > 198.188.2.10.22222: UDP, length 1024
18:24:22.979254 IP 192.91.235.230.57784 > 198.188.2.10.22222: UDP, length 1024
18:24:22.983358 IP 192.91.235.230.57784 > 198.188.2.10.22222: UDP, length 1024
18:24:22.987871 IP 192.91.235.230.57784 > 198.188.2.10.22222: UDP, length 1024
18:24:22.991974 IP 192.91.235.230.57784 > 198.188.2.10.22222: UDP, length 1024
18:24:22.996486 IP 192.91.235.230.57784 > 198.188.2.10.22222: UDP, length 1024
18:24:23.000591 IP 192.91.235.230.57784 > 198.188.2.10.22222: UDP, length 1024
18:24:23.005108 IP 192.91.235.230.57784 > 198.188.2.10.22222: UDP, length 1024
18:24:23.009207 IP 192.91.235.230.57784 > 198.188.2.10.22222: UDP, length 1024
18:24:23.013719 IP 192.91.235.230.57784 > 198.188.2.10.22222: UDP, length 1024
18:24:23.017824 IP 192.91.235.230.57784 > 198.188.2.10.22222: UDP, length 1024
18:24:23.021927 IP 192.91.235.230.57784 > 198.188.2.10.22222: UDP, length 1024
18:24:23.026439 IP 192.91.235.230.57784 > 198.188.2.10.22222: UDP, length 1024
18:24:23.030544 IP 192.91.235.230.57784 > 198.188.2.10.22222: UDP, length 1024
18:24:23.035054 IP 192.91.235.230.57784 > 198.188.2.10.22222: UDP, length 1024
18:24:23.039159 IP 192.91.235.230.57784 > 198.188.2.10.22222: UDP, length 1024
18:24:23.043671 IP 192.91.235.230.57784 > 198.188.2.10.22222: UDP, length 1024
18:24:23.047775 IP 192.91.235.230.57784 > 198.188.2.10.22222: UDP, length 1024
18:24:23.052291 IP 192.91.235.230.57784 > 198.188.2.10.22222: UDP, length 1024
18:24:23.056391 IP 192.91.235.230.57784 > 198.188.2.10.22222: UDP, length 1024
18:24:23.060904 IP 192.91.235.230.57784 > 198.188.2.10.22222: UDP, length 1024
18:24:23.065008 IP 192.91.235.230.57784 > 198.188.2.10.22222: UDP, length 1024
18:24:23.069520 IP 192.91.235.230.57784 > 198.188.2.10.22222: UDP, length 1024
18:24:23.073624 IP 192.91.235.230.57784 > 198.188.2.10.22222: UDP, length 1024
18:24:23.078135 IP 192.91.235.230.57784 > 198.188.2.10.22222: UDP, length 1024
18:24:23.082239 IP 192.91.235.230.57784 > 198.188.2.10.22222: UDP, length 1024
18:24:23.086752 IP 192.91.235.230.57784 > 198.188.2.10.22222: UDP, length 1024
18:24:23.090855 IP 192.91.235.230.57784 > 198.188.2.10.22222: UDP, length 1024
18:24:23.094959 IP 192.91.235.230.57784 > 198.188.2.10.22222: UDP, length 1024
18:24:23.099472 IP 192.91.235.230.57784 > 198.188.2.10.22222: UDP, length 1024
18:24:23.103574 IP 192.91.235.230.57784 > 198.188.2.10.22222: UDP, length 1024
18:24:23.108087 IP 192.91.235.230.57784 > 198.188.2.10.22222: UDP, length 1024
18:24:23.112192 IP 192.91.235.230.57784 > 198.188.2.10.22222: UDP, length 1024
18:24:23.116704 IP 192.91.235.230.57784 > 198.188.2.10.22222: UDP, length 1024
18:24:23.120807 IP 192.91.235.230.57784 > 198.188.2.10.22222: UDP, length 1024
18:24:23.125319 IP 192.91.235.230.57784 > 198.188.2.10.22222: UDP, length 1024
18:24:23.129425 IP 192.91.235.230.57784 > 198.188.2.10.22222: UDP, length 1024
18:24:23.133935 IP 192.91.235.230.57784 > 198.188.2.10.22222: UDP, length 1024
18:24:23.138039 IP 192.91.235.230.57784 > 198.188.2.10.22222: UDP, length 1024
18:24:23.142551 IP 192.91.235.230.57784 > 198.188.2.10.22222: UDP, length 1024
18:24:23.146656 IP 192.91.235.230.57784 > 198.188.2.10.22222: UDP, length 1024
18:24:23.151169 IP 192.91.235.230.57784 > 198.188.2.10.22222: UDP, length 1024
18:24:23.155273 IP 192.91.235.230.57784 > 198.188.2.10.22222: UDP, length 1024
18:24:23.159376 IP 192.91.235.230.57784 > 198.188.2.10.22222: UDP, length 1024
18:24:23.163888 IP 192.91.235.230.57784 > 198.188.2.10.22222: UDP, length 1024
18:24:23.167993 IP 192.91.235.230.57784 > 198.188.2.10.22222: UDP, length 1024
18:24:23.172505 IP 192.91.235.230.57784 > 198.188.2.10.22222: UDP, length 1024
18:24:23.176609 IP 192.91.235.230.20000 > 198.188.2.10.22222: UDP, length 1024
18:24:23.181120 IP 192.91.235.230.20000 > 198.188.2.10.22222: UDP, length 1024
18:24:23.185223 IP 192.91.235.230.20000 > 198.188.2.10.22222: UDP, length 1024
18:24:23.189736 IP 192.91.235.230.20000 > 198.188.2.10.22222: UDP, length 1024
18:24:23.193840 IP 192.91.235.230.20000 > 198.188.2.10.22222: UDP, length 1024
18:24:23.198353 IP 192.91.235.230.20000 > 198.188.2.10.22222: UDP, length 1024
18:24:23.202458 IP 192.91.235.230.20000 > 198.188.2.10.22222: UDP, length 1024
18:24:23.206969 IP 192.91.235.230.20000 > 198.188.2.10.22222: UDP, length 1024
18:24:23.211072 IP 192.91.235.230.20000 > 198.188.2.10.22222: UDP, length 1024
18:24:23.215584 IP 192.91.235.230.20000 > 198.188.2.10.22222: UDP, length 1024
18:24:23.219687 IP 192.91.235.230.20000 > 198.188.2.10.22222: UDP, length 1024
18:24:23.223792 IP 192.91.235.230.20000 > 198.188.2.10.22222: UDP, length 1024
18:24:23.228305 IP 192.91.235.230.20000 > 198.188.2.10.22222: UDP, length 1024
18:24:23.232411 IP 192.91.235.230.20000 > 198.188.2.10.22222: UDP, length 1024
18:24:23.236920 IP 192.91.235.230.20000 > 198.188.2.10.22222: UDP, length 1024
18:24:23.241025 IP 192.91.235.230.20000 > 198.188.2.10.22222: UDP, length 1024
18:24:23.245537 IP 192.91.235.230.20000 > 198.188.2.10.22222: UDP, length 1024
18:24:23.249640 IP 192.91.235.230.20000 > 198.188.2.10.22222: UDP, length 1024
18:24:23.254152 IP 192.91.235.230.20000 > 198.188.2.10.22222: UDP, length 1024
18:24:23.258257 IP 192.91.235.230.20000 > 198.188.2.10.22222: UDP, length 1024
18:24:23.262772 IP 192.91.235.230.20000 > 198.188.2.10.22222: UDP, length 1024
18:24:23.266874 IP 192.91.235.230.20000 > 198.188.2.10.22222: UDP, length 1024
18:24:23.271385 IP 192.91.235.230.20000 > 198.188.2.10.22222: UDP, length 1024
18:24:23.275490 IP 192.91.235.230.20000 > 198.188.2.10.22222: UDP, length 1024
18:24:23.280001 IP 192.91.235.230.20000 > 198.188.2.10.22222: UDP, length 1024
18:24:23.284105 IP 192.91.235.230.20000 > 198.188.2.10.22222: UDP, length 1024
18:24:23.288208 IP 192.91.235.230.20000 > 198.188.2.10.22222: UDP, length 1024
18:24:23.292721 IP 192.91.235.230.20000 > 198.188.2.10.22222: UDP, length 1024
18:24:23.296830 IP 192.91.235.230.20000 > 198.188.2.10.22222: UDP, length 1024
18:24:23.301337 IP 192.91.235.230.20000 > 198.188.2.10.22222: UDP, length 1024
18:24:23.305442 IP 192.91.235.230.20000 > 198.188.2.10.22222: UDP, length 1024
18:24:23.309953 IP 192.91.235.230.20000 > 198.188.2.10.22222: UDP, length 1024
18:24:23.314058 IP 192.91.235.230.20000 > 198.188.2.10.22222: UDP, length 1024
18:24:23.318570 IP 192.91.235.230.20000 > 198.188.2.10.22222: UDP, length 1024
18:24:23.322674 IP 192.91.235.230.20000 > 198.188.2.10.22222: UDP, length 1024
18:24:23.327185 IP 192.91.235.230.20000 > 198.188.2.10.22222: UDP, length 1024
18:24:23.331290 IP 192.91.235.230.20000 > 198.188.2.10.22222: UDP, length 1024
18:24:23.335802 IP 192.91.235.230.20000 > 198.188.2.10.22222: UDP, length 1024
18:24:23.339910 IP 192.91.235.230.20000 > 198.188.2.10.22222: UDP, length 1024
18:24:23.344419 IP 192.91.235.230.20000 > 198.188.2.10.22222: UDP, length 1024
18:24:23.348522 IP 192.91.235.230.20000 > 198.188.2.10.22222: UDP, length 1024
18:24:23.353034 IP 192.91.235.230.20000 > 198.188.2.10.22222: UDP, length 1024
18:24:23.357137 IP 192.91.235.230.20000 > 198.188.2.10.22222: UDP, length 1024
18:24:23.361241 IP 192.91.235.230.20000 > 198.188.2.10.22222: UDP, length 1024
18:24:23.365753 IP 192.91.235.230.20000 > 198.188.2.10.22222: UDP, length 1024
18:24:23.369859 IP 192.91.235.230.20000 > 198.188.2.10.22222: UDP, length 1024
18:24:23.374371 IP 192.91.235.230.20000 > 198.188.2.10.22222: UDP, length 1024
18:24:23.378475 IP 192.91.235.230.20000 > 198.188.2.10.22222: UDP, length 1024
18:24:23.382990 IP 192.91.235.230.20000 > 198.188.2.10.22222: UDP, length 1024
18:24:23.387090 IP 192.91.235.230.20000 > 198.188.2.10.22222: UDP, length 1024
18:24:23.391601 IP 192.91.235.230.20000 > 198.188.2.10.22222: UDP, length 1024
18:24:23.395705 IP 192.91.235.230.20000 > 198.188.2.10.22222: UDP, length 1024
18:24:23.400218 IP 192.91.235.230.20000 > 198.188.2.10.22222: UDP, length 1024
18:24:23.404299 IP 192.91.235.230.20000 > 198.188.2.10.22222: UDP, length 1024
18:24:23.408810 IP 192.91.235.230.20000 > 198.188.2.10.22222: UDP, length 1024
18:24:23.412914 IP 192.91.235.230.20000 > 198.188.2.10.22222: UDP, length 1024
18:24:23.417426 IP 192.91.235.230.20000 > 198.188.2.10.22222: UDP, length 1024
18:24:23.421529 IP 192.91.235.230.20000 > 198.188.2.10.22222: UDP, length 1024
18:24:23.425633 IP 192.91.235.230.20000 > 198.188.2.10.22222: UDP, length 1024
18:24:23.430145 IP 192.91.235.230.20000 > 198.188.2.10.22222: UDP, length 1024
18:24:23.434250 IP 192.91.235.230.20000 > 198.188.2.10.22222: UDP, length 1024
18:24:23.438762 IP 192.91.235.230.20000 > 198.188.2.10.22222: UDP, length 1024
18:24:23.442867 IP 192.91.235.230.20000 > 198.188.2.10.22222: UDP, length 1024
18:24:23.447383 IP 192.91.235.230.20000 > 198.188.2.10.22222: UDP, length 1024
18:24:23.451506 IP 192.91.235.230.20000 > 198.188.2.10.22222: UDP, length 1024
18:24:23.455998 IP 192.91.235.230.20000 > 198.188.2.10.22222: UDP, length 1024
18:24:23.460108 IP 192.91.235.230.20000 > 198.188.2.10.22222: UDP, length 1024
18:24:23.464616 IP 192.91.235.230.20000 > 198.188.2.10.22222: UDP, length 1024
18:24:23.468723 IP 192.91.235.230.20000 > 198.188.2.10.22222: UDP, length 1024
18:24:23.473231 IP 192.91.235.230.20000 > 198.188.2.10.22222: UDP, length 1024
18:24:23.477339 IP 192.91.235.230.20000 > 198.188.2.10.22222: UDP, length 1024
18:24:23.481854 IP 192.91.235.230.20000 > 198.188.2.10.22222: UDP, length 1024
18:24:23.485958 IP 192.91.235.230.20000 > 198.188.2.10.22222: UDP, length 1024
18:24:23.490063 IP 192.91.235.230.20000 > 198.188.2.10.22222: UDP, length 1024
18:24:23.494575 IP 192.91.235.230.20000 > 198.188.2.10.22222: UDP, length 1024
18:24:23.498680 IP 192.91.235.230.20000 > 198.188.2.10.22222: UDP, length 1024
18:24:23.503182 IP 192.91.235.230.20000 > 198.188.2.10.22222: UDP, length 1024
18:24:23.507276 IP 192.91.235.230.20000 > 198.188.2.10.22222: UDP, length 1024
18:24:23.511804 IP 192.91.235.230.20000 > 198.188.2.10.22222: UDP, length 1024
18:24:23.515907 IP 192.91.235.230.20000 > 198.188.2.10.22222: UDP, length 1024
18:24:23.520420 IP 192.91.235.230.20000 > 198.188.2.10.22222: UDP, length 1024
18:24:23.524518 IP 192.91.235.230.20000 > 198.188.2.10.22222: UDP, length 1024
18:24:23.529036 IP 192.91.235.230.20000 > 198.188.2.10.22222: UDP, length 1024
18:24:23.533139 IP 192.91.235.230.20000 > 198.188.2.10.22222: UDP, length 1024
18:24:23.537653 IP 192.91.235.230.20000 > 198.188.2.10.22222: UDP, length 1024
18:24:23.541758 IP 192.91.235.230.20000 > 198.188.2.10.22222: UDP, length 1024
18:24:23.546271 IP 192.91.235.230.20000 > 198.188.2.10.22222: UDP, length 1024
18:24:23.550377 IP 192.91.235.230.20000 > 198.188.2.10.22222: UDP, length 1024
18:24:23.554480 IP 192.91.235.230.20000 > 198.188.2.10.22222: UDP, length 1024
18:24:23.558983 IP 192.91.235.230.20000 > 198.188.2.10.22222: UDP, length 1024
18:24:23.563098 IP 192.91.235.230.20000 > 198.188.2.10.22222: UDP, length 1024
18:24:23.567705 IP 192.91.235.230.20000 > 198.188.2.10.22222: UDP, length 1024
18:24:23.571707 IP 192.91.235.230.20000 > 198.188.2.10.22222: UDP, length 1024
18:24:23.576225 IP 192.91.235.230.20000 > 198.188.2.10.22222: UDP, length 1024
18:24:23.580324 IP 192.91.235.230.20000 > 198.188.2.10.22222: UDP, length 1024
18:24:23.584831 IP 192.91.235.230.20000 > 198.188.2.10.22222: UDP, length 1024
18:24:23.588934 IP 192.91.235.230.20000 > 198.188.2.10.22222: UDP, length 1024
18:24:23.593446 IP 192.91.235.230.20000 > 198.188.2.10.22222: UDP, length 1024
18:24:23.597552 IP 192.91.235.230.20000 > 198.188.2.10.22222: UDP, length 1024
18:24:23.602064 IP 192.91.235.230.20000 > 198.188.2.10.22222: UDP, length 1024
18:24:23.606169 IP 192.91.235.230.20000 > 198.188.2.10.22222: UDP, length 1024
18:24:23.610684 IP 192.91.235.230.20000 > 198.188.2.10.22222: UDP, length 1024
18:24:23.614785 IP 192.91.235.230.20000 > 198.188.2.10.22222: UDP, length 1024
18:24:23.619283 IP 192.91.235.230.20000 > 198.188.2.10.22222: UDP, length 1024
18:24:23.623590 IP 192.91.235.230.20000 > 198.188.2.10.22222: UDP, length 1024
18:24:23.627495 IP 192.91.235.230.20000 > 198.188.2.10.22222: UDP, length 1024
18:24:23.632003 IP 192.91.235.230.20000 > 198.188.2.10.22222: UDP, length 1024
18:24:23.636120 IP 192.91.235.230.20000 > 198.188.2.10.22222: UDP, length 1024
18:24:23.640630 IP 192.91.235.230.20000 > 198.188.2.10.22222: UDP, length 1024
18:24:23.644733 IP 192.91.235.230.20000 > 198.188.2.10.22222: UDP, length 1024
18:24:23.649234 IP 192.91.235.230.20000 > 198.188.2.10.22222: UDP, length 1024
18:24:23.653339 IP 192.91.235.230.20000 > 198.188.2.10.22222: UDP, length 1024
18:24:23.657852 IP 192.91.235.230.20000 > 198.188.2.10.22222: UDP, length 1024
18:24:23.661963 IP 192.91.235.230.20000 > 198.188.2.10.22222: UDP, length 1024
18:24:23.666487 IP 192.91.235.230.20000 > 198.188.2.10.22222: UDP, length 1024
18:24:23.670604 IP 192.91.235.230.20000 > 198.188.2.10.22222: UDP, length 1024
18:24:23.675118 IP 192.91.235.230.20000 > 198.188.2.10.22222: UDP, length 1024
18:24:23.679221 IP 192.91.235.230.20000 > 198.188.2.10.22222: UDP, length 1024
18:24:23.683738 IP 192.91.235.230.20000 > 198.188.2.10.22222: UDP, length 1024
18:24:23.687838 IP 192.91.235.230.20000 > 198.188.2.10.22222: UDP, length 1024
18:24:23.691940 IP 192.91.235.230.20000 > 198.188.2.10.22222: UDP, length 1024
18:24:23.696453 IP 192.91.235.230.20000 > 198.188.2.10.22222: UDP, length 1024
18:24:23.700558 IP 192.91.235.230.20000 > 198.188.2.10.22222: UDP, length 1024
18:24:23.705069 IP 192.91.235.230.20000 > 198.188.2.10.22222: UDP, length 1024
18:24:23.709174 IP 192.91.235.230.20000 > 198.188.2.10.22222: UDP, length 1024
18:24:23.713686 IP 192.91.235.230.20000 > 198.188.2.10.22222: UDP, length 1024
18:24:23.717793 IP 192.91.235.230.20000 > 198.188.2.10.22222: UDP, length 1024
18:24:23.722302 IP 192.91.235.230.20000 > 198.188.2.10.22222: UDP, length 1024
18:24:23.726404 IP 192.91.235.230.20000 > 198.188.2.10.22222: UDP, length 1024
18:24:23.730917 IP 192.91.235.230.20000 > 198.188.2.10.22222: UDP, length 1024
18:24:23.735022 IP 192.91.235.230.20000 > 198.188.2.10.22222: UDP, length 1024
18:24:23.739534 IP 192.91.235.230.20000 > 198.188.2.10.22222: UDP, length 1024
18:24:23.743639 IP 192.91.235.230.20000 > 198.188.2.10.22222: UDP, length 1024
18:24:23.748151 IP 192.91.235.230.20000 > 198.188.2.10.22222: UDP, length 1024
18:24:23.752254 IP 192.91.235.230.20000 > 198.188.2.10.22222: UDP, length 1024
18:24:23.756358 IP 192.91.235.230.20000 > 198.188.2.10.22222: UDP, length 1024
18:24:23.760870 IP 192.91.235.230.20000 > 198.188.2.10.22222: UDP, length 1024
18:24:23.764974 IP 192.91.235.230.20000 > 198.188.2.10.22222: UDP, length 1024
18:24:23.769486 IP 192.91.235.230.20000 > 198.188.2.10.22222: UDP, length 1024
18:24:23.773591 IP 192.91.235.230.20000 > 198.188.2.10.22222: UDP, length 1024
18:24:23.778102 IP 192.91.235.230.20000 > 198.188.2.10.22222: UDP, length 1024
18:24:23.782206 IP 192.91.235.230.20000 > 198.188.2.10.22222: UDP, length 1024
18:24:23.786719 IP 192.91.235.230.20000 > 198.188.2.10.22222: UDP, length 1024
18:24:23.790821 IP 192.91.235.230.20000 > 198.188.2.10.22222: UDP, length 1024
18:24:23.795334 IP 192.91.235.230.20000 > 198.188.2.10.22222: UDP, length 1024
18:24:23.799438 IP 192.91.235.230.20000 > 198.188.2.10.22222: UDP, length 1024
18:24:23.803950 IP 192.91.235.230.20000 > 198.188.2.10.22222: UDP, length 1024
18:24:23.808055 IP 192.91.235.230.20000 > 198.188.2.10.22222: UDP, length 1024
18:24:23.812567 IP 192.91.235.230.20000 > 198.188.2.10.22222: UDP, length 1024
18:24:23.816671 IP 192.91.235.230.20000 > 198.188.2.10.22222: UDP, length 1024
18:24:23.820773 IP 192.91.235.230.20000 > 198.188.2.10.22222: UDP, length 1024
18:24:23.825286 IP 192.91.235.230.20000 > 198.188.2.10.22222: UDP, length 1024
18:24:23.829391 IP 192.91.235.230.20000 > 198.188.2.10.22222: UDP, length 1024
18:24:23.833902 IP 192.91.235.230.20000 > 198.188.2.10.22222: UDP, length 1024
18:24:23.838007 IP 192.91.235.230.20000 > 198.188.2.10.22222: UDP, length 1024
18:24:23.842519 IP 192.91.235.230.20000 > 198.188.2.10.22222: UDP, length 1024
18:24:23.846623 IP 192.91.235.230.20000 > 198.188.2.10.22222: UDP, length 1024
18:24:23.851134 IP 192.91.235.230.20000 > 198.188.2.10.22222: UDP, length 1024
18:24:23.855240 IP 192.91.235.230.20000 > 198.188.2.10.22222: UDP, length 1024
18:24:23.859752 IP 192.91.235.230.20000 > 198.188.2.10.22222: UDP, length 1024
18:24:23.863855 IP 192.91.235.230.20000 > 198.188.2.10.22222: UDP, length 1024
18:24:23.868366 IP 192.91.235.230.20000 > 198.188.2.10.22222: UDP, length 1024
18:24:23.872472 IP 192.91.235.230.20000 > 198.188.2.10.22222: UDP, length 1024
18:24:23.876983 IP 192.91.235.230.20000 > 198.188.2.10.22222: UDP, length 1024
18:24:23.881086 IP 192.91.235.230.20000 > 198.188.2.10.22222: UDP, length 1024
18:24:23.885599 IP 192.91.235.230.20000 > 198.188.2.10.22222: UDP, length 1024
18:24:23.889705 IP 192.91.235.230.20000 > 198.188.2.10.22222: UDP, length 1024
18:24:23.893807 IP 192.91.235.230.20000 > 198.188.2.10.22222: UDP, length 1024
18:24:23.898318 IP 192.91.235.230.20000 > 198.188.2.10.22222: UDP, length 1024
18:24:23.902423 IP 192.91.235.230.20000 > 198.188.2.10.22222: UDP, length 1024
18:24:23.906934 IP 192.91.235.230.20000 > 198.188.2.10.22222: UDP, length 1024
18:24:23.911040 IP 192.91.235.230.20000 > 198.188.2.10.22222: UDP, length 1024
18:24:23.915552 IP 192.91.235.230.20000 > 198.188.2.10.22222: UDP, length 1024
18:24:23.919657 IP 192.91.235.230.20000 > 198.188.2.10.22222: UDP, length 1024
18:24:23.924178 IP 192.91.235.230.20000 > 198.188.2.10.22222: UDP, length 1024
18:24:23.928283 IP 192.91.235.230.20000 > 198.188.2.10.22222: UDP, length 1024
18:24:23.932793 IP 192.91.235.230.20000 > 198.188.2.10.22222: UDP, length 1024
18:24:23.936897 IP 192.91.235.230.20000 > 198.188.2.10.22222: UDP, length 1024
18:24:23.941409 IP 192.91.235.230.20000 > 198.188.2.10.22222: UDP, length 1024
18:24:23.945514 IP 192.91.235.230.20000 > 198.188.2.10.22222: UDP, length 1024
18:24:23.950028 IP 192.91.235.230.20000 > 198.188.2.10.22222: UDP, length 1024
18:24:23.954132 IP 192.91.235.230.20000 > 198.188.2.10.22222: UDP, length 1024
18:24:23.958233 IP 192.91.235.230.20000 > 198.188.2.10.22222: UDP, length 1024
18:24:23.962745 IP 192.91.235.230.20000 > 198.188.2.10.22222: UDP, length 1024
18:24:23.966849 IP 192.91.235.230.20000 > 198.188.2.10.22222: UDP, length 1024
18:24:23.971368 IP 192.91.235.230.20000 > 198.188.2.10.22222: UDP, length 1024
18:24:23.975467 IP 192.91.235.230.20000 > 198.188.2.10.22222: UDP, length 1024
18:24:23.979979 IP 192.91.235.230.20000 > 198.188.2.10.22222: UDP, length 1024
18:24:23.984081 IP 192.91.235.230.20000 > 198.188.2.10.22222: UDP, length 1024
18:24:23.988595 IP 192.91.235.230.20000 > 198.188.2.10.22222: UDP, length 1024
18:24:23.992697 IP 192.91.235.230.20000 > 198.188.2.10.22222: UDP, length 1024
18:24:23.997209 IP 192.91.235.230.20000 > 198.188.2.10.22222: UDP, length 1024
18:24:24.001314 IP 192.91.235.230.20000 > 198.188.2.10.22222: UDP, length 1024
18:24:24.005827 IP 192.91.235.230.20000 > 198.188.2.10.22222: UDP, length 1024
18:24:24.009930 IP 192.91.235.230.20000 > 198.188.2.10.22222: UDP, length 1024
18:24:24.014442 IP 192.91.235.230.20000 > 198.188.2.10.22222: UDP, length 1024
18:24:24.018546 IP 192.91.235.230.20000 > 198.188.2.10.22222: UDP, length 1024
18:24:24.022653 IP 192.91.235.230.20000 > 198.188.2.10.22222: UDP, length 1024
18:24:24.027164 IP 192.91.235.230.20000 > 198.188.2.10.22222: UDP, length 1024
18:24:24.031267 IP 192.91.235.230.20000 > 198.188.2.10.22222: UDP, length 1024
18:24:24.035778 IP 192.91.235.230.20000 > 198.188.2.10.22222: UDP, length 1024
18:24:24.039882 IP 192.91.235.230.20000 > 198.188.2.10.22222: UDP, length 1024
18:24:24.044394 IP 192.91.235.230.20000 > 198.188.2.10.22222: UDP, length 1024
18:24:24.048499 IP 192.91.235.230.20000 > 198.188.2.10.22222: UDP, length 1024
18:24:24.053011 IP 192.91.235.230.20000 > 198.188.2.10.22222: UDP, length 1024
18:24:24.057117 IP 192.91.235.230.20000 > 198.188.2.10.22222: UDP, length 1024
18:24:24.061630 IP 192.91.235.230.20000 > 198.188.2.10.22222: UDP, length 1024
18:24:24.065730 IP 192.91.235.230.20000 > 198.188.2.10.22222: UDP, length 1024
18:24:24.070242 IP 192.91.235.230.20000 > 198.188.2.10.22222: UDP, length 1024
18:24:24.074347 IP 192.91.235.230.20000 > 198.188.2.10.22222: UDP, length 1024
18:24:24.078860 IP 192.91.235.230.20000 > 198.188.2.10.22222: UDP, length 1024
18:24:24.082963 IP 192.91.235.230.20000 > 198.188.2.10.22222: UDP, length 1024
18:24:24.087068 IP 192.91.235.230.20000 > 198.188.2.10.22222: UDP, length 1024
18:24:24.091580 IP 192.91.235.230.20000 > 198.188.2.10.22222: UDP, length 1024
18:24:24.095686 IP 192.91.235.230.20000 > 198.188.2.10.22222: UDP, length 1024
18:24:24.100196 IP 192.91.235.230.20000 > 198.188.2.10.22222: UDP, length 1024
18:24:24.104299 IP 192.91.235.230.20000 > 198.188.2.10.22222: UDP, length 1024
18:24:24.108811 IP 192.91.235.230.20000 > 198.188.2.10.22222: UDP, length 1024
18:24:24.112917 IP 192.91.235.230.20000 > 198.188.2.10.22222: UDP, length 1024
18:24:24.117427 IP 192.91.235.230.20000 > 198.188.2.10.22222: UDP, length 1024
18:24:24.121532 IP 192.91.235.230.20000 > 198.188.2.10.22222: UDP, length 1024
18:24:24.126044 IP 192.91.235.230.20000 > 198.188.2.10.22222: UDP, length 1024
18:24:24.130147 IP 192.91.235.230.20000 > 198.188.2.10.22222: UDP, length 1024
18:24:24.134659 IP 192.91.235.230.20000 > 198.188.2.10.22222: UDP, length 1024
18:24:24.138764 IP 192.91.235.230.20000 > 198.188.2.10.22222: UDP, length 1024
18:24:24.143277 IP 192.91.235.230.20000 > 198.188.2.10.22222: UDP, length 1024
18:24:24.147379 IP 192.91.235.230.20000 > 198.188.2.10.22222: UDP, length 1024
18:24:24.151897 IP 192.91.235.230.20000 > 198.188.2.10.22222: UDP, length 1024
18:24:24.155996 IP 192.91.235.230.20000 > 198.188.2.10.22222: UDP, length 1024
18:24:24.160101 IP 192.91.235.230.20000 > 198.188.2.10.22222: UDP, length 1024
18:24:24.164611 IP 192.91.235.230.20000 > 198.188.2.10.22222: UDP, length 1024
18:24:24.168716 IP 192.91.235.230.20000 > 198.188.2.10.22222: UDP, length 1024
18:24:24.173228 IP 192.91.235.230.20000 > 198.188.2.10.22222: UDP, length 1024
18:24:24.177332 IP 192.91.235.230.20000 > 198.188.2.10.22222: UDP, length 1024
18:24:24.181851 IP 192.91.235.230.20000 > 198.188.2.10.22222: UDP, length 1024
18:24:24.185949 IP 192.91.235.230.20000 > 198.188.2.10.22222: UDP, length 1024
18:24:24.190460 IP 192.91.235.230.20000 > 198.188.2.10.22222: UDP, length 1024
18:24:24.194566 IP 192.91.235.230.20000 > 198.188.2.10.22222: UDP, length 1024
18:24:24.199078 IP 192.91.235.230.20000 > 198.188.2.10.22222: UDP, length 1024
18:24:24.203180 IP 192.91.235.230.20000 > 198.188.2.10.22222: UDP, length 1024
18:24:24.207693 IP 192.91.235.230.20000 > 198.188.2.10.22222: UDP, length 1024
18:24:24.211796 IP 192.91.235.230.20000 > 198.188.2.10.22222: UDP, length 1024
18:24:24.216307 IP 192.91.235.230.20000 > 198.188.2.10.22222: UDP, length 1024
18:24:24.220413 IP 192.91.235.230.20000 > 198.188.2.10.22222: UDP, length 1024
18:24:24.224517 IP 192.91.235.230.20000 > 198.188.2.10.22222: UDP, length 1024
18:24:24.229031 IP 192.91.235.230.20000 > 198.188.2.10.22222: UDP, length 1024
18:24:24.233133 IP 192.91.235.230.20000 > 198.188.2.10.22222: UDP, length 1024
18:24:24.237644 IP 192.91.235.230.20000 > 198.188.2.10.22222: UDP, length 1024
18:24:24.241748 IP 192.91.235.230.20000 > 198.188.2.10.22222: UDP, length 1024
18:24:24.246261 IP 192.91.235.230.20000 > 198.188.2.10.22222: UDP, length 1024
18:24:24.250365 IP 192.91.235.230.20000 > 198.188.2.10.22222: UDP, length 1024
18:24:24.254878 IP 192.91.235.230.20000 > 198.188.2.10.22222: UDP, length 1024
18:24:24.258981 IP 192.91.235.230.20000 > 198.188.2.10.22222: UDP, length 1024
18:24:24.263494 IP 192.91.235.230.20000 > 198.188.2.10.22222: UDP, length 1024
18:24:24.267597 IP 192.91.235.230.20000 > 198.188.2.10.22222: UDP, length 1024
18:24:24.272114 IP 192.91.235.230.20000 > 198.188.2.10.22222: UDP, length 1024
18:24:24.276212 IP 192.91.235.230.20000 > 198.188.2.10.22222: UDP, length 1024
18:24:24.280724 IP 192.91.235.230.20000 > 198.188.2.10.22222: UDP, length 1024
18:24:24.284829 IP 192.91.235.230.20000 > 198.188.2.10.22222: UDP, length 1024
18:24:24.288934 IP 192.91.235.230.20000 > 198.188.2.10.22222: UDP, length 1024
18:24:24.293446 IP 192.91.235.230.20000 > 198.188.2.10.22222: UDP, length 1024
18:24:24.297550 IP 192.91.235.230.20000 > 198.188.2.10.22222: UDP, length 1024
18:24:24.302061 IP 192.91.235.230.20000 > 198.188.2.10.22222: UDP, length 1024
18:24:24.306160 IP 192.91.235.230.20000 > 198.188.2.10.22222: UDP, length 1024
18:24:24.310676 IP 192.91.235.230.20000 > 198.188.2.10.22222: UDP, length 1024
18:24:24.314782 IP 192.91.235.230.20000 > 198.188.2.10.22222: UDP, length 1024
18:24:24.319293 IP 192.91.235.230.20000 > 198.188.2.10.22222: UDP, length 1024
18:24:24.323398 IP 192.91.235.230.20000 > 198.188.2.10.22222: UDP, length 1024
18:24:24.327909 IP 192.91.235.230.20000 > 198.188.2.10.22222: UDP, length 1024
18:24:24.332014 IP 192.91.235.230.20000 > 198.188.2.10.22222: UDP, length 1024
18:24:24.336526 IP 192.91.235.230.20000 > 198.188.2.10.22222: UDP, length 1024
18:24:24.340630 IP 192.91.235.230.20000 > 198.188.2.10.22222: UDP, length 1024
18:24:24.345142 IP 192.91.235.230.20000 > 198.188.2.10.22222: UDP, length 1024
18:24:24.349251 IP 192.91.235.230.20000 > 198.188.2.10.22222: UDP, length 1024
18:24:24.353350 IP 192.91.235.230.20000 > 198.188.2.10.22222: UDP, length 1024
18:24:24.357863 IP 192.91.235.230.20000 > 198.188.2.10.22222: UDP, length 1024
18:24:24.361965 IP 192.91.235.230.20000 > 198.188.2.10.22222: UDP, length 1024
18:24:24.366478 IP 192.91.235.230.20000 > 198.188.2.10.22222: UDP, length 1024
18:24:24.370582 IP 192.91.235.230.20000 > 198.188.2.10.22222: UDP, length 1024
18:24:24.375095 IP 192.91.235.230.20000 > 198.188.2.10.22222: UDP, length 1024
18:24:24.379198 IP 192.91.235.230.20000 > 198.188.2.10.22222: UDP, length 1024
18:24:24.383710 IP 192.91.235.230.20000 > 198.188.2.10.22222: UDP, length 1024
18:24:24.387814 IP 192.91.235.230.20000 > 198.188.2.10.22222: UDP, length 1024
18:24:24.392326 IP 192.91.235.230.20000 > 198.188.2.10.22222: UDP, length 1024
18:24:24.396431 IP 192.91.235.230.20000 > 198.188.2.10.22222: UDP, length 1024
