19:00:18.203743 IP Planetlab1.CS.UCLA.EDU.42588 > 198.188.2.10.22222: UDP, length 1024
19:00:18.207847 IP Planetlab1.CS.UCLA.EDU.42588 > 198.188.2.10.22222: UDP, length 1024
19:00:18.211950 IP Planetlab1.CS.UCLA.EDU.42588 > 198.188.2.10.22222: UDP, length 1024
19:00:18.216463 IP Planetlab1.CS.UCLA.EDU.42588 > 198.188.2.10.22222: UDP, length 1024
19:00:18.220566 IP Planetlab1.CS.UCLA.EDU.42588 > 198.188.2.10.22222: UDP, length 1024
19:00:18.225080 IP Planetlab1.CS.UCLA.EDU.42588 > 198.188.2.10.22222: UDP, length 1024
19:00:18.229186 IP Planetlab1.CS.UCLA.EDU.42588 > 198.188.2.10.22222: UDP, length 1024
19:00:18.233697 IP Planetlab1.CS.UCLA.EDU.42588 > 198.188.2.10.22222: UDP, length 1024
19:00:18.237801 IP Planetlab1.CS.UCLA.EDU.42588 > 198.188.2.10.22222: UDP, length 1024
19:00:18.242314 IP Planetlab1.CS.UCLA.EDU.42588 > 198.188.2.10.22222: UDP, length 1024
19:00:18.246417 IP Planetlab1.CS.UCLA.EDU.42588 > 198.188.2.10.22222: UDP, length 1024
19:00:18.250928 IP Planetlab1.CS.UCLA.EDU.42588 > 198.188.2.10.22222: UDP, length 1024
19:00:18.255031 IP Planetlab1.CS.UCLA.EDU.42588 > 198.188.2.10.22222: UDP, length 1024
19:00:18.259543 IP Planetlab1.CS.UCLA.EDU.42588 > 198.188.2.10.22222: UDP, length 1024
19:00:18.263647 IP Planetlab1.CS.UCLA.EDU.42588 > 198.188.2.10.22222: UDP, length 1024
19:00:18.267752 IP Planetlab1.CS.UCLA.EDU.42588 > 198.188.2.10.22222: UDP, length 1024
19:00:18.272264 IP Planetlab1.CS.UCLA.EDU.42588 > 198.188.2.10.22222: UDP, length 1024
19:00:18.276369 IP Planetlab1.CS.UCLA.EDU.42588 > 198.188.2.10.22222: UDP, length 1024
19:00:18.280883 IP Planetlab1.CS.UCLA.EDU.42588 > 198.188.2.10.22222: UDP, length 1024
19:00:18.284985 IP Planetlab1.CS.UCLA.EDU.42588 > 198.188.2.10.22222: UDP, length 1024
19:00:18.289507 IP Planetlab1.CS.UCLA.EDU.42588 > 198.188.2.10.22222: UDP, length 1024
19:00:18.293592 IP Planetlab1.CS.UCLA.EDU.42588 > 198.188.2.10.22222: UDP, length 1024
19:00:18.298105 IP Planetlab1.CS.UCLA.EDU.42588 > 198.188.2.10.22222: UDP, length 1024
19:00:18.302207 IP Planetlab1.CS.UCLA.EDU.42588 > 198.188.2.10.22222: UDP, length 1024
19:00:18.306718 IP Planetlab1.CS.UCLA.EDU.42588 > 198.188.2.10.22222: UDP, length 1024
19:00:18.310822 IP Planetlab1.CS.UCLA.EDU.42588 > 198.188.2.10.22222: UDP, length 1024
19:00:18.315334 IP Planetlab1.CS.UCLA.EDU.42588 > 198.188.2.10.22222: UDP, length 1024
19:00:18.319438 IP Planetlab1.CS.UCLA.EDU.42588 > 198.188.2.10.22222: UDP, length 1024
19:00:18.323952 IP Planetlab1.CS.UCLA.EDU.42588 > 198.188.2.10.22222: UDP, length 1024
19:00:18.328055 IP Planetlab1.CS.UCLA.EDU.42588 > 198.188.2.10.22222: UDP, length 1024
19:00:18.332568 IP Planetlab1.CS.UCLA.EDU.42588 > 198.188.2.10.22222: UDP, length 1024
19:00:18.336680 IP Planetlab1.CS.UCLA.EDU.42588 > 198.188.2.10.22222: UDP, length 1024
19:00:18.340775 IP Planetlab1.CS.UCLA.EDU.42588 > 198.188.2.10.22222: UDP, length 1024
19:00:18.345289 IP Planetlab1.CS.UCLA.EDU.42588 > 198.188.2.10.22222: UDP, length 1024
19:00:18.349390 IP Planetlab1.CS.UCLA.EDU.42588 > 198.188.2.10.22222: UDP, length 1024
19:00:18.353904 IP Planetlab1.CS.UCLA.EDU.42588 > 198.188.2.10.22222: UDP, length 1024
19:00:18.358013 IP Planetlab1.CS.UCLA.EDU.42588 > 198.188.2.10.22222: UDP, length 1024
19:00:18.362533 IP Planetlab1.CS.UCLA.EDU.42588 > 198.188.2.10.22222: UDP, length 1024
19:00:18.366638 IP Planetlab1.CS.UCLA.EDU.42588 > 198.188.2.10.22222: UDP, length 1024
19:00:18.371143 IP Planetlab1.CS.UCLA.EDU.42588 > 198.188.2.10.22222: UDP, length 1024
19:00:18.375249 IP Planetlab1.CS.UCLA.EDU.42588 > 198.188.2.10.22222: UDP, length 1024
19:00:18.379762 IP Planetlab1.CS.UCLA.EDU.42588 > 198.188.2.10.22222: UDP, length 1024
19:00:18.383865 IP Planetlab1.CS.UCLA.EDU.42588 > 198.188.2.10.22222: UDP, length 1024
19:00:18.388378 IP Planetlab1.CS.UCLA.EDU.42588 > 198.188.2.10.22222: UDP, length 1024
19:00:18.392481 IP Planetlab1.CS.UCLA.EDU.42588 > 198.188.2.10.22222: UDP, length 1024
19:00:18.396993 IP Planetlab1.CS.UCLA.EDU.42588 > 198.188.2.10.22222: UDP, length 1024
19:00:18.401087 IP Planetlab1.CS.UCLA.EDU.42588 > 198.188.2.10.22222: UDP, length 1024
19:00:18.405200 IP Planetlab1.CS.UCLA.EDU.42588 > 198.188.2.10.22222: UDP, length 1024
19:00:18.409715 IP Planetlab1.CS.UCLA.EDU.42588 > 198.188.2.10.22222: UDP, length 1024
19:00:18.413815 IP Planetlab1.CS.UCLA.EDU.42588 > 198.188.2.10.22222: UDP, length 1024
19:00:18.418328 IP Planetlab1.CS.UCLA.EDU.42588 > 198.188.2.10.22222: UDP, length 1024
19:00:18.422430 IP Planetlab1.CS.UCLA.EDU.42588 > 198.188.2.10.22222: UDP, length 1024
19:00:18.426942 IP Planetlab1.CS.UCLA.EDU.42588 > 198.188.2.10.22222: UDP, length 1024
19:00:18.431037 IP Planetlab1.CS.UCLA.EDU.42588 > 198.188.2.10.22222: UDP, length 1024
19:00:18.435613 IP Planetlab1.CS.UCLA.EDU.42588 > 198.188.2.10.22222: UDP, length 1024
19:00:18.439663 IP Planetlab1.CS.UCLA.EDU.42588 > 198.188.2.10.22222: UDP, length 1024
19:00:18.444173 IP Planetlab1.CS.UCLA.EDU.42588 > 198.188.2.10.22222: UDP, length 1024
19:00:18.448303 IP Planetlab1.CS.UCLA.EDU.42588 > 198.188.2.10.22222: UDP, length 1024
19:00:18.452814 IP Planetlab1.CS.UCLA.EDU.42588 > 198.188.2.10.22222: UDP, length 1024
19:00:18.456917 IP Planetlab1.CS.UCLA.EDU.42588 > 198.188.2.10.22222: UDP, length 1024
19:00:18.461430 IP Planetlab1.CS.UCLA.EDU.42588 > 198.188.2.10.22222: UDP, length 1024
19:00:18.465534 IP Planetlab1.CS.UCLA.EDU.42588 > 198.188.2.10.22222: UDP, length 1024
19:00:18.469638 IP Planetlab1.CS.UCLA.EDU.42588 > 198.188.2.10.22222: UDP, length 1024
19:00:18.474150 IP Planetlab1.CS.UCLA.EDU.42588 > 198.188.2.10.22222: UDP, length 1024
19:00:18.478254 IP Planetlab1.CS.UCLA.EDU.42588 > 198.188.2.10.22222: UDP, length 1024
19:00:18.482766 IP Planetlab1.CS.UCLA.EDU.42588 > 198.188.2.10.22222: UDP, length 1024
19:00:18.486870 IP Planetlab1.CS.UCLA.EDU.42588 > 198.188.2.10.22222: UDP, length 1024
19:00:18.491381 IP Planetlab1.CS.UCLA.EDU.42588 > 198.188.2.10.22222: UDP, length 1024
19:00:18.495486 IP Planetlab1.CS.UCLA.EDU.42588 > 198.188.2.10.22222: UDP, length 1024
19:00:18.499999 IP Planetlab1.CS.UCLA.EDU.42588 > 198.188.2.10.22222: UDP, length 1024
19:00:18.504104 IP Planetlab1.CS.UCLA.EDU.42588 > 198.188.2.10.22222: UDP, length 1024
19:00:18.508615 IP Planetlab1.CS.UCLA.EDU.42588 > 198.188.2.10.22222: UDP, length 1024
19:00:18.512718 IP Planetlab1.CS.UCLA.EDU.42588 > 198.188.2.10.22222: UDP, length 1024
19:00:18.517230 IP Planetlab1.CS.UCLA.EDU.42588 > 198.188.2.10.22222: UDP, length 1024
19:00:18.521335 IP Planetlab1.CS.UCLA.EDU.42588 > 198.188.2.10.22222: UDP, length 1024
19:00:18.525850 IP Planetlab1.CS.UCLA.EDU.42588 > 198.188.2.10.22222: UDP, length 1024
19:00:18.529951 IP Planetlab1.CS.UCLA.EDU.42588 > 198.188.2.10.22222: UDP, length 1024
19:00:18.534055 IP Planetlab1.CS.UCLA.EDU.42588 > 198.188.2.10.22222: UDP, length 1024
19:00:18.538567 IP Planetlab1.CS.UCLA.EDU.42588 > 198.188.2.10.22222: UDP, length 1024
19:00:18.542671 IP Planetlab1.CS.UCLA.EDU.42588 > 198.188.2.10.22222: UDP, length 1024
19:00:18.547182 IP Planetlab1.CS.UCLA.EDU.42588 > 198.188.2.10.22222: UDP, length 1024
19:00:18.551287 IP Planetlab1.CS.UCLA.EDU.42588 > 198.188.2.10.22222: UDP, length 1024
19:00:18.555800 IP Planetlab1.CS.UCLA.EDU.42588 > 198.188.2.10.22222: UDP, length 1024
19:00:18.559909 IP Planetlab1.CS.UCLA.EDU.42588 > 198.188.2.10.22222: UDP, length 1024
19:00:18.564415 IP Planetlab1.CS.UCLA.EDU.42588 > 198.188.2.10.22222: UDP, length 1024
19:00:18.568519 IP Planetlab1.CS.UCLA.EDU.42588 > 198.188.2.10.22222: UDP, length 1024
19:00:18.573032 IP Planetlab1.CS.UCLA.EDU.42588 > 198.188.2.10.22222: UDP, length 1024
19:00:18.577135 IP Planetlab1.CS.UCLA.EDU.42588 > 198.188.2.10.22222: UDP, length 1024
19:00:18.581648 IP Planetlab1.CS.UCLA.EDU.42588 > 198.188.2.10.22222: UDP, length 1024
19:00:18.585752 IP Planetlab1.CS.UCLA.EDU.42588 > 198.188.2.10.22222: UDP, length 1024
19:00:18.590263 IP Planetlab1.CS.UCLA.EDU.42588 > 198.188.2.10.22222: UDP, length 1024
19:00:18.594367 IP Planetlab1.CS.UCLA.EDU.42588 > 198.188.2.10.22222: UDP, length 1024
19:00:18.598878 IP Planetlab1.CS.UCLA.EDU.42588 > 198.188.2.10.22222: UDP, length 1024
19:00:18.602986 IP Planetlab1.CS.UCLA.EDU.42588 > 198.188.2.10.22222: UDP, length 1024
19:00:18.607087 IP Planetlab1.CS.UCLA.EDU.42588 > 198.188.2.10.22222: UDP, length 1024
19:00:18.611600 IP Planetlab1.CS.UCLA.EDU.42588 > 198.188.2.10.22222: UDP, length 1024
19:00:18.615705 IP Planetlab1.CS.UCLA.EDU.42588 > 198.188.2.10.22222: UDP, length 1024
19:00:18.620217 IP Planetlab1.CS.UCLA.EDU.42588 > 198.188.2.10.22222: UDP, length 1024
19:00:18.624318 IP Planetlab1.CS.UCLA.EDU.42588 > 198.188.2.10.22222: UDP, length 1024
19:00:18.628834 IP Planetlab1.CS.UCLA.EDU.42588 > 198.188.2.10.22222: UDP, length 1024
19:00:18.632936 IP Planetlab1.CS.UCLA.EDU.42588 > 198.188.2.10.22222: UDP, length 1024
19:00:18.637448 IP Planetlab1.CS.UCLA.EDU.42588 > 198.188.2.10.22222: UDP, length 1024
19:00:18.641553 IP Planetlab1.CS.UCLA.EDU.42588 > 198.188.2.10.22222: UDP, length 1024
19:00:18.646065 IP Planetlab1.CS.UCLA.EDU.42588 > 198.188.2.10.22222: UDP, length 1024
19:00:18.650168 IP Planetlab1.CS.UCLA.EDU.42588 > 198.188.2.10.22222: UDP, length 1024
19:00:18.654680 IP Planetlab1.CS.UCLA.EDU.42588 > 198.188.2.10.22222: UDP, length 1024
19:00:18.658784 IP Planetlab1.CS.UCLA.EDU.42588 > 198.188.2.10.22222: UDP, length 1024
19:00:18.663296 IP Planetlab1.CS.UCLA.EDU.42588 > 198.188.2.10.22222: UDP, length 1024
19:00:18.667400 IP Planetlab1.CS.UCLA.EDU.42588 > 198.188.2.10.22222: UDP, length 1024
19:00:18.671504 IP Planetlab1.CS.UCLA.EDU.42588 > 198.188.2.10.22222: UDP, length 1024
19:00:18.676017 IP Planetlab1.CS.UCLA.EDU.42588 > 198.188.2.10.22222: UDP, length 1024
19:00:18.680120 IP Planetlab1.CS.UCLA.EDU.42588 > 198.188.2.10.22222: UDP, length 1024
19:00:18.684632 IP Planetlab1.CS.UCLA.EDU.42588 > 198.188.2.10.22222: UDP, length 1024
19:00:18.688737 IP Planetlab1.CS.UCLA.EDU.42588 > 198.188.2.10.22222: UDP, length 1024
19:00:18.693249 IP Planetlab1.CS.UCLA.EDU.42588 > 198.188.2.10.22222: UDP, length 1024
19:00:18.697353 IP Planetlab1.CS.UCLA.EDU.42588 > 198.188.2.10.22222: UDP, length 1024
19:00:18.701864 IP Planetlab1.CS.UCLA.EDU.42588 > 198.188.2.10.22222: UDP, length 1024
19:00:18.705969 IP Planetlab1.CS.UCLA.EDU.42588 > 198.188.2.10.22222: UDP, length 1024
19:00:18.710481 IP Planetlab1.CS.UCLA.EDU.42588 > 198.188.2.10.22222: UDP, length 1024
19:00:18.714584 IP Planetlab1.CS.UCLA.EDU.42588 > 198.188.2.10.22222: UDP, length 1024
19:00:18.719097 IP Planetlab1.CS.UCLA.EDU.42588 > 198.188.2.10.22222: UDP, length 1024
19:00:18.723201 IP Planetlab1.CS.UCLA.EDU.42588 > 198.188.2.10.22222: UDP, length 1024
19:00:18.727713 IP Planetlab1.CS.UCLA.EDU.42588 > 198.188.2.10.22222: UDP, length 1024
19:00:18.731817 IP Planetlab1.CS.UCLA.EDU.42588 > 198.188.2.10.22222: UDP, length 1024
19:00:18.735921 IP Planetlab1.CS.UCLA.EDU.42588 > 198.188.2.10.22222: UDP, length 1024
19:00:18.740433 IP Planetlab1.CS.UCLA.EDU.42588 > 198.188.2.10.22222: UDP, length 1024
19:00:18.744538 IP Planetlab1.CS.UCLA.EDU.42588 > 198.188.2.10.22222: UDP, length 1024
19:00:18.749050 IP Planetlab1.CS.UCLA.EDU.42588 > 198.188.2.10.22222: UDP, length 1024
19:00:18.753154 IP Planetlab1.CS.UCLA.EDU.42588 > 198.188.2.10.22222: UDP, length 1024
19:00:18.757666 IP Planetlab1.CS.UCLA.EDU.42588 > 198.188.2.10.22222: UDP, length 1024
19:00:18.761769 IP Planetlab1.CS.UCLA.EDU.42588 > 198.188.2.10.22222: UDP, length 1024
19:00:18.766281 IP Planetlab1.CS.UCLA.EDU.42588 > 198.188.2.10.22222: UDP, length 1024
19:00:18.770388 IP Planetlab1.CS.UCLA.EDU.42588 > 198.188.2.10.22222: UDP, length 1024
19:00:18.774897 IP Planetlab1.CS.UCLA.EDU.42588 > 198.188.2.10.22222: UDP, length 1024
19:00:18.779002 IP Planetlab1.CS.UCLA.EDU.42588 > 198.188.2.10.22222: UDP, length 1024
19:00:18.783515 IP Planetlab1.CS.UCLA.EDU.42588 > 198.188.2.10.22222: UDP, length 1024
19:00:18.787617 IP Planetlab1.CS.UCLA.EDU.42588 > 198.188.2.10.22222: UDP, length 1024
19:00:18.792131 IP Planetlab1.CS.UCLA.EDU.42588 > 198.188.2.10.22222: UDP, length 1024
19:00:18.796234 IP Planetlab1.CS.UCLA.EDU.42588 > 198.188.2.10.22222: UDP, length 1024
19:00:18.800339 IP Planetlab1.CS.UCLA.EDU.42588 > 198.188.2.10.22222: UDP, length 1024
19:00:18.804850 IP Planetlab1.CS.UCLA.EDU.42588 > 198.188.2.10.22222: UDP, length 1024
19:00:18.808954 IP Planetlab1.CS.UCLA.EDU.42588 > 198.188.2.10.22222: UDP, length 1024
19:00:18.813470 IP Planetlab1.CS.UCLA.EDU.42588 > 198.188.2.10.22222: UDP, length 1024
19:00:18.817570 IP Planetlab1.CS.UCLA.EDU.42588 > 198.188.2.10.22222: UDP, length 1024
19:00:18.822081 IP Planetlab1.CS.UCLA.EDU.42588 > 198.188.2.10.22222: UDP, length 1024
19:00:18.826185 IP Planetlab1.CS.UCLA.EDU.42588 > 198.188.2.10.22222: UDP, length 1024
19:00:18.830697 IP Planetlab1.CS.UCLA.EDU.42588 > 198.188.2.10.22222: UDP, length 1024
19:00:18.834802 IP Planetlab1.CS.UCLA.EDU.42588 > 198.188.2.10.22222: UDP, length 1024
19:00:18.839314 IP Planetlab1.CS.UCLA.EDU.42588 > 198.188.2.10.22222: UDP, length 1024
19:00:18.843418 IP Planetlab1.CS.UCLA.EDU.42588 > 198.188.2.10.22222: UDP, length 1024
19:00:18.847930 IP Planetlab1.CS.UCLA.EDU.42588 > 198.188.2.10.22222: UDP, length 1024
19:00:18.852034 IP Planetlab1.CS.UCLA.EDU.42588 > 198.188.2.10.22222: UDP, length 1024
19:00:18.856550 IP Planetlab1.CS.UCLA.EDU.42588 > 198.188.2.10.22222: UDP, length 1024
19:00:18.860652 IP Planetlab1.CS.UCLA.EDU.42588 > 198.188.2.10.22222: UDP, length 1024
19:00:18.865163 IP Planetlab1.CS.UCLA.EDU.42588 > 198.188.2.10.22222: UDP, length 1024
19:00:18.869266 IP Planetlab1.CS.UCLA.EDU.42588 > 198.188.2.10.22222: UDP, length 1024
19:00:18.873370 IP Planetlab1.CS.UCLA.EDU.42588 > 198.188.2.10.22222: UDP, length 1024
19:00:18.877883 IP Planetlab1.CS.UCLA.EDU.42588 > 198.188.2.10.22222: UDP, length 1024
19:00:18.881986 IP Planetlab1.CS.UCLA.EDU.42588 > 198.188.2.10.22222: UDP, length 1024
19:00:18.886498 IP Planetlab1.CS.UCLA.EDU.42588 > 198.188.2.10.22222: UDP, length 1024
19:00:18.890604 IP Planetlab1.CS.UCLA.EDU.42588 > 198.188.2.10.22222: UDP, length 1024
19:00:18.895115 IP Planetlab1.CS.UCLA.EDU.42588 > 198.188.2.10.22222: UDP, length 1024
19:00:18.899218 IP Planetlab1.CS.UCLA.EDU.42588 > 198.188.2.10.22222: UDP, length 1024
19:00:18.903733 IP Planetlab1.CS.UCLA.EDU.42588 > 198.188.2.10.22222: UDP, length 1024
19:00:18.907834 IP Planetlab1.CS.UCLA.EDU.42588 > 198.188.2.10.22222: UDP, length 1024
19:00:18.912346 IP Planetlab1.CS.UCLA.EDU.42588 > 198.188.2.10.22222: UDP, length 1024
19:00:18.916451 IP Planetlab1.CS.UCLA.EDU.42588 > 198.188.2.10.22222: UDP, length 1024
19:00:18.920962 IP Planetlab1.CS.UCLA.EDU.42588 > 198.188.2.10.22222: UDP, length 1024
19:00:18.925068 IP Planetlab1.CS.UCLA.EDU.42588 > 198.188.2.10.22222: UDP, length 1024
19:00:18.929580 IP Planetlab1.CS.UCLA.EDU.42588 > 198.188.2.10.22222: UDP, length 1024
19:00:18.933683 IP Planetlab1.CS.UCLA.EDU.42588 > 198.188.2.10.22222: UDP, length 1024
19:00:18.937786 IP Planetlab1.CS.UCLA.EDU.42588 > 198.188.2.10.22222: UDP, length 1024
19:00:18.942298 IP Planetlab1.CS.UCLA.EDU.42588 > 198.188.2.10.22222: UDP, length 1024
19:00:18.946403 IP Planetlab1.CS.UCLA.EDU.42588 > 198.188.2.10.22222: UDP, length 1024
19:00:18.950916 IP Planetlab1.CS.UCLA.EDU.42588 > 198.188.2.10.22222: UDP, length 1024
19:00:18.955020 IP Planetlab1.CS.UCLA.EDU.42588 > 198.188.2.10.22222: UDP, length 1024
19:00:18.959532 IP Planetlab1.CS.UCLA.EDU.42588 > 198.188.2.10.22222: UDP, length 1024
19:00:18.963635 IP Planetlab1.CS.UCLA.EDU.42588 > 198.188.2.10.22222: UDP, length 1024
19:00:18.968147 IP Planetlab1.CS.UCLA.EDU.42588 > 198.188.2.10.22222: UDP, length 1024
19:00:18.972251 IP Planetlab1.CS.UCLA.EDU.42588 > 198.188.2.10.22222: UDP, length 1024
19:00:18.976764 IP Planetlab1.CS.UCLA.EDU.42588 > 198.188.2.10.22222: UDP, length 1024
19:00:18.980874 IP Planetlab1.CS.UCLA.EDU.42588 > 198.188.2.10.22222: UDP, length 1024
19:00:18.985380 IP Planetlab1.CS.UCLA.EDU.42588 > 198.188.2.10.22222: UDP, length 1024
19:00:18.989484 IP Planetlab1.CS.UCLA.EDU.42588 > 198.188.2.10.22222: UDP, length 1024
19:00:18.993996 IP Planetlab1.CS.UCLA.EDU.42588 > 198.188.2.10.22222: UDP, length 1024
19:00:18.998098 IP Planetlab1.CS.UCLA.EDU.42588 > 198.188.2.10.22222: UDP, length 1024
19:00:19.002203 IP Planetlab1.CS.UCLA.EDU.42588 > 198.188.2.10.22222: UDP, length 1024
19:00:19.006716 IP Planetlab1.CS.UCLA.EDU.42588 > 198.188.2.10.22222: UDP, length 1024
19:00:19.010820 IP Planetlab1.CS.UCLA.EDU.42588 > 198.188.2.10.22222: UDP, length 1024
19:00:19.015331 IP Planetlab1.CS.UCLA.EDU.42588 > 198.188.2.10.22222: UDP, length 1024
19:00:19.019425 IP Planetlab1.CS.UCLA.EDU.42588 > 198.188.2.10.22222: UDP, length 1024
19:00:19.023951 IP Planetlab1.CS.UCLA.EDU.42588 > 198.188.2.10.22222: UDP, length 1024
19:00:19.028051 IP Planetlab1.CS.UCLA.EDU.42588 > 198.188.2.10.22222: UDP, length 1024
19:00:19.032564 IP Planetlab1.CS.UCLA.EDU.42588 > 198.188.2.10.22222: UDP, length 1024
19:00:19.036669 IP Planetlab1.CS.UCLA.EDU.42588 > 198.188.2.10.22222: UDP, length 1024
19:00:19.041180 IP Planetlab1.CS.UCLA.EDU.42588 > 198.188.2.10.22222: UDP, length 1024
19:00:19.045284 IP Planetlab1.CS.UCLA.EDU.42588 > 198.188.2.10.22222: UDP, length 1024
19:00:19.049797 IP Planetlab1.CS.UCLA.EDU.42588 > 198.188.2.10.22222: UDP, length 1024
19:00:19.053901 IP Planetlab1.CS.UCLA.EDU.42588 > 198.188.2.10.22222: UDP, length 1024
19:00:19.058413 IP Planetlab1.CS.UCLA.EDU.42588 > 198.188.2.10.22222: UDP, length 1024
19:00:19.062519 IP Planetlab1.CS.UCLA.EDU.42588 > 198.188.2.10.22222: UDP, length 1024
19:00:19.066620 IP Planetlab1.CS.UCLA.EDU.42588 > 198.188.2.10.22222: UDP, length 1024
19:00:19.071135 IP Planetlab1.CS.UCLA.EDU.42588 > 198.188.2.10.22222: UDP, length 1024
19:00:19.075236 IP Planetlab1.CS.UCLA.EDU.42588 > 198.188.2.10.22222: UDP, length 1024
19:00:19.079748 IP Planetlab1.CS.UCLA.EDU.42588 > 198.188.2.10.22222: UDP, length 1024
19:00:19.083852 IP Planetlab1.CS.UCLA.EDU.42588 > 198.188.2.10.22222: UDP, length 1024
19:00:19.088365 IP Planetlab1.CS.UCLA.EDU.42588 > 198.188.2.10.22222: UDP, length 1024
19:00:19.092469 IP Planetlab1.CS.UCLA.EDU.42588 > 198.188.2.10.22222: UDP, length 1024
19:00:19.096982 IP Planetlab1.CS.UCLA.EDU.20000 > 198.188.2.10.22222: UDP, length 1024
19:00:19.101084 IP Planetlab1.CS.UCLA.EDU.20000 > 198.188.2.10.22222: UDP, length 1024
19:00:19.105597 IP Planetlab1.CS.UCLA.EDU.20000 > 198.188.2.10.22222: UDP, length 1024
19:00:19.109700 IP Planetlab1.CS.UCLA.EDU.20000 > 198.188.2.10.22222: UDP, length 1024
19:00:19.114213 IP Planetlab1.CS.UCLA.EDU.20000 > 198.188.2.10.22222: UDP, length 1024
19:00:19.118318 IP Planetlab1.CS.UCLA.EDU.20000 > 198.188.2.10.22222: UDP, length 1024
19:00:19.122831 IP Planetlab1.CS.UCLA.EDU.20000 > 198.188.2.10.22222: UDP, length 1024
19:00:19.126934 IP Planetlab1.CS.UCLA.EDU.20000 > 198.188.2.10.22222: UDP, length 1024
19:00:19.131445 IP Planetlab1.CS.UCLA.EDU.20000 > 198.188.2.10.22222: UDP, length 1024
19:00:19.135549 IP Planetlab1.CS.UCLA.EDU.20000 > 198.188.2.10.22222: UDP, length 1024
19:00:19.139653 IP Planetlab1.CS.UCLA.EDU.20000 > 198.188.2.10.22222: UDP, length 1024
19:00:19.144164 IP Planetlab1.CS.UCLA.EDU.20000 > 198.188.2.10.22222: UDP, length 1024
19:00:19.148273 IP Planetlab1.CS.UCLA.EDU.20000 > 198.188.2.10.22222: UDP, length 1024
19:00:19.152782 IP Planetlab1.CS.UCLA.EDU.20000 > 198.188.2.10.22222: UDP, length 1024
19:00:19.156887 IP Planetlab1.CS.UCLA.EDU.20000 > 198.188.2.10.22222: UDP, length 1024
19:00:19.161398 IP Planetlab1.CS.UCLA.EDU.20000 > 198.188.2.10.22222: UDP, length 1024
19:00:19.165500 IP Planetlab1.CS.UCLA.EDU.20000 > 198.188.2.10.22222: UDP, length 1024
19:00:19.170013 IP Planetlab1.CS.UCLA.EDU.20000 > 198.188.2.10.22222: UDP, length 1024
19:00:19.174119 IP Planetlab1.CS.UCLA.EDU.20000 > 198.188.2.10.22222: UDP, length 1024
19:00:19.178630 IP Planetlab1.CS.UCLA.EDU.20000 > 198.188.2.10.22222: UDP, length 1024
19:00:19.182733 IP Planetlab1.CS.UCLA.EDU.20000 > 198.188.2.10.22222: UDP, length 1024
19:00:19.187246 IP Planetlab1.CS.UCLA.EDU.20000 > 198.188.2.10.22222: UDP, length 1024
19:00:19.191351 IP Planetlab1.CS.UCLA.EDU.20000 > 198.188.2.10.22222: UDP, length 1024
19:00:19.195862 IP Planetlab1.CS.UCLA.EDU.20000 > 198.188.2.10.22222: UDP, length 1024
19:00:19.199966 IP Planetlab1.CS.UCLA.EDU.20000 > 198.188.2.10.22222: UDP, length 1024
19:00:19.204070 IP Planetlab1.CS.UCLA.EDU.20000 > 198.188.2.10.22222: UDP, length 1024
19:00:19.208582 IP Planetlab1.CS.UCLA.EDU.20000 > 198.188.2.10.22222: UDP, length 1024
19:00:19.212685 IP Planetlab1.CS.UCLA.EDU.20000 > 198.188.2.10.22222: UDP, length 1024
19:00:19.217198 IP Planetlab1.CS.UCLA.EDU.20000 > 198.188.2.10.22222: UDP, length 1024
19:00:19.221302 IP Planetlab1.CS.UCLA.EDU.20000 > 198.188.2.10.22222: UDP, length 1024
19:00:19.225815 IP Planetlab1.CS.UCLA.EDU.20000 > 198.188.2.10.22222: UDP, length 1024
19:00:19.229920 IP Planetlab1.CS.UCLA.EDU.20000 > 198.188.2.10.22222: UDP, length 1024
19:00:19.234431 IP Planetlab1.CS.UCLA.EDU.20000 > 198.188.2.10.22222: UDP, length 1024
19:00:19.238539 IP Planetlab1.CS.UCLA.EDU.20000 > 198.188.2.10.22222: UDP, length 1024
19:00:19.243046 IP Planetlab1.CS.UCLA.EDU.20000 > 198.188.2.10.22222: UDP, length 1024
19:00:19.247150 IP Planetlab1.CS.UCLA.EDU.20000 > 198.188.2.10.22222: UDP, length 1024
19:00:19.251662 IP Planetlab1.CS.UCLA.EDU.20000 > 198.188.2.10.22222: UDP, length 1024
19:00:19.255766 IP Planetlab1.CS.UCLA.EDU.20000 > 198.188.2.10.22222: UDP, length 1024
19:00:19.260280 IP Planetlab1.CS.UCLA.EDU.20000 > 198.188.2.10.22222: UDP, length 1024
19:00:19.264384 IP Planetlab1.CS.UCLA.EDU.20000 > 198.188.2.10.22222: UDP, length 1024
19:00:19.268486 IP Planetlab1.CS.UCLA.EDU.20000 > 198.188.2.10.22222: UDP, length 1024
19:00:19.272999 IP Planetlab1.CS.UCLA.EDU.20000 > 198.188.2.10.22222: UDP, length 1024
19:00:19.277102 IP Planetlab1.CS.UCLA.EDU.20000 > 198.188.2.10.22222: UDP, length 1024
19:00:19.281617 IP Planetlab1.CS.UCLA.EDU.20000 > 198.188.2.10.22222: UDP, length 1024
19:00:19.285719 IP Planetlab1.CS.UCLA.EDU.20000 > 198.188.2.10.22222: UDP, length 1024
19:00:19.290231 IP Planetlab1.CS.UCLA.EDU.20000 > 198.188.2.10.22222: UDP, length 1024
19:00:19.294336 IP Planetlab1.CS.UCLA.EDU.20000 > 198.188.2.10.22222: UDP, length 1024
19:00:19.298847 IP Planetlab1.CS.UCLA.EDU.20000 > 198.188.2.10.22222: UDP, length 1024
19:00:19.302950 IP Planetlab1.CS.UCLA.EDU.20000 > 198.188.2.10.22222: UDP, length 1024
19:00:19.307462 IP Planetlab1.CS.UCLA.EDU.20000 > 198.188.2.10.22222: UDP, length 1024
19:00:19.311567 IP Planetlab1.CS.UCLA.EDU.20000 > 198.188.2.10.22222: UDP, length 1024
19:00:19.316079 IP Planetlab1.CS.UCLA.EDU.20000 > 198.188.2.10.22222: UDP, length 1024
19:00:19.320183 IP Planetlab1.CS.UCLA.EDU.20000 > 198.188.2.10.22222: UDP, length 1024
19:00:19.324695 IP Planetlab1.CS.UCLA.EDU.20000 > 198.188.2.10.22222: UDP, length 1024
19:00:19.328801 IP Planetlab1.CS.UCLA.EDU.20000 > 198.188.2.10.22222: UDP, length 1024
19:00:19.332902 IP Planetlab1.CS.UCLA.EDU.20000 > 198.188.2.10.22222: UDP, length 1024
19:00:19.337416 IP Planetlab1.CS.UCLA.EDU.20000 > 198.188.2.10.22222: UDP, length 1024
19:00:19.341518 IP Planetlab1.CS.UCLA.EDU.20000 > 198.188.2.10.22222: UDP, length 1024
19:00:19.346031 IP Planetlab1.CS.UCLA.EDU.20000 > 198.188.2.10.22222: UDP, length 1024
19:00:19.350135 IP Planetlab1.CS.UCLA.EDU.20000 > 198.188.2.10.22222: UDP, length 1024
19:00:19.354647 IP Planetlab1.CS.UCLA.EDU.20000 > 198.188.2.10.22222: UDP, length 1024
19:00:19.358755 IP Planetlab1.CS.UCLA.EDU.20000 > 198.188.2.10.22222: UDP, length 1024
19:00:19.363264 IP Planetlab1.CS.UCLA.EDU.20000 > 198.188.2.10.22222: UDP, length 1024
19:00:19.367367 IP Planetlab1.CS.UCLA.EDU.20000 > 198.188.2.10.22222: UDP, length 1024
19:00:19.371878 IP Planetlab1.CS.UCLA.EDU.20000 > 198.188.2.10.22222: UDP, length 1024
19:00:19.375985 IP Planetlab1.CS.UCLA.EDU.20000 > 198.188.2.10.22222: UDP, length 1024
19:00:19.380495 IP Planetlab1.CS.UCLA.EDU.20000 > 198.188.2.10.22222: UDP, length 1024
19:00:19.384600 IP Planetlab1.CS.UCLA.EDU.20000 > 198.188.2.10.22222: UDP, length 1024
19:00:19.389111 IP Planetlab1.CS.UCLA.EDU.20000 > 198.188.2.10.22222: UDP, length 1024
19:00:19.393215 IP Planetlab1.CS.UCLA.EDU.20000 > 198.188.2.10.22222: UDP, length 1024
19:00:19.397728 IP Planetlab1.CS.UCLA.EDU.20000 > 198.188.2.10.22222: UDP, length 1024
19:00:19.401834 IP Planetlab1.CS.UCLA.EDU.20000 > 198.188.2.10.22222: UDP, length 1024
19:00:19.405939 IP Planetlab1.CS.UCLA.EDU.20000 > 198.188.2.10.22222: UDP, length 1024
19:00:19.410448 IP Planetlab1.CS.UCLA.EDU.20000 > 198.188.2.10.22222: UDP, length 1024
19:00:19.414551 IP Planetlab1.CS.UCLA.EDU.20000 > 198.188.2.10.22222: UDP, length 1024
19:00:19.419063 IP Planetlab1.CS.UCLA.EDU.20000 > 198.188.2.10.22222: UDP, length 1024
19:00:19.423167 IP Planetlab1.CS.UCLA.EDU.20000 > 198.188.2.10.22222: UDP, length 1024
19:00:19.427680 IP Planetlab1.CS.UCLA.EDU.20000 > 198.188.2.10.22222: UDP, length 1024
19:00:19.431785 IP Planetlab1.CS.UCLA.EDU.20000 > 198.188.2.10.22222: UDP, length 1024
19:00:19.436297 IP Planetlab1.CS.UCLA.EDU.20000 > 198.188.2.10.22222: UDP, length 1024
19:00:19.440400 IP Planetlab1.CS.UCLA.EDU.20000 > 198.188.2.10.22222: UDP, length 1024
19:00:19.444916 IP Planetlab1.CS.UCLA.EDU.20000 > 198.188.2.10.22222: UDP, length 1024
19:00:19.449016 IP Planetlab1.CS.UCLA.EDU.20000 > 198.188.2.10.22222: UDP, length 1024
19:00:19.453527 IP Planetlab1.CS.UCLA.EDU.20000 > 198.188.2.10.22222: UDP, length 1024
19:00:19.457632 IP Planetlab1.CS.UCLA.EDU.20000 > 198.188.2.10.22222: UDP, length 1024
19:00:19.462144 IP Planetlab1.CS.UCLA.EDU.20000 > 198.188.2.10.22222: UDP, length 1024
19:00:19.466250 IP Planetlab1.CS.UCLA.EDU.20000 > 198.188.2.10.22222: UDP, length 1024
19:00:19.470352 IP Planetlab1.CS.UCLA.EDU.20000 > 198.188.2.10.22222: UDP, length 1024
19:00:19.474864 IP Planetlab1.CS.UCLA.EDU.20000 > 198.188.2.10.22222: UDP, length 1024
19:00:19.478968 IP Planetlab1.CS.UCLA.EDU.20000 > 198.188.2.10.22222: UDP, length 1024
19:00:19.483480 IP Planetlab1.CS.UCLA.EDU.20000 > 198.188.2.10.22222: UDP, length 1024
19:00:19.487585 IP Planetlab1.CS.UCLA.EDU.20000 > 198.188.2.10.22222: UDP, length 1024
19:00:19.492099 IP Planetlab1.CS.UCLA.EDU.20000 > 198.188.2.10.22222: UDP, length 1024
19:00:19.496202 IP Planetlab1.CS.UCLA.EDU.20000 > 198.188.2.10.22222: UDP, length 1024
19:00:19.500713 IP Planetlab1.CS.UCLA.EDU.20000 > 198.188.2.10.22222: UDP, length 1024
19:00:19.504817 IP Planetlab1.CS.UCLA.EDU.20000 > 198.188.2.10.22222: UDP, length 1024
19:00:19.509328 IP Planetlab1.CS.UCLA.EDU.20000 > 198.188.2.10.22222: UDP, length 1024
19:00:19.513433 IP Planetlab1.CS.UCLA.EDU.20000 > 198.188.2.10.22222: UDP, length 1024
19:00:19.517944 IP Planetlab1.CS.UCLA.EDU.20000 > 198.188.2.10.22222: UDP, length 1024
19:00:19.522049 IP Planetlab1.CS.UCLA.EDU.20000 > 198.188.2.10.22222: UDP, length 1024
19:00:19.526561 IP Planetlab1.CS.UCLA.EDU.20000 > 198.188.2.10.22222: UDP, length 1024
19:00:19.530666 IP Planetlab1.CS.UCLA.EDU.20000 > 198.188.2.10.22222: UDP, length 1024
19:00:19.534769 IP Planetlab1.CS.UCLA.EDU.20000 > 198.188.2.10.22222: UDP, length 1024
19:00:19.539281 IP Planetlab1.CS.UCLA.EDU.20000 > 198.188.2.10.22222: UDP, length 1024
19:00:19.543377 IP Planetlab1.CS.UCLA.EDU.20000 > 198.188.2.10.22222: UDP, length 1024
19:00:19.547897 IP Planetlab1.CS.UCLA.EDU.20000 > 198.188.2.10.22222: UDP, length 1024
19:00:19.552002 IP Planetlab1.CS.UCLA.EDU.20000 > 198.188.2.10.22222: UDP, length 1024
19:00:19.556513 IP Planetlab1.CS.UCLA.EDU.20000 > 198.188.2.10.22222: UDP, length 1024
19:00:19.560618 IP Planetlab1.CS.UCLA.EDU.20000 > 198.188.2.10.22222: UDP, length 1024
19:00:19.565129 IP Planetlab1.CS.UCLA.EDU.20000 > 198.188.2.10.22222: UDP, length 1024
19:00:19.569237 IP Planetlab1.CS.UCLA.EDU.20000 > 198.188.2.10.22222: UDP, length 1024
19:00:19.573745 IP Planetlab1.CS.UCLA.EDU.20000 > 198.188.2.10.22222: UDP, length 1024
19:00:19.577850 IP Planetlab1.CS.UCLA.EDU.20000 > 198.188.2.10.22222: UDP, length 1024
19:00:19.582361 IP Planetlab1.CS.UCLA.EDU.20000 > 198.188.2.10.22222: UDP, length 1024
19:00:19.586465 IP Planetlab1.CS.UCLA.EDU.20000 > 198.188.2.10.22222: UDP, length 1024
19:00:19.590977 IP Planetlab1.CS.UCLA.EDU.20000 > 198.188.2.10.22222: UDP, length 1024
19:00:19.595083 IP Planetlab1.CS.UCLA.EDU.20000 > 198.188.2.10.22222: UDP, length 1024
19:00:19.599185 IP Planetlab1.CS.UCLA.EDU.20000 > 198.188.2.10.22222: UDP, length 1024
19:00:19.603698 IP Planetlab1.CS.UCLA.EDU.20000 > 198.188.2.10.22222: UDP, length 1024
19:00:19.607802 IP Planetlab1.CS.UCLA.EDU.20000 > 198.188.2.10.22222: UDP, length 1024
19:00:19.612313 IP Planetlab1.CS.UCLA.EDU.20000 > 198.188.2.10.22222: UDP, length 1024
19:00:19.616422 IP Planetlab1.CS.UCLA.EDU.20000 > 198.188.2.10.22222: UDP, length 1024
19:00:19.620929 IP Planetlab1.CS.UCLA.EDU.20000 > 198.188.2.10.22222: UDP, length 1024
19:00:19.625035 IP Planetlab1.CS.UCLA.EDU.20000 > 198.188.2.10.22222: UDP, length 1024
19:00:19.629546 IP Planetlab1.CS.UCLA.EDU.20000 > 198.188.2.10.22222: UDP, length 1024
19:00:19.633649 IP Planetlab1.CS.UCLA.EDU.20000 > 198.188.2.10.22222: UDP, length 1024
19:00:19.638164 IP Planetlab1.CS.UCLA.EDU.20000 > 198.188.2.10.22222: UDP, length 1024
19:00:19.642266 IP Planetlab1.CS.UCLA.EDU.20000 > 198.188.2.10.22222: UDP, length 1024
19:00:19.646778 IP Planetlab1.CS.UCLA.EDU.20000 > 198.188.2.10.22222: UDP, length 1024
19:00:19.650882 IP Planetlab1.CS.UCLA.EDU.20000 > 198.188.2.10.22222: UDP, length 1024
19:00:19.655394 IP Planetlab1.CS.UCLA.EDU.20000 > 198.188.2.10.22222: UDP, length 1024
19:00:19.659503 IP Planetlab1.CS.UCLA.EDU.20000 > 198.188.2.10.22222: UDP, length 1024
19:00:19.664011 IP Planetlab1.CS.UCLA.EDU.20000 > 198.188.2.10.22222: UDP, length 1024
19:00:19.668114 IP Planetlab1.CS.UCLA.EDU.20000 > 198.188.2.10.22222: UDP, length 1024
19:00:19.672218 IP Planetlab1.CS.UCLA.EDU.20000 > 198.188.2.10.22222: UDP, length 1024
19:00:19.676730 IP Planetlab1.CS.UCLA.EDU.20000 > 198.188.2.10.22222: UDP, length 1024
19:00:19.680833 IP Planetlab1.CS.UCLA.EDU.20000 > 198.188.2.10.22222: UDP, length 1024
19:00:19.685346 IP Planetlab1.CS.UCLA.EDU.20000 > 198.188.2.10.22222: UDP, length 1024
19:00:19.689451 IP Planetlab1.CS.UCLA.EDU.20000 > 198.188.2.10.22222: UDP, length 1024
19:00:19.693963 IP Planetlab1.CS.UCLA.EDU.20000 > 198.188.2.10.22222: UDP, length 1024
19:00:19.698066 IP Planetlab1.CS.UCLA.EDU.20000 > 198.188.2.10.22222: UDP, length 1024
19:00:19.702578 IP Planetlab1.CS.UCLA.EDU.20000 > 198.188.2.10.22222: UDP, length 1024
19:00:19.706682 IP Planetlab1.CS.UCLA.EDU.20000 > 198.188.2.10.22222: UDP, length 1024
19:00:19.711194 IP Planetlab1.CS.UCLA.EDU.20000 > 198.188.2.10.22222: UDP, length 1024
19:00:19.715299 IP Planetlab1.CS.UCLA.EDU.20000 > 198.188.2.10.22222: UDP, length 1024
19:00:19.719811 IP Planetlab1.CS.UCLA.EDU.20000 > 198.188.2.10.22222: UDP, length 1024
19:00:19.723915 IP Planetlab1.CS.UCLA.EDU.20000 > 198.188.2.10.22222: UDP, length 1024
19:00:19.728428 IP Planetlab1.CS.UCLA.EDU.20000 > 198.188.2.10.22222: UDP, length 1024
19:00:19.732531 IP Planetlab1.CS.UCLA.EDU.20000 > 198.188.2.10.22222: UDP, length 1024
19:00:19.736639 IP Planetlab1.CS.UCLA.EDU.20000 > 198.188.2.10.22222: UDP, length 1024
19:00:19.741147 IP Planetlab1.CS.UCLA.EDU.20000 > 198.188.2.10.22222: UDP, length 1024
19:00:19.745252 IP Planetlab1.CS.UCLA.EDU.20000 > 198.188.2.10.22222: UDP, length 1024
19:00:19.749764 IP Planetlab1.CS.UCLA.EDU.20000 > 198.188.2.10.22222: UDP, length 1024
19:00:19.753867 IP Planetlab1.CS.UCLA.EDU.20000 > 198.188.2.10.22222: UDP, length 1024
19:00:19.758379 IP Planetlab1.CS.UCLA.EDU.20000 > 198.188.2.10.22222: UDP, length 1024
19:00:19.762483 IP Planetlab1.CS.UCLA.EDU.20000 > 198.188.2.10.22222: UDP, length 1024
19:00:19.766994 IP Planetlab1.CS.UCLA.EDU.20000 > 198.188.2.10.22222: UDP, length 1024
19:00:19.771099 IP Planetlab1.CS.UCLA.EDU.20000 > 198.188.2.10.22222: UDP, length 1024
19:00:19.775611 IP Planetlab1.CS.UCLA.EDU.20000 > 198.188.2.10.22222: UDP, length 1024
19:00:19.779717 IP Planetlab1.CS.UCLA.EDU.20000 > 198.188.2.10.22222: UDP, length 1024
19:00:19.784228 IP Planetlab1.CS.UCLA.EDU.20000 > 198.188.2.10.22222: UDP, length 1024
19:00:19.788307 IP Planetlab1.CS.UCLA.EDU.20000 > 198.188.2.10.22222: UDP, length 1024
19:00:19.792843 IP Planetlab1.CS.UCLA.EDU.20000 > 198.188.2.10.22222: UDP, length 1024
19:00:19.796946 IP Planetlab1.CS.UCLA.EDU.20000 > 198.188.2.10.22222: UDP, length 1024
19:00:19.801051 IP Planetlab1.CS.UCLA.EDU.20000 > 198.188.2.10.22222: UDP, length 1024
19:00:19.805565 IP Planetlab1.CS.UCLA.EDU.20000 > 198.188.2.10.22222: UDP, length 1024
19:00:19.809668 IP Planetlab1.CS.UCLA.EDU.20000 > 198.188.2.10.22222: UDP, length 1024
19:00:19.814181 IP Planetlab1.CS.UCLA.EDU.20000 > 198.188.2.10.22222: UDP, length 1024
19:00:19.818284 IP Planetlab1.CS.UCLA.EDU.20000 > 198.188.2.10.22222: UDP, length 1024
19:00:19.822795 IP Planetlab1.CS.UCLA.EDU.20000 > 198.188.2.10.22222: UDP, length 1024
19:00:19.826899 IP Planetlab1.CS.UCLA.EDU.20000 > 198.188.2.10.22222: UDP, length 1024
19:00:19.831413 IP Planetlab1.CS.UCLA.EDU.20000 > 198.188.2.10.22222: UDP, length 1024
19:00:19.835515 IP Planetlab1.CS.UCLA.EDU.20000 > 198.188.2.10.22222: UDP, length 1024
19:00:19.840027 IP Planetlab1.CS.UCLA.EDU.20000 > 198.188.2.10.22222: UDP, length 1024
19:00:19.844132 IP Planetlab1.CS.UCLA.EDU.20000 > 198.188.2.10.22222: UDP, length 1024
19:00:19.848644 IP Planetlab1.CS.UCLA.EDU.20000 > 198.188.2.10.22222: UDP, length 1024
19:00:19.852748 IP Planetlab1.CS.UCLA.EDU.20000 > 198.188.2.10.22222: UDP, length 1024
19:00:19.857259 IP Planetlab1.CS.UCLA.EDU.20000 > 198.188.2.10.22222: UDP, length 1024
19:00:19.861364 IP Planetlab1.CS.UCLA.EDU.20000 > 198.188.2.10.22222: UDP, length 1024
19:00:19.865468 IP Planetlab1.CS.UCLA.EDU.20000 > 198.188.2.10.22222: UDP, length 1024
19:00:19.869979 IP Planetlab1.CS.UCLA.EDU.20000 > 198.188.2.10.22222: UDP, length 1024
19:00:19.874084 IP Planetlab1.CS.UCLA.EDU.20000 > 198.188.2.10.22222: UDP, length 1024
19:00:19.878596 IP Planetlab1.CS.UCLA.EDU.20000 > 198.188.2.10.22222: UDP, length 1024
19:00:19.882700 IP Planetlab1.CS.UCLA.EDU.20000 > 198.188.2.10.22222: UDP, length 1024
19:00:19.887212 IP Planetlab1.CS.UCLA.EDU.20000 > 198.188.2.10.22222: UDP, length 1024
19:00:19.891316 IP Planetlab1.CS.UCLA.EDU.20000 > 198.188.2.10.22222: UDP, length 1024
19:00:19.895829 IP Planetlab1.CS.UCLA.EDU.20000 > 198.188.2.10.22222: UDP, length 1024
19:00:19.899932 IP Planetlab1.CS.UCLA.EDU.20000 > 198.188.2.10.22222: UDP, length 1024
19:00:19.904444 IP Planetlab1.CS.UCLA.EDU.20000 > 198.188.2.10.22222: UDP, length 1024
19:00:19.908548 IP Planetlab1.CS.UCLA.EDU.20000 > 198.188.2.10.22222: UDP, length 1024
19:00:19.913061 IP Planetlab1.CS.UCLA.EDU.20000 > 198.188.2.10.22222: UDP, length 1024
19:00:19.917166 IP Planetlab1.CS.UCLA.EDU.20000 > 198.188.2.10.22222: UDP, length 1024
19:00:19.921677 IP Planetlab1.CS.UCLA.EDU.20000 > 198.188.2.10.22222: UDP, length 1024
19:00:19.925781 IP Planetlab1.CS.UCLA.EDU.20000 > 198.188.2.10.22222: UDP, length 1024
19:00:19.930293 IP Planetlab1.CS.UCLA.EDU.20000 > 198.188.2.10.22222: UDP, length 1024
19:00:19.934396 IP Planetlab1.CS.UCLA.EDU.20000 > 198.188.2.10.22222: UDP, length 1024
19:00:19.938499 IP Planetlab1.CS.UCLA.EDU.20000 > 198.188.2.10.22222: UDP, length 1024
19:00:19.943012 IP Planetlab1.CS.UCLA.EDU.20000 > 198.188.2.10.22222: UDP, length 1024
19:00:19.947117 IP Planetlab1.CS.UCLA.EDU.20000 > 198.188.2.10.22222: UDP, length 1024
19:00:19.951629 IP Planetlab1.CS.UCLA.EDU.20000 > 198.188.2.10.22222: UDP, length 1024
19:00:19.955733 IP Planetlab1.CS.UCLA.EDU.20000 > 198.188.2.10.22222: UDP, length 1024
19:00:19.960245 IP Planetlab1.CS.UCLA.EDU.20000 > 198.188.2.10.22222: UDP, length 1024
19:00:19.964348 IP Planetlab1.CS.UCLA.EDU.20000 > 198.188.2.10.22222: UDP, length 1024
19:00:19.968860 IP Planetlab1.CS.UCLA.EDU.20000 > 198.188.2.10.22222: UDP, length 1024
19:00:19.972965 IP Planetlab1.CS.UCLA.EDU.20000 > 198.188.2.10.22222: UDP, length 1024
19:00:19.977477 IP Planetlab1.CS.UCLA.EDU.20000 > 198.188.2.10.22222: UDP, length 1024
19:00:19.981581 IP Planetlab1.CS.UCLA.EDU.20000 > 198.188.2.10.22222: UDP, length 1024
19:00:19.986094 IP Planetlab1.CS.UCLA.EDU.20000 > 198.188.2.10.22222: UDP, length 1024
19:00:19.990203 IP Planetlab1.CS.UCLA.EDU.20000 > 198.188.2.10.22222: UDP, length 1024
19:00:19.994710 IP Planetlab1.CS.UCLA.EDU.20000 > 198.188.2.10.22222: UDP, length 1024
19:00:19.998812 IP Planetlab1.CS.UCLA.EDU.20000 > 198.188.2.10.22222: UDP, length 1024
19:00:20.002918 IP Planetlab1.CS.UCLA.EDU.20000 > 198.188.2.10.22222: UDP, length 1024
19:00:20.007430 IP Planetlab1.CS.UCLA.EDU.20000 > 198.188.2.10.22222: UDP, length 1024
19:00:20.011534 IP Planetlab1.CS.UCLA.EDU.20000 > 198.188.2.10.22222: UDP, length 1024
19:00:20.016046 IP Planetlab1.CS.UCLA.EDU.20000 > 198.188.2.10.22222: UDP, length 1024
19:00:20.020149 IP Planetlab1.CS.UCLA.EDU.20000 > 198.188.2.10.22222: UDP, length 1024
19:00:20.024661 IP Planetlab1.CS.UCLA.EDU.20000 > 198.188.2.10.22222: UDP, length 1024
19:00:20.028767 IP Planetlab1.CS.UCLA.EDU.20000 > 198.188.2.10.22222: UDP, length 1024
19:00:20.033282 IP Planetlab1.CS.UCLA.EDU.20000 > 198.188.2.10.22222: UDP, length 1024
19:00:20.037381 IP Planetlab1.CS.UCLA.EDU.20000 > 198.188.2.10.22222: UDP, length 1024
19:00:20.041893 IP Planetlab1.CS.UCLA.EDU.20000 > 198.188.2.10.22222: UDP, length 1024
19:00:20.045998 IP Planetlab1.CS.UCLA.EDU.20000 > 198.188.2.10.22222: UDP, length 1024
19:00:20.050510 IP Planetlab1.CS.UCLA.EDU.20000 > 198.188.2.10.22222: UDP, length 1024
19:00:20.054613 IP Planetlab1.CS.UCLA.EDU.20000 > 198.188.2.10.22222: UDP, length 1024
19:00:20.059126 IP Planetlab1.CS.UCLA.EDU.20000 > 198.188.2.10.22222: UDP, length 1024
19:00:20.063230 IP Planetlab1.CS.UCLA.EDU.20000 > 198.188.2.10.22222: UDP, length 1024
19:00:20.067334 IP Planetlab1.CS.UCLA.EDU.20000 > 198.188.2.10.22222: UDP, length 1024
19:00:20.071845 IP Planetlab1.CS.UCLA.EDU.20000 > 198.188.2.10.22222: UDP, length 1024
19:00:20.075949 IP Planetlab1.CS.UCLA.EDU.20000 > 198.188.2.10.22222: UDP, length 1024
19:00:20.080462 IP Planetlab1.CS.UCLA.EDU.20000 > 198.188.2.10.22222: UDP, length 1024
19:00:20.084567 IP Planetlab1.CS.UCLA.EDU.20000 > 198.188.2.10.22222: UDP, length 1024
19:00:20.089078 IP Planetlab1.CS.UCLA.EDU.20000 > 198.188.2.10.22222: UDP, length 1024
19:00:20.093184 IP Planetlab1.CS.UCLA.EDU.20000 > 198.188.2.10.22222: UDP, length 1024
19:00:20.097694 IP Planetlab1.CS.UCLA.EDU.20000 > 198.188.2.10.22222: UDP, length 1024
19:00:20.101798 IP Planetlab1.CS.UCLA.EDU.20000 > 198.188.2.10.22222: UDP, length 1024
19:00:20.106311 IP Planetlab1.CS.UCLA.EDU.20000 > 198.188.2.10.22222: UDP, length 1024
19:00:20.110415 IP Planetlab1.CS.UCLA.EDU.20000 > 198.188.2.10.22222: UDP, length 1024
19:00:20.114925 IP Planetlab1.CS.UCLA.EDU.20000 > 198.188.2.10.22222: UDP, length 1024
19:00:20.119031 IP Planetlab1.CS.UCLA.EDU.20000 > 198.188.2.10.22222: UDP, length 1024
19:00:20.123548 IP Planetlab1.CS.UCLA.EDU.20000 > 198.188.2.10.22222: UDP, length 1024
19:00:20.127646 IP Planetlab1.CS.UCLA.EDU.20000 > 198.188.2.10.22222: UDP, length 1024
19:00:20.131750 IP Planetlab1.CS.UCLA.EDU.20000 > 198.188.2.10.22222: UDP, length 1024
19:00:20.136262 IP Planetlab1.CS.UCLA.EDU.20000 > 198.188.2.10.22222: UDP, length 1024
19:00:20.140367 IP Planetlab1.CS.UCLA.EDU.20000 > 198.188.2.10.22222: UDP, length 1024
19:00:20.144879 IP Planetlab1.CS.UCLA.EDU.20000 > 198.188.2.10.22222: UDP, length 1024
19:00:20.148983 IP Planetlab1.CS.UCLA.EDU.20000 > 198.188.2.10.22222: UDP, length 1024
19:00:20.153496 IP Planetlab1.CS.UCLA.EDU.20000 > 198.188.2.10.22222: UDP, length 1024
19:00:20.157603 IP Planetlab1.CS.UCLA.EDU.20000 > 198.188.2.10.22222: UDP, length 1024
19:00:20.162111 IP Planetlab1.CS.UCLA.EDU.20000 > 198.188.2.10.22222: UDP, length 1024
19:00:20.166213 IP Planetlab1.CS.UCLA.EDU.20000 > 198.188.2.10.22222: UDP, length 1024
19:00:20.170726 IP Planetlab1.CS.UCLA.EDU.20000 > 198.188.2.10.22222: UDP, length 1024
