18:28:32.045289 IP planetlab2.cs.ubc.ca.42691 > 198.188.2.10.22222: UDP, length 1024
18:28:32.049390 IP planetlab2.cs.ubc.ca.42691 > 198.188.2.10.22222: UDP, length 1024
18:28:32.053497 IP planetlab2.cs.ubc.ca.42691 > 198.188.2.10.22222: UDP, length 1024
18:28:32.058005 IP planetlab2.cs.ubc.ca.42691 > 198.188.2.10.22222: UDP, length 1024
18:28:32.062110 IP planetlab2.cs.ubc.ca.42691 > 198.188.2.10.22222: UDP, length 1024
18:28:32.066621 IP planetlab2.cs.ubc.ca.42691 > 198.188.2.10.22222: UDP, length 1024
18:28:32.070725 IP planetlab2.cs.ubc.ca.42691 > 198.188.2.10.22222: UDP, length 1024
18:28:32.075238 IP planetlab2.cs.ubc.ca.42691 > 198.188.2.10.22222: UDP, length 1024
18:28:32.079341 IP planetlab2.cs.ubc.ca.42691 > 198.188.2.10.22222: UDP, length 1024
18:28:32.083853 IP planetlab2.cs.ubc.ca.42691 > 198.188.2.10.22222: UDP, length 1024
18:28:32.087957 IP planetlab2.cs.ubc.ca.42691 > 198.188.2.10.22222: UDP, length 1024
18:28:32.092470 IP planetlab2.cs.ubc.ca.42691 > 198.188.2.10.22222: UDP, length 1024
18:28:32.096580 IP planetlab2.cs.ubc.ca.42691 > 198.188.2.10.22222: UDP, length 1024
18:28:32.101085 IP planetlab2.cs.ubc.ca.42691 > 198.188.2.10.22222: UDP, length 1024
18:28:32.105189 IP planetlab2.cs.ubc.ca.42691 > 198.188.2.10.22222: UDP, length 1024
18:28:32.109701 IP planetlab2.cs.ubc.ca.42691 > 198.188.2.10.22222: UDP, length 1024
18:28:32.113806 IP planetlab2.cs.ubc.ca.42691 > 198.188.2.10.22222: UDP, length 1024
18:28:32.117910 IP planetlab2.cs.ubc.ca.42691 > 198.188.2.10.22222: UDP, length 1024
18:28:32.122422 IP planetlab2.cs.ubc.ca.42691 > 198.188.2.10.22222: UDP, length 1024
18:28:32.126526 IP planetlab2.cs.ubc.ca.42691 > 198.188.2.10.22222: UDP, length 1024
18:28:32.131038 IP planetlab2.cs.ubc.ca.42691 > 198.188.2.10.22222: UDP, length 1024
18:28:32.135142 IP planetlab2.cs.ubc.ca.42691 > 198.188.2.10.22222: UDP, length 1024
18:28:32.139653 IP planetlab2.cs.ubc.ca.42691 > 198.188.2.10.22222: UDP, length 1024
18:28:32.143758 IP planetlab2.cs.ubc.ca.42691 > 198.188.2.10.22222: UDP, length 1024
18:28:32.148269 IP planetlab2.cs.ubc.ca.42691 > 198.188.2.10.22222: UDP, length 1024
18:28:32.152373 IP planetlab2.cs.ubc.ca.42691 > 198.188.2.10.22222: UDP, length 1024
18:28:32.156887 IP planetlab2.cs.ubc.ca.42691 > 198.188.2.10.22222: UDP, length 1024
18:28:32.160990 IP planetlab2.cs.ubc.ca.42691 > 198.188.2.10.22222: UDP, length 1024
18:28:32.165502 IP planetlab2.cs.ubc.ca.42691 > 198.188.2.10.22222: UDP, length 1024
18:28:32.169605 IP planetlab2.cs.ubc.ca.42691 > 198.188.2.10.22222: UDP, length 1024
18:28:32.174118 IP planetlab2.cs.ubc.ca.42691 > 198.188.2.10.22222: UDP, length 1024
18:28:32.178222 IP planetlab2.cs.ubc.ca.42691 > 198.188.2.10.22222: UDP, length 1024
18:28:32.182326 IP planetlab2.cs.ubc.ca.42691 > 198.188.2.10.22222: UDP, length 1024
18:28:32.186838 IP planetlab2.cs.ubc.ca.42691 > 198.188.2.10.22222: UDP, length 1024
18:28:32.190942 IP planetlab2.cs.ubc.ca.42691 > 198.188.2.10.22222: UDP, length 1024
18:28:32.195454 IP planetlab2.cs.ubc.ca.42691 > 198.188.2.10.22222: UDP, length 1024
18:28:32.199559 IP planetlab2.cs.ubc.ca.42691 > 198.188.2.10.22222: UDP, length 1024
18:28:32.204071 IP planetlab2.cs.ubc.ca.42691 > 198.188.2.10.22222: UDP, length 1024
18:28:32.208174 IP planetlab2.cs.ubc.ca.42691 > 198.188.2.10.22222: UDP, length 1024
18:28:32.212687 IP planetlab2.cs.ubc.ca.42691 > 198.188.2.10.22222: UDP, length 1024
18:28:32.216790 IP planetlab2.cs.ubc.ca.42691 > 198.188.2.10.22222: UDP, length 1024
18:28:32.221302 IP planetlab2.cs.ubc.ca.42691 > 198.188.2.10.22222: UDP, length 1024
18:28:32.225406 IP planetlab2.cs.ubc.ca.42691 > 198.188.2.10.22222: UDP, length 1024
18:28:32.229918 IP planetlab2.cs.ubc.ca.42691 > 198.188.2.10.22222: UDP, length 1024
18:28:32.234024 IP planetlab2.cs.ubc.ca.42691 > 198.188.2.10.22222: UDP, length 1024
18:28:32.238534 IP planetlab2.cs.ubc.ca.42691 > 198.188.2.10.22222: UDP, length 1024
18:28:32.242640 IP planetlab2.cs.ubc.ca.42691 > 198.188.2.10.22222: UDP, length 1024
18:28:32.246744 IP planetlab2.cs.ubc.ca.42691 > 198.188.2.10.22222: UDP, length 1024
18:28:32.251255 IP planetlab2.cs.ubc.ca.42691 > 198.188.2.10.22222: UDP, length 1024
18:28:32.255359 IP planetlab2.cs.ubc.ca.42691 > 198.188.2.10.22222: UDP, length 1024
18:28:32.259872 IP planetlab2.cs.ubc.ca.42691 > 198.188.2.10.22222: UDP, length 1024
18:28:32.263978 IP planetlab2.cs.ubc.ca.42691 > 198.188.2.10.22222: UDP, length 1024
18:28:32.268487 IP planetlab2.cs.ubc.ca.42691 > 198.188.2.10.22222: UDP, length 1024
18:28:32.272590 IP planetlab2.cs.ubc.ca.42691 > 198.188.2.10.22222: UDP, length 1024
18:28:32.277103 IP planetlab2.cs.ubc.ca.42691 > 198.188.2.10.22222: UDP, length 1024
18:28:32.281207 IP planetlab2.cs.ubc.ca.42691 > 198.188.2.10.22222: UDP, length 1024
18:28:32.285718 IP planetlab2.cs.ubc.ca.42691 > 198.188.2.10.22222: UDP, length 1024
18:28:32.289824 IP planetlab2.cs.ubc.ca.42691 > 198.188.2.10.22222: UDP, length 1024
18:28:32.294336 IP planetlab2.cs.ubc.ca.42691 > 198.188.2.10.22222: UDP, length 1024
18:28:32.298441 IP planetlab2.cs.ubc.ca.42691 > 198.188.2.10.22222: UDP, length 1024
18:28:32.302951 IP planetlab2.cs.ubc.ca.42691 > 198.188.2.10.22222: UDP, length 1024
18:28:32.307058 IP planetlab2.cs.ubc.ca.42691 > 198.188.2.10.22222: UDP, length 1024
18:28:32.311164 IP planetlab2.cs.ubc.ca.42691 > 198.188.2.10.22222: UDP, length 1024
18:28:32.315671 IP planetlab2.cs.ubc.ca.42691 > 198.188.2.10.22222: UDP, length 1024
18:28:32.319776 IP planetlab2.cs.ubc.ca.42691 > 198.188.2.10.22222: UDP, length 1024
18:28:32.324289 IP planetlab2.cs.ubc.ca.42691 > 198.188.2.10.22222: UDP, length 1024
18:28:32.328391 IP planetlab2.cs.ubc.ca.42691 > 198.188.2.10.22222: UDP, length 1024
18:28:32.332905 IP planetlab2.cs.ubc.ca.42691 > 198.188.2.10.22222: UDP, length 1024
18:28:32.337007 IP planetlab2.cs.ubc.ca.42691 > 198.188.2.10.22222: UDP, length 1024
18:28:32.341518 IP planetlab2.cs.ubc.ca.42691 > 198.188.2.10.22222: UDP, length 1024
18:28:32.345624 IP planetlab2.cs.ubc.ca.42691 > 198.188.2.10.22222: UDP, length 1024
18:28:32.350136 IP planetlab2.cs.ubc.ca.42691 > 198.188.2.10.22222: UDP, length 1024
18:28:32.354240 IP planetlab2.cs.ubc.ca.42691 > 198.188.2.10.22222: UDP, length 1024
18:28:32.358753 IP planetlab2.cs.ubc.ca.42691 > 198.188.2.10.22222: UDP, length 1024
18:28:32.362856 IP planetlab2.cs.ubc.ca.42691 > 198.188.2.10.22222: UDP, length 1024
18:28:32.367367 IP planetlab2.cs.ubc.ca.42691 > 198.188.2.10.22222: UDP, length 1024
18:28:32.371470 IP planetlab2.cs.ubc.ca.42691 > 198.188.2.10.22222: UDP, length 1024
18:28:32.375984 IP planetlab2.cs.ubc.ca.42691 > 198.188.2.10.22222: UDP, length 1024
18:28:32.380088 IP planetlab2.cs.ubc.ca.42691 > 198.188.2.10.22222: UDP, length 1024
18:28:32.384192 IP planetlab2.cs.ubc.ca.42691 > 198.188.2.10.22222: UDP, length 1024
18:28:32.388704 IP planetlab2.cs.ubc.ca.42691 > 198.188.2.10.22222: UDP, length 1024
18:28:32.392808 IP planetlab2.cs.ubc.ca.42691 > 198.188.2.10.22222: UDP, length 1024
18:28:32.397325 IP planetlab2.cs.ubc.ca.42691 > 198.188.2.10.22222: UDP, length 1024
18:28:32.401425 IP planetlab2.cs.ubc.ca.42691 > 198.188.2.10.22222: UDP, length 1024
18:28:32.405936 IP planetlab2.cs.ubc.ca.42691 > 198.188.2.10.22222: UDP, length 1024
18:28:32.410041 IP planetlab2.cs.ubc.ca.42691 > 198.188.2.10.22222: UDP, length 1024
18:28:32.414551 IP planetlab2.cs.ubc.ca.42691 > 198.188.2.10.22222: UDP, length 1024
18:28:32.418656 IP planetlab2.cs.ubc.ca.42691 > 198.188.2.10.22222: UDP, length 1024
18:28:32.423168 IP planetlab2.cs.ubc.ca.42691 > 198.188.2.10.22222: UDP, length 1024
18:28:32.427272 IP planetlab2.cs.ubc.ca.42691 > 198.188.2.10.22222: UDP, length 1024
18:28:32.431784 IP planetlab2.cs.ubc.ca.42691 > 198.188.2.10.22222: UDP, length 1024
18:28:32.435889 IP planetlab2.cs.ubc.ca.42691 > 198.188.2.10.22222: UDP, length 1024
18:28:32.440405 IP planetlab2.cs.ubc.ca.42691 > 198.188.2.10.22222: UDP, length 1024
18:28:32.444504 IP planetlab2.cs.ubc.ca.42691 > 198.188.2.10.22222: UDP, length 1024
18:28:32.448609 IP planetlab2.cs.ubc.ca.42691 > 198.188.2.10.22222: UDP, length 1024
18:28:32.453121 IP planetlab2.cs.ubc.ca.42691 > 198.188.2.10.22222: UDP, length 1024
18:28:32.457225 IP planetlab2.cs.ubc.ca.42691 > 198.188.2.10.22222: UDP, length 1024
18:28:32.461738 IP planetlab2.cs.ubc.ca.42691 > 198.188.2.10.22222: UDP, length 1024
18:28:32.465841 IP planetlab2.cs.ubc.ca.42691 > 198.188.2.10.22222: UDP, length 1024
18:28:32.470353 IP planetlab2.cs.ubc.ca.42691 > 198.188.2.10.22222: UDP, length 1024
18:28:32.474460 IP planetlab2.cs.ubc.ca.42691 > 198.188.2.10.22222: UDP, length 1024
18:28:32.478969 IP planetlab2.cs.ubc.ca.42691 > 198.188.2.10.22222: UDP, length 1024
18:28:32.483074 IP planetlab2.cs.ubc.ca.42691 > 198.188.2.10.22222: UDP, length 1024
18:28:32.487584 IP planetlab2.cs.ubc.ca.42691 > 198.188.2.10.22222: UDP, length 1024
18:28:32.491691 IP planetlab2.cs.ubc.ca.42691 > 198.188.2.10.22222: UDP, length 1024
18:28:32.496202 IP planetlab2.cs.ubc.ca.42691 > 198.188.2.10.22222: UDP, length 1024
18:28:32.500308 IP planetlab2.cs.ubc.ca.42691 > 198.188.2.10.22222: UDP, length 1024
18:28:32.504817 IP planetlab2.cs.ubc.ca.42691 > 198.188.2.10.22222: UDP, length 1024
18:28:32.508920 IP planetlab2.cs.ubc.ca.42691 > 198.188.2.10.22222: UDP, length 1024
18:28:32.513026 IP planetlab2.cs.ubc.ca.42691 > 198.188.2.10.22222: UDP, length 1024
18:28:32.517539 IP planetlab2.cs.ubc.ca.42691 > 198.188.2.10.22222: UDP, length 1024
18:28:32.521645 IP planetlab2.cs.ubc.ca.42691 > 198.188.2.10.22222: UDP, length 1024
18:28:32.526154 IP planetlab2.cs.ubc.ca.42691 > 198.188.2.10.22222: UDP, length 1024
18:28:32.530258 IP planetlab2.cs.ubc.ca.42691 > 198.188.2.10.22222: UDP, length 1024
18:28:32.534770 IP planetlab2.cs.ubc.ca.42691 > 198.188.2.10.22222: UDP, length 1024
18:28:32.538873 IP planetlab2.cs.ubc.ca.42691 > 198.188.2.10.22222: UDP, length 1024
18:28:32.543385 IP planetlab2.cs.ubc.ca.42691 > 198.188.2.10.22222: UDP, length 1024
18:28:32.547490 IP planetlab2.cs.ubc.ca.42691 > 198.188.2.10.22222: UDP, length 1024
18:28:32.552002 IP planetlab2.cs.ubc.ca.42691 > 198.188.2.10.22222: UDP, length 1024
18:28:32.556106 IP planetlab2.cs.ubc.ca.42691 > 198.188.2.10.22222: UDP, length 1024
18:28:32.560618 IP planetlab2.cs.ubc.ca.42691 > 198.188.2.10.22222: UDP, length 1024
18:28:32.564721 IP planetlab2.cs.ubc.ca.42691 > 198.188.2.10.22222: UDP, length 1024
18:28:32.569234 IP planetlab2.cs.ubc.ca.42691 > 198.188.2.10.22222: UDP, length 1024
18:28:32.573339 IP planetlab2.cs.ubc.ca.42691 > 198.188.2.10.22222: UDP, length 1024
18:28:32.577442 IP planetlab2.cs.ubc.ca.42691 > 198.188.2.10.22222: UDP, length 1024
18:28:32.581954 IP planetlab2.cs.ubc.ca.42691 > 198.188.2.10.22222: UDP, length 1024
18:28:32.586058 IP planetlab2.cs.ubc.ca.42691 > 198.188.2.10.22222: UDP, length 1024
18:28:32.590570 IP planetlab2.cs.ubc.ca.42691 > 198.188.2.10.22222: UDP, length 1024
18:28:32.594675 IP planetlab2.cs.ubc.ca.42691 > 198.188.2.10.22222: UDP, length 1024
18:28:32.599185 IP planetlab2.cs.ubc.ca.42691 > 198.188.2.10.22222: UDP, length 1024
18:28:32.603292 IP planetlab2.cs.ubc.ca.42691 > 198.188.2.10.22222: UDP, length 1024
18:28:32.607803 IP planetlab2.cs.ubc.ca.42691 > 198.188.2.10.22222: UDP, length 1024
18:28:32.611906 IP planetlab2.cs.ubc.ca.42691 > 198.188.2.10.22222: UDP, length 1024
18:28:32.616417 IP planetlab2.cs.ubc.ca.42691 > 198.188.2.10.22222: UDP, length 1024
18:28:32.620523 IP planetlab2.cs.ubc.ca.42691 > 198.188.2.10.22222: UDP, length 1024
18:28:32.625034 IP planetlab2.cs.ubc.ca.42691 > 198.188.2.10.22222: UDP, length 1024
18:28:32.629140 IP planetlab2.cs.ubc.ca.42691 > 198.188.2.10.22222: UDP, length 1024
18:28:32.633652 IP planetlab2.cs.ubc.ca.42691 > 198.188.2.10.22222: UDP, length 1024
18:28:32.637756 IP planetlab2.cs.ubc.ca.42691 > 198.188.2.10.22222: UDP, length 1024
18:28:32.642268 IP planetlab2.cs.ubc.ca.42691 > 198.188.2.10.22222: UDP, length 1024
18:28:32.646370 IP planetlab2.cs.ubc.ca.42691 > 198.188.2.10.22222: UDP, length 1024
18:28:32.650474 IP planetlab2.cs.ubc.ca.42691 > 198.188.2.10.22222: UDP, length 1024
18:28:32.654987 IP planetlab2.cs.ubc.ca.42691 > 198.188.2.10.22222: UDP, length 1024
18:28:32.659092 IP planetlab2.cs.ubc.ca.42691 > 198.188.2.10.22222: UDP, length 1024
18:28:32.663604 IP planetlab2.cs.ubc.ca.42691 > 198.188.2.10.22222: UDP, length 1024
18:28:32.667708 IP planetlab2.cs.ubc.ca.42691 > 198.188.2.10.22222: UDP, length 1024
18:28:32.672219 IP planetlab2.cs.ubc.ca.42691 > 198.188.2.10.22222: UDP, length 1024
18:28:32.676323 IP planetlab2.cs.ubc.ca.42691 > 198.188.2.10.22222: UDP, length 1024
18:28:32.680834 IP planetlab2.cs.ubc.ca.42691 > 198.188.2.10.22222: UDP, length 1024
18:28:32.684944 IP planetlab2.cs.ubc.ca.42691 > 198.188.2.10.22222: UDP, length 1024
18:28:32.689452 IP planetlab2.cs.ubc.ca.42691 > 198.188.2.10.22222: UDP, length 1024
18:28:32.693557 IP planetlab2.cs.ubc.ca.42691 > 198.188.2.10.22222: UDP, length 1024
18:28:32.698068 IP planetlab2.cs.ubc.ca.42691 > 198.188.2.10.22222: UDP, length 1024
18:28:32.702172 IP planetlab2.cs.ubc.ca.42691 > 198.188.2.10.22222: UDP, length 1024
18:28:32.706685 IP planetlab2.cs.ubc.ca.42691 > 198.188.2.10.22222: UDP, length 1024
18:28:32.710788 IP planetlab2.cs.ubc.ca.42691 > 198.188.2.10.22222: UDP, length 1024
18:28:32.714892 IP planetlab2.cs.ubc.ca.42691 > 198.188.2.10.22222: UDP, length 1024
18:28:32.719404 IP planetlab2.cs.ubc.ca.42691 > 198.188.2.10.22222: UDP, length 1024
18:28:32.723481 IP planetlab2.cs.ubc.ca.42691 > 198.188.2.10.22222: UDP, length 1024
18:28:32.727997 IP planetlab2.cs.ubc.ca.42691 > 198.188.2.10.22222: UDP, length 1024
18:28:32.732099 IP planetlab2.cs.ubc.ca.42691 > 198.188.2.10.22222: UDP, length 1024
18:28:32.736611 IP planetlab2.cs.ubc.ca.42691 > 198.188.2.10.22222: UDP, length 1024
18:28:32.740713 IP planetlab2.cs.ubc.ca.42691 > 198.188.2.10.22222: UDP, length 1024
18:28:32.745228 IP planetlab2.cs.ubc.ca.42691 > 198.188.2.10.22222: UDP, length 1024
18:28:32.749331 IP planetlab2.cs.ubc.ca.42691 > 198.188.2.10.22222: UDP, length 1024
18:28:32.753843 IP planetlab2.cs.ubc.ca.42691 > 198.188.2.10.22222: UDP, length 1024
18:28:32.757947 IP planetlab2.cs.ubc.ca.42691 > 198.188.2.10.22222: UDP, length 1024
18:28:32.762460 IP planetlab2.cs.ubc.ca.42691 > 198.188.2.10.22222: UDP, length 1024
18:28:32.766566 IP planetlab2.cs.ubc.ca.42691 > 198.188.2.10.22222: UDP, length 1024
18:28:32.771086 IP planetlab2.cs.ubc.ca.42691 > 198.188.2.10.22222: UDP, length 1024
18:28:32.775192 IP planetlab2.cs.ubc.ca.42691 > 198.188.2.10.22222: UDP, length 1024
18:28:32.779296 IP planetlab2.cs.ubc.ca.42691 > 198.188.2.10.22222: UDP, length 1024
18:28:32.783805 IP planetlab2.cs.ubc.ca.42691 > 198.188.2.10.22222: UDP, length 1024
18:28:32.787910 IP planetlab2.cs.ubc.ca.42691 > 198.188.2.10.22222: UDP, length 1024
18:28:32.792422 IP planetlab2.cs.ubc.ca.42691 > 198.188.2.10.22222: UDP, length 1024
18:28:32.796521 IP planetlab2.cs.ubc.ca.42691 > 198.188.2.10.22222: UDP, length 1024
18:28:32.801040 IP planetlab2.cs.ubc.ca.42691 > 198.188.2.10.22222: UDP, length 1024
18:28:32.805146 IP planetlab2.cs.ubc.ca.42691 > 198.188.2.10.22222: UDP, length 1024
18:28:32.809658 IP planetlab2.cs.ubc.ca.42691 > 198.188.2.10.22222: UDP, length 1024
18:28:32.813762 IP planetlab2.cs.ubc.ca.42691 > 198.188.2.10.22222: UDP, length 1024
18:28:32.818280 IP planetlab2.cs.ubc.ca.42691 > 198.188.2.10.22222: UDP, length 1024
18:28:32.822359 IP planetlab2.cs.ubc.ca.42691 > 198.188.2.10.22222: UDP, length 1024
18:28:32.826885 IP planetlab2.cs.ubc.ca.42691 > 198.188.2.10.22222: UDP, length 1024
18:28:32.830990 IP planetlab2.cs.ubc.ca.42691 > 198.188.2.10.22222: UDP, length 1024
18:28:32.835501 IP planetlab2.cs.ubc.ca.42691 > 198.188.2.10.22222: UDP, length 1024
18:28:32.839618 IP planetlab2.cs.ubc.ca.42691 > 198.188.2.10.22222: UDP, length 1024
18:28:32.843710 IP planetlab2.cs.ubc.ca.42691 > 198.188.2.10.22222: UDP, length 1024
18:28:32.848221 IP planetlab2.cs.ubc.ca.42691 > 198.188.2.10.22222: UDP, length 1024
18:28:32.852325 IP planetlab2.cs.ubc.ca.42691 > 198.188.2.10.22222: UDP, length 1024
18:28:32.856838 IP planetlab2.cs.ubc.ca.42691 > 198.188.2.10.22222: UDP, length 1024
18:28:32.860945 IP planetlab2.cs.ubc.ca.42691 > 198.188.2.10.22222: UDP, length 1024
18:28:32.865456 IP planetlab2.cs.ubc.ca.42691 > 198.188.2.10.22222: UDP, length 1024
18:28:32.869560 IP planetlab2.cs.ubc.ca.42691 > 198.188.2.10.22222: UDP, length 1024
18:28:32.874057 IP planetlab2.cs.ubc.ca.42691 > 198.188.2.10.22222: UDP, length 1024
18:28:32.878170 IP planetlab2.cs.ubc.ca.42691 > 198.188.2.10.22222: UDP, length 1024
18:28:32.882669 IP planetlab2.cs.ubc.ca.42691 > 198.188.2.10.22222: UDP, length 1024
18:28:32.886774 IP planetlab2.cs.ubc.ca.42691 > 198.188.2.10.22222: UDP, length 1024
18:28:32.891305 IP planetlab2.cs.ubc.ca.42691 > 198.188.2.10.22222: UDP, length 1024
18:28:32.895400 IP planetlab2.cs.ubc.ca.42691 > 198.188.2.10.22222: UDP, length 1024
18:28:32.899910 IP planetlab2.cs.ubc.ca.42691 > 198.188.2.10.22222: UDP, length 1024
18:28:32.904014 IP planetlab2.cs.ubc.ca.42691 > 198.188.2.10.22222: UDP, length 1024
18:28:32.908527 IP planetlab2.cs.ubc.ca.42691 > 198.188.2.10.22222: UDP, length 1024
18:28:32.912632 IP planetlab2.cs.ubc.ca.42691 > 198.188.2.10.22222: UDP, length 1024
18:28:32.916736 IP planetlab2.cs.ubc.ca.42691 > 198.188.2.10.22222: UDP, length 1024
18:28:32.921250 IP planetlab2.cs.ubc.ca.42691 > 198.188.2.10.22222: UDP, length 1024
18:28:32.925354 IP planetlab2.cs.ubc.ca.42691 > 198.188.2.10.22222: UDP, length 1024
18:28:32.929867 IP planetlab2.cs.ubc.ca.42691 > 198.188.2.10.22222: UDP, length 1024
18:28:32.933969 IP planetlab2.cs.ubc.ca.42691 > 198.188.2.10.22222: UDP, length 1024
18:28:32.938469 IP planetlab2.cs.ubc.ca.42691 > 198.188.2.10.22222: UDP, length 1024
18:28:32.942585 IP planetlab2.cs.ubc.ca.42691 > 198.188.2.10.22222: UDP, length 1024
18:28:32.947098 IP planetlab2.cs.ubc.ca.42691 > 198.188.2.10.22222: UDP, length 1024
18:28:32.951199 IP planetlab2.cs.ubc.ca.42691 > 198.188.2.10.22222: UDP, length 1024
18:28:32.955715 IP planetlab2.cs.ubc.ca.42691 > 198.188.2.10.22222: UDP, length 1024
18:28:32.959815 IP planetlab2.cs.ubc.ca.42691 > 198.188.2.10.22222: UDP, length 1024
18:28:32.964327 IP planetlab2.cs.ubc.ca.42691 > 198.188.2.10.22222: UDP, length 1024
18:28:32.968432 IP planetlab2.cs.ubc.ca.42691 > 198.188.2.10.22222: UDP, length 1024
18:28:32.972943 IP planetlab2.cs.ubc.ca.42691 > 198.188.2.10.22222: UDP, length 1024
18:28:32.977050 IP planetlab2.cs.ubc.ca.42691 > 198.188.2.10.22222: UDP, length 1024
18:28:32.981152 IP planetlab2.cs.ubc.ca.42691 > 198.188.2.10.22222: UDP, length 1024
18:28:32.985686 IP planetlab2.cs.ubc.ca.42691 > 198.188.2.10.22222: UDP, length 1024
18:28:32.989791 IP planetlab2.cs.ubc.ca.42691 > 198.188.2.10.22222: UDP, length 1024
18:28:32.994302 IP planetlab2.cs.ubc.ca.42691 > 198.188.2.10.22222: UDP, length 1024
18:28:32.998408 IP planetlab2.cs.ubc.ca.42691 > 198.188.2.10.22222: UDP, length 1024
18:28:33.002919 IP planetlab2.cs.ubc.ca.42691 > 198.188.2.10.22222: UDP, length 1024
18:28:33.007023 IP planetlab2.cs.ubc.ca.42691 > 198.188.2.10.22222: UDP, length 1024
18:28:33.011512 IP planetlab2.cs.ubc.ca.42691 > 198.188.2.10.22222: UDP, length 1024
18:28:33.015639 IP planetlab2.cs.ubc.ca.42691 > 198.188.2.10.22222: UDP, length 1024
18:28:33.020151 IP planetlab2.cs.ubc.ca.42691 > 198.188.2.10.22222: UDP, length 1024
18:28:33.024256 IP planetlab2.cs.ubc.ca.42691 > 198.188.2.10.22222: UDP, length 1024
18:28:33.028767 IP planetlab2.cs.ubc.ca.42691 > 198.188.2.10.22222: UDP, length 1024
18:28:33.032872 IP planetlab2.cs.ubc.ca.42691 > 198.188.2.10.22222: UDP, length 1024
18:28:33.037383 IP planetlab2.cs.ubc.ca.42691 > 198.188.2.10.22222: UDP, length 1024
18:28:33.041489 IP planetlab2.cs.ubc.ca.42691 > 198.188.2.10.22222: UDP, length 1024
18:28:33.045592 IP planetlab2.cs.ubc.ca.42691 > 198.188.2.10.22222: UDP, length 1024
18:28:33.050103 IP planetlab2.cs.ubc.ca.42691 > 198.188.2.10.22222: UDP, length 1024
18:28:33.054207 IP planetlab2.cs.ubc.ca.42691 > 198.188.2.10.22222: UDP, length 1024
18:28:33.058721 IP planetlab2.cs.ubc.ca.42691 > 198.188.2.10.22222: UDP, length 1024
18:28:33.062829 IP planetlab2.cs.ubc.ca.42691 > 198.188.2.10.22222: UDP, length 1024
18:28:33.067337 IP planetlab2.cs.ubc.ca.42691 > 198.188.2.10.22222: UDP, length 1024
18:28:33.071441 IP planetlab2.cs.ubc.ca.42691 > 198.188.2.10.22222: UDP, length 1024
18:28:33.075952 IP planetlab2.cs.ubc.ca.42691 > 198.188.2.10.22222: UDP, length 1024
18:28:33.080055 IP planetlab2.cs.ubc.ca.42691 > 198.188.2.10.22222: UDP, length 1024
18:28:33.084568 IP planetlab2.cs.ubc.ca.42691 > 198.188.2.10.22222: UDP, length 1024
18:28:33.088673 IP planetlab2.cs.ubc.ca.42691 > 198.188.2.10.22222: UDP, length 1024
18:28:33.093185 IP planetlab2.cs.ubc.ca.42691 > 198.188.2.10.22222: UDP, length 1024
18:28:33.097288 IP planetlab2.cs.ubc.ca.42691 > 198.188.2.10.22222: UDP, length 1024
18:28:33.101800 IP planetlab2.cs.ubc.ca.42691 > 198.188.2.10.22222: UDP, length 1024
18:28:33.105906 IP planetlab2.cs.ubc.ca.42691 > 198.188.2.10.22222: UDP, length 1024
18:28:33.110009 IP planetlab2.cs.ubc.ca.42691 > 198.188.2.10.22222: UDP, length 1024
18:28:33.114521 IP planetlab2.cs.ubc.ca.42691 > 198.188.2.10.22222: UDP, length 1024
18:28:33.118624 IP planetlab2.cs.ubc.ca.42691 > 198.188.2.10.22222: UDP, length 1024
18:28:33.123137 IP planetlab2.cs.ubc.ca.42691 > 198.188.2.10.22222: UDP, length 1024
18:28:33.127241 IP planetlab2.cs.ubc.ca.42691 > 198.188.2.10.22222: UDP, length 1024
18:28:33.131753 IP planetlab2.cs.ubc.ca.42691 > 198.188.2.10.22222: UDP, length 1024
18:28:33.135857 IP planetlab2.cs.ubc.ca.42691 > 198.188.2.10.22222: UDP, length 1024
18:28:33.140369 IP planetlab2.cs.ubc.ca.42691 > 198.188.2.10.22222: UDP, length 1024
18:28:33.144473 IP planetlab2.cs.ubc.ca.42691 > 198.188.2.10.22222: UDP, length 1024
18:28:33.148985 IP planetlab2.cs.ubc.ca.42691 > 198.188.2.10.22222: UDP, length 1024
18:28:33.153092 IP planetlab2.cs.ubc.ca.42691 > 198.188.2.10.22222: UDP, length 1024
18:28:33.157601 IP planetlab2.cs.ubc.ca.42691 > 198.188.2.10.22222: UDP, length 1024
18:28:33.161705 IP planetlab2.cs.ubc.ca.42691 > 198.188.2.10.22222: UDP, length 1024
18:28:33.166216 IP planetlab2.cs.ubc.ca.42691 > 198.188.2.10.22222: UDP, length 1024
18:28:33.170321 IP planetlab2.cs.ubc.ca.42691 > 198.188.2.10.22222: UDP, length 1024
18:28:33.174834 IP planetlab2.cs.ubc.ca.42691 > 198.188.2.10.22222: UDP, length 1024
18:28:33.178938 IP planetlab2.cs.ubc.ca.42691 > 198.188.2.10.22222: UDP, length 1024
18:28:33.183040 IP planetlab2.cs.ubc.ca.42691 > 198.188.2.10.22222: UDP, length 1024
18:28:33.187553 IP planetlab2.cs.ubc.ca.42691 > 198.188.2.10.22222: UDP, length 1024
18:28:33.191657 IP planetlab2.cs.ubc.ca.42691 > 198.188.2.10.22222: UDP, length 1024
18:28:33.196168 IP planetlab2.cs.ubc.ca.42691 > 198.188.2.10.22222: UDP, length 1024
18:28:33.200274 IP planetlab2.cs.ubc.ca.42691 > 198.188.2.10.22222: UDP, length 1024
18:28:33.204787 IP planetlab2.cs.ubc.ca.42691 > 198.188.2.10.22222: UDP, length 1024
18:28:33.208890 IP planetlab2.cs.ubc.ca.42691 > 198.188.2.10.22222: UDP, length 1024
18:28:33.213402 IP planetlab2.cs.ubc.ca.42691 > 198.188.2.10.22222: UDP, length 1024
18:28:33.217504 IP planetlab2.cs.ubc.ca.42691 > 198.188.2.10.22222: UDP, length 1024
18:28:33.222018 IP planetlab2.cs.ubc.ca.42691 > 198.188.2.10.22222: UDP, length 1024
18:28:33.226121 IP planetlab2.cs.ubc.ca.42691 > 198.188.2.10.22222: UDP, length 1024
18:28:33.230634 IP planetlab2.cs.ubc.ca.42691 > 198.188.2.10.22222: UDP, length 1024
18:28:33.234737 IP planetlab2.cs.ubc.ca.42691 > 198.188.2.10.22222: UDP, length 1024
18:28:33.239255 IP planetlab2.cs.ubc.ca.42691 > 198.188.2.10.22222: UDP, length 1024
18:28:33.243354 IP planetlab2.cs.ubc.ca.42691 > 198.188.2.10.22222: UDP, length 1024
18:28:33.247458 IP planetlab2.cs.ubc.ca.42691 > 198.188.2.10.22222: UDP, length 1024
18:28:33.251969 IP planetlab2.cs.ubc.ca.42691 > 198.188.2.10.22222: UDP, length 1024
18:28:33.256074 IP planetlab2.cs.ubc.ca.42691 > 198.188.2.10.22222: UDP, length 1024
18:28:33.260587 IP planetlab2.cs.ubc.ca.42691 > 198.188.2.10.22222: UDP, length 1024
18:28:33.264691 IP planetlab2.cs.ubc.ca.42691 > 198.188.2.10.22222: UDP, length 1024
18:28:33.269202 IP planetlab2.cs.ubc.ca.42691 > 198.188.2.10.22222: UDP, length 1024
18:28:33.273311 IP planetlab2.cs.ubc.ca.42691 > 198.188.2.10.22222: UDP, length 1024
18:28:33.277818 IP planetlab2.cs.ubc.ca.42691 > 198.188.2.10.22222: UDP, length 1024
18:28:33.281921 IP planetlab2.cs.ubc.ca.42691 > 198.188.2.10.22222: UDP, length 1024
18:28:33.286433 IP planetlab2.cs.ubc.ca.42691 > 198.188.2.10.22222: UDP, length 1024
18:28:33.290539 IP planetlab2.cs.ubc.ca.42691 > 198.188.2.10.22222: UDP, length 1024
18:28:33.295051 IP planetlab2.cs.ubc.ca.42691 > 198.188.2.10.22222: UDP, length 1024
18:28:33.299155 IP planetlab2.cs.ubc.ca.42691 > 198.188.2.10.22222: UDP, length 1024
18:28:33.303666 IP planetlab2.cs.ubc.ca.42691 > 198.188.2.10.22222: UDP, length 1024
18:28:33.307771 IP planetlab2.cs.ubc.ca.42691 > 198.188.2.10.22222: UDP, length 1024
18:28:33.311874 IP planetlab2.cs.ubc.ca.42691 > 198.188.2.10.22222: UDP, length 1024
18:28:33.316386 IP planetlab2.cs.ubc.ca.42691 > 198.188.2.10.22222: UDP, length 1024
18:28:33.320490 IP planetlab2.cs.ubc.ca.42691 > 198.188.2.10.22222: UDP, length 1024
18:28:33.325003 IP planetlab2.cs.ubc.ca.42691 > 198.188.2.10.22222: UDP, length 1024
18:28:33.329106 IP planetlab2.cs.ubc.ca.42691 > 198.188.2.10.22222: UDP, length 1024
18:28:33.333618 IP planetlab2.cs.ubc.ca.42691 > 198.188.2.10.22222: UDP, length 1024
18:28:33.337723 IP planetlab2.cs.ubc.ca.42691 > 198.188.2.10.22222: UDP, length 1024
18:28:33.342235 IP planetlab2.cs.ubc.ca.42691 > 198.188.2.10.22222: UDP, length 1024
18:28:33.346338 IP planetlab2.cs.ubc.ca.42691 > 198.188.2.10.22222: UDP, length 1024
18:28:33.350851 IP planetlab2.cs.ubc.ca.42691 > 198.188.2.10.22222: UDP, length 1024
18:28:33.354955 IP planetlab2.cs.ubc.ca.42691 > 198.188.2.10.22222: UDP, length 1024
18:28:33.359467 IP planetlab2.cs.ubc.ca.42691 > 198.188.2.10.22222: UDP, length 1024
18:28:33.363571 IP planetlab2.cs.ubc.ca.42691 > 198.188.2.10.22222: UDP, length 1024
18:28:33.368083 IP planetlab2.cs.ubc.ca.42691 > 198.188.2.10.22222: UDP, length 1024
18:28:33.372187 IP planetlab2.cs.ubc.ca.42691 > 198.188.2.10.22222: UDP, length 1024
18:28:33.376290 IP planetlab2.cs.ubc.ca.42691 > 198.188.2.10.22222: UDP, length 1024
18:28:33.380803 IP planetlab2.cs.ubc.ca.42691 > 198.188.2.10.22222: UDP, length 1024
18:28:33.384907 IP planetlab2.cs.ubc.ca.42691 > 198.188.2.10.22222: UDP, length 1024
18:28:33.389419 IP planetlab2.cs.ubc.ca.42691 > 198.188.2.10.22222: UDP, length 1024
18:28:33.393523 IP planetlab2.cs.ubc.ca.42691 > 198.188.2.10.22222: UDP, length 1024
18:28:33.398034 IP planetlab2.cs.ubc.ca.42691 > 198.188.2.10.22222: UDP, length 1024
18:28:33.402139 IP planetlab2.cs.ubc.ca.42691 > 198.188.2.10.22222: UDP, length 1024
18:28:33.406655 IP planetlab2.cs.ubc.ca.42691 > 198.188.2.10.22222: UDP, length 1024
18:28:33.410755 IP planetlab2.cs.ubc.ca.42691 > 198.188.2.10.22222: UDP, length 1024
18:28:33.415268 IP planetlab2.cs.ubc.ca.42691 > 198.188.2.10.22222: UDP, length 1024
18:28:33.419371 IP planetlab2.cs.ubc.ca.42691 > 198.188.2.10.22222: UDP, length 1024
18:28:33.423882 IP planetlab2.cs.ubc.ca.42691 > 198.188.2.10.22222: UDP, length 1024
18:28:33.427988 IP planetlab2.cs.ubc.ca.42691 > 198.188.2.10.22222: UDP, length 1024
18:28:33.432501 IP planetlab2.cs.ubc.ca.42691 > 198.188.2.10.22222: UDP, length 1024
18:28:33.436604 IP planetlab2.cs.ubc.ca.42691 > 198.188.2.10.22222: UDP, length 1024
18:28:33.441117 IP planetlab2.cs.ubc.ca.42691 > 198.188.2.10.22222: UDP, length 1024
18:28:33.445220 IP planetlab2.cs.ubc.ca.42691 > 198.188.2.10.22222: UDP, length 1024
18:28:33.449323 IP planetlab2.cs.ubc.ca.42691 > 198.188.2.10.22222: UDP, length 1024
18:28:33.453836 IP planetlab2.cs.ubc.ca.42691 > 198.188.2.10.22222: UDP, length 1024
18:28:33.457941 IP planetlab2.cs.ubc.ca.42691 > 198.188.2.10.22222: UDP, length 1024
18:28:33.462453 IP planetlab2.cs.ubc.ca.42691 > 198.188.2.10.22222: UDP, length 1024
18:28:33.466555 IP planetlab2.cs.ubc.ca.42691 > 198.188.2.10.22222: UDP, length 1024
18:28:33.471067 IP planetlab2.cs.ubc.ca.42691 > 198.188.2.10.22222: UDP, length 1024
18:28:33.475171 IP planetlab2.cs.ubc.ca.42691 > 198.188.2.10.22222: UDP, length 1024
18:28:33.479683 IP planetlab2.cs.ubc.ca.42691 > 198.188.2.10.22222: UDP, length 1024
18:28:33.483791 IP planetlab2.cs.ubc.ca.42691 > 198.188.2.10.22222: UDP, length 1024
18:28:33.488300 IP planetlab2.cs.ubc.ca.42691 > 198.188.2.10.22222: UDP, length 1024
18:28:33.492404 IP planetlab2.cs.ubc.ca.42691 > 198.188.2.10.22222: UDP, length 1024
18:28:33.496921 IP planetlab2.cs.ubc.ca.42691 > 198.188.2.10.22222: UDP, length 1024
18:28:33.501020 IP planetlab2.cs.ubc.ca.42691 > 198.188.2.10.22222: UDP, length 1024
18:28:33.505532 IP planetlab2.cs.ubc.ca.42691 > 198.188.2.10.22222: UDP, length 1024
18:28:33.509636 IP planetlab2.cs.ubc.ca.42691 > 198.188.2.10.22222: UDP, length 1024
18:28:33.513740 IP planetlab2.cs.ubc.ca.42691 > 198.188.2.10.22222: UDP, length 1024
18:28:33.518252 IP planetlab2.cs.ubc.ca.42691 > 198.188.2.10.22222: UDP, length 1024
18:28:33.522357 IP planetlab2.cs.ubc.ca.42691 > 198.188.2.10.22222: UDP, length 1024
18:28:33.526870 IP planetlab2.cs.ubc.ca.42691 > 198.188.2.10.22222: UDP, length 1024
18:28:33.530972 IP planetlab2.cs.ubc.ca.42691 > 198.188.2.10.22222: UDP, length 1024
18:28:33.535484 IP planetlab2.cs.ubc.ca.42691 > 198.188.2.10.22222: UDP, length 1024
18:28:33.539588 IP planetlab2.cs.ubc.ca.42691 > 198.188.2.10.22222: UDP, length 1024
18:28:33.544101 IP planetlab2.cs.ubc.ca.42691 > 198.188.2.10.22222: UDP, length 1024
18:28:33.548205 IP planetlab2.cs.ubc.ca.42691 > 198.188.2.10.22222: UDP, length 1024
18:28:33.552717 IP planetlab2.cs.ubc.ca.42691 > 198.188.2.10.22222: UDP, length 1024
18:28:33.556820 IP planetlab2.cs.ubc.ca.42691 > 198.188.2.10.22222: UDP, length 1024
18:28:33.561333 IP planetlab2.cs.ubc.ca.42691 > 198.188.2.10.22222: UDP, length 1024
18:28:33.565436 IP planetlab2.cs.ubc.ca.42691 > 198.188.2.10.22222: UDP, length 1024
18:28:33.569949 IP planetlab2.cs.ubc.ca.42691 > 198.188.2.10.22222: UDP, length 1024
18:28:33.574054 IP planetlab2.cs.ubc.ca.42691 > 198.188.2.10.22222: UDP, length 1024
18:28:33.578156 IP planetlab2.cs.ubc.ca.42691 > 198.188.2.10.22222: UDP, length 1024
18:28:33.582669 IP planetlab2.cs.ubc.ca.42691 > 198.188.2.10.22222: UDP, length 1024
18:28:33.586772 IP planetlab2.cs.ubc.ca.42691 > 198.188.2.10.22222: UDP, length 1024
18:28:33.591285 IP planetlab2.cs.ubc.ca.42691 > 198.188.2.10.22222: UDP, length 1024
18:28:33.595390 IP planetlab2.cs.ubc.ca.42691 > 198.188.2.10.22222: UDP, length 1024
18:28:33.599901 IP planetlab2.cs.ubc.ca.42691 > 198.188.2.10.22222: UDP, length 1024
18:28:33.604006 IP planetlab2.cs.ubc.ca.42691 > 198.188.2.10.22222: UDP, length 1024
18:28:33.608517 IP planetlab2.cs.ubc.ca.42691 > 198.188.2.10.22222: UDP, length 1024
18:28:33.612620 IP planetlab2.cs.ubc.ca.42691 > 198.188.2.10.22222: UDP, length 1024
18:28:33.617134 IP planetlab2.cs.ubc.ca.42691 > 198.188.2.10.22222: UDP, length 1024
18:28:33.621237 IP planetlab2.cs.ubc.ca.42691 > 198.188.2.10.22222: UDP, length 1024
18:28:33.625748 IP planetlab2.cs.ubc.ca.42691 > 198.188.2.10.22222: UDP, length 1024
18:28:33.629854 IP planetlab2.cs.ubc.ca.42691 > 198.188.2.10.22222: UDP, length 1024
18:28:33.634365 IP planetlab2.cs.ubc.ca.42691 > 198.188.2.10.22222: UDP, length 1024
18:28:33.638470 IP planetlab2.cs.ubc.ca.42691 > 198.188.2.10.22222: UDP, length 1024
18:28:33.642573 IP planetlab2.cs.ubc.ca.42691 > 198.188.2.10.22222: UDP, length 1024
18:28:33.647085 IP planetlab2.cs.ubc.ca.42691 > 198.188.2.10.22222: UDP, length 1024
18:28:33.651189 IP planetlab2.cs.ubc.ca.42691 > 198.188.2.10.22222: UDP, length 1024
18:28:33.655702 IP planetlab2.cs.ubc.ca.42691 > 198.188.2.10.22222: UDP, length 1024
18:28:33.659806 IP planetlab2.cs.ubc.ca.42691 > 198.188.2.10.22222: UDP, length 1024
18:28:33.664318 IP planetlab2.cs.ubc.ca.42691 > 198.188.2.10.22222: UDP, length 1024
18:28:33.668421 IP planetlab2.cs.ubc.ca.42691 > 198.188.2.10.22222: UDP, length 1024
18:28:33.672934 IP planetlab2.cs.ubc.ca.42691 > 198.188.2.10.22222: UDP, length 1024
18:28:33.677038 IP planetlab2.cs.ubc.ca.42691 > 198.188.2.10.22222: UDP, length 1024
18:28:33.681548 IP planetlab2.cs.ubc.ca.42691 > 198.188.2.10.22222: UDP, length 1024
18:28:33.685656 IP planetlab2.cs.ubc.ca.42691 > 198.188.2.10.22222: UDP, length 1024
18:28:33.690166 IP planetlab2.cs.ubc.ca.42691 > 198.188.2.10.22222: UDP, length 1024
18:28:33.694270 IP planetlab2.cs.ubc.ca.42691 > 198.188.2.10.22222: UDP, length 1024
18:28:33.698783 IP planetlab2.cs.ubc.ca.42691 > 198.188.2.10.22222: UDP, length 1024
18:28:33.702886 IP planetlab2.cs.ubc.ca.42691 > 198.188.2.10.22222: UDP, length 1024
18:28:33.707398 IP planetlab2.cs.ubc.ca.42691 > 198.188.2.10.22222: UDP, length 1024
18:28:33.711501 IP planetlab2.cs.ubc.ca.42691 > 198.188.2.10.22222: UDP, length 1024
18:28:33.715606 IP planetlab2.cs.ubc.ca.42691 > 198.188.2.10.22222: UDP, length 1024
18:28:33.720119 IP planetlab2.cs.ubc.ca.42691 > 198.188.2.10.22222: UDP, length 1024
18:28:33.724186 IP planetlab2.cs.ubc.ca.42691 > 198.188.2.10.22222: UDP, length 1024
18:28:33.728696 IP planetlab2.cs.ubc.ca.42691 > 198.188.2.10.22222: UDP, length 1024
18:28:33.732799 IP planetlab2.cs.ubc.ca.42691 > 198.188.2.10.22222: UDP, length 1024
18:28:33.737312 IP planetlab2.cs.ubc.ca.42691 > 198.188.2.10.22222: UDP, length 1024
18:28:33.741417 IP planetlab2.cs.ubc.ca.42691 > 198.188.2.10.22222: UDP, length 1024
18:28:33.745928 IP planetlab2.cs.ubc.ca.42691 > 198.188.2.10.22222: UDP, length 1024
18:28:33.750032 IP planetlab2.cs.ubc.ca.42691 > 198.188.2.10.22222: UDP, length 1024
18:28:33.754544 IP planetlab2.cs.ubc.ca.42691 > 198.188.2.10.22222: UDP, length 1024
18:28:33.758648 IP planetlab2.cs.ubc.ca.42691 > 198.188.2.10.22222: UDP, length 1024
18:28:33.763160 IP planetlab2.cs.ubc.ca.42691 > 198.188.2.10.22222: UDP, length 1024
18:28:33.767265 IP planetlab2.cs.ubc.ca.42691 > 198.188.2.10.22222: UDP, length 1024
18:28:33.771784 IP planetlab2.cs.ubc.ca.42691 > 198.188.2.10.22222: UDP, length 1024
18:28:33.775885 IP planetlab2.cs.ubc.ca.42691 > 198.188.2.10.22222: UDP, length 1024
18:28:33.779987 IP planetlab2.cs.ubc.ca.42691 > 198.188.2.10.22222: UDP, length 1024
18:28:33.784498 IP planetlab2.cs.ubc.ca.42691 > 198.188.2.10.22222: UDP, length 1024
18:28:33.788603 IP planetlab2.cs.ubc.ca.42691 > 198.188.2.10.22222: UDP, length 1024
18:28:33.793115 IP planetlab2.cs.ubc.ca.42691 > 198.188.2.10.22222: UDP, length 1024
18:28:33.797219 IP planetlab2.cs.ubc.ca.42691 > 198.188.2.10.22222: UDP, length 1024
18:28:33.801732 IP planetlab2.cs.ubc.ca.42691 > 198.188.2.10.22222: UDP, length 1024
18:28:33.805835 IP planetlab2.cs.ubc.ca.42691 > 198.188.2.10.22222: UDP, length 1024
18:28:33.810348 IP planetlab2.cs.ubc.ca.42691 > 198.188.2.10.22222: UDP, length 1024
18:28:33.814452 IP planetlab2.cs.ubc.ca.42691 > 198.188.2.10.22222: UDP, length 1024
18:28:33.818964 IP planetlab2.cs.ubc.ca.42691 > 198.188.2.10.22222: UDP, length 1024
18:28:33.823071 IP planetlab2.cs.ubc.ca.42691 > 198.188.2.10.22222: UDP, length 1024
18:28:33.827595 IP planetlab2.cs.ubc.ca.42691 > 198.188.2.10.22222: UDP, length 1024
18:28:33.831683 IP planetlab2.cs.ubc.ca.42691 > 198.188.2.10.22222: UDP, length 1024
18:28:33.836197 IP planetlab2.cs.ubc.ca.42691 > 198.188.2.10.22222: UDP, length 1024
18:28:33.840299 IP planetlab2.cs.ubc.ca.42691 > 198.188.2.10.22222: UDP, length 1024
18:28:33.844402 IP planetlab2.cs.ubc.ca.42691 > 198.188.2.10.22222: UDP, length 1024
18:28:33.848915 IP planetlab2.cs.ubc.ca.42691 > 198.188.2.10.22222: UDP, length 1024
18:28:33.853020 IP planetlab2.cs.ubc.ca.42691 > 198.188.2.10.22222: UDP, length 1024
18:28:33.857531 IP planetlab2.cs.ubc.ca.42691 > 198.188.2.10.22222: UDP, length 1024
18:28:33.861638 IP planetlab2.cs.ubc.ca.42691 > 198.188.2.10.22222: UDP, length 1024
18:28:33.866150 IP planetlab2.cs.ubc.ca.42691 > 198.188.2.10.22222: UDP, length 1024
18:28:33.870252 IP planetlab2.cs.ubc.ca.42691 > 198.188.2.10.22222: UDP, length 1024
18:28:33.874764 IP planetlab2.cs.ubc.ca.42691 > 198.188.2.10.22222: UDP, length 1024
18:28:33.878869 IP planetlab2.cs.ubc.ca.42691 > 198.188.2.10.22222: UDP, length 1024
18:28:33.883593 IP planetlab2.cs.ubc.ca.42691 > 198.188.2.10.22222: UDP, length 1024
18:28:33.887489 IP planetlab2.cs.ubc.ca.42691 > 198.188.2.10.22222: UDP, length 1024
18:28:33.892001 IP planetlab2.cs.ubc.ca.42691 > 198.188.2.10.22222: UDP, length 1024
18:28:33.896125 IP planetlab2.cs.ubc.ca.42691 > 198.188.2.10.22222: UDP, length 1024
18:28:33.900637 IP planetlab2.cs.ubc.ca.42691 > 198.188.2.10.22222: UDP, length 1024
18:28:33.904731 IP planetlab2.cs.ubc.ca.42691 > 198.188.2.10.22222: UDP, length 1024
18:28:33.908835 IP planetlab2.cs.ubc.ca.42691 > 198.188.2.10.22222: UDP, length 1024
18:28:33.913347 IP planetlab2.cs.ubc.ca.42691 > 198.188.2.10.22222: UDP, length 1024
18:28:33.917451 IP planetlab2.cs.ubc.ca.42691 > 198.188.2.10.22222: UDP, length 1024
18:28:33.921963 IP planetlab2.cs.ubc.ca.42691 > 198.188.2.10.22222: UDP, length 1024
18:28:33.926068 IP planetlab2.cs.ubc.ca.42691 > 198.188.2.10.22222: UDP, length 1024
18:28:33.930582 IP planetlab2.cs.ubc.ca.42691 > 198.188.2.10.22222: UDP, length 1024
18:28:33.934684 IP planetlab2.cs.ubc.ca.42691 > 198.188.2.10.22222: UDP, length 1024
18:28:33.939195 IP planetlab2.cs.ubc.ca.42691 > 198.188.2.10.22222: UDP, length 1024
18:28:33.943298 IP planetlab2.cs.ubc.ca.42691 > 198.188.2.10.22222: UDP, length 1024
18:28:33.947809 IP planetlab2.cs.ubc.ca.42691 > 198.188.2.10.22222: UDP, length 1024
18:28:33.951912 IP planetlab2.cs.ubc.ca.42691 > 198.188.2.10.22222: UDP, length 1024
18:28:33.956424 IP planetlab2.cs.ubc.ca.42691 > 198.188.2.10.22222: UDP, length 1024
18:28:33.960529 IP planetlab2.cs.ubc.ca.42691 > 198.188.2.10.22222: UDP, length 1024
18:28:33.965040 IP planetlab2.cs.ubc.ca.42691 > 198.188.2.10.22222: UDP, length 1024
18:28:33.969145 IP planetlab2.cs.ubc.ca.42691 > 198.188.2.10.22222: UDP, length 1024
18:28:33.973657 IP planetlab2.cs.ubc.ca.42691 > 198.188.2.10.22222: UDP, length 1024
18:28:33.977761 IP planetlab2.cs.ubc.ca.42691 > 198.188.2.10.22222: UDP, length 1024
18:28:33.981853 IP planetlab2.cs.ubc.ca.42691 > 198.188.2.10.22222: UDP, length 1024
18:28:33.986400 IP planetlab2.cs.ubc.ca.42691 > 198.188.2.10.22222: UDP, length 1024
18:28:33.990504 IP planetlab2.cs.ubc.ca.42691 > 198.188.2.10.22222: UDP, length 1024
18:28:33.995019 IP planetlab2.cs.ubc.ca.42691 > 198.188.2.10.22222: UDP, length 1024
18:28:33.999121 IP planetlab2.cs.ubc.ca.42691 > 198.188.2.10.22222: UDP, length 1024
18:28:34.003633 IP planetlab2.cs.ubc.ca.42691 > 198.188.2.10.22222: UDP, length 1024
18:28:34.007738 IP planetlab2.cs.ubc.ca.42691 > 198.188.2.10.22222: UDP, length 1024
18:28:34.012249 IP planetlab2.cs.ubc.ca.42691 > 198.188.2.10.22222: UDP, length 1024
18:28:34.016352 IP planetlab2.cs.ubc.ca.42691 > 198.188.2.10.22222: UDP, length 1024
18:28:34.020864 IP planetlab2.cs.ubc.ca.42691 > 198.188.2.10.22222: UDP, length 1024
18:28:34.024962 IP planetlab2.cs.ubc.ca.42691 > 198.188.2.10.22222: UDP, length 1024
18:28:34.029481 IP planetlab2.cs.ubc.ca.42691 > 198.188.2.10.22222: UDP, length 1024
18:28:34.033585 IP planetlab2.cs.ubc.ca.42691 > 198.188.2.10.22222: UDP, length 1024
18:28:34.038100 IP planetlab2.cs.ubc.ca.42691 > 198.188.2.10.22222: UDP, length 1024
18:28:34.042201 IP planetlab2.cs.ubc.ca.42691 > 198.188.2.10.22222: UDP, length 1024
18:28:34.046304 IP planetlab2.cs.ubc.ca.42691 > 198.188.2.10.22222: UDP, length 1024
18:28:34.050816 IP planetlab2.cs.ubc.ca.42691 > 198.188.2.10.22222: UDP, length 1024
18:28:34.054922 IP planetlab2.cs.ubc.ca.42691 > 198.188.2.10.22222: UDP, length 1024
18:28:34.059432 IP planetlab2.cs.ubc.ca.42691 > 198.188.2.10.22222: UDP, length 1024
