18:28:04.017141 IP planetlab2.cs.ubc.ca.56628 > 198.188.2.10.22222: UDP, length 1024
18:28:04.021243 IP planetlab2.cs.ubc.ca.56628 > 198.188.2.10.22222: UDP, length 1024
18:28:04.025347 IP planetlab2.cs.ubc.ca.56628 > 198.188.2.10.22222: UDP, length 1024
18:28:04.029858 IP planetlab2.cs.ubc.ca.56628 > 198.188.2.10.22222: UDP, length 1024
18:28:04.033961 IP planetlab2.cs.ubc.ca.56628 > 198.188.2.10.22222: UDP, length 1024
18:28:04.038473 IP planetlab2.cs.ubc.ca.56628 > 198.188.2.10.22222: UDP, length 1024
18:28:04.042577 IP planetlab2.cs.ubc.ca.56628 > 198.188.2.10.22222: UDP, length 1024
18:28:04.047089 IP planetlab2.cs.ubc.ca.56628 > 198.188.2.10.22222: UDP, length 1024
18:28:04.051194 IP planetlab2.cs.ubc.ca.56628 > 198.188.2.10.22222: UDP, length 1024
18:28:04.055705 IP planetlab2.cs.ubc.ca.56628 > 198.188.2.10.22222: UDP, length 1024
18:28:04.059815 IP planetlab2.cs.ubc.ca.56628 > 198.188.2.10.22222: UDP, length 1024
18:28:04.064321 IP planetlab2.cs.ubc.ca.56628 > 198.188.2.10.22222: UDP, length 1024
18:28:04.068426 IP planetlab2.cs.ubc.ca.56628 > 198.188.2.10.22222: UDP, length 1024
18:28:04.072940 IP planetlab2.cs.ubc.ca.56628 > 198.188.2.10.22222: UDP, length 1024
18:28:04.077042 IP planetlab2.cs.ubc.ca.56628 > 198.188.2.10.22222: UDP, length 1024
18:28:04.081554 IP planetlab2.cs.ubc.ca.56628 > 198.188.2.10.22222: UDP, length 1024
18:28:04.085660 IP planetlab2.cs.ubc.ca.56628 > 198.188.2.10.22222: UDP, length 1024
18:28:04.089762 IP planetlab2.cs.ubc.ca.56628 > 198.188.2.10.22222: UDP, length 1024
18:28:04.094274 IP planetlab2.cs.ubc.ca.56628 > 198.188.2.10.22222: UDP, length 1024
18:28:04.098377 IP planetlab2.cs.ubc.ca.56628 > 198.188.2.10.22222: UDP, length 1024
18:28:04.102891 IP planetlab2.cs.ubc.ca.56628 > 198.188.2.10.22222: UDP, length 1024
18:28:04.106994 IP planetlab2.cs.ubc.ca.56628 > 198.188.2.10.22222: UDP, length 1024
18:28:04.111506 IP planetlab2.cs.ubc.ca.56628 > 198.188.2.10.22222: UDP, length 1024
18:28:04.115610 IP planetlab2.cs.ubc.ca.56628 > 198.188.2.10.22222: UDP, length 1024
18:28:04.120122 IP planetlab2.cs.ubc.ca.56628 > 198.188.2.10.22222: UDP, length 1024
18:28:04.124226 IP planetlab2.cs.ubc.ca.56628 > 198.188.2.10.22222: UDP, length 1024
18:28:04.128741 IP planetlab2.cs.ubc.ca.56628 > 198.188.2.10.22222: UDP, length 1024
18:28:04.132844 IP planetlab2.cs.ubc.ca.56628 > 198.188.2.10.22222: UDP, length 1024
18:28:04.137355 IP planetlab2.cs.ubc.ca.56628 > 198.188.2.10.22222: UDP, length 1024
18:28:04.141458 IP planetlab2.cs.ubc.ca.56628 > 198.188.2.10.22222: UDP, length 1024
18:28:04.145970 IP planetlab2.cs.ubc.ca.56628 > 198.188.2.10.22222: UDP, length 1024
18:28:04.150074 IP planetlab2.cs.ubc.ca.56628 > 198.188.2.10.22222: UDP, length 1024
18:28:04.154180 IP planetlab2.cs.ubc.ca.56628 > 198.188.2.10.22222: UDP, length 1024
18:28:04.158691 IP planetlab2.cs.ubc.ca.56628 > 198.188.2.10.22222: UDP, length 1024
18:28:04.162796 IP planetlab2.cs.ubc.ca.56628 > 198.188.2.10.22222: UDP, length 1024
18:28:04.167301 IP planetlab2.cs.ubc.ca.56628 > 198.188.2.10.22222: UDP, length 1024
18:28:04.171412 IP planetlab2.cs.ubc.ca.56628 > 198.188.2.10.22222: UDP, length 1024
18:28:04.175923 IP planetlab2.cs.ubc.ca.56628 > 198.188.2.10.22222: UDP, length 1024
18:28:04.180027 IP planetlab2.cs.ubc.ca.56628 > 198.188.2.10.22222: UDP, length 1024
18:28:04.184538 IP planetlab2.cs.ubc.ca.56628 > 198.188.2.10.22222: UDP, length 1024
18:28:04.188643 IP planetlab2.cs.ubc.ca.56628 > 198.188.2.10.22222: UDP, length 1024
18:28:04.193159 IP planetlab2.cs.ubc.ca.56628 > 198.188.2.10.22222: UDP, length 1024
18:28:04.197259 IP planetlab2.cs.ubc.ca.56628 > 198.188.2.10.22222: UDP, length 1024
18:28:04.201772 IP planetlab2.cs.ubc.ca.56628 > 198.188.2.10.22222: UDP, length 1024
18:28:04.205874 IP planetlab2.cs.ubc.ca.56628 > 198.188.2.10.22222: UDP, length 1024
18:28:04.210387 IP planetlab2.cs.ubc.ca.56628 > 198.188.2.10.22222: UDP, length 1024
18:28:04.214491 IP planetlab2.cs.ubc.ca.56628 > 198.188.2.10.22222: UDP, length 1024
18:28:04.218595 IP planetlab2.cs.ubc.ca.56628 > 198.188.2.10.22222: UDP, length 1024
18:28:04.223108 IP planetlab2.cs.ubc.ca.56628 > 198.188.2.10.22222: UDP, length 1024
18:28:04.227216 IP planetlab2.cs.ubc.ca.56628 > 198.188.2.10.22222: UDP, length 1024
18:28:04.231725 IP planetlab2.cs.ubc.ca.56628 > 198.188.2.10.22222: UDP, length 1024
18:28:04.235826 IP planetlab2.cs.ubc.ca.56628 > 198.188.2.10.22222: UDP, length 1024
18:28:04.240339 IP planetlab2.cs.ubc.ca.56628 > 198.188.2.10.22222: UDP, length 1024
18:28:04.244443 IP planetlab2.cs.ubc.ca.56628 > 198.188.2.10.22222: UDP, length 1024
18:28:04.248957 IP planetlab2.cs.ubc.ca.56628 > 198.188.2.10.22222: UDP, length 1024
18:28:04.253059 IP planetlab2.cs.ubc.ca.56628 > 198.188.2.10.22222: UDP, length 1024
18:28:04.257573 IP planetlab2.cs.ubc.ca.56628 > 198.188.2.10.22222: UDP, length 1024
18:28:04.261676 IP planetlab2.cs.ubc.ca.56628 > 198.188.2.10.22222: UDP, length 1024
18:28:04.266189 IP planetlab2.cs.ubc.ca.56628 > 198.188.2.10.22222: UDP, length 1024
18:28:04.270292 IP planetlab2.cs.ubc.ca.56628 > 198.188.2.10.22222: UDP, length 1024
18:28:04.274804 IP planetlab2.cs.ubc.ca.56628 > 198.188.2.10.22222: UDP, length 1024
18:28:04.278908 IP planetlab2.cs.ubc.ca.56628 > 198.188.2.10.22222: UDP, length 1024
18:28:04.283013 IP planetlab2.cs.ubc.ca.56628 > 198.188.2.10.22222: UDP, length 1024
18:28:04.287524 IP planetlab2.cs.ubc.ca.56628 > 198.188.2.10.22222: UDP, length 1024
18:28:04.291628 IP planetlab2.cs.ubc.ca.56628 > 198.188.2.10.22222: UDP, length 1024
18:28:04.296141 IP planetlab2.cs.ubc.ca.56628 > 198.188.2.10.22222: UDP, length 1024
18:28:04.300243 IP planetlab2.cs.ubc.ca.56628 > 198.188.2.10.22222: UDP, length 1024
18:28:04.304755 IP planetlab2.cs.ubc.ca.56628 > 198.188.2.10.22222: UDP, length 1024
18:28:04.308861 IP planetlab2.cs.ubc.ca.56628 > 198.188.2.10.22222: UDP, length 1024
18:28:04.313372 IP planetlab2.cs.ubc.ca.56628 > 198.188.2.10.22222: UDP, length 1024
18:28:04.317476 IP planetlab2.cs.ubc.ca.56628 > 198.188.2.10.22222: UDP, length 1024
18:28:04.321988 IP planetlab2.cs.ubc.ca.56628 > 198.188.2.10.22222: UDP, length 1024
18:28:04.326093 IP planetlab2.cs.ubc.ca.56628 > 198.188.2.10.22222: UDP, length 1024
18:28:04.330604 IP planetlab2.cs.ubc.ca.56628 > 198.188.2.10.22222: UDP, length 1024
18:28:04.334709 IP planetlab2.cs.ubc.ca.56628 > 198.188.2.10.22222: UDP, length 1024
18:28:04.339221 IP planetlab2.cs.ubc.ca.56628 > 198.188.2.10.22222: UDP, length 1024
18:28:04.343318 IP planetlab2.cs.ubc.ca.56628 > 198.188.2.10.22222: UDP, length 1024
18:28:04.347836 IP planetlab2.cs.ubc.ca.56628 > 198.188.2.10.22222: UDP, length 1024
18:28:04.351940 IP planetlab2.cs.ubc.ca.56628 > 198.188.2.10.22222: UDP, length 1024
18:28:04.356044 IP planetlab2.cs.ubc.ca.56628 > 198.188.2.10.22222: UDP, length 1024
18:28:04.360557 IP planetlab2.cs.ubc.ca.56628 > 198.188.2.10.22222: UDP, length 1024
18:28:04.364661 IP planetlab2.cs.ubc.ca.56628 > 198.188.2.10.22222: UDP, length 1024
18:28:04.369174 IP planetlab2.cs.ubc.ca.56628 > 198.188.2.10.22222: UDP, length 1024
18:28:04.373277 IP planetlab2.cs.ubc.ca.56628 > 198.188.2.10.22222: UDP, length 1024
18:28:04.377789 IP planetlab2.cs.ubc.ca.56628 > 198.188.2.10.22222: UDP, length 1024
18:28:04.381893 IP planetlab2.cs.ubc.ca.56628 > 198.188.2.10.22222: UDP, length 1024
18:28:04.386406 IP planetlab2.cs.ubc.ca.56628 > 198.188.2.10.22222: UDP, length 1024
18:28:04.390509 IP planetlab2.cs.ubc.ca.56628 > 198.188.2.10.22222: UDP, length 1024
18:28:04.395021 IP planetlab2.cs.ubc.ca.56628 > 198.188.2.10.22222: UDP, length 1024
18:28:04.399125 IP planetlab2.cs.ubc.ca.56628 > 198.188.2.10.22222: UDP, length 1024
18:28:04.403638 IP planetlab2.cs.ubc.ca.56628 > 198.188.2.10.22222: UDP, length 1024
18:28:04.407742 IP planetlab2.cs.ubc.ca.56628 > 198.188.2.10.22222: UDP, length 1024
18:28:04.412254 IP planetlab2.cs.ubc.ca.56628 > 198.188.2.10.22222: UDP, length 1024
18:28:04.416357 IP planetlab2.cs.ubc.ca.56628 > 198.188.2.10.22222: UDP, length 1024
18:28:04.420462 IP planetlab2.cs.ubc.ca.56628 > 198.188.2.10.22222: UDP, length 1024
18:28:04.424974 IP planetlab2.cs.ubc.ca.56628 > 198.188.2.10.22222: UDP, length 1024
18:28:04.429078 IP planetlab2.cs.ubc.ca.56628 > 198.188.2.10.22222: UDP, length 1024
18:28:04.433590 IP planetlab2.cs.ubc.ca.56628 > 198.188.2.10.22222: UDP, length 1024
18:28:04.437696 IP planetlab2.cs.ubc.ca.56628 > 198.188.2.10.22222: UDP, length 1024
18:28:04.442205 IP planetlab2.cs.ubc.ca.56628 > 198.188.2.10.22222: UDP, length 1024
18:28:04.446310 IP planetlab2.cs.ubc.ca.56628 > 198.188.2.10.22222: UDP, length 1024
18:28:04.450822 IP planetlab2.cs.ubc.ca.56628 > 198.188.2.10.22222: UDP, length 1024
18:28:04.454925 IP planetlab2.cs.ubc.ca.56628 > 198.188.2.10.22222: UDP, length 1024
18:28:04.459437 IP planetlab2.cs.ubc.ca.56628 > 198.188.2.10.22222: UDP, length 1024
18:28:04.463543 IP planetlab2.cs.ubc.ca.56628 > 198.188.2.10.22222: UDP, length 1024
18:28:04.468054 IP planetlab2.cs.ubc.ca.56628 > 198.188.2.10.22222: UDP, length 1024
18:28:04.472157 IP planetlab2.cs.ubc.ca.56628 > 198.188.2.10.22222: UDP, length 1024
18:28:04.476669 IP planetlab2.cs.ubc.ca.56628 > 198.188.2.10.22222: UDP, length 1024
18:28:04.480775 IP planetlab2.cs.ubc.ca.56628 > 198.188.2.10.22222: UDP, length 1024
18:28:04.484877 IP planetlab2.cs.ubc.ca.56628 > 198.188.2.10.22222: UDP, length 1024
18:28:04.489389 IP planetlab2.cs.ubc.ca.56628 > 198.188.2.10.22222: UDP, length 1024
18:28:04.493494 IP planetlab2.cs.ubc.ca.56628 > 198.188.2.10.22222: UDP, length 1024
18:28:04.498007 IP planetlab2.cs.ubc.ca.56628 > 198.188.2.10.22222: UDP, length 1024
18:28:04.502110 IP planetlab2.cs.ubc.ca.56628 > 198.188.2.10.22222: UDP, length 1024
18:28:04.506622 IP planetlab2.cs.ubc.ca.56628 > 198.188.2.10.22222: UDP, length 1024
18:28:04.510726 IP planetlab2.cs.ubc.ca.56628 > 198.188.2.10.22222: UDP, length 1024
18:28:04.515238 IP planetlab2.cs.ubc.ca.56628 > 198.188.2.10.22222: UDP, length 1024
18:28:04.519335 IP planetlab2.cs.ubc.ca.56628 > 198.188.2.10.22222: UDP, length 1024
18:28:04.523853 IP planetlab2.cs.ubc.ca.56628 > 198.188.2.10.22222: UDP, length 1024
18:28:04.527962 IP planetlab2.cs.ubc.ca.56628 > 198.188.2.10.22222: UDP, length 1024
18:28:04.532470 IP planetlab2.cs.ubc.ca.56628 > 198.188.2.10.22222: UDP, length 1024
18:28:04.536575 IP planetlab2.cs.ubc.ca.56628 > 198.188.2.10.22222: UDP, length 1024
18:28:04.541085 IP planetlab2.cs.ubc.ca.56628 > 198.188.2.10.22222: UDP, length 1024
18:28:04.545191 IP planetlab2.cs.ubc.ca.56628 > 198.188.2.10.22222: UDP, length 1024
18:28:04.549294 IP planetlab2.cs.ubc.ca.56628 > 198.188.2.10.22222: UDP, length 1024
18:28:04.553807 IP planetlab2.cs.ubc.ca.56628 > 198.188.2.10.22222: UDP, length 1024
18:28:04.557911 IP planetlab2.cs.ubc.ca.56628 > 198.188.2.10.22222: UDP, length 1024
18:28:04.562423 IP planetlab2.cs.ubc.ca.56628 > 198.188.2.10.22222: UDP, length 1024
18:28:04.566526 IP planetlab2.cs.ubc.ca.56628 > 198.188.2.10.22222: UDP, length 1024
18:28:04.571041 IP planetlab2.cs.ubc.ca.56628 > 198.188.2.10.22222: UDP, length 1024
18:28:04.575142 IP planetlab2.cs.ubc.ca.56628 > 198.188.2.10.22222: UDP, length 1024
18:28:04.579654 IP planetlab2.cs.ubc.ca.56628 > 198.188.2.10.22222: UDP, length 1024
18:28:04.583758 IP planetlab2.cs.ubc.ca.56628 > 198.188.2.10.22222: UDP, length 1024
18:28:04.588270 IP planetlab2.cs.ubc.ca.56628 > 198.188.2.10.22222: UDP, length 1024
18:28:04.592376 IP planetlab2.cs.ubc.ca.56628 > 198.188.2.10.22222: UDP, length 1024
18:28:04.596887 IP planetlab2.cs.ubc.ca.56628 > 198.188.2.10.22222: UDP, length 1024
18:28:04.600990 IP planetlab2.cs.ubc.ca.56628 > 198.188.2.10.22222: UDP, length 1024
18:28:04.605503 IP planetlab2.cs.ubc.ca.56628 > 198.188.2.10.22222: UDP, length 1024
18:28:04.609607 IP planetlab2.cs.ubc.ca.56628 > 198.188.2.10.22222: UDP, length 1024
18:28:04.614122 IP planetlab2.cs.ubc.ca.56628 > 198.188.2.10.22222: UDP, length 1024
18:28:04.618224 IP planetlab2.cs.ubc.ca.56628 > 198.188.2.10.22222: UDP, length 1024
18:28:04.622328 IP planetlab2.cs.ubc.ca.56628 > 198.188.2.10.22222: UDP, length 1024
18:28:04.626839 IP planetlab2.cs.ubc.ca.56628 > 198.188.2.10.22222: UDP, length 1024
18:28:04.630943 IP planetlab2.cs.ubc.ca.56628 > 198.188.2.10.22222: UDP, length 1024
18:28:04.635454 IP planetlab2.cs.ubc.ca.56628 > 198.188.2.10.22222: UDP, length 1024
18:28:04.639559 IP planetlab2.cs.ubc.ca.56628 > 198.188.2.10.22222: UDP, length 1024
18:28:04.644071 IP planetlab2.cs.ubc.ca.56628 > 198.188.2.10.22222: UDP, length 1024
18:28:04.648176 IP planetlab2.cs.ubc.ca.56628 > 198.188.2.10.22222: UDP, length 1024
18:28:04.652688 IP planetlab2.cs.ubc.ca.56628 > 198.188.2.10.22222: UDP, length 1024
18:28:04.656791 IP planetlab2.cs.ubc.ca.56628 > 198.188.2.10.22222: UDP, length 1024
18:28:04.661304 IP planetlab2.cs.ubc.ca.56628 > 198.188.2.10.22222: UDP, length 1024
18:28:04.665407 IP planetlab2.cs.ubc.ca.56628 > 198.188.2.10.22222: UDP, length 1024
18:28:04.669919 IP planetlab2.cs.ubc.ca.56628 > 198.188.2.10.22222: UDP, length 1024
18:28:04.674024 IP planetlab2.cs.ubc.ca.56628 > 198.188.2.10.22222: UDP, length 1024
18:28:04.678536 IP planetlab2.cs.ubc.ca.56628 > 198.188.2.10.22222: UDP, length 1024
18:28:04.682640 IP planetlab2.cs.ubc.ca.56628 > 198.188.2.10.22222: UDP, length 1024
18:28:04.686718 IP planetlab2.cs.ubc.ca.56628 > 198.188.2.10.22222: UDP, length 1024
18:28:04.691231 IP planetlab2.cs.ubc.ca.56628 > 198.188.2.10.22222: UDP, length 1024
18:28:04.695333 IP planetlab2.cs.ubc.ca.56628 > 198.188.2.10.22222: UDP, length 1024
18:28:04.699845 IP planetlab2.cs.ubc.ca.56628 > 198.188.2.10.22222: UDP, length 1024
18:28:04.703951 IP planetlab2.cs.ubc.ca.56628 > 198.188.2.10.22222: UDP, length 1024
18:28:04.708463 IP planetlab2.cs.ubc.ca.56628 > 198.188.2.10.22222: UDP, length 1024
18:28:04.712567 IP planetlab2.cs.ubc.ca.56628 > 198.188.2.10.22222: UDP, length 1024
18:28:04.717079 IP planetlab2.cs.ubc.ca.56628 > 198.188.2.10.22222: UDP, length 1024
18:28:04.721183 IP planetlab2.cs.ubc.ca.56628 > 198.188.2.10.22222: UDP, length 1024
18:28:04.725701 IP planetlab2.cs.ubc.ca.56628 > 198.188.2.10.22222: UDP, length 1024
18:28:04.729824 IP planetlab2.cs.ubc.ca.56628 > 198.188.2.10.22222: UDP, length 1024
18:28:04.734310 IP planetlab2.cs.ubc.ca.56628 > 198.188.2.10.22222: UDP, length 1024
18:28:04.738408 IP planetlab2.cs.ubc.ca.56628 > 198.188.2.10.22222: UDP, length 1024
18:28:04.742921 IP planetlab2.cs.ubc.ca.56628 > 198.188.2.10.22222: UDP, length 1024
18:28:04.747026 IP planetlab2.cs.ubc.ca.56628 > 198.188.2.10.22222: UDP, length 1024
18:28:04.751128 IP planetlab2.cs.ubc.ca.56628 > 198.188.2.10.22222: UDP, length 1024
18:28:04.755640 IP planetlab2.cs.ubc.ca.56628 > 198.188.2.10.22222: UDP, length 1024
18:28:04.759745 IP planetlab2.cs.ubc.ca.56628 > 198.188.2.10.22222: UDP, length 1024
18:28:04.764258 IP planetlab2.cs.ubc.ca.56628 > 198.188.2.10.22222: UDP, length 1024
18:28:04.768362 IP planetlab2.cs.ubc.ca.56628 > 198.188.2.10.22222: UDP, length 1024
18:28:04.772876 IP planetlab2.cs.ubc.ca.56628 > 198.188.2.10.22222: UDP, length 1024
18:28:04.776980 IP planetlab2.cs.ubc.ca.56628 > 198.188.2.10.22222: UDP, length 1024
18:28:04.781491 IP planetlab2.cs.ubc.ca.56628 > 198.188.2.10.22222: UDP, length 1024
18:28:04.785622 IP planetlab2.cs.ubc.ca.56628 > 198.188.2.10.22222: UDP, length 1024
18:28:04.790121 IP planetlab2.cs.ubc.ca.56628 > 198.188.2.10.22222: UDP, length 1024
18:28:04.794229 IP planetlab2.cs.ubc.ca.56628 > 198.188.2.10.22222: UDP, length 1024
18:28:04.798739 IP planetlab2.cs.ubc.ca.56628 > 198.188.2.10.22222: UDP, length 1024
18:28:04.802841 IP planetlab2.cs.ubc.ca.56628 > 198.188.2.10.22222: UDP, length 1024
18:28:04.807377 IP planetlab2.cs.ubc.ca.56628 > 198.188.2.10.22222: UDP, length 1024
18:28:04.811505 IP planetlab2.cs.ubc.ca.56628 > 198.188.2.10.22222: UDP, length 1024
18:28:04.815562 IP planetlab2.cs.ubc.ca.56628 > 198.188.2.10.22222: UDP, length 1024
18:28:04.820075 IP planetlab2.cs.ubc.ca.56628 > 198.188.2.10.22222: UDP, length 1024
18:28:04.824179 IP planetlab2.cs.ubc.ca.56628 > 198.188.2.10.22222: UDP, length 1024
18:28:04.828687 IP planetlab2.cs.ubc.ca.56628 > 198.188.2.10.22222: UDP, length 1024
18:28:04.832790 IP planetlab2.cs.ubc.ca.56628 > 198.188.2.10.22222: UDP, length 1024
18:28:04.837303 IP planetlab2.cs.ubc.ca.56628 > 198.188.2.10.22222: UDP, length 1024
18:28:04.841416 IP planetlab2.cs.ubc.ca.56628 > 198.188.2.10.22222: UDP, length 1024
18:28:04.845903 IP planetlab2.cs.ubc.ca.56628 > 198.188.2.10.22222: UDP, length 1024
18:28:04.850027 IP planetlab2.cs.ubc.ca.56628 > 198.188.2.10.22222: UDP, length 1024
18:28:04.854543 IP planetlab2.cs.ubc.ca.56628 > 198.188.2.10.22222: UDP, length 1024
18:28:04.858641 IP planetlab2.cs.ubc.ca.56628 > 198.188.2.10.22222: UDP, length 1024
18:28:04.863149 IP planetlab2.cs.ubc.ca.56628 > 198.188.2.10.22222: UDP, length 1024
18:28:04.867249 IP planetlab2.cs.ubc.ca.56628 > 198.188.2.10.22222: UDP, length 1024
18:28:04.871761 IP planetlab2.cs.ubc.ca.56628 > 198.188.2.10.22222: UDP, length 1024
18:28:04.875868 IP planetlab2.cs.ubc.ca.56628 > 198.188.2.10.22222: UDP, length 1024
18:28:04.880381 IP planetlab2.cs.ubc.ca.56628 > 198.188.2.10.22222: UDP, length 1024
18:28:04.884485 IP planetlab2.cs.ubc.ca.56628 > 198.188.2.10.22222: UDP, length 1024
18:28:04.888590 IP planetlab2.cs.ubc.ca.56628 > 198.188.2.10.22222: UDP, length 1024
18:28:04.893102 IP planetlab2.cs.ubc.ca.56628 > 198.188.2.10.22222: UDP, length 1024
18:28:04.897204 IP planetlab2.cs.ubc.ca.56628 > 198.188.2.10.22222: UDP, length 1024
18:28:04.901715 IP planetlab2.cs.ubc.ca.56628 > 198.188.2.10.22222: UDP, length 1024
18:28:04.905839 IP planetlab2.cs.ubc.ca.56628 > 198.188.2.10.22222: UDP, length 1024
18:28:04.910336 IP planetlab2.cs.ubc.ca.56628 > 198.188.2.10.22222: UDP, length 1024
18:28:04.914435 IP planetlab2.cs.ubc.ca.56628 > 198.188.2.10.22222: UDP, length 1024
18:28:04.918951 IP planetlab2.cs.ubc.ca.56628 > 198.188.2.10.22222: UDP, length 1024
18:28:04.923051 IP planetlab2.cs.ubc.ca.56628 > 198.188.2.10.22222: UDP, length 1024
18:28:04.927614 IP planetlab2.cs.ubc.ca.56628 > 198.188.2.10.22222: UDP, length 1024
18:28:04.931668 IP planetlab2.cs.ubc.ca.56628 > 198.188.2.10.22222: UDP, length 1024
18:28:04.936194 IP planetlab2.cs.ubc.ca.56628 > 198.188.2.10.22222: UDP, length 1024
18:28:04.940283 IP planetlab2.cs.ubc.ca.56628 > 198.188.2.10.22222: UDP, length 1024
18:28:04.944818 IP planetlab2.cs.ubc.ca.56628 > 198.188.2.10.22222: UDP, length 1024
18:28:04.948926 IP planetlab2.cs.ubc.ca.56628 > 198.188.2.10.22222: UDP, length 1024
18:28:04.953025 IP planetlab2.cs.ubc.ca.56628 > 198.188.2.10.22222: UDP, length 1024
18:28:04.957538 IP planetlab2.cs.ubc.ca.56628 > 198.188.2.10.22222: UDP, length 1024
18:28:04.961642 IP planetlab2.cs.ubc.ca.56628 > 198.188.2.10.22222: UDP, length 1024
18:28:04.966154 IP planetlab2.cs.ubc.ca.56628 > 198.188.2.10.22222: UDP, length 1024
18:28:04.970257 IP planetlab2.cs.ubc.ca.56628 > 198.188.2.10.22222: UDP, length 1024
18:28:04.974770 IP planetlab2.cs.ubc.ca.56628 > 198.188.2.10.22222: UDP, length 1024
18:28:04.978875 IP planetlab2.cs.ubc.ca.56628 > 198.188.2.10.22222: UDP, length 1024
18:28:04.983380 IP planetlab2.cs.ubc.ca.56628 > 198.188.2.10.22222: UDP, length 1024
18:28:04.987491 IP planetlab2.cs.ubc.ca.56628 > 198.188.2.10.22222: UDP, length 1024
18:28:04.992009 IP planetlab2.cs.ubc.ca.56628 > 198.188.2.10.22222: UDP, length 1024
18:28:04.996107 IP planetlab2.cs.ubc.ca.56628 > 198.188.2.10.22222: UDP, length 1024
18:28:05.000620 IP planetlab2.cs.ubc.ca.56628 > 198.188.2.10.22222: UDP, length 1024
18:28:05.004721 IP planetlab2.cs.ubc.ca.56628 > 198.188.2.10.22222: UDP, length 1024
18:28:05.009234 IP planetlab2.cs.ubc.ca.56628 > 198.188.2.10.22222: UDP, length 1024
18:28:05.013338 IP planetlab2.cs.ubc.ca.56628 > 198.188.2.10.22222: UDP, length 1024
18:28:05.017443 IP planetlab2.cs.ubc.ca.56628 > 198.188.2.10.22222: UDP, length 1024
18:28:05.021956 IP planetlab2.cs.ubc.ca.56628 > 198.188.2.10.22222: UDP, length 1024
18:28:05.026061 IP planetlab2.cs.ubc.ca.56628 > 198.188.2.10.22222: UDP, length 1024
18:28:05.030571 IP planetlab2.cs.ubc.ca.56628 > 198.188.2.10.22222: UDP, length 1024
18:28:05.034673 IP planetlab2.cs.ubc.ca.56628 > 198.188.2.10.22222: UDP, length 1024
18:28:05.039186 IP planetlab2.cs.ubc.ca.56628 > 198.188.2.10.22222: UDP, length 1024
18:28:05.043291 IP planetlab2.cs.ubc.ca.56628 > 198.188.2.10.22222: UDP, length 1024
18:28:05.047803 IP planetlab2.cs.ubc.ca.56628 > 198.188.2.10.22222: UDP, length 1024
18:28:05.051908 IP planetlab2.cs.ubc.ca.56628 > 198.188.2.10.22222: UDP, length 1024
18:28:05.056420 IP planetlab2.cs.ubc.ca.56628 > 198.188.2.10.22222: UDP, length 1024
18:28:05.060523 IP planetlab2.cs.ubc.ca.56628 > 198.188.2.10.22222: UDP, length 1024
18:28:05.065035 IP planetlab2.cs.ubc.ca.56628 > 198.188.2.10.22222: UDP, length 1024
18:28:05.069142 IP planetlab2.cs.ubc.ca.56628 > 198.188.2.10.22222: UDP, length 1024
18:28:05.073650 IP planetlab2.cs.ubc.ca.56628 > 198.188.2.10.22222: UDP, length 1024
18:28:05.077755 IP planetlab2.cs.ubc.ca.56628 > 198.188.2.10.22222: UDP, length 1024
18:28:05.081860 IP planetlab2.cs.ubc.ca.56628 > 198.188.2.10.22222: UDP, length 1024
18:28:05.086371 IP planetlab2.cs.ubc.ca.56628 > 198.188.2.10.22222: UDP, length 1024
18:28:05.090476 IP planetlab2.cs.ubc.ca.56628 > 198.188.2.10.22222: UDP, length 1024
18:28:05.094988 IP planetlab2.cs.ubc.ca.56628 > 198.188.2.10.22222: UDP, length 1024
18:28:05.099092 IP planetlab2.cs.ubc.ca.56628 > 198.188.2.10.22222: UDP, length 1024
18:28:05.103604 IP planetlab2.cs.ubc.ca.56628 > 198.188.2.10.22222: UDP, length 1024
18:28:05.107708 IP planetlab2.cs.ubc.ca.56628 > 198.188.2.10.22222: UDP, length 1024
18:28:05.112220 IP planetlab2.cs.ubc.ca.56628 > 198.188.2.10.22222: UDP, length 1024
18:28:05.116325 IP planetlab2.cs.ubc.ca.56628 > 198.188.2.10.22222: UDP, length 1024
18:28:05.120835 IP planetlab2.cs.ubc.ca.56628 > 198.188.2.10.22222: UDP, length 1024
18:28:05.124939 IP planetlab2.cs.ubc.ca.56628 > 198.188.2.10.22222: UDP, length 1024
18:28:05.129450 IP planetlab2.cs.ubc.ca.56628 > 198.188.2.10.22222: UDP, length 1024
18:28:05.133557 IP planetlab2.cs.ubc.ca.56628 > 198.188.2.10.22222: UDP, length 1024
18:28:05.138068 IP planetlab2.cs.ubc.ca.56628 > 198.188.2.10.22222: UDP, length 1024
18:28:05.142172 IP planetlab2.cs.ubc.ca.56628 > 198.188.2.10.22222: UDP, length 1024
18:28:05.146685 IP planetlab2.cs.ubc.ca.56628 > 198.188.2.10.22222: UDP, length 1024
18:28:05.150788 IP planetlab2.cs.ubc.ca.56628 > 198.188.2.10.22222: UDP, length 1024
18:28:05.154892 IP planetlab2.cs.ubc.ca.56628 > 198.188.2.10.22222: UDP, length 1024
18:28:05.159399 IP planetlab2.cs.ubc.ca.56628 > 198.188.2.10.22222: UDP, length 1024
18:28:05.163508 IP planetlab2.cs.ubc.ca.56628 > 198.188.2.10.22222: UDP, length 1024
18:28:05.168021 IP planetlab2.cs.ubc.ca.56628 > 198.188.2.10.22222: UDP, length 1024
18:28:05.172124 IP planetlab2.cs.ubc.ca.56628 > 198.188.2.10.22222: UDP, length 1024
18:28:05.176636 IP planetlab2.cs.ubc.ca.56628 > 198.188.2.10.22222: UDP, length 1024
18:28:05.180740 IP planetlab2.cs.ubc.ca.56628 > 198.188.2.10.22222: UDP, length 1024
18:28:05.185253 IP planetlab2.cs.ubc.ca.56628 > 198.188.2.10.22222: UDP, length 1024
18:28:05.189357 IP planetlab2.cs.ubc.ca.56628 > 198.188.2.10.22222: UDP, length 1024
18:28:05.193870 IP planetlab2.cs.ubc.ca.56628 > 198.188.2.10.22222: UDP, length 1024
18:28:05.197973 IP planetlab2.cs.ubc.ca.56628 > 198.188.2.10.22222: UDP, length 1024
18:28:05.202485 IP planetlab2.cs.ubc.ca.56628 > 198.188.2.10.22222: UDP, length 1024
18:28:05.206588 IP planetlab2.cs.ubc.ca.56628 > 198.188.2.10.22222: UDP, length 1024
18:28:05.211101 IP planetlab2.cs.ubc.ca.56628 > 198.188.2.10.22222: UDP, length 1024
18:28:05.215204 IP planetlab2.cs.ubc.ca.56628 > 198.188.2.10.22222: UDP, length 1024
18:28:05.219310 IP planetlab2.cs.ubc.ca.56628 > 198.188.2.10.22222: UDP, length 1024
18:28:05.223822 IP planetlab2.cs.ubc.ca.56628 > 198.188.2.10.22222: UDP, length 1024
18:28:05.227925 IP planetlab2.cs.ubc.ca.56628 > 198.188.2.10.22222: UDP, length 1024
18:28:05.232437 IP planetlab2.cs.ubc.ca.56628 > 198.188.2.10.22222: UDP, length 1024
18:28:05.236544 IP planetlab2.cs.ubc.ca.56628 > 198.188.2.10.22222: UDP, length 1024
18:28:05.241052 IP planetlab2.cs.ubc.ca.56628 > 198.188.2.10.22222: UDP, length 1024
18:28:05.245157 IP planetlab2.cs.ubc.ca.56628 > 198.188.2.10.22222: UDP, length 1024
18:28:05.249670 IP planetlab2.cs.ubc.ca.56628 > 198.188.2.10.22222: UDP, length 1024
18:28:05.253773 IP planetlab2.cs.ubc.ca.56628 > 198.188.2.10.22222: UDP, length 1024
18:28:05.258285 IP planetlab2.cs.ubc.ca.56628 > 198.188.2.10.22222: UDP, length 1024
18:28:05.262389 IP planetlab2.cs.ubc.ca.56628 > 198.188.2.10.22222: UDP, length 1024
18:28:05.266901 IP planetlab2.cs.ubc.ca.56628 > 198.188.2.10.22222: UDP, length 1024
18:28:05.271005 IP planetlab2.cs.ubc.ca.56628 > 198.188.2.10.22222: UDP, length 1024
18:28:05.275517 IP planetlab2.cs.ubc.ca.56628 > 198.188.2.10.22222: UDP, length 1024
18:28:05.279617 IP planetlab2.cs.ubc.ca.56628 > 198.188.2.10.22222: UDP, length 1024
18:28:05.283726 IP planetlab2.cs.ubc.ca.56628 > 198.188.2.10.22222: UDP, length 1024
18:28:05.288237 IP planetlab2.cs.ubc.ca.56628 > 198.188.2.10.22222: UDP, length 1024
18:28:05.292341 IP planetlab2.cs.ubc.ca.56628 > 198.188.2.10.22222: UDP, length 1024
18:28:05.296854 IP planetlab2.cs.ubc.ca.56628 > 198.188.2.10.22222: UDP, length 1024
18:28:05.300959 IP planetlab2.cs.ubc.ca.56628 > 198.188.2.10.22222: UDP, length 1024
18:28:05.305472 IP planetlab2.cs.ubc.ca.56628 > 198.188.2.10.22222: UDP, length 1024
18:28:05.309573 IP planetlab2.cs.ubc.ca.56628 > 198.188.2.10.22222: UDP, length 1024
18:28:05.314086 IP planetlab2.cs.ubc.ca.56628 > 198.188.2.10.22222: UDP, length 1024
18:28:05.318189 IP planetlab2.cs.ubc.ca.56628 > 198.188.2.10.22222: UDP, length 1024
18:28:05.322703 IP planetlab2.cs.ubc.ca.56628 > 198.188.2.10.22222: UDP, length 1024
18:28:05.326805 IP planetlab2.cs.ubc.ca.56628 > 198.188.2.10.22222: UDP, length 1024
18:28:05.331318 IP planetlab2.cs.ubc.ca.56628 > 198.188.2.10.22222: UDP, length 1024
18:28:05.335416 IP planetlab2.cs.ubc.ca.56628 > 198.188.2.10.22222: UDP, length 1024
18:28:05.339935 IP planetlab2.cs.ubc.ca.56628 > 198.188.2.10.22222: UDP, length 1024
18:28:05.344038 IP planetlab2.cs.ubc.ca.56628 > 198.188.2.10.22222: UDP, length 1024
18:28:05.348142 IP planetlab2.cs.ubc.ca.56628 > 198.188.2.10.22222: UDP, length 1024
18:28:05.352653 IP planetlab2.cs.ubc.ca.56628 > 198.188.2.10.22222: UDP, length 1024
18:28:05.356759 IP planetlab2.cs.ubc.ca.56628 > 198.188.2.10.22222: UDP, length 1024
18:28:05.361270 IP planetlab2.cs.ubc.ca.56628 > 198.188.2.10.22222: UDP, length 1024
18:28:05.365376 IP planetlab2.cs.ubc.ca.56628 > 198.188.2.10.22222: UDP, length 1024
18:28:05.369891 IP planetlab2.cs.ubc.ca.56628 > 198.188.2.10.22222: UDP, length 1024
18:28:05.373990 IP planetlab2.cs.ubc.ca.56628 > 198.188.2.10.22222: UDP, length 1024
18:28:05.378502 IP planetlab2.cs.ubc.ca.56628 > 198.188.2.10.22222: UDP, length 1024
18:28:05.382607 IP planetlab2.cs.ubc.ca.56628 > 198.188.2.10.22222: UDP, length 1024
18:28:05.387117 IP planetlab2.cs.ubc.ca.56628 > 198.188.2.10.22222: UDP, length 1024
18:28:05.391223 IP planetlab2.cs.ubc.ca.56628 > 198.188.2.10.22222: UDP, length 1024
18:28:05.395735 IP planetlab2.cs.ubc.ca.56628 > 198.188.2.10.22222: UDP, length 1024
18:28:05.399840 IP planetlab2.cs.ubc.ca.56628 > 198.188.2.10.22222: UDP, length 1024
18:28:05.404352 IP planetlab2.cs.ubc.ca.56628 > 198.188.2.10.22222: UDP, length 1024
18:28:05.408454 IP planetlab2.cs.ubc.ca.56628 > 198.188.2.10.22222: UDP, length 1024
18:28:05.412967 IP planetlab2.cs.ubc.ca.56628 > 198.188.2.10.22222: UDP, length 1024
18:28:05.417071 IP planetlab2.cs.ubc.ca.56628 > 198.188.2.10.22222: UDP, length 1024
18:28:05.421176 IP planetlab2.cs.ubc.ca.56628 > 198.188.2.10.22222: UDP, length 1024
18:28:05.425688 IP planetlab2.cs.ubc.ca.56628 > 198.188.2.10.22222: UDP, length 1024
18:28:05.429792 IP planetlab2.cs.ubc.ca.56628 > 198.188.2.10.22222: UDP, length 1024
18:28:05.434303 IP planetlab2.cs.ubc.ca.56628 > 198.188.2.10.22222: UDP, length 1024
18:28:05.438407 IP planetlab2.cs.ubc.ca.56628 > 198.188.2.10.22222: UDP, length 1024
18:28:05.442918 IP planetlab2.cs.ubc.ca.56628 > 198.188.2.10.22222: UDP, length 1024
18:28:05.447027 IP planetlab2.cs.ubc.ca.56628 > 198.188.2.10.22222: UDP, length 1024
18:28:05.451536 IP planetlab2.cs.ubc.ca.56628 > 198.188.2.10.22222: UDP, length 1024
18:28:05.455640 IP planetlab2.cs.ubc.ca.56628 > 198.188.2.10.22222: UDP, length 1024
18:28:05.460151 IP planetlab2.cs.ubc.ca.56628 > 198.188.2.10.22222: UDP, length 1024
18:28:05.464255 IP planetlab2.cs.ubc.ca.56628 > 198.188.2.10.22222: UDP, length 1024
18:28:05.468767 IP planetlab2.cs.ubc.ca.56628 > 198.188.2.10.22222: UDP, length 1024
18:28:05.472874 IP planetlab2.cs.ubc.ca.56628 > 198.188.2.10.22222: UDP, length 1024
18:28:05.477385 IP planetlab2.cs.ubc.ca.56628 > 198.188.2.10.22222: UDP, length 1024
18:28:05.481487 IP planetlab2.cs.ubc.ca.56628 > 198.188.2.10.22222: UDP, length 1024
18:28:05.485591 IP planetlab2.cs.ubc.ca.56628 > 198.188.2.10.22222: UDP, length 1024
18:28:05.490107 IP planetlab2.cs.ubc.ca.56628 > 198.188.2.10.22222: UDP, length 1024
18:28:05.494207 IP planetlab2.cs.ubc.ca.56628 > 198.188.2.10.22222: UDP, length 1024
18:28:05.498720 IP planetlab2.cs.ubc.ca.56628 > 198.188.2.10.22222: UDP, length 1024
18:28:05.502824 IP planetlab2.cs.ubc.ca.56628 > 198.188.2.10.22222: UDP, length 1024
18:28:05.507336 IP planetlab2.cs.ubc.ca.56628 > 198.188.2.10.22222: UDP, length 1024
18:28:05.511434 IP planetlab2.cs.ubc.ca.56628 > 198.188.2.10.22222: UDP, length 1024
18:28:05.515954 IP planetlab2.cs.ubc.ca.56628 > 198.188.2.10.22222: UDP, length 1024
18:28:05.520055 IP planetlab2.cs.ubc.ca.56628 > 198.188.2.10.22222: UDP, length 1024
18:28:05.524568 IP planetlab2.cs.ubc.ca.56628 > 198.188.2.10.22222: UDP, length 1024
18:28:05.528674 IP planetlab2.cs.ubc.ca.56628 > 198.188.2.10.22222: UDP, length 1024
18:28:05.533184 IP planetlab2.cs.ubc.ca.56628 > 198.188.2.10.22222: UDP, length 1024
18:28:05.537289 IP planetlab2.cs.ubc.ca.56628 > 198.188.2.10.22222: UDP, length 1024
18:28:05.541800 IP planetlab2.cs.ubc.ca.56628 > 198.188.2.10.22222: UDP, length 1024
18:28:05.545903 IP planetlab2.cs.ubc.ca.56628 > 198.188.2.10.22222: UDP, length 1024
18:28:05.550007 IP planetlab2.cs.ubc.ca.56628 > 198.188.2.10.22222: UDP, length 1024
18:28:05.554520 IP planetlab2.cs.ubc.ca.56628 > 198.188.2.10.22222: UDP, length 1024
18:28:05.558624 IP planetlab2.cs.ubc.ca.56628 > 198.188.2.10.22222: UDP, length 1024
18:28:05.563136 IP planetlab2.cs.ubc.ca.56628 > 198.188.2.10.22222: UDP, length 1024
18:28:05.567241 IP planetlab2.cs.ubc.ca.56628 > 198.188.2.10.22222: UDP, length 1024
18:28:05.571753 IP planetlab2.cs.ubc.ca.56628 > 198.188.2.10.22222: UDP, length 1024
18:28:05.575856 IP planetlab2.cs.ubc.ca.56628 > 198.188.2.10.22222: UDP, length 1024
18:28:05.580368 IP planetlab2.cs.ubc.ca.56628 > 198.188.2.10.22222: UDP, length 1024
18:28:05.584475 IP planetlab2.cs.ubc.ca.56628 > 198.188.2.10.22222: UDP, length 1024
18:28:05.588984 IP planetlab2.cs.ubc.ca.56628 > 198.188.2.10.22222: UDP, length 1024
18:28:05.593088 IP planetlab2.cs.ubc.ca.56628 > 198.188.2.10.22222: UDP, length 1024
18:28:05.597602 IP planetlab2.cs.ubc.ca.56628 > 198.188.2.10.22222: UDP, length 1024
18:28:05.601706 IP planetlab2.cs.ubc.ca.56628 > 198.188.2.10.22222: UDP, length 1024
18:28:05.606217 IP planetlab2.cs.ubc.ca.56628 > 198.188.2.10.22222: UDP, length 1024
18:28:05.610320 IP planetlab2.cs.ubc.ca.56628 > 198.188.2.10.22222: UDP, length 1024
18:28:05.614429 IP planetlab2.cs.ubc.ca.56628 > 198.188.2.10.22222: UDP, length 1024
18:28:05.618937 IP planetlab2.cs.ubc.ca.56628 > 198.188.2.10.22222: UDP, length 1024
18:28:05.623041 IP planetlab2.cs.ubc.ca.56628 > 198.188.2.10.22222: UDP, length 1024
18:28:05.627553 IP planetlab2.cs.ubc.ca.56628 > 198.188.2.10.22222: UDP, length 1024
18:28:05.631658 IP planetlab2.cs.ubc.ca.56628 > 198.188.2.10.22222: UDP, length 1024
18:28:05.636169 IP planetlab2.cs.ubc.ca.56628 > 198.188.2.10.22222: UDP, length 1024
18:28:05.640273 IP planetlab2.cs.ubc.ca.56628 > 198.188.2.10.22222: UDP, length 1024
18:28:05.644785 IP planetlab2.cs.ubc.ca.56628 > 198.188.2.10.22222: UDP, length 1024
18:28:05.648890 IP planetlab2.cs.ubc.ca.56628 > 198.188.2.10.22222: UDP, length 1024
18:28:05.653402 IP planetlab2.cs.ubc.ca.56628 > 198.188.2.10.22222: UDP, length 1024
18:28:05.657510 IP planetlab2.cs.ubc.ca.56628 > 198.188.2.10.22222: UDP, length 1024
18:28:05.662016 IP planetlab2.cs.ubc.ca.56628 > 198.188.2.10.22222: UDP, length 1024
18:28:05.666121 IP planetlab2.cs.ubc.ca.56628 > 198.188.2.10.22222: UDP, length 1024
18:28:05.670636 IP planetlab2.cs.ubc.ca.56628 > 198.188.2.10.22222: UDP, length 1024
18:28:05.674738 IP planetlab2.cs.ubc.ca.56628 > 198.188.2.10.22222: UDP, length 1024
18:28:05.679250 IP planetlab2.cs.ubc.ca.56628 > 198.188.2.10.22222: UDP, length 1024
18:28:05.683354 IP planetlab2.cs.ubc.ca.56628 > 198.188.2.10.22222: UDP, length 1024
18:28:05.687471 IP planetlab2.cs.ubc.ca.56628 > 198.188.2.10.22222: UDP, length 1024
18:28:05.691932 IP planetlab2.cs.ubc.ca.56628 > 198.188.2.10.22222: UDP, length 1024
18:28:05.696036 IP planetlab2.cs.ubc.ca.56628 > 198.188.2.10.22222: UDP, length 1024
18:28:05.700548 IP planetlab2.cs.ubc.ca.56628 > 198.188.2.10.22222: UDP, length 1024
18:28:05.704653 IP planetlab2.cs.ubc.ca.56628 > 198.188.2.10.22222: UDP, length 1024
18:28:05.709165 IP planetlab2.cs.ubc.ca.56628 > 198.188.2.10.22222: UDP, length 1024
18:28:05.713268 IP planetlab2.cs.ubc.ca.56628 > 198.188.2.10.22222: UDP, length 1024
18:28:05.717780 IP planetlab2.cs.ubc.ca.56628 > 198.188.2.10.22222: UDP, length 1024
18:28:05.721884 IP planetlab2.cs.ubc.ca.56628 > 198.188.2.10.22222: UDP, length 1024
18:28:05.726396 IP planetlab2.cs.ubc.ca.56628 > 198.188.2.10.22222: UDP, length 1024
18:28:05.730501 IP planetlab2.cs.ubc.ca.56628 > 198.188.2.10.22222: UDP, length 1024
18:28:05.735021 IP planetlab2.cs.ubc.ca.56628 > 198.188.2.10.22222: UDP, length 1024
18:28:05.739119 IP planetlab2.cs.ubc.ca.56628 > 198.188.2.10.22222: UDP, length 1024
18:28:05.743638 IP planetlab2.cs.ubc.ca.56628 > 198.188.2.10.22222: UDP, length 1024
18:28:05.747733 IP planetlab2.cs.ubc.ca.56628 > 198.188.2.10.22222: UDP, length 1024
18:28:05.751837 IP planetlab2.cs.ubc.ca.56628 > 198.188.2.10.22222: UDP, length 1024
18:28:05.756351 IP planetlab2.cs.ubc.ca.56628 > 198.188.2.10.22222: UDP, length 1024
18:28:05.760456 IP planetlab2.cs.ubc.ca.56628 > 198.188.2.10.22222: UDP, length 1024
18:28:05.764967 IP planetlab2.cs.ubc.ca.56628 > 198.188.2.10.22222: UDP, length 1024
18:28:05.769071 IP planetlab2.cs.ubc.ca.56628 > 198.188.2.10.22222: UDP, length 1024
18:28:05.773585 IP planetlab2.cs.ubc.ca.56628 > 198.188.2.10.22222: UDP, length 1024
18:28:05.777687 IP planetlab2.cs.ubc.ca.56628 > 198.188.2.10.22222: UDP, length 1024
18:28:05.782203 IP planetlab2.cs.ubc.ca.56628 > 198.188.2.10.22222: UDP, length 1024
18:28:05.786306 IP planetlab2.cs.ubc.ca.56628 > 198.188.2.10.22222: UDP, length 1024
18:28:05.790818 IP planetlab2.cs.ubc.ca.56628 > 198.188.2.10.22222: UDP, length 1024
18:28:05.794921 IP planetlab2.cs.ubc.ca.56628 > 198.188.2.10.22222: UDP, length 1024
18:28:05.799432 IP planetlab2.cs.ubc.ca.56628 > 198.188.2.10.22222: UDP, length 1024
18:28:05.803536 IP planetlab2.cs.ubc.ca.56628 > 198.188.2.10.22222: UDP, length 1024
18:28:05.808049 IP planetlab2.cs.ubc.ca.56628 > 198.188.2.10.22222: UDP, length 1024
18:28:05.812150 IP planetlab2.cs.ubc.ca.56628 > 198.188.2.10.22222: UDP, length 1024
18:28:05.816257 IP planetlab2.cs.ubc.ca.56628 > 198.188.2.10.22222: UDP, length 1024
18:28:05.820769 IP planetlab2.cs.ubc.ca.56628 > 198.188.2.10.22222: UDP, length 1024
18:28:05.824872 IP planetlab2.cs.ubc.ca.56628 > 198.188.2.10.22222: UDP, length 1024
18:28:05.829385 IP planetlab2.cs.ubc.ca.56628 > 198.188.2.10.22222: UDP, length 1024
18:28:05.833493 IP planetlab2.cs.ubc.ca.56628 > 198.188.2.10.22222: UDP, length 1024
18:28:05.838005 IP planetlab2.cs.ubc.ca.56628 > 198.188.2.10.22222: UDP, length 1024
18:28:05.842142 IP planetlab2.cs.ubc.ca.56628 > 198.188.2.10.22222: UDP, length 1024
18:28:05.846640 IP planetlab2.cs.ubc.ca.56628 > 198.188.2.10.22222: UDP, length 1024
18:28:05.850725 IP planetlab2.cs.ubc.ca.56628 > 198.188.2.10.22222: UDP, length 1024
18:28:05.855237 IP planetlab2.cs.ubc.ca.56628 > 198.188.2.10.22222: UDP, length 1024
18:28:05.859353 IP planetlab2.cs.ubc.ca.56628 > 198.188.2.10.22222: UDP, length 1024
18:28:05.863863 IP planetlab2.cs.ubc.ca.56628 > 198.188.2.10.22222: UDP, length 1024
18:28:05.867965 IP planetlab2.cs.ubc.ca.56628 > 198.188.2.10.22222: UDP, length 1024
18:28:05.872480 IP planetlab2.cs.ubc.ca.56628 > 198.188.2.10.22222: UDP, length 1024
18:28:05.876583 IP planetlab2.cs.ubc.ca.56628 > 198.188.2.10.22222: UDP, length 1024
18:28:05.880687 IP planetlab2.cs.ubc.ca.56628 > 198.188.2.10.22222: UDP, length 1024
18:28:05.885200 IP planetlab2.cs.ubc.ca.56628 > 198.188.2.10.22222: UDP, length 1024
18:28:05.889303 IP planetlab2.cs.ubc.ca.56628 > 198.188.2.10.22222: UDP, length 1024
18:28:05.893814 IP planetlab2.cs.ubc.ca.56628 > 198.188.2.10.22222: UDP, length 1024
18:28:05.897917 IP planetlab2.cs.ubc.ca.56628 > 198.188.2.10.22222: UDP, length 1024
18:28:05.902418 IP planetlab2.cs.ubc.ca.56628 > 198.188.2.10.22222: UDP, length 1024
18:28:05.906522 IP planetlab2.cs.ubc.ca.56628 > 198.188.2.10.22222: UDP, length 1024
18:28:05.911046 IP planetlab2.cs.ubc.ca.56628 > 198.188.2.10.22222: UDP, length 1024
18:28:05.915149 IP planetlab2.cs.ubc.ca.56628 > 198.188.2.10.22222: UDP, length 1024
18:28:05.919660 IP planetlab2.cs.ubc.ca.56628 > 198.188.2.10.22222: UDP, length 1024
18:28:05.923767 IP planetlab2.cs.ubc.ca.56628 > 198.188.2.10.22222: UDP, length 1024
18:28:05.928268 IP planetlab2.cs.ubc.ca.56628 > 198.188.2.10.22222: UDP, length 1024
18:28:05.932381 IP planetlab2.cs.ubc.ca.56628 > 198.188.2.10.22222: UDP, length 1024
18:28:05.936892 IP planetlab2.cs.ubc.ca.56628 > 198.188.2.10.22222: UDP, length 1024
18:28:05.941021 IP planetlab2.cs.ubc.ca.56628 > 198.188.2.10.22222: UDP, length 1024
18:28:05.945532 IP planetlab2.cs.ubc.ca.56628 > 198.188.2.10.22222: UDP, length 1024
18:28:05.949635 IP planetlab2.cs.ubc.ca.56628 > 198.188.2.10.22222: UDP, length 1024
18:28:05.953740 IP planetlab2.cs.ubc.ca.56628 > 198.188.2.10.22222: UDP, length 1024
18:28:05.958254 IP planetlab2.cs.ubc.ca.56628 > 198.188.2.10.22222: UDP, length 1024
18:28:05.962356 IP planetlab2.cs.ubc.ca.56628 > 198.188.2.10.22222: UDP, length 1024
18:28:05.966869 IP planetlab2.cs.ubc.ca.56628 > 198.188.2.10.22222: UDP, length 1024
18:28:05.970975 IP planetlab2.cs.ubc.ca.56628 > 198.188.2.10.22222: UDP, length 1024
18:28:05.975485 IP planetlab2.cs.ubc.ca.56628 > 198.188.2.10.22222: UDP, length 1024
18:28:05.979588 IP planetlab2.cs.ubc.ca.56628 > 198.188.2.10.22222: UDP, length 1024
18:28:05.984099 IP planetlab2.cs.ubc.ca.56628 > 198.188.2.10.22222: UDP, length 1024
18:28:05.988206 IP planetlab2.cs.ubc.ca.56628 > 198.188.2.10.22222: UDP, length 1024
18:28:05.992717 IP planetlab2.cs.ubc.ca.56628 > 198.188.2.10.22222: UDP, length 1024
18:28:05.996820 IP planetlab2.cs.ubc.ca.56628 > 198.188.2.10.22222: UDP, length 1024
18:28:06.001333 IP planetlab2.cs.ubc.ca.56628 > 198.188.2.10.22222: UDP, length 1024
18:28:06.005437 IP planetlab2.cs.ubc.ca.56628 > 198.188.2.10.22222: UDP, length 1024
18:28:06.009950 IP planetlab2.cs.ubc.ca.56628 > 198.188.2.10.22222: UDP, length 1024
18:28:06.014053 IP planetlab2.cs.ubc.ca.56628 > 198.188.2.10.22222: UDP, length 1024
18:28:06.018157 IP planetlab2.cs.ubc.ca.56628 > 198.188.2.10.22222: UDP, length 1024
18:28:06.022669 IP planetlab2.cs.ubc.ca.56628 > 198.188.2.10.22222: UDP, length 1024
18:28:06.026773 IP planetlab2.cs.ubc.ca.56628 > 198.188.2.10.22222: UDP, length 1024
18:28:06.031285 IP planetlab2.cs.ubc.ca.56628 > 198.188.2.10.22222: UDP, length 1024
