19:44:43.465999 IP 198.188.2.10.40620 > 198.188.2.10.22222: UDP, length 1024
19:44:43.466021 IP 198.188.2.10.40620 > 198.188.2.10.22222: UDP, length 1024
19:44:43.466027 IP 198.188.2.10.40620 > 198.188.2.10.22222: UDP, length 1024
19:44:43.466033 IP 198.188.2.10.40620 > 198.188.2.10.22222: UDP, length 1024
19:44:43.466038 IP 198.188.2.10.40620 > 198.188.2.10.22222: UDP, length 1024
19:44:43.466043 IP 198.188.2.10.40620 > 198.188.2.10.22222: UDP, length 1024
19:44:43.466048 IP 198.188.2.10.40620 > 198.188.2.10.22222: UDP, length 1024
19:44:43.466053 IP 198.188.2.10.40620 > 198.188.2.10.22222: UDP, length 1024
19:44:43.466058 IP 198.188.2.10.40620 > 198.188.2.10.22222: UDP, length 1024
19:44:43.466063 IP 198.188.2.10.40620 > 198.188.2.10.22222: UDP, length 1024
19:44:43.466069 IP 198.188.2.10.40620 > 198.188.2.10.22222: UDP, length 1024
19:44:43.466075 IP 198.188.2.10.40620 > 198.188.2.10.22222: UDP, length 1024
19:44:43.466080 IP 198.188.2.10.40620 > 198.188.2.10.22222: UDP, length 1024
19:44:43.466085 IP 198.188.2.10.40620 > 198.188.2.10.22222: UDP, length 1024
19:44:43.466091 IP 198.188.2.10.40620 > 198.188.2.10.22222: UDP, length 1024
19:44:43.466100 IP 198.188.2.10.40620 > 198.188.2.10.22222: UDP, length 1024
19:44:43.466107 IP 198.188.2.10.40620 > 198.188.2.10.22222: UDP, length 1024
19:44:43.466113 IP 198.188.2.10.40620 > 198.188.2.10.22222: UDP, length 1024
19:44:43.466121 IP 198.188.2.10.40620 > 198.188.2.10.22222: UDP, length 1024
19:44:43.466128 IP 198.188.2.10.40620 > 198.188.2.10.22222: UDP, length 1024
19:44:43.466135 IP 198.188.2.10.40620 > 198.188.2.10.22222: UDP, length 1024
19:44:43.466140 IP 198.188.2.10.40620 > 198.188.2.10.22222: UDP, length 1024
19:44:43.466147 IP 198.188.2.10.40620 > 198.188.2.10.22222: UDP, length 1024
19:44:43.466152 IP 198.188.2.10.40620 > 198.188.2.10.22222: UDP, length 1024
19:44:43.466159 IP 198.188.2.10.40620 > 198.188.2.10.22222: UDP, length 1024
19:44:43.466166 IP 198.188.2.10.40620 > 198.188.2.10.22222: UDP, length 1024
19:44:43.466174 IP 198.188.2.10.40620 > 198.188.2.10.22222: UDP, length 1024
19:44:43.466181 IP 198.188.2.10.40620 > 198.188.2.10.22222: UDP, length 1024
19:44:43.466190 IP 198.188.2.10.40620 > 198.188.2.10.22222: UDP, length 1024
19:44:43.466197 IP 198.188.2.10.40620 > 198.188.2.10.22222: UDP, length 1024
19:44:43.466204 IP 198.188.2.10.40620 > 198.188.2.10.22222: UDP, length 1024
19:44:43.466212 IP 198.188.2.10.40620 > 198.188.2.10.22222: UDP, length 1024
19:44:43.466217 IP 198.188.2.10.40620 > 198.188.2.10.22222: UDP, length 1024
19:44:43.466225 IP 198.188.2.10.40620 > 198.188.2.10.22222: UDP, length 1024
19:44:43.466232 IP 198.188.2.10.40620 > 198.188.2.10.22222: UDP, length 1024
19:44:43.466239 IP 198.188.2.10.40620 > 198.188.2.10.22222: UDP, length 1024
19:44:43.466246 IP 198.188.2.10.40620 > 198.188.2.10.22222: UDP, length 1024
19:44:43.466255 IP 198.188.2.10.40620 > 198.188.2.10.22222: UDP, length 1024
19:44:43.466262 IP 198.188.2.10.40620 > 198.188.2.10.22222: UDP, length 1024
19:44:43.466270 IP 198.188.2.10.40620 > 198.188.2.10.22222: UDP, length 1024
19:44:43.466277 IP 198.188.2.10.40620 > 198.188.2.10.22222: UDP, length 1024
19:44:43.466284 IP 198.188.2.10.40620 > 198.188.2.10.22222: UDP, length 1024
19:44:43.466292 IP 198.188.2.10.40620 > 198.188.2.10.22222: UDP, length 1024
19:44:43.466301 IP 198.188.2.10.40620 > 198.188.2.10.22222: UDP, length 1024
19:44:43.466308 IP 198.188.2.10.40620 > 198.188.2.10.22222: UDP, length 1024
19:44:43.466317 IP 198.188.2.10.40620 > 198.188.2.10.22222: UDP, length 1024
19:44:43.466325 IP 198.188.2.10.40620 > 198.188.2.10.22222: UDP, length 1024
19:44:43.466332 IP 198.188.2.10.40620 > 198.188.2.10.22222: UDP, length 1024
19:44:43.466337 IP 198.188.2.10.40620 > 198.188.2.10.22222: UDP, length 1024
19:44:43.466344 IP 198.188.2.10.40620 > 198.188.2.10.22222: UDP, length 1024
19:44:43.466350 IP 198.188.2.10.40620 > 198.188.2.10.22222: UDP, length 1024
19:44:43.466356 IP 198.188.2.10.40620 > 198.188.2.10.22222: UDP, length 1024
19:44:43.466362 IP 198.188.2.10.40620 > 198.188.2.10.22222: UDP, length 1024
19:44:43.466369 IP 198.188.2.10.40620 > 198.188.2.10.22222: UDP, length 1024
19:44:43.466376 IP 198.188.2.10.40620 > 198.188.2.10.22222: UDP, length 1024
19:44:43.466383 IP 198.188.2.10.40620 > 198.188.2.10.22222: UDP, length 1024
19:44:43.466388 IP 198.188.2.10.40620 > 198.188.2.10.22222: UDP, length 1024
19:44:43.466398 IP 198.188.2.10.40620 > 198.188.2.10.22222: UDP, length 1024
19:44:43.466404 IP 198.188.2.10.40620 > 198.188.2.10.22222: UDP, length 1024
19:44:43.466412 IP 198.188.2.10.40620 > 198.188.2.10.22222: UDP, length 1024
19:44:43.466419 IP 198.188.2.10.40620 > 198.188.2.10.22222: UDP, length 1024
19:44:43.466427 IP 198.188.2.10.40620 > 198.188.2.10.22222: UDP, length 1024
19:44:43.466435 IP 198.188.2.10.40620 > 198.188.2.10.22222: UDP, length 1024
19:44:43.466442 IP 198.188.2.10.40620 > 198.188.2.10.22222: UDP, length 1024
19:44:43.466450 IP 198.188.2.10.40620 > 198.188.2.10.22222: UDP, length 1024
19:44:43.466457 IP 198.188.2.10.40620 > 198.188.2.10.22222: UDP, length 1024
19:44:43.466465 IP 198.188.2.10.40620 > 198.188.2.10.22222: UDP, length 1024
19:44:43.466472 IP 198.188.2.10.40620 > 198.188.2.10.22222: UDP, length 1024
19:44:43.466480 IP 198.188.2.10.40620 > 198.188.2.10.22222: UDP, length 1024
19:44:43.466485 IP 198.188.2.10.40620 > 198.188.2.10.22222: UDP, length 1024
19:44:43.466493 IP 198.188.2.10.40620 > 198.188.2.10.22222: UDP, length 1024
19:44:43.466501 IP 198.188.2.10.40620 > 198.188.2.10.22222: UDP, length 1024
19:44:43.466509 IP 198.188.2.10.40620 > 198.188.2.10.22222: UDP, length 1024
19:44:43.466516 IP 198.188.2.10.40620 > 198.188.2.10.22222: UDP, length 1024
19:44:43.466523 IP 198.188.2.10.40620 > 198.188.2.10.22222: UDP, length 1024
19:44:43.466528 IP 198.188.2.10.40620 > 198.188.2.10.22222: UDP, length 1024
19:44:43.466536 IP 198.188.2.10.40620 > 198.188.2.10.22222: UDP, length 1024
19:44:43.466542 IP 198.188.2.10.40620 > 198.188.2.10.22222: UDP, length 1024
19:44:43.466549 IP 198.188.2.10.40620 > 198.188.2.10.22222: UDP, length 1024
19:44:43.466554 IP 198.188.2.10.40620 > 198.188.2.10.22222: UDP, length 1024
19:44:43.466561 IP 198.188.2.10.40620 > 198.188.2.10.22222: UDP, length 1024
19:44:43.466567 IP 198.188.2.10.40620 > 198.188.2.10.22222: UDP, length 1024
19:44:43.466574 IP 198.188.2.10.40620 > 198.188.2.10.22222: UDP, length 1024
19:44:43.466581 IP 198.188.2.10.40620 > 198.188.2.10.22222: UDP, length 1024
19:44:43.466589 IP 198.188.2.10.40620 > 198.188.2.10.22222: UDP, length 1024
19:44:43.466596 IP 198.188.2.10.40620 > 198.188.2.10.22222: UDP, length 1024
19:44:43.466603 IP 198.188.2.10.40620 > 198.188.2.10.22222: UDP, length 1024
19:44:43.466609 IP 198.188.2.10.40620 > 198.188.2.10.22222: UDP, length 1024
19:44:43.466616 IP 198.188.2.10.40620 > 198.188.2.10.22222: UDP, length 1024
19:44:43.466622 IP 198.188.2.10.40620 > 198.188.2.10.22222: UDP, length 1024
19:44:43.466628 IP 198.188.2.10.40620 > 198.188.2.10.22222: UDP, length 1024
19:44:43.466634 IP 198.188.2.10.40620 > 198.188.2.10.22222: UDP, length 1024
19:44:43.466642 IP 198.188.2.10.40620 > 198.188.2.10.22222: UDP, length 1024
19:44:43.466646 IP 198.188.2.10.40620 > 198.188.2.10.22222: UDP, length 1024
19:44:43.466654 IP 198.188.2.10.40620 > 198.188.2.10.22222: UDP, length 1024
19:44:43.466660 IP 198.188.2.10.40620 > 198.188.2.10.22222: UDP, length 1024
19:44:43.466665 IP 198.188.2.10.40620 > 198.188.2.10.22222: UDP, length 1024
19:44:43.466674 IP 198.188.2.10.40620 > 198.188.2.10.22222: UDP, length 1024
19:44:43.466679 IP 198.188.2.10.40620 > 198.188.2.10.22222: UDP, length 1024
19:44:43.466686 IP 198.188.2.10.40620 > 198.188.2.10.22222: UDP, length 1024
19:44:43.466693 IP 198.188.2.10.40620 > 198.188.2.10.22222: UDP, length 1024
19:44:43.466700 IP 198.188.2.10.40620 > 198.188.2.10.22222: UDP, length 1024
19:44:43.466705 IP 198.188.2.10.40620 > 198.188.2.10.22222: UDP, length 1024
19:44:43.466712 IP 198.188.2.10.40620 > 198.188.2.10.22222: UDP, length 1024
19:44:43.466717 IP 198.188.2.10.40620 > 198.188.2.10.22222: UDP, length 1024
19:44:43.466724 IP 198.188.2.10.40620 > 198.188.2.10.22222: UDP, length 1024
19:44:43.466729 IP 198.188.2.10.40620 > 198.188.2.10.22222: UDP, length 1024
19:44:43.466736 IP 198.188.2.10.40620 > 198.188.2.10.22222: UDP, length 1024
19:44:43.466741 IP 198.188.2.10.40620 > 198.188.2.10.22222: UDP, length 1024
19:44:43.466748 IP 198.188.2.10.40620 > 198.188.2.10.22222: UDP, length 1024
19:44:43.466756 IP 198.188.2.10.40620 > 198.188.2.10.22222: UDP, length 1024
19:44:43.466765 IP 198.188.2.10.40620 > 198.188.2.10.22222: UDP, length 1024
19:44:43.466770 IP 198.188.2.10.40620 > 198.188.2.10.22222: UDP, length 1024
19:44:43.466779 IP 198.188.2.10.40620 > 198.188.2.10.22222: UDP, length 1024
19:44:43.466787 IP 198.188.2.10.40620 > 198.188.2.10.22222: UDP, length 1024
19:44:43.466793 IP 198.188.2.10.40620 > 198.188.2.10.22222: UDP, length 1024
19:44:43.466800 IP 198.188.2.10.40620 > 198.188.2.10.22222: UDP, length 1024
19:44:43.466806 IP 198.188.2.10.40620 > 198.188.2.10.22222: UDP, length 1024
19:44:43.466813 IP 198.188.2.10.40620 > 198.188.2.10.22222: UDP, length 1024
19:44:43.466818 IP 198.188.2.10.40620 > 198.188.2.10.22222: UDP, length 1024
19:44:43.466826 IP 198.188.2.10.40620 > 198.188.2.10.22222: UDP, length 1024
19:44:43.466833 IP 198.188.2.10.40620 > 198.188.2.10.22222: UDP, length 1024
19:44:43.466840 IP 198.188.2.10.40620 > 198.188.2.10.22222: UDP, length 1024
19:44:43.466846 IP 198.188.2.10.40620 > 198.188.2.10.22222: UDP, length 1024
19:44:43.466853 IP 198.188.2.10.40620 > 198.188.2.10.22222: UDP, length 1024
19:44:43.466860 IP 198.188.2.10.40620 > 198.188.2.10.22222: UDP, length 1024
19:44:43.466865 IP 198.188.2.10.40620 > 198.188.2.10.22222: UDP, length 1024
19:44:43.466872 IP 198.188.2.10.40620 > 198.188.2.10.22222: UDP, length 1024
19:44:43.466878 IP 198.188.2.10.40620 > 198.188.2.10.22222: UDP, length 1024
19:44:43.466885 IP 198.188.2.10.40620 > 198.188.2.10.22222: UDP, length 1024
19:44:43.466893 IP 198.188.2.10.40620 > 198.188.2.10.22222: UDP, length 1024
19:44:43.466898 IP 198.188.2.10.40620 > 198.188.2.10.22222: UDP, length 1024
19:44:43.466905 IP 198.188.2.10.40620 > 198.188.2.10.22222: UDP, length 1024
19:44:43.466913 IP 198.188.2.10.40620 > 198.188.2.10.22222: UDP, length 1024
19:44:43.466918 IP 198.188.2.10.40620 > 198.188.2.10.22222: UDP, length 1024
19:44:43.466925 IP 198.188.2.10.40620 > 198.188.2.10.22222: UDP, length 1024
19:44:43.466933 IP 198.188.2.10.40620 > 198.188.2.10.22222: UDP, length 1024
19:44:43.466939 IP 198.188.2.10.40620 > 198.188.2.10.22222: UDP, length 1024
19:44:43.466945 IP 198.188.2.10.40620 > 198.188.2.10.22222: UDP, length 1024
19:44:43.466951 IP 198.188.2.10.40620 > 198.188.2.10.22222: UDP, length 1024
19:44:43.466958 IP 198.188.2.10.40620 > 198.188.2.10.22222: UDP, length 1024
19:44:43.466963 IP 198.188.2.10.40620 > 198.188.2.10.22222: UDP, length 1024
19:44:43.466969 IP 198.188.2.10.40620 > 198.188.2.10.22222: UDP, length 1024
19:44:43.466977 IP 198.188.2.10.40620 > 198.188.2.10.22222: UDP, length 1024
19:44:43.466982 IP 198.188.2.10.40620 > 198.188.2.10.22222: UDP, length 1024
19:44:43.466989 IP 198.188.2.10.40620 > 198.188.2.10.22222: UDP, length 1024
19:44:43.466994 IP 198.188.2.10.40620 > 198.188.2.10.22222: UDP, length 1024
19:44:43.467001 IP 198.188.2.10.40620 > 198.188.2.10.22222: UDP, length 1024
19:44:43.467009 IP 198.188.2.10.40620 > 198.188.2.10.22222: UDP, length 1024
19:44:43.467014 IP 198.188.2.10.40620 > 198.188.2.10.22222: UDP, length 1024
19:44:43.467021 IP 198.188.2.10.40620 > 198.188.2.10.22222: UDP, length 1024
19:44:43.467027 IP 198.188.2.10.40620 > 198.188.2.10.22222: UDP, length 1024
19:44:43.467033 IP 198.188.2.10.40620 > 198.188.2.10.22222: UDP, length 1024
19:44:43.467038 IP 198.188.2.10.40620 > 198.188.2.10.22222: UDP, length 1024
19:44:43.467046 IP 198.188.2.10.40620 > 198.188.2.10.22222: UDP, length 1024
19:44:43.467052 IP 198.188.2.10.40620 > 198.188.2.10.22222: UDP, length 1024
19:44:43.467057 IP 198.188.2.10.40620 > 198.188.2.10.22222: UDP, length 1024
19:44:43.467064 IP 198.188.2.10.40620 > 198.188.2.10.22222: UDP, length 1024
19:44:43.467069 IP 198.188.2.10.40620 > 198.188.2.10.22222: UDP, length 1024
19:44:43.467076 IP 198.188.2.10.40620 > 198.188.2.10.22222: UDP, length 1024
19:44:43.467081 IP 198.188.2.10.40620 > 198.188.2.10.22222: UDP, length 1024
19:44:43.467088 IP 198.188.2.10.40620 > 198.188.2.10.22222: UDP, length 1024
19:44:43.467093 IP 198.188.2.10.40620 > 198.188.2.10.22222: UDP, length 1024
19:44:43.467100 IP 198.188.2.10.40620 > 198.188.2.10.22222: UDP, length 1024
19:44:43.467108 IP 198.188.2.10.40620 > 198.188.2.10.22222: UDP, length 1024
19:44:43.467116 IP 198.188.2.10.40620 > 198.188.2.10.22222: UDP, length 1024
19:44:43.467121 IP 198.188.2.10.40620 > 198.188.2.10.22222: UDP, length 1024
19:44:43.467127 IP 198.188.2.10.40620 > 198.188.2.10.22222: UDP, length 1024
19:44:43.467133 IP 198.188.2.10.40620 > 198.188.2.10.22222: UDP, length 1024
19:44:43.467140 IP 198.188.2.10.40620 > 198.188.2.10.22222: UDP, length 1024
19:44:43.467149 IP 198.188.2.10.40620 > 198.188.2.10.22222: UDP, length 1024
19:44:43.467154 IP 198.188.2.10.40620 > 198.188.2.10.22222: UDP, length 1024
19:44:43.467161 IP 198.188.2.10.40620 > 198.188.2.10.22222: UDP, length 1024
19:44:43.467169 IP 198.188.2.10.40620 > 198.188.2.10.22222: UDP, length 1024
19:44:43.467176 IP 198.188.2.10.40620 > 198.188.2.10.22222: UDP, length 1024
19:44:43.467184 IP 198.188.2.10.40620 > 198.188.2.10.22222: UDP, length 1024
19:44:43.467189 IP 198.188.2.10.40620 > 198.188.2.10.22222: UDP, length 1024
19:44:43.467196 IP 198.188.2.10.40620 > 198.188.2.10.22222: UDP, length 1024
19:44:43.467201 IP 198.188.2.10.40620 > 198.188.2.10.22222: UDP, length 1024
19:44:43.467208 IP 198.188.2.10.40620 > 198.188.2.10.22222: UDP, length 1024
19:44:43.467213 IP 198.188.2.10.40620 > 198.188.2.10.22222: UDP, length 1024
19:44:43.467220 IP 198.188.2.10.40620 > 198.188.2.10.22222: UDP, length 1024
19:44:43.467225 IP 198.188.2.10.40620 > 198.188.2.10.22222: UDP, length 1024
19:44:43.467231 IP 198.188.2.10.40620 > 198.188.2.10.22222: UDP, length 1024
19:44:43.467237 IP 198.188.2.10.40620 > 198.188.2.10.22222: UDP, length 1024
19:44:43.467244 IP 198.188.2.10.40620 > 198.188.2.10.22222: UDP, length 1024
19:44:43.467251 IP 198.188.2.10.40620 > 198.188.2.10.22222: UDP, length 1024
19:44:43.467256 IP 198.188.2.10.40620 > 198.188.2.10.22222: UDP, length 1024
19:44:43.467263 IP 198.188.2.10.40620 > 198.188.2.10.22222: UDP, length 1024
19:44:43.467269 IP 198.188.2.10.40620 > 198.188.2.10.22222: UDP, length 1024
19:44:43.467276 IP 198.188.2.10.40620 > 198.188.2.10.22222: UDP, length 1024
19:44:43.467281 IP 198.188.2.10.40620 > 198.188.2.10.22222: UDP, length 1024
19:44:43.467288 IP 198.188.2.10.40620 > 198.188.2.10.22222: UDP, length 1024
19:44:43.467295 IP 198.188.2.10.40620 > 198.188.2.10.22222: UDP, length 1024
19:44:43.467300 IP 198.188.2.10.40620 > 198.188.2.10.22222: UDP, length 1024
19:44:43.467307 IP 198.188.2.10.40620 > 198.188.2.10.22222: UDP, length 1024
19:44:43.467312 IP 198.188.2.10.40620 > 198.188.2.10.22222: UDP, length 1024
19:44:43.467319 IP 198.188.2.10.40620 > 198.188.2.10.22222: UDP, length 1024
19:44:43.467327 IP 198.188.2.10.40620 > 198.188.2.10.22222: UDP, length 1024
19:44:43.467332 IP 198.188.2.10.40620 > 198.188.2.10.22222: UDP, length 1024
19:44:43.467369 IP 198.188.2.10.40620 > 198.188.2.10.22222: UDP, length 1024
19:44:43.467377 IP 198.188.2.10.40620 > 198.188.2.10.22222: UDP, length 1024
19:44:43.467386 IP 198.188.2.10.40620 > 198.188.2.10.22222: UDP, length 1024
19:44:43.467393 IP 198.188.2.10.40620 > 198.188.2.10.22222: UDP, length 1024
19:44:43.467401 IP 198.188.2.10.40620 > 198.188.2.10.22222: UDP, length 1024
19:44:43.467408 IP 198.188.2.10.40620 > 198.188.2.10.22222: UDP, length 1024
19:44:43.467416 IP 198.188.2.10.40620 > 198.188.2.10.22222: UDP, length 1024
19:44:43.467421 IP 198.188.2.10.40620 > 198.188.2.10.22222: UDP, length 1024
19:44:43.467428 IP 198.188.2.10.40620 > 198.188.2.10.22222: UDP, length 1024
19:44:43.467434 IP 198.188.2.10.40620 > 198.188.2.10.22222: UDP, length 1024
19:44:43.467441 IP 198.188.2.10.40620 > 198.188.2.10.22222: UDP, length 1024
19:44:43.467449 IP 198.188.2.10.40620 > 198.188.2.10.22222: UDP, length 1024
19:44:43.467456 IP 198.188.2.10.40620 > 198.188.2.10.22222: UDP, length 1024
19:44:43.467462 IP 198.188.2.10.40620 > 198.188.2.10.22222: UDP, length 1024
19:44:43.467469 IP 198.188.2.10.40620 > 198.188.2.10.22222: UDP, length 1024
19:44:43.467474 IP 198.188.2.10.40620 > 198.188.2.10.22222: UDP, length 1024
19:44:43.467481 IP 198.188.2.10.40620 > 198.188.2.10.22222: UDP, length 1024
19:44:43.467487 IP 198.188.2.10.40620 > 198.188.2.10.22222: UDP, length 1024
19:44:43.467493 IP 198.188.2.10.40620 > 198.188.2.10.22222: UDP, length 1024
19:44:43.467499 IP 198.188.2.10.40620 > 198.188.2.10.22222: UDP, length 1024
19:44:43.467506 IP 198.188.2.10.40620 > 198.188.2.10.22222: UDP, length 1024
19:44:43.467511 IP 198.188.2.10.40620 > 198.188.2.10.22222: UDP, length 1024
19:44:43.467518 IP 198.188.2.10.40620 > 198.188.2.10.22222: UDP, length 1024
19:44:43.467523 IP 198.188.2.10.40620 > 198.188.2.10.22222: UDP, length 1024
19:44:43.467530 IP 198.188.2.10.40620 > 198.188.2.10.22222: UDP, length 1024
19:44:43.467535 IP 198.188.2.10.40620 > 198.188.2.10.22222: UDP, length 1024
19:44:43.467545 IP 198.188.2.10.40620 > 198.188.2.10.22222: UDP, length 1024
19:44:43.467553 IP 198.188.2.10.40620 > 198.188.2.10.22222: UDP, length 1024
19:44:43.467561 IP 198.188.2.10.40620 > 198.188.2.10.22222: UDP, length 1024
19:44:43.467569 IP 198.188.2.10.40620 > 198.188.2.10.22222: UDP, length 1024
19:44:43.467577 IP 198.188.2.10.40620 > 198.188.2.10.22222: UDP, length 1024
19:44:43.467584 IP 198.188.2.10.40620 > 198.188.2.10.22222: UDP, length 1024
19:44:43.467589 IP 198.188.2.10.40620 > 198.188.2.10.22222: UDP, length 1024
19:44:43.467596 IP 198.188.2.10.40620 > 198.188.2.10.22222: UDP, length 1024
19:44:43.467602 IP 198.188.2.10.40620 > 198.188.2.10.22222: UDP, length 1024
19:44:43.467609 IP 198.188.2.10.40620 > 198.188.2.10.22222: UDP, length 1024
19:44:43.467614 IP 198.188.2.10.40620 > 198.188.2.10.22222: UDP, length 1024
19:44:43.467621 IP 198.188.2.10.40620 > 198.188.2.10.22222: UDP, length 1024
19:44:43.467626 IP 198.188.2.10.40620 > 198.188.2.10.22222: UDP, length 1024
19:44:43.467633 IP 198.188.2.10.40620 > 198.188.2.10.22222: UDP, length 1024
19:44:43.467641 IP 198.188.2.10.40620 > 198.188.2.10.22222: UDP, length 1024
19:44:43.467649 IP 198.188.2.10.40620 > 198.188.2.10.22222: UDP, length 1024
19:44:43.467655 IP 198.188.2.10.40620 > 198.188.2.10.22222: UDP, length 1024
19:44:43.467662 IP 198.188.2.10.40620 > 198.188.2.10.22222: UDP, length 1024
19:44:43.467667 IP 198.188.2.10.40620 > 198.188.2.10.22222: UDP, length 1024
19:44:43.467674 IP 198.188.2.10.40620 > 198.188.2.10.22222: UDP, length 1024
19:44:43.467682 IP 198.188.2.10.40620 > 198.188.2.10.22222: UDP, length 1024
19:44:43.467690 IP 198.188.2.10.40620 > 198.188.2.10.22222: UDP, length 1024
19:44:43.467698 IP 198.188.2.10.40620 > 198.188.2.10.22222: UDP, length 1024
19:44:43.467703 IP 198.188.2.10.40620 > 198.188.2.10.22222: UDP, length 1024
19:44:43.467710 IP 198.188.2.10.40620 > 198.188.2.10.22222: UDP, length 1024
19:44:43.467716 IP 198.188.2.10.40620 > 198.188.2.10.22222: UDP, length 1024
19:44:43.467723 IP 198.188.2.10.40620 > 198.188.2.10.22222: UDP, length 1024
19:44:43.467732 IP 198.188.2.10.40620 > 198.188.2.10.22222: UDP, length 1024
19:44:43.467739 IP 198.188.2.10.40620 > 198.188.2.10.22222: UDP, length 1024
19:44:43.467747 IP 198.188.2.10.40620 > 198.188.2.10.22222: UDP, length 1024
19:44:43.467753 IP 198.188.2.10.40620 > 198.188.2.10.22222: UDP, length 1024
19:44:43.467760 IP 198.188.2.10.40620 > 198.188.2.10.22222: UDP, length 1024
19:44:43.467767 IP 198.188.2.10.40620 > 198.188.2.10.22222: UDP, length 1024
19:44:43.467776 IP 198.188.2.10.40620 > 198.188.2.10.22222: UDP, length 1024
19:44:43.467783 IP 198.188.2.10.40620 > 198.188.2.10.22222: UDP, length 1024
19:44:43.467789 IP 198.188.2.10.40620 > 198.188.2.10.22222: UDP, length 1024
19:44:43.467796 IP 198.188.2.10.40620 > 198.188.2.10.22222: UDP, length 1024
19:44:43.467801 IP 198.188.2.10.40620 > 198.188.2.10.22222: UDP, length 1024
19:44:43.467808 IP 198.188.2.10.40620 > 198.188.2.10.22222: UDP, length 1024
19:44:43.467815 IP 198.188.2.10.40620 > 198.188.2.10.22222: UDP, length 1024
19:44:43.467821 IP 198.188.2.10.40620 > 198.188.2.10.22222: UDP, length 1024
19:44:43.467827 IP 198.188.2.10.40620 > 198.188.2.10.22222: UDP, length 1024
19:44:43.467833 IP 198.188.2.10.40620 > 198.188.2.10.22222: UDP, length 1024
19:44:43.467840 IP 198.188.2.10.40620 > 198.188.2.10.22222: UDP, length 1024
19:44:43.467847 IP 198.188.2.10.40620 > 198.188.2.10.22222: UDP, length 1024
19:44:43.467852 IP 198.188.2.10.40620 > 198.188.2.10.22222: UDP, length 1024
19:44:43.467859 IP 198.188.2.10.40620 > 198.188.2.10.22222: UDP, length 1024
19:44:43.467865 IP 198.188.2.10.40620 > 198.188.2.10.22222: UDP, length 1024
19:44:43.467872 IP 198.188.2.10.40620 > 198.188.2.10.22222: UDP, length 1024
19:44:43.467877 IP 198.188.2.10.40620 > 198.188.2.10.22222: UDP, length 1024
19:44:43.467884 IP 198.188.2.10.40620 > 198.188.2.10.22222: UDP, length 1024
19:44:43.467892 IP 198.188.2.10.40620 > 198.188.2.10.22222: UDP, length 1024
19:44:43.467900 IP 198.188.2.10.40620 > 198.188.2.10.22222: UDP, length 1024
19:44:43.467905 IP 198.188.2.10.40620 > 198.188.2.10.22222: UDP, length 1024
19:44:43.467912 IP 198.188.2.10.40620 > 198.188.2.10.22222: UDP, length 1024
19:44:43.467917 IP 198.188.2.10.40620 > 198.188.2.10.22222: UDP, length 1024
19:44:43.467924 IP 198.188.2.10.40620 > 198.188.2.10.22222: UDP, length 1024
19:44:43.467933 IP 198.188.2.10.40620 > 198.188.2.10.22222: UDP, length 1024
19:44:43.467942 IP 198.188.2.10.40620 > 198.188.2.10.22222: UDP, length 1024
19:44:43.467949 IP 198.188.2.10.40620 > 198.188.2.10.22222: UDP, length 1024
19:44:43.467956 IP 198.188.2.10.40620 > 198.188.2.10.22222: UDP, length 1024
19:44:43.467964 IP 198.188.2.10.40620 > 198.188.2.10.22222: UDP, length 1024
19:44:43.467972 IP 198.188.2.10.40620 > 198.188.2.10.22222: UDP, length 1024
19:44:43.467980 IP 198.188.2.10.40620 > 198.188.2.10.22222: UDP, length 1024
19:44:43.467988 IP 198.188.2.10.40620 > 198.188.2.10.22222: UDP, length 1024
19:44:43.467996 IP 198.188.2.10.40620 > 198.188.2.10.22222: UDP, length 1024
19:44:43.468001 IP 198.188.2.10.40620 > 198.188.2.10.22222: UDP, length 1024
19:44:43.468008 IP 198.188.2.10.40620 > 198.188.2.10.22222: UDP, length 1024
19:44:43.468014 IP 198.188.2.10.40620 > 198.188.2.10.22222: UDP, length 1024
19:44:43.468021 IP 198.188.2.10.40620 > 198.188.2.10.22222: UDP, length 1024
19:44:43.468028 IP 198.188.2.10.40620 > 198.188.2.10.22222: UDP, length 1024
19:44:43.468036 IP 198.188.2.10.40620 > 198.188.2.10.22222: UDP, length 1024
19:44:43.468041 IP 198.188.2.10.40620 > 198.188.2.10.22222: UDP, length 1024
19:44:43.468049 IP 198.188.2.10.40620 > 198.188.2.10.22222: UDP, length 1024
19:44:43.468057 IP 198.188.2.10.40620 > 198.188.2.10.22222: UDP, length 1024
19:44:43.468065 IP 198.188.2.10.40620 > 198.188.2.10.22222: UDP, length 1024
19:44:43.468073 IP 198.188.2.10.40620 > 198.188.2.10.22222: UDP, length 1024
19:44:43.468080 IP 198.188.2.10.40620 > 198.188.2.10.22222: UDP, length 1024
19:44:43.468088 IP 198.188.2.10.40620 > 198.188.2.10.22222: UDP, length 1024
19:44:43.468097 IP 198.188.2.10.40620 > 198.188.2.10.22222: UDP, length 1024
19:44:43.468104 IP 198.188.2.10.40620 > 198.188.2.10.22222: UDP, length 1024
19:44:43.468112 IP 198.188.2.10.40620 > 198.188.2.10.22222: UDP, length 1024
19:44:43.468117 IP 198.188.2.10.40620 > 198.188.2.10.22222: UDP, length 1024
19:44:43.468125 IP 198.188.2.10.40620 > 198.188.2.10.22222: UDP, length 1024
19:44:43.468133 IP 198.188.2.10.40620 > 198.188.2.10.22222: UDP, length 1024
19:44:43.468140 IP 198.188.2.10.40620 > 198.188.2.10.22222: UDP, length 1024
19:44:43.468149 IP 198.188.2.10.40620 > 198.188.2.10.22222: UDP, length 1024
19:44:43.468156 IP 198.188.2.10.40620 > 198.188.2.10.22222: UDP, length 1024
19:44:43.468164 IP 198.188.2.10.40620 > 198.188.2.10.22222: UDP, length 1024
19:44:43.468172 IP 198.188.2.10.40620 > 198.188.2.10.22222: UDP, length 1024
19:44:43.468180 IP 198.188.2.10.40620 > 198.188.2.10.22222: UDP, length 1024
19:44:43.468188 IP 198.188.2.10.40620 > 198.188.2.10.22222: UDP, length 1024
19:44:43.468196 IP 198.188.2.10.40620 > 198.188.2.10.22222: UDP, length 1024
19:44:43.468204 IP 198.188.2.10.40620 > 198.188.2.10.22222: UDP, length 1024
19:44:43.468212 IP 198.188.2.10.40620 > 198.188.2.10.22222: UDP, length 1024
19:44:43.468217 IP 198.188.2.10.40620 > 198.188.2.10.22222: UDP, length 1024
19:44:43.468224 IP 198.188.2.10.40620 > 198.188.2.10.22222: UDP, length 1024
19:44:43.468229 IP 198.188.2.10.40620 > 198.188.2.10.22222: UDP, length 1024
19:44:43.468236 IP 198.188.2.10.40620 > 198.188.2.10.22222: UDP, length 1024
19:44:43.468244 IP 198.188.2.10.40620 > 198.188.2.10.22222: UDP, length 1024
19:44:43.468252 IP 198.188.2.10.40620 > 198.188.2.10.22222: UDP, length 1024
19:44:43.468257 IP 198.188.2.10.40620 > 198.188.2.10.22222: UDP, length 1024
19:44:43.468264 IP 198.188.2.10.40620 > 198.188.2.10.22222: UDP, length 1024
19:44:43.468270 IP 198.188.2.10.40620 > 198.188.2.10.22222: UDP, length 1024
19:44:43.468277 IP 198.188.2.10.40620 > 198.188.2.10.22222: UDP, length 1024
19:44:43.468285 IP 198.188.2.10.40620 > 198.188.2.10.22222: UDP, length 1024
19:44:43.468293 IP 198.188.2.10.40620 > 198.188.2.10.22222: UDP, length 1024
19:44:43.468298 IP 198.188.2.10.40620 > 198.188.2.10.22222: UDP, length 1024
19:44:43.468305 IP 198.188.2.10.40620 > 198.188.2.10.22222: UDP, length 1024
19:44:43.468313 IP 198.188.2.10.40620 > 198.188.2.10.22222: UDP, length 1024
19:44:43.468321 IP 198.188.2.10.40620 > 198.188.2.10.22222: UDP, length 1024
19:44:43.468329 IP 198.188.2.10.40620 > 198.188.2.10.22222: UDP, length 1024
19:44:43.468334 IP 198.188.2.10.40620 > 198.188.2.10.22222: UDP, length 1024
19:44:43.468343 IP 198.188.2.10.40620 > 198.188.2.10.22222: UDP, length 1024
19:44:43.468350 IP 198.188.2.10.40620 > 198.188.2.10.22222: UDP, length 1024
19:44:43.468358 IP 198.188.2.10.40620 > 198.188.2.10.22222: UDP, length 1024
19:44:43.468363 IP 198.188.2.10.40620 > 198.188.2.10.22222: UDP, length 1024
19:44:43.468371 IP 198.188.2.10.40620 > 198.188.2.10.22222: UDP, length 1024
19:44:43.468376 IP 198.188.2.10.40620 > 198.188.2.10.22222: UDP, length 1024
19:44:43.468383 IP 198.188.2.10.40620 > 198.188.2.10.22222: UDP, length 1024
19:44:43.468390 IP 198.188.2.10.40620 > 198.188.2.10.22222: UDP, length 1024
19:44:43.468398 IP 198.188.2.10.40620 > 198.188.2.10.22222: UDP, length 1024
19:44:43.468403 IP 198.188.2.10.40620 > 198.188.2.10.22222: UDP, length 1024
19:44:43.468410 IP 198.188.2.10.40620 > 198.188.2.10.22222: UDP, length 1024
19:44:43.468415 IP 198.188.2.10.40620 > 198.188.2.10.22222: UDP, length 1024
19:44:43.468422 IP 198.188.2.10.40620 > 198.188.2.10.22222: UDP, length 1024
19:44:43.468427 IP 198.188.2.10.40620 > 198.188.2.10.22222: UDP, length 1024
19:44:43.468434 IP 198.188.2.10.40620 > 198.188.2.10.22222: UDP, length 1024
19:44:43.468439 IP 198.188.2.10.40620 > 198.188.2.10.22222: UDP, length 1024
19:44:43.468447 IP 198.188.2.10.40620 > 198.188.2.10.22222: UDP, length 1024
19:44:43.468455 IP 198.188.2.10.40620 > 198.188.2.10.22222: UDP, length 1024
19:44:43.468463 IP 198.188.2.10.40620 > 198.188.2.10.22222: UDP, length 1024
19:44:43.468468 IP 198.188.2.10.40620 > 198.188.2.10.22222: UDP, length 1024
19:44:43.468475 IP 198.188.2.10.40620 > 198.188.2.10.22222: UDP, length 1024
19:44:43.468482 IP 198.188.2.10.40620 > 198.188.2.10.22222: UDP, length 1024
19:44:43.468490 IP 198.188.2.10.40620 > 198.188.2.10.22222: UDP, length 1024
19:44:43.468495 IP 198.188.2.10.40620 > 198.188.2.10.22222: UDP, length 1024
19:44:43.468502 IP 198.188.2.10.40620 > 198.188.2.10.22222: UDP, length 1024
19:44:43.468507 IP 198.188.2.10.40620 > 198.188.2.10.22222: UDP, length 1024
19:44:43.468514 IP 198.188.2.10.40620 > 198.188.2.10.22222: UDP, length 1024
19:44:43.468519 IP 198.188.2.10.40620 > 198.188.2.10.22222: UDP, length 1024
19:44:43.468526 IP 198.188.2.10.40620 > 198.188.2.10.22222: UDP, length 1024
19:44:43.468534 IP 198.188.2.10.40620 > 198.188.2.10.22222: UDP, length 1024
19:44:43.468539 IP 198.188.2.10.40620 > 198.188.2.10.22222: UDP, length 1024
19:44:43.468546 IP 198.188.2.10.40620 > 198.188.2.10.22222: UDP, length 1024
19:44:43.468551 IP 198.188.2.10.40620 > 198.188.2.10.22222: UDP, length 1024
19:44:43.468558 IP 198.188.2.10.40620 > 198.188.2.10.22222: UDP, length 1024
19:44:43.468563 IP 198.188.2.10.40620 > 198.188.2.10.22222: UDP, length 1024
19:44:43.468570 IP 198.188.2.10.40620 > 198.188.2.10.22222: UDP, length 1024
19:44:43.468578 IP 198.188.2.10.40620 > 198.188.2.10.22222: UDP, length 1024
19:44:43.468585 IP 198.188.2.10.40620 > 198.188.2.10.22222: UDP, length 1024
19:44:43.468590 IP 198.188.2.10.40620 > 198.188.2.10.22222: UDP, length 1024
19:44:43.468597 IP 198.188.2.10.40620 > 198.188.2.10.22222: UDP, length 1024
19:44:43.468605 IP 198.188.2.10.40620 > 198.188.2.10.22222: UDP, length 1024
19:44:43.468613 IP 198.188.2.10.40620 > 198.188.2.10.22222: UDP, length 1024
19:44:43.468622 IP 198.188.2.10.40620 > 198.188.2.10.22222: UDP, length 1024
19:44:43.468630 IP 198.188.2.10.40620 > 198.188.2.10.22222: UDP, length 1024
19:44:43.468637 IP 198.188.2.10.40620 > 198.188.2.10.22222: UDP, length 1024
19:44:43.468643 IP 198.188.2.10.40620 > 198.188.2.10.22222: UDP, length 1024
19:44:43.468650 IP 198.188.2.10.40620 > 198.188.2.10.22222: UDP, length 1024
19:44:43.468656 IP 198.188.2.10.40620 > 198.188.2.10.22222: UDP, length 1024
19:44:43.468662 IP 198.188.2.10.40620 > 198.188.2.10.22222: UDP, length 1024
19:44:43.468667 IP 198.188.2.10.40620 > 198.188.2.10.22222: UDP, length 1024
19:44:43.468674 IP 198.188.2.10.40620 > 198.188.2.10.22222: UDP, length 1024
19:44:43.468683 IP 198.188.2.10.40620 > 198.188.2.10.22222: UDP, length 1024
19:44:43.468690 IP 198.188.2.10.40620 > 198.188.2.10.22222: UDP, length 1024
19:44:43.468697 IP 198.188.2.10.40620 > 198.188.2.10.22222: UDP, length 1024
19:44:43.468702 IP 198.188.2.10.40620 > 198.188.2.10.22222: UDP, length 1024
19:44:43.468709 IP 198.188.2.10.40620 > 198.188.2.10.22222: UDP, length 1024
19:44:43.468717 IP 198.188.2.10.40620 > 198.188.2.10.22222: UDP, length 1024
19:44:43.468726 IP 198.188.2.10.40620 > 198.188.2.10.22222: UDP, length 1024
19:44:43.468734 IP 198.188.2.10.40620 > 198.188.2.10.22222: UDP, length 1024
19:44:43.468740 IP 198.188.2.10.40620 > 198.188.2.10.22222: UDP, length 1024
19:44:43.468747 IP 198.188.2.10.40620 > 198.188.2.10.22222: UDP, length 1024
19:44:43.468752 IP 198.188.2.10.40620 > 198.188.2.10.22222: UDP, length 1024
19:44:43.468759 IP 198.188.2.10.40620 > 198.188.2.10.22222: UDP, length 1024
19:44:43.468764 IP 198.188.2.10.40620 > 198.188.2.10.22222: UDP, length 1024
19:44:43.468771 IP 198.188.2.10.40620 > 198.188.2.10.22222: UDP, length 1024
19:44:43.468777 IP 198.188.2.10.40620 > 198.188.2.10.22222: UDP, length 1024
19:44:43.468784 IP 198.188.2.10.40620 > 198.188.2.10.22222: UDP, length 1024
19:44:43.468792 IP 198.188.2.10.40620 > 198.188.2.10.22222: UDP, length 1024
19:44:43.468799 IP 198.188.2.10.40620 > 198.188.2.10.22222: UDP, length 1024
19:44:43.468804 IP 198.188.2.10.40620 > 198.188.2.10.22222: UDP, length 1024
19:44:43.468811 IP 198.188.2.10.40620 > 198.188.2.10.22222: UDP, length 1024
19:44:43.468820 IP 198.188.2.10.40620 > 198.188.2.10.22222: UDP, length 1024
19:44:43.468828 IP 198.188.2.10.40620 > 198.188.2.10.22222: UDP, length 1024
19:44:43.468833 IP 198.188.2.10.40620 > 198.188.2.10.22222: UDP, length 1024
19:44:43.468839 IP 198.188.2.10.40620 > 198.188.2.10.22222: UDP, length 1024
19:44:43.468844 IP 198.188.2.10.40620 > 198.188.2.10.22222: UDP, length 1024
19:44:43.468852 IP 198.188.2.10.40620 > 198.188.2.10.22222: UDP, length 1024
19:44:43.468860 IP 198.188.2.10.40620 > 198.188.2.10.22222: UDP, length 1024
19:44:43.468868 IP 198.188.2.10.40620 > 198.188.2.10.22222: UDP, length 1024
19:44:43.468876 IP 198.188.2.10.40620 > 198.188.2.10.22222: UDP, length 1024
19:44:43.468883 IP 198.188.2.10.40620 > 198.188.2.10.22222: UDP, length 1024
19:44:43.468889 IP 198.188.2.10.40620 > 198.188.2.10.22222: UDP, length 1024
19:44:43.468896 IP 198.188.2.10.40620 > 198.188.2.10.22222: UDP, length 1024
19:44:43.468901 IP 198.188.2.10.40620 > 198.188.2.10.22222: UDP, length 1024
19:44:43.468908 IP 198.188.2.10.40620 > 198.188.2.10.22222: UDP, length 1024
19:44:43.468913 IP 198.188.2.10.40620 > 198.188.2.10.22222: UDP, length 1024
19:44:43.468920 IP 198.188.2.10.40620 > 198.188.2.10.22222: UDP, length 1024
19:44:43.468928 IP 198.188.2.10.40620 > 198.188.2.10.22222: UDP, length 1024
19:44:43.468934 IP 198.188.2.10.40620 > 198.188.2.10.22222: UDP, length 1024
19:44:43.468940 IP 198.188.2.10.40620 > 198.188.2.10.22222: UDP, length 1024
19:44:43.468945 IP 198.188.2.10.40620 > 198.188.2.10.22222: UDP, length 1024
19:44:43.468952 IP 198.188.2.10.40620 > 198.188.2.10.22222: UDP, length 1024
19:44:43.468960 IP 198.188.2.10.40620 > 198.188.2.10.22222: UDP, length 1024
19:44:43.468967 IP 198.188.2.10.40620 > 198.188.2.10.22222: UDP, length 1024
19:44:43.468975 IP 198.188.2.10.40620 > 198.188.2.10.22222: UDP, length 1024
19:44:43.468983 IP 198.188.2.10.40620 > 198.188.2.10.22222: UDP, length 1024
19:44:43.468988 IP 198.188.2.10.40620 > 198.188.2.10.22222: UDP, length 1024
19:44:43.468995 IP 198.188.2.10.40620 > 198.188.2.10.22222: UDP, length 1024
19:44:43.469000 IP 198.188.2.10.40620 > 198.188.2.10.22222: UDP, length 1024
19:44:43.469007 IP 198.188.2.10.40620 > 198.188.2.10.22222: UDP, length 1024
19:44:43.469013 IP 198.188.2.10.40620 > 198.188.2.10.22222: UDP, length 1024
19:44:43.469020 IP 198.188.2.10.40620 > 198.188.2.10.22222: UDP, length 1024
19:44:43.469025 IP 198.188.2.10.40620 > 198.188.2.10.22222: UDP, length 1024
19:44:43.469032 IP 198.188.2.10.40620 > 198.188.2.10.22222: UDP, length 1024
19:44:43.469040 IP 198.188.2.10.40620 > 198.188.2.10.22222: UDP, length 1024
19:44:43.469048 IP 198.188.2.10.40620 > 198.188.2.10.22222: UDP, length 1024
19:44:43.469056 IP 198.188.2.10.40620 > 198.188.2.10.22222: UDP, length 1024
19:44:43.469064 IP 198.188.2.10.40620 > 198.188.2.10.22222: UDP, length 1024
19:44:43.469073 IP 198.188.2.10.40620 > 198.188.2.10.22222: UDP, length 1024
19:44:43.469080 IP 198.188.2.10.40620 > 198.188.2.10.22222: UDP, length 1024
19:44:43.469085 IP 198.188.2.10.40620 > 198.188.2.10.22222: UDP, length 1024
19:44:43.469092 IP 198.188.2.10.40620 > 198.188.2.10.22222: UDP, length 1024
19:44:43.469097 IP 198.188.2.10.40620 > 198.188.2.10.22222: UDP, length 1024
19:44:43.469106 IP 198.188.2.10.40620 > 198.188.2.10.22222: UDP, length 1024
19:44:43.469113 IP 198.188.2.10.40620 > 198.188.2.10.22222: UDP, length 1024
19:44:43.469119 IP 198.188.2.10.40620 > 198.188.2.10.22222: UDP, length 1024
19:44:43.469126 IP 198.188.2.10.40620 > 198.188.2.10.22222: UDP, length 1024
19:44:43.469132 IP 198.188.2.10.40620 > 198.188.2.10.22222: UDP, length 1024
19:44:43.469139 IP 198.188.2.10.40620 > 198.188.2.10.22222: UDP, length 1024
19:44:43.469144 IP 198.188.2.10.40620 > 198.188.2.10.22222: UDP, length 1024
19:44:43.469151 IP 198.188.2.10.40620 > 198.188.2.10.22222: UDP, length 1024
19:44:43.469156 IP 198.188.2.10.40620 > 198.188.2.10.22222: UDP, length 1024
19:44:43.469163 IP 198.188.2.10.40620 > 198.188.2.10.22222: UDP, length 1024
19:44:43.469168 IP 198.188.2.10.40620 > 198.188.2.10.22222: UDP, length 1024
19:44:43.469175 IP 198.188.2.10.40620 > 198.188.2.10.22222: UDP, length 1024
19:44:43.469181 IP 198.188.2.10.40620 > 198.188.2.10.22222: UDP, length 1024
19:44:43.469188 IP 198.188.2.10.40620 > 198.188.2.10.22222: UDP, length 1024
19:44:43.469196 IP 198.188.2.10.40620 > 198.188.2.10.22222: UDP, length 1024
19:44:43.469203 IP 198.188.2.10.40620 > 198.188.2.10.22222: UDP, length 1024
19:44:43.469210 IP 198.188.2.10.40620 > 198.188.2.10.22222: UDP, length 1024
19:44:43.469219 IP 198.188.2.10.40620 > 198.188.2.10.22222: UDP, length 1024
19:44:43.469226 IP 198.188.2.10.40620 > 198.188.2.10.22222: UDP, length 1024
19:44:43.469231 IP 198.188.2.10.40620 > 198.188.2.10.22222: UDP, length 1024
19:44:43.469238 IP 198.188.2.10.40620 > 198.188.2.10.22222: UDP, length 1024
19:44:43.469244 IP 198.188.2.10.40620 > 198.188.2.10.22222: UDP, length 1024
19:44:43.469250 IP 198.188.2.10.40620 > 198.188.2.10.22222: UDP, length 1024
19:44:43.469256 IP 198.188.2.10.40620 > 198.188.2.10.22222: UDP, length 1024
19:44:43.469263 IP 198.188.2.10.40620 > 198.188.2.10.22222: UDP, length 1024
19:44:43.469272 IP 198.188.2.10.40620 > 198.188.2.10.22222: UDP, length 1024
19:44:43.469279 IP 198.188.2.10.40620 > 198.188.2.10.22222: UDP, length 1024
19:44:43.469284 IP 198.188.2.10.40620 > 198.188.2.10.22222: UDP, length 1024
19:44:43.469291 IP 198.188.2.10.40620 > 198.188.2.10.22222: UDP, length 1024
19:44:43.469297 IP 198.188.2.10.40620 > 198.188.2.10.22222: UDP, length 1024
19:44:43.469304 IP 198.188.2.10.40620 > 198.188.2.10.22222: UDP, length 1024
19:44:43.469309 IP 198.188.2.10.40620 > 198.188.2.10.22222: UDP, length 1024
19:44:43.469316 IP 198.188.2.10.40620 > 198.188.2.10.22222: UDP, length 1024
19:44:43.469321 IP 198.188.2.10.40620 > 198.188.2.10.22222: UDP, length 1024
19:44:43.469328 IP 198.188.2.10.40620 > 198.188.2.10.22222: UDP, length 1024
19:44:43.469333 IP 198.188.2.10.40620 > 198.188.2.10.22222: UDP, length 1024
19:44:43.469340 IP 198.188.2.10.40620 > 198.188.2.10.22222: UDP, length 1024
19:44:43.469348 IP 198.188.2.10.40620 > 198.188.2.10.22222: UDP, length 1024
19:44:43.469356 IP 198.188.2.10.40620 > 198.188.2.10.22222: UDP, length 1024
19:44:43.469364 IP 198.188.2.10.40620 > 198.188.2.10.22222: UDP, length 1024
19:44:43.469373 IP 198.188.2.10.40620 > 198.188.2.10.22222: UDP, length 1024
19:44:43.469380 IP 198.188.2.10.40620 > 198.188.2.10.22222: UDP, length 1024
19:44:43.469385 IP 198.188.2.10.40620 > 198.188.2.10.22222: UDP, length 1024
19:44:43.469392 IP 198.188.2.10.40620 > 198.188.2.10.22222: UDP, length 1024
19:44:43.469397 IP 198.188.2.10.40620 > 198.188.2.10.22222: UDP, length 1024
19:44:43.469404 IP 198.188.2.10.40620 > 198.188.2.10.22222: UDP, length 1024
19:44:43.469412 IP 198.188.2.10.40620 > 198.188.2.10.22222: UDP, length 1024
19:44:43.469420 IP 198.188.2.10.40620 > 198.188.2.10.22222: UDP, length 1024
19:44:43.469426 IP 198.188.2.10.40620 > 198.188.2.10.22222: UDP, length 1024
19:44:43.469433 IP 198.188.2.10.40620 > 198.188.2.10.22222: UDP, length 1024
19:44:43.469437 IP 198.188.2.10.40620 > 198.188.2.10.22222: UDP, length 1024
19:44:43.469444 IP 198.188.2.10.40620 > 198.188.2.10.22222: UDP, length 1024
19:44:43.469452 IP 198.188.2.10.40620 > 198.188.2.10.22222: UDP, length 1024
19:44:43.469457 IP 198.188.2.10.40620 > 198.188.2.10.22222: UDP, length 1024
19:44:43.469464 IP 198.188.2.10.40620 > 198.188.2.10.22222: UDP, length 1024
19:44:43.469469 IP 198.188.2.10.40620 > 198.188.2.10.22222: UDP, length 1024
19:44:43.469476 IP 198.188.2.10.40620 > 198.188.2.10.22222: UDP, length 1024
19:44:43.469485 IP 198.188.2.10.40620 > 198.188.2.10.22222: UDP, length 1024
19:44:43.469490 IP 198.188.2.10.40620 > 198.188.2.10.22222: UDP, length 1024
19:44:43.469498 IP 198.188.2.10.40620 > 198.188.2.10.22222: UDP, length 1024
19:44:43.469503 IP 198.188.2.10.40620 > 198.188.2.10.22222: UDP, length 1024
19:44:43.469510 IP 198.188.2.10.40620 > 198.188.2.10.22222: UDP, length 1024
19:44:43.469515 IP 198.188.2.10.40620 > 198.188.2.10.22222: UDP, length 1024
19:44:43.469522 IP 198.188.2.10.40620 > 198.188.2.10.22222: UDP, length 1024
19:44:43.469530 IP 198.188.2.10.40620 > 198.188.2.10.22222: UDP, length 1024
19:44:43.469537 IP 198.188.2.10.40620 > 198.188.2.10.22222: UDP, length 1024
19:44:43.469545 IP 198.188.2.10.40620 > 198.188.2.10.22222: UDP, length 1024
